[I 2024-08-18 21:58:18,432] Trial 80 finished with value: 0.9666666666666667 and parameters: {'classifier': 'XGBoost', 'xgb_eta': 0.12790039703023934, 'xgb_max_depth': 7, 'xgb_min_child_weight': 0.0012906505376866961, 'xgb_subsample': 0.6128476395036057, 'xgb_colsample_bytree': 0.6379621471562581}. Best is trial 11 with value: 0.9866666666666667.
[I 2024-08-18 21:58:19,578] Trial 81 finished with value: 0.9866666666666667 and parameters: {'classifier': 'NeuralNetwork', 'nn_alpha': 0.09714950599248628, 'hidden_layer_sizes': 64, 'activation': 'tanh', 'solver': 'sgd'}. Best is trial 11 with value: 0.9866666666666667.
[I 2024-08-18 21:58:20,771] Trial 82 finished with value: 0.98 and parameters: {'classifier': 'NeuralNetwork', 'nn_alpha': 0.0626276795033743, 'hidden_layer_sizes': 64, 'activation': 'tanh', 'solver': 'sgd'}. Best is trial 11 with value: 0.9866666666666667.
[I 2024-08-18 21:58:24,470] Trial 83 finished with value: 0.9866666666666667 and parameters: {'classifier': 'NeuralNetwork', 'nn_alpha': 0.03447244544469949, 'hidden_layer_sizes': 512, 'activation': 'tanh', 'solver': 'sgd'}. Best is trial 11 with value: 0.9866666666666667.
[I 2024-08-18 21:58:25,585] Trial 84 finished with value: 0.9733333333333333 and parameters: {'classifier': 'NeuralNetwork', 'nn_alpha': 0.000733039173342199, 'hidden_layer_sizes': 64, 'activation': 'tanh', 'solver': 'sgd'}. Best is trial 11 with value: 0.9866666666666667.
[I 2024-08-18 21:58:27,266] Trial 85 finished with value: 0.9666666666666667 and parameters: {'classifier': 'NeuralNetwork', 'nn_alpha': 0.05369749663841003, 'hidden_layer_sizes': 64, 'activation': 'tanh', 'solver': 'lbfgs'}. Best is trial 11 with value: 0.9866666666666667.
[I 2024-08-18 21:58:29,272] Trial 86 finished with value: 0.9866666666666667 and parameters: {'classifier': 'NeuralNetwork', 'nn_alpha': 0.07908693664514327, 'hidden_layer_sizes': 256, 'activation': 'tanh', 'solver': 'sgd'}. Best is trial 11 with value: 0.9866666666666667.
[I 2024-08-18 21:58:29,296] Trial 87 finished with value: 0.96 and parameters: {'classifier': 'SVC', 'svc_c': 83555.30228902561, 'gamma': 'scale', 'kernel': 'linear'}. Best is trial 11 with value: 0.9866666666666667.
[I 2024-08-18 21:58:29,936] Trial 88 finished with value: 0.98 and parameters: {'classifier': 'NeuralNetwork', 'nn_alpha': 0.03039554558985025, 'hidden_layer_sizes': 128, 'activation': 'tanh', 'solver': 'adam'}. Best is trial 11 with value: 0.9866666666666667.
[I 2024-08-18 21:58:46,601] Trial 89 finished with value: 0.96 and parameters: {'classifier': 'NeuralNetwork', 'nn_alpha': 0.050513997183152914, 'hidden_layer_sizes': 512, 'activation': 'logistic', 'solver': 'sgd'}. Best is trial 11 with value: 0.9866666666666667.
[I 2024-08-18 21:58:47,785] Trial 90 finished with value: 0.98 and parameters: {'classifier': 'NeuralNetwork', 'nn_alpha': 0.07604295073608305, 'hidden_layer_sizes': 64, 'activation': 'tanh', 'solver': 'sgd'}. Best is trial 11 with value: 0.9866666666666667.
[I 2024-08-18 21:58:48,888] Trial 91 finished with value: 0.9733333333333333 and parameters: {'classifier': 'NeuralNetwork', 'nn_alpha': 0.038729149630241426, 'hidden_layer_sizes': 64, 'activation': 'tanh', 'solver': 'sgd'}. Best is trial 11 with value: 0.9866666666666667.
[I 2024-08-18 21:58:49,999] Trial 92 finished with value: 0.9866666666666667 and parameters: {'classifier': 'NeuralNetwork', 'nn_alpha': 0.02311148133510079, 'hidden_layer_sizes': 64, 'activation': 'tanh', 'solver': 'sgd'}. Best is trial 11 with value: 0.9866666666666667.
[I 2024-08-18 21:58:51,079] Trial 93 finished with value: 0.98 and parameters: {'classifier': 'NeuralNetwork', 'nn_alpha': 0.013821598080094888, 'hidden_layer_sizes': 64, 'activation': 'tanh', 'solver': 'sgd'}. Best is trial 11 with value: 0.9866666666666667.
[I 2024-08-18 21:58:54,512] Trial 94 finished with value: 0.98 and parameters: {'classifier': 'NeuralNetwork', 'nn_alpha': 0.05003473245137888, 'hidden_layer_sizes': 512, 'activation': 'tanh', 'solver': 'sgd'}. Best is trial 11 with value: 0.9866666666666667.
[I 2024-08-18 21:58:55,663] Trial 95 finished with value: 0.98 and parameters: {'classifier': 'NeuralNetwork', 'nn_alpha': 0.033210312066667885, 'hidden_layer_sizes': 64, 'activation': 'tanh', 'solver': 'sgd'}. Best is trial 11 with value: 0.9866666666666667.
[I 2024-08-18 21:58:56,727] Trial 96 finished with value: 0.98 and parameters: {'classifier': 'NeuralNetwork', 'nn_alpha': 0.09912228662436953, 'hidden_layer_sizes': 128, 'activation': 'relu', 'solver': 'sgd'}. Best is trial 11 with value: 0.9866666666666667.
[I 2024-08-18 21:58:57,002] Trial 97 finished with value: 0.9533333333333333 and parameters: {'classifier': 'RandomForest', 'rf_max_depth': 15, 'rf_min_samples_split': 13, 'rf_min_samples_leaf': 4, 'rf_max_features': 'log2'}. Best is trial 11 with value: 0.9866666666666667.
[I 2024-08-18 21:58:59,106] Trial 98 finished with value: 0.9733333333333333 and parameters: {'classifier': 'NeuralNetwork', 'nn_alpha': 0.06484831984196694, 'hidden_layer_sizes': 512, 'activation': 'tanh', 'solver': 'lbfgs'}. Best is trial 11 with value: 0.9866666666666667.
[I 2024-08-18 21:59:00,244] Trial 99 finished with value: 0.98 and parameters: {'classifier': 'NeuralNetwork', 'nn_alpha': 0.02034700585660839, 'hidden_layer_sizes': 512, 'activation': 'tanh', 'solver': 'adam'}. Best is trial 11 with value: 0.9866666666666667.
FrozenTrial(number=11, state=1, values=[0.9866666666666667], datetime_start=datetime.datetime(2024, 8, 18, 21, 55, 56, 203979), datetime_complete=datetime.datetime(2024, 8, 18, 21, 55, 57, 826636), params={'classifier': 'NeuralNetwork', 'nn_alpha': 0.03199399575525478, 'hidden_layer_sizes': 128, 'activation': 'logistic', 'solver': 'adam'}, user_attrs={}, system_attrs={}, intermediate_values={}, distributions={'classifier': CategoricalDistribution(choices=('SVC', 'RandomForest', 'NeuralNetwork', 'XGBoost')), 'nn_alpha': FloatDistribution(high=0.1, log=True, low=1e-05, step=None), 'hidden_layer_sizes': CategoricalDistribution(choices=(64, 128, 256, 512)), 'activation': CategoricalDistribution(choices=('relu', 'tanh', 'logistic')), 'solver': CategoricalDistribution(choices=('sgd', 'adam', 'lbfgs'))}, trial_id=11, value=None)