[I 2024-08-18 21:55:49,615] A new study created in memory with name: no-name-cdb3badb-8f69-4eab-b973-70e868b1a135
[I 2024-08-18 21:55:49,911] Trial 0 finished with value: 0.9533333333333333 and parameters: {'classifier': 'RandomForest', 'rf_max_depth': 22, 'rf_min_samples_split': 5, 'rf_min_samples_leaf': 2, 'rf_max_features': 'log2'}. Best is trial 0 with value: 0.9533333333333333.
[I 2024-08-18 21:55:50,716] Trial 1 finished with value: 0.9666666666666667 and parameters: {'classifier': 'NeuralNetwork', 'nn_alpha': 0.00010626315107073331, 'hidden_layer_sizes': 256, 'activation': 'tanh', 'solver': 'lbfgs'}. Best is trial 1 with value: 0.9666666666666667.
[I 2024-08-18 21:55:51,123] Trial 2 finished with value: 0.3333333333333333 and parameters: {'classifier': 'XGBoost', 'xgb_eta': 0.18817086053997992, 'xgb_max_depth': 3, 'xgb_min_child_weight': 58.79428765667244, 'xgb_subsample': 0.8723248574098681, 'xgb_colsample_bytree': 0.9349298546751639}. Best is trial 1 with value: 0.9666666666666667.
[I 2024-08-18 21:55:51,424] Trial 3 finished with value: 0.96 and parameters: {'classifier': 'RandomForest', 'rf_max_depth': 8, 'rf_min_samples_split': 9, 'rf_min_samples_leaf': 4, 'rf_max_features': 'log2'}. Best is trial 1 with value: 0.9666666666666667.
[I 2024-08-18 21:55:51,691] Trial 4 finished with value: 0.9466666666666667 and parameters: {'classifier': 'RandomForest', 'rf_max_depth': 26, 'rf_min_samples_split': 16, 'rf_min_samples_leaf': 9, 'rf_max_features': 'log2'}. Best is trial 1 with value: 0.9666666666666667.
[I 2024-08-18 21:55:53,144] Trial 5 finished with value: 0.9733333333333333 and parameters: {'classifier': 'NeuralNetwork', 'nn_alpha': 1.3151840058541203e-05, 'hidden_layer_sizes': 256, 'activation': 'relu', 'solver': 'sgd'}. Best is trial 5 with value: 0.9733333333333333.
[I 2024-08-18 21:55:53,159] Trial 6 finished with value: 0.9666666666666667 and parameters: {'classifier': 'SVC', 'svc_c': 197.2866638529666, 'gamma': 'auto', 'kernel': 'linear'}. Best is trial 5 with value: 0.9733333333333333.
[I 2024-08-18 21:55:53,900] Trial 7 finished with value: 0.98 and parameters: {'classifier': 'NeuralNetwork', 'nn_alpha': 0.0010415304667053759, 'hidden_layer_sizes': 128, 'activation': 'tanh', 'solver': 'adam'}. Best is trial 7 with value: 0.98.
[I 2024-08-18 21:55:54,159] Trial 8 finished with value: 0.9466666666666667 and parameters: {'classifier': 'RandomForest', 'rf_max_depth': 7, 'rf_min_samples_split': 12, 'rf_min_samples_leaf': 6, 'rf_max_features': 'sqrt'}. Best is trial 7 with value: 0.98.
[I 2024-08-18 21:55:54,422] Trial 9 finished with value: 0.9533333333333333 and parameters: {'classifier': 'RandomForest', 'rf_max_depth': 2, 'rf_min_samples_split': 15, 'rf_min_samples_leaf': 2, 'rf_max_features': 'log2'}. Best is trial 7 with value: 0.98.
[I 2024-08-18 21:55:56,202] Trial 10 finished with value: 0.98 and parameters: {'classifier': 'NeuralNetwork', 'nn_alpha': 0.01592254671184919, 'hidden_layer_sizes': 128, 'activation': 'logistic', 'solver': 'adam'}. Best is trial 7 with value: 0.98.
[I 2024-08-18 21:55:57,826] Trial 11 finished with value: 0.9866666666666667 and parameters: {'classifier': 'NeuralNetwork', 'nn_alpha': 0.03199399575525478, 'hidden_layer_sizes': 128, 'activation': 'logistic', 'solver': 'adam'}. Best is trial 11 with value: 0.9866666666666667.
[I 2024-08-18 21:55:58,520] Trial 12 finished with value: 0.98 and parameters: {'classifier': 'NeuralNetwork', 'nn_alpha': 0.0762966249793577, 'hidden_layer_sizes': 128, 'activation': 'tanh', 'solver': 'adam'}. Best is trial 11 with value: 0.9866666666666667.
[I 2024-08-18 21:56:00,423] Trial 13 finished with value: 0.9733333333333333 and parameters: {'classifier': 'NeuralNetwork', 'nn_alpha': 0.002296147163027348, 'hidden_layer_sizes': 128, 'activation': 'logistic', 'solver': 'adam'}. Best is trial 11 with value: 0.9866666666666667.
[I 2024-08-18 21:56:00,435] Trial 14 finished with value: 0.32 and parameters: {'classifier': 'SVC', 'svc_c': 2.516765055461004e-10, 'gamma': 'scale', 'kernel': 'poly'}. Best is trial 11 with value: 0.9866666666666667.
[I 2024-08-18 21:56:00,745] Trial 15 finished with value: 0.9666666666666667 and parameters: {'classifier': 'XGBoost', 'xgb_eta': 0.010477964051831087, 'xgb_max_depth': 9, 'xgb_min_child_weight': 1.5220867603871697e-05, 'xgb_subsample': 0.5242130297512841, 'xgb_colsample_bytree': 0.5135925921957261}. Best is trial 11 with value: 0.9866666666666667.
[I 2024-08-18 21:56:01,481] Trial 16 finished with value: 0.98 and parameters: {'classifier': 'NeuralNetwork', 'nn_alpha': 0.0014095155837407578, 'hidden_layer_sizes': 64, 'activation': 'tanh', 'solver': 'adam'}. Best is trial 11 with value: 0.9866666666666667.
[I 2024-08-18 21:56:05,591] Trial 17 finished with value: 0.9733333333333333 and parameters: {'classifier': 'NeuralNetwork', 'nn_alpha': 0.01290566808653344, 'hidden_layer_sizes': 512, 'activation': 'logistic', 'solver': 'adam'}. Best is trial 11 with value: 0.9866666666666667.
[I 2024-08-18 21:56:05,844] Trial 18 finished with value: 0.9666666666666667 and parameters: {'classifier': 'NeuralNetwork', 'nn_alpha': 0.0002417947442017684, 'hidden_layer_sizes': 128, 'activation': 'relu', 'solver': 'lbfgs'}. Best is trial 11 with value: 0.9866666666666667.
[I 2024-08-18 21:56:06,186] Trial 19 finished with value: 0.9666666666666667 and parameters: {'classifier': 'XGBoost', 'xgb_eta': 0.0233718627117308, 'xgb_max_depth': 7, 'xgb_min_child_weight': 0.023836575143438603, 'xgb_subsample': 0.9848860726198971, 'xgb_colsample_bytree': 0.6594034593934854}. Best is trial 11 with value: 0.9866666666666667.
[I 2024-08-18 21:56:06,206] Trial 20 finished with value: 0.96 and parameters: {'classifier': 'SVC', 'svc_c': 7645321075.541229, 'gamma': 'scale', 'kernel': 'rbf'}. Best is trial 11 with value: 0.9866666666666667.
[I 2024-08-18 21:56:08,192] Trial 21 finished with value: 0.98 and parameters: {'classifier': 'NeuralNetwork', 'nn_alpha': 0.031115875789220423, 'hidden_layer_sizes': 128, 'activation': 'logistic', 'solver': 'adam'}. Best is trial 11 with value: 0.9866666666666667.
[I 2024-08-18 21:56:10,018] Trial 22 finished with value: 0.98 and parameters: {'classifier': 'NeuralNetwork', 'nn_alpha': 0.007201228112443947, 'hidden_layer_sizes': 128, 'activation': 'logistic', 'solver': 'adam'}. Best is trial 11 with value: 0.9866666666666667.
[I 2024-08-18 21:56:11,947] Trial 23 finished with value: 0.98 and parameters: {'classifier': 'NeuralNetwork', 'nn_alpha': 0.00722538566973132, 'hidden_layer_sizes': 128, 'activation': 'logistic', 'solver': 'adam'}. Best is trial 11 with value: 0.9866666666666667.
[I 2024-08-18 21:56:13,335] Trial 24 finished with value: 0.9866666666666667 and parameters: {'classifier': 'NeuralNetwork', 'nn_alpha': 0.07521860872060951, 'hidden_layer_sizes': 128, 'activation': 'tanh', 'solver': 'sgd'}. Best is trial 11 with value: 0.9866666666666667.
[I 2024-08-18 21:56:16,948] Trial 25 finished with value: 0.9866666666666667 and parameters: {'classifier': 'NeuralNetwork', 'nn_alpha': 0.09626623126113913, 'hidden_layer_sizes': 512, 'activation': 'tanh', 'solver': 'sgd'}. Best is trial 11 with value: 0.9866666666666667.
[I 2024-08-18 21:56:20,421] Trial 26 finished with value: 0.98 and parameters: {'classifier': 'NeuralNetwork', 'nn_alpha': 0.09741995592693324, 'hidden_layer_sizes': 512, 'activation': 'tanh', 'solver': 'sgd'}. Best is trial 11 with value: 0.9866666666666667.
[I 2024-08-18 21:56:23,788] Trial 27 finished with value: 0.9866666666666667 and parameters: {'classifier': 'NeuralNetwork', 'nn_alpha': 0.04222438909568985, 'hidden_layer_sizes': 512, 'activation': 'tanh', 'solver': 'sgd'}. Best is trial 11 with value: 0.9866666666666667.
[I 2024-08-18 21:56:23,801] Trial 28 finished with value: 0.32 and parameters: {'classifier': 'SVC', 'svc_c': 2.2464397187482977e-07, 'gamma': 'auto', 'kernel': 'rbf'}. Best is trial 11 with value: 0.9866666666666667.
[I 2024-08-18 21:56:23,929] Trial 29 finished with value: 0.3333333333333333 and parameters: {'classifier': 'XGBoost', 'xgb_eta': 0.2845543271259046, 'xgb_max_depth': 3, 'xgb_min_child_weight': 90.17690206767591, 'xgb_subsample': 0.5873959266496227, 'xgb_colsample_bytree': 0.9904616521748782}. Best is trial 11 with value: 0.9866666666666667.
[I 2024-08-18 21:56:25,076] Trial 30 finished with value: 0.9866666666666667 and parameters: {'classifier': 'NeuralNetwork', 'nn_alpha': 0.03377720580723764, 'hidden_layer_sizes': 64, 'activation': 'tanh', 'solver': 'sgd'}. Best is trial 11 with value: 0.9866666666666667.
[I 2024-08-18 21:56:28,624] Trial 31 finished with value: 0.9866666666666667 and parameters: {'classifier': 'NeuralNetwork', 'nn_alpha': 0.09294462517435856, 'hidden_layer_sizes': 512, 'activation': 'tanh', 'solver': 'sgd'}. Best is trial 11 with value: 0.9866666666666667.
[I 2024-08-18 21:56:31,988] Trial 32 finished with value: 0.9866666666666667 and parameters: {'classifier': 'NeuralNetwork', 'nn_alpha': 0.040472552863205696, 'hidden_layer_sizes': 512, 'activation': 'tanh', 'solver': 'sgd'}. Best is trial 11 with value: 0.9866666666666667.
[I 2024-08-18 21:56:35,351] Trial 33 finished with value: 0.98 and parameters: {'classifier': 'NeuralNetwork', 'nn_alpha': 0.0287716244518146, 'hidden_layer_sizes': 512, 'activation': 'tanh', 'solver': 'sgd'}. Best is trial 11 with value: 0.9866666666666667.
[I 2024-08-18 21:56:38,765] Trial 34 finished with value: 0.98 and parameters: {'classifier': 'NeuralNetwork', 'nn_alpha': 0.004136891310549325, 'hidden_layer_sizes': 512, 'activation': 'tanh', 'solver': 'sgd'}. Best is trial 11 with value: 0.9866666666666667.
[I 2024-08-18 21:56:40,966] Trial 35 finished with value: 0.9733333333333333 and parameters: {'classifier': 'NeuralNetwork', 'nn_alpha': 0.04941990774486135, 'hidden_layer_sizes': 512, 'activation': 'relu', 'solver': 'sgd'}. Best is trial 11 with value: 0.9866666666666667.
[I 2024-08-18 21:56:41,238] Trial 36 finished with value: 0.96 and parameters: {'classifier': 'RandomForest', 'rf_max_depth': 2, 'rf_min_samples_split': 20, 'rf_min_samples_leaf': 10, 'rf_max_features': 'sqrt'}. Best is trial 11 with value: 0.9866666666666667.
[I 2024-08-18 21:56:41,470] Trial 37 finished with value: 0.96 and parameters: {'classifier': 'XGBoost', 'xgb_eta': 0.05686806635289461, 'xgb_max_depth': 5, 'xgb_min_child_weight': 2.7791315708301314e-05, 'xgb_subsample': 0.7131754978467123, 'xgb_colsample_bytree': 0.7784693191874991}. Best is trial 11 with value: 0.9866666666666667.
[I 2024-08-18 21:56:45,014] Trial 38 finished with value: 0.9866666666666667 and parameters: {'classifier': 'NeuralNetwork', 'nn_alpha': 0.017066959221099656, 'hidden_layer_sizes': 512, 'activation': 'tanh', 'solver': 'sgd'}. Best is trial 11 with value: 0.9866666666666667.
[I 2024-08-18 21:56:46,109] Trial 39 finished with value: 0.9866666666666667 and parameters: {'classifier': 'NeuralNetwork', 'nn_alpha': 0.09964941164028103, 'hidden_layer_sizes': 64, 'activation': 'tanh', 'solver': 'sgd'}. Best is trial 11 with value: 0.9866666666666667.
[I 2024-08-18 21:56:46,367] Trial 40 finished with value: 0.9533333333333333 and parameters: {'classifier': 'RandomForest', 'rf_max_depth': 13, 'rf_min_samples_split': 3, 'rf_min_samples_leaf': 7, 'rf_max_features': 'sqrt'}. Best is trial 11 with value: 0.9866666666666667.
[I 2024-08-18 21:56:47,453] Trial 41 finished with value: 0.98 and parameters: {'classifier': 'NeuralNetwork', 'nn_alpha': 0.031721729314186126, 'hidden_layer_sizes': 64, 'activation': 'tanh', 'solver': 'sgd'}. Best is trial 11 with value: 0.9866666666666667.
[I 2024-08-18 21:56:48,514] Trial 42 finished with value: 0.9866666666666667 and parameters: {'classifier': 'NeuralNetwork', 'nn_alpha': 0.03570791859510407, 'hidden_layer_sizes': 64, 'activation': 'tanh', 'solver': 'sgd'}. Best is trial 11 with value: 0.9866666666666667.
[I 2024-08-18 21:56:49,722] Trial 43 finished with value: 0.9733333333333333 and parameters: {'classifier': 'NeuralNetwork', 'nn_alpha': 0.015873343859109122, 'hidden_layer_sizes': 64, 'activation': 'tanh', 'solver': 'sgd'}. Best is trial 11 with value: 0.9866666666666667.
[I 2024-08-18 21:56:51,890] Trial 44 finished with value: 0.98 and parameters: {'classifier': 'NeuralNetwork', 'nn_alpha': 0.050092933438129476, 'hidden_layer_sizes': 256, 'activation': 'tanh', 'solver': 'sgd'}. Best is trial 11 with value: 0.9866666666666667.
[I 2024-08-18 21:56:51,901] Trial 45 finished with value: 0.9666666666666667 and parameters: {'classifier': 'SVC', 'svc_c': 1.805572136515825, 'gamma': 'scale', 'kernel': 'poly'}. Best is trial 11 with value: 0.9866666666666667.
[I 2024-08-18 21:56:52,734] Trial 46 finished with value: 0.9533333333333333 and parameters: {'classifier': 'NeuralNetwork', 'nn_alpha': 0.009276020430892231, 'hidden_layer_sizes': 64, 'activation': 'tanh', 'solver': 'lbfgs'}. Best is trial 11 with value: 0.9866666666666667.
[I 2024-08-18 21:56:57,941] Trial 47 finished with value: 0.9733333333333333 and parameters: {'classifier': 'NeuralNetwork', 'nn_alpha': 0.05673176333250013, 'hidden_layer_sizes': 128, 'activation': 'logistic', 'solver': 'sgd'}. Best is trial 11 with value: 0.9866666666666667.
[I 2024-08-18 21:56:58,212] Trial 48 finished with value: 0.9533333333333333 and parameters: {'classifier': 'RandomForest', 'rf_max_depth': 4, 'rf_min_samples_split': 8, 'rf_min_samples_leaf': 4, 'rf_max_features': 'sqrt'}. Best is trial 11 with value: 0.9866666666666667.
[I 2024-08-18 21:56:59,095] Trial 49 finished with value: 0.9733333333333333 and parameters: {'classifier': 'NeuralNetwork', 'nn_alpha': 0.00037687124374338347, 'hidden_layer_sizes': 256, 'activation': 'tanh', 'solver': 'lbfgs'}. Best is trial 11 with value: 0.9866666666666667.
[I 2024-08-18 21:57:01,373] Trial 50 finished with value: 0.9733333333333333 and parameters: {'classifier': 'NeuralNetwork', 'nn_alpha': 0.02225316307158094, 'hidden_layer_sizes': 512, 'activation': 'relu', 'solver': 'sgd'}. Best is trial 11 with value: 0.9866666666666667.
[I 2024-08-18 21:57:04,932] Trial 51 finished with value: 0.9866666666666667 and parameters: {'classifier': 'NeuralNetwork', 'nn_alpha': 0.09855932903341268, 'hidden_layer_sizes': 512, 'activation': 'tanh', 'solver': 'sgd'}. Best is trial 11 with value: 0.9866666666666667.
[I 2024-08-18 21:57:08,687] Trial 52 finished with value: 0.9866666666666667 and parameters: {'classifier': 'NeuralNetwork', 'nn_alpha': 4.874387816746543e-05, 'hidden_layer_sizes': 512, 'activation': 'tanh', 'solver': 'sgd'}. Best is trial 11 with value: 0.9866666666666667.
[I 2024-08-18 21:57:12,260] Trial 53 finished with value: 0.9866666666666667 and parameters: {'classifier': 'NeuralNetwork', 'nn_alpha': 0.059356208078386506, 'hidden_layer_sizes': 512, 'activation': 'tanh', 'solver': 'sgd'}. Best is trial 11 with value: 0.9866666666666667.
[I 2024-08-18 21:57:15,872] Trial 54 finished with value: 0.9866666666666667 and parameters: {'classifier': 'NeuralNetwork', 'nn_alpha': 0.05654943967864226, 'hidden_layer_sizes': 512, 'activation': 'tanh', 'solver': 'sgd'}. Best is trial 11 with value: 0.9866666666666667.
[I 2024-08-18 21:57:16,122] Trial 55 finished with value: 0.96 and parameters: {'classifier': 'XGBoost', 'xgb_eta': 0.07878770412693953, 'xgb_max_depth': 5, 'xgb_min_child_weight': 0.038534728760447806, 'xgb_subsample': 0.7416892115332541, 'xgb_colsample_bytree': 0.8021945231277603}. Best is trial 11 with value: 0.9866666666666667.
[I 2024-08-18 21:57:18,211] Trial 56 finished with value: 0.9866666666666667 and parameters: {'classifier': 'NeuralNetwork', 'nn_alpha': 0.023581829903452724, 'hidden_layer_sizes': 256, 'activation': 'tanh', 'solver': 'sgd'}. Best is trial 11 with value: 0.9866666666666667.
[I 2024-08-18 21:57:18,490] Trial 57 finished with value: 0.96 and parameters: {'classifier': 'SVC', 'svc_c': 1813975138.3461442, 'gamma': 'auto', 'kernel': 'linear'}. Best is trial 11 with value: 0.9866666666666667.
[I 2024-08-18 21:57:19,882] Trial 58 finished with value: 0.98 and parameters: {'classifier': 'NeuralNetwork', 'nn_alpha': 0.06829689681875802, 'hidden_layer_sizes': 128, 'activation': 'tanh', 'solver': 'sgd'}. Best is trial 11 with value: 0.9866666666666667.
[I 2024-08-18 21:57:20,671] Trial 59 finished with value: 0.98 and parameters: {'classifier': 'NeuralNetwork', 'nn_alpha': 1.7907865391846883e-05, 'hidden_layer_sizes': 128, 'activation': 'logistic', 'solver': 'lbfgs'}. Best is trial 11 with value: 0.9866666666666667.
[I 2024-08-18 21:57:21,720] Trial 60 finished with value: 0.98 and parameters: {'classifier': 'NeuralNetwork', 'nn_alpha': 0.0402435201772084, 'hidden_layer_sizes': 128, 'activation': 'relu', 'solver': 'sgd'}. Best is trial 11 with value: 0.9866666666666667.
[I 2024-08-18 21:57:25,284] Trial 61 finished with value: 0.9866666666666667 and parameters: {'classifier': 'NeuralNetwork', 'nn_alpha': 0.04040976137896433, 'hidden_layer_sizes': 512, 'activation': 'tanh', 'solver': 'sgd'}. Best is trial 11 with value: 0.9866666666666667.
[I 2024-08-18 21:57:28,990] Trial 62 finished with value: 0.9866666666666667 and parameters: {'classifier': 'NeuralNetwork', 'nn_alpha': 0.06593277915981356, 'hidden_layer_sizes': 512, 'activation': 'tanh', 'solver': 'sgd'}. Best is trial 11 with value: 0.9866666666666667.
[I 2024-08-18 21:57:30,194] Trial 63 finished with value: 0.98 and parameters: {'classifier': 'NeuralNetwork', 'nn_alpha': 0.01962858866714729, 'hidden_layer_sizes': 512, 'activation': 'tanh', 'solver': 'adam'}. Best is trial 11 with value: 0.9866666666666667.
[I 2024-08-18 21:57:33,809] Trial 64 finished with value: 0.9866666666666667 and parameters: {'classifier': 'NeuralNetwork', 'nn_alpha': 0.010694060956123654, 'hidden_layer_sizes': 512, 'activation': 'tanh', 'solver': 'sgd'}. Best is trial 11 with value: 0.9866666666666667.
[I 2024-08-18 21:57:34,087] Trial 65 finished with value: 0.9466666666666667 and parameters: {'classifier': 'RandomForest', 'rf_max_depth': 4, 'rf_min_samples_split': 19, 'rf_min_samples_leaf': 8, 'rf_max_features': 'sqrt'}. Best is trial 11 with value: 0.9866666666666667.
[I 2024-08-18 21:57:35,812] Trial 66 finished with value: 0.9866666666666667 and parameters: {'classifier': 'NeuralNetwork', 'nn_alpha': 0.07679722825757941, 'hidden_layer_sizes': 128, 'activation': 'logistic', 'solver': 'adam'}. Best is trial 11 with value: 0.9866666666666667.
[I 2024-08-18 21:57:36,148] Trial 67 finished with value: 0.9666666666666667 and parameters: {'classifier': 'XGBoost', 'xgb_eta': 0.022692465869283626, 'xgb_max_depth': 4, 'xgb_min_child_weight': 0.1137535978130512, 'xgb_subsample': 0.8838014929513889, 'xgb_colsample_bytree': 0.5303334829281097}. Best is trial 11 with value: 0.9866666666666667.
[I 2024-08-18 21:57:37,297] Trial 68 finished with value: 0.98 and parameters: {'classifier': 'NeuralNetwork', 'nn_alpha': 0.004534894249819489, 'hidden_layer_sizes': 64, 'activation': 'tanh', 'solver': 'sgd'}. Best is trial 11 with value: 0.9866666666666667.
[I 2024-08-18 21:57:37,309] Trial 69 finished with value: 0.32 and parameters: {'classifier': 'SVC', 'svc_c': 2.5566392154541027e-05, 'gamma': 'auto', 'kernel': 'rbf'}. Best is trial 11 with value: 0.9866666666666667.
[I 2024-08-18 21:57:54,052] Trial 70 finished with value: 0.96 and parameters: {'classifier': 'NeuralNetwork', 'nn_alpha': 0.02769230599084556, 'hidden_layer_sizes': 512, 'activation': 'logistic', 'solver': 'sgd'}. Best is trial 11 with value: 0.9866666666666667.
[I 2024-08-18 21:57:57,742] Trial 71 finished with value: 0.9866666666666667 and parameters: {'classifier': 'NeuralNetwork', 'nn_alpha': 0.01599708303502887, 'hidden_layer_sizes': 512, 'activation': 'tanh', 'solver': 'sgd'}. Best is trial 11 with value: 0.9866666666666667.
[I 2024-08-18 21:58:01,588] Trial 72 finished with value: 0.9866666666666667 and parameters: {'classifier': 'NeuralNetwork', 'nn_alpha': 0.04138503263922197, 'hidden_layer_sizes': 512, 'activation': 'tanh', 'solver': 'sgd'}. Best is trial 11 with value: 0.9866666666666667.
[I 2024-08-18 21:58:02,855] Trial 73 finished with value: 0.98 and parameters: {'classifier': 'NeuralNetwork', 'nn_alpha': 0.08128851644819844, 'hidden_layer_sizes': 512, 'activation': 'tanh', 'solver': 'adam'}. Best is trial 11 with value: 0.9866666666666667.
[I 2024-08-18 21:58:07,169] Trial 74 finished with value: 0.9866666666666667 and parameters: {'classifier': 'NeuralNetwork', 'nn_alpha': 0.026988245597163434, 'hidden_layer_sizes': 512, 'activation': 'tanh', 'solver': 'sgd'}. Best is trial 11 with value: 0.9866666666666667.
[I 2024-08-18 21:58:08,569] Trial 75 finished with value: 0.9866666666666667 and parameters: {'classifier': 'NeuralNetwork', 'nn_alpha': 0.04340461009534932, 'hidden_layer_sizes': 128, 'activation': 'tanh', 'solver': 'sgd'}. Best is trial 11 with value: 0.9866666666666667.
[I 2024-08-18 21:58:09,685] Trial 76 finished with value: 0.98 and parameters: {'classifier': 'NeuralNetwork', 'nn_alpha': 0.0987844607630451, 'hidden_layer_sizes': 512, 'activation': 'tanh', 'solver': 'adam'}. Best is trial 11 with value: 0.9866666666666667.
[I 2024-08-18 21:58:16,865] Trial 77 finished with value: 0.9733333333333333 and parameters: {'classifier': 'NeuralNetwork', 'nn_alpha': 0.01732940619129388, 'hidden_layer_sizes': 128, 'activation': 'logistic', 'solver': 'sgd'}. Best is trial 11 with value: 0.9866666666666667.
[I 2024-08-18 21:58:17,216] Trial 78 finished with value: 0.9666666666666667 and parameters: {'classifier': 'RandomForest', 'rf_max_depth': 4, 'rf_min_samples_split': 2, 'rf_min_samples_leaf': 1, 'rf_max_features': 'log2'}. Best is trial 11 with value: 0.9866666666666667.
[I 2024-08-18 21:58:18,146] Trial 79 finished with value: 0.9733333333333333 and parameters: {'classifier': 'NeuralNetwork', 'nn_alpha': 0.001198671308432268, 'hidden_layer_sizes': 64, 'activation': 'relu', 'solver': 'sgd'}. Best is trial 11 with value: 0.9866666666666667.
