[I 2024-08-19 19:06:51,590] Trial 324 finished with value: 0.9866666666666667 and parameters: {'classifier': 'NeuralNetwork', 'nn_alpha': 0.00017982266445130122, 'hidden_layer_sizes': 256, 'activation': 'tanh', 'solver': 'sgd'}. Best is trial 65 with value: 0.9866666666666667.
[I 2024-08-19 19:06:51,935] Trial 325 finished with value: 0.96 and parameters: {'classifier': 'XGBoost', 'xgb_eta': 0.04014681899331394, 'xgb_max_depth': 7, 'xgb_min_child_weight': 9.26292957863066e-05, 'xgb_subsample': 0.791600677295861, 'xgb_colsample_bytree': 0.5815188523887319}. Best is trial 65 with value: 0.9866666666666667.
[I 2024-08-19 19:06:54,128] Trial 326 finished with value: 0.98 and parameters: {'classifier': 'NeuralNetwork', 'nn_alpha': 0.0001268425665470851, 'hidden_layer_sizes': 256, 'activation': 'tanh', 'solver': 'sgd'}. Best is trial 65 with value: 0.9866666666666667.
[I 2024-08-19 19:06:55,257] Trial 327 finished with value: 0.9666666666666667 and parameters: {'classifier': 'NeuralNetwork', 'nn_alpha': 0.00047782477361273947, 'hidden_layer_sizes': 256, 'activation': 'tanh', 'solver': 'lbfgs'}. Best is trial 65 with value: 0.9866666666666667.
[I 2024-08-19 19:06:55,278] Trial 328 finished with value: 0.9533333333333333 and parameters: {'classifier': 'DecisionTree', 'dt_max_depth': 19, 'dt_min_samples_split': 15, 'dt_min_samples_leaf': 4, 'dt_max_features': 'sqrt'}. Best is trial 65 with value: 0.9866666666666667.
[I 2024-08-19 19:06:57,401] Trial 329 finished with value: 0.9866666666666667 and parameters: {'classifier': 'NeuralNetwork', 'nn_alpha': 0.00029407499736915283, 'hidden_layer_sizes': 256, 'activation': 'tanh', 'solver': 'sgd'}. Best is trial 65 with value: 0.9866666666666667.
[I 2024-08-19 19:06:59,612] Trial 330 finished with value: 0.98 and parameters: {'classifier': 'NeuralNetwork', 'nn_alpha': 7.692718523333672e-05, 'hidden_layer_sizes': 256, 'activation': 'tanh', 'solver': 'sgd'}. Best is trial 65 with value: 0.9866666666666667.
[I 2024-08-19 19:07:00,768] Trial 331 finished with value: 0.9733333333333333 and parameters: {'classifier': 'NeuralNetwork', 'nn_alpha': 0.00023779012779768935, 'hidden_layer_sizes': 128, 'activation': 'relu', 'solver': 'sgd'}. Best is trial 65 with value: 0.9866666666666667.
[I 2024-08-19 19:07:02,996] Trial 332 finished with value: 0.9866666666666667 and parameters: {'classifier': 'NeuralNetwork', 'nn_alpha': 5.797093458521975e-05, 'hidden_layer_sizes': 256, 'activation': 'tanh', 'solver': 'sgd'}. Best is trial 65 with value: 0.9866666666666667.
[I 2024-08-19 19:07:05,194] Trial 333 finished with value: 0.9866666666666667 and parameters: {'classifier': 'NeuralNetwork', 'nn_alpha': 0.00014285147831873585, 'hidden_layer_sizes': 256, 'activation': 'tanh', 'solver': 'sgd'}. Best is trial 65 with value: 0.9866666666666667.
[I 2024-08-19 19:07:07,406] Trial 334 finished with value: 0.98 and parameters: {'classifier': 'NeuralNetwork', 'nn_alpha': 0.00018521675224134507, 'hidden_layer_sizes': 256, 'activation': 'tanh', 'solver': 'sgd'}. Best is trial 65 with value: 0.9866666666666667.
[I 2024-08-19 19:07:09,607] Trial 335 finished with value: 0.9866666666666667 and parameters: {'classifier': 'NeuralNetwork', 'nn_alpha': 0.0003522007116507062, 'hidden_layer_sizes': 256, 'activation': 'tanh', 'solver': 'sgd'}. Best is trial 65 with value: 0.9866666666666667.
[I 2024-08-19 19:07:11,764] Trial 336 finished with value: 0.9866666666666667 and parameters: {'classifier': 'NeuralNetwork', 'nn_alpha': 0.00010678953872211825, 'hidden_layer_sizes': 256, 'activation': 'tanh', 'solver': 'sgd'}. Best is trial 65 with value: 0.9866666666666667.
[I 2024-08-19 19:07:14,013] Trial 337 finished with value: 0.9866666666666667 and parameters: {'classifier': 'NeuralNetwork', 'nn_alpha': 0.00020960785825478931, 'hidden_layer_sizes': 256, 'activation': 'tanh', 'solver': 'sgd'}. Best is trial 65 with value: 0.9866666666666667.
[I 2024-08-19 19:07:16,185] Trial 338 finished with value: 0.9866666666666667 and parameters: {'classifier': 'NeuralNetwork', 'nn_alpha': 0.00015524838763574967, 'hidden_layer_sizes': 256, 'activation': 'tanh', 'solver': 'sgd'}. Best is trial 65 with value: 0.9866666666666667.
[I 2024-08-19 19:07:18,517] Trial 339 finished with value: 0.9866666666666667 and parameters: {'classifier': 'NeuralNetwork', 'nn_alpha': 0.0002696622394147887, 'hidden_layer_sizes': 256, 'activation': 'tanh', 'solver': 'sgd'}. Best is trial 65 with value: 0.9866666666666667.
[I 2024-08-19 19:07:19,519] Trial 340 finished with value: 0.98 and parameters: {'classifier': 'NeuralNetwork', 'nn_alpha': 0.00017669373710458777, 'hidden_layer_sizes': 256, 'activation': 'tanh', 'solver': 'adam'}. Best is trial 65 with value: 0.9866666666666667.
[I 2024-08-19 19:07:19,806] Trial 341 finished with value: 0.9466666666666667 and parameters: {'classifier': 'RandomForest', 'rf_max_depth': 3, 'rf_min_samples_split': 4, 'rf_min_samples_leaf': 5, 'rf_max_features': 'log2'}. Best is trial 65 with value: 0.9866666666666667.
[I 2024-08-19 19:07:22,015] Trial 342 finished with value: 0.9866666666666667 and parameters: {'classifier': 'NeuralNetwork', 'nn_alpha': 0.00041897082119150516, 'hidden_layer_sizes': 256, 'activation': 'tanh', 'solver': 'sgd'}. Best is trial 65 with value: 0.9866666666666667.
[I 2024-08-19 19:07:25,395] Trial 343 finished with value: 0.6066666666666667 and parameters: {'classifier': 'NeuralNetwork', 'nn_alpha': 0.00012512148284368724, 'hidden_layer_sizes': 256, 'activation': 'logistic', 'solver': 'sgd'}. Best is trial 65 with value: 0.9866666666666667.
[I 2024-08-19 19:07:26,597] Trial 344 finished with value: 0.98 and parameters: {'classifier': 'NeuralNetwork', 'nn_alpha': 0.00022596232540072212, 'hidden_layer_sizes': 64, 'activation': 'tanh', 'solver': 'sgd'}. Best is trial 65 with value: 0.9866666666666667.
[I 2024-08-19 19:07:28,138] Trial 345 finished with value: 0.9866666666666667 and parameters: {'classifier': 'NeuralNetwork', 'nn_alpha': 8.625058232392324e-05, 'hidden_layer_sizes': 128, 'activation': 'tanh', 'solver': 'sgd'}. Best is trial 65 with value: 0.9866666666666667.
[I 2024-08-19 19:07:30,344] Trial 346 finished with value: 0.98 and parameters: {'classifier': 'NeuralNetwork', 'nn_alpha': 0.0002945155558028745, 'hidden_layer_sizes': 256, 'activation': 'tanh', 'solver': 'sgd'}. Best is trial 65 with value: 0.9866666666666667.
[I 2024-08-19 19:07:34,253] Trial 347 finished with value: 0.9866666666666667 and parameters: {'classifier': 'NeuralNetwork', 'nn_alpha': 0.00016485674790634697, 'hidden_layer_sizes': 512, 'activation': 'tanh', 'solver': 'sgd'}. Best is trial 65 with value: 0.9866666666666667.
[I 2024-08-19 19:07:36,427] Trial 348 finished with value: 0.98 and parameters: {'classifier': 'NeuralNetwork', 'nn_alpha': 0.00024181942555170216, 'hidden_layer_sizes': 256, 'activation': 'tanh', 'solver': 'sgd'}. Best is trial 65 with value: 0.9866666666666667.
[I 2024-08-19 19:07:36,442] Trial 349 finished with value: 0.9533333333333333 and parameters: {'classifier': 'SVC', 'svc_c': 0.04630060576270153, 'gamma': 'auto', 'kernel': 'linear'}. Best is trial 65 with value: 0.9866666666666667.
[I 2024-08-19 19:07:38,524] Trial 350 finished with value: 0.9866666666666667 and parameters: {'classifier': 'NeuralNetwork', 'nn_alpha': 0.0001403420141035206, 'hidden_layer_sizes': 256, 'activation': 'tanh', 'solver': 'sgd'}. Best is trial 65 with value: 0.9866666666666667.
[I 2024-08-19 19:07:38,707] Trial 351 finished with value: 0.94 and parameters: {'classifier': 'XGBoost', 'xgb_eta': 0.09965018717324527, 'xgb_max_depth': 6, 'xgb_min_child_weight': 6.336154231985169, 'xgb_subsample': 0.9964677460883525, 'xgb_colsample_bytree': 0.9935102615852134}. Best is trial 65 with value: 0.9866666666666667.
[I 2024-08-19 19:07:39,936] Trial 352 finished with value: 0.96 and parameters: {'classifier': 'NeuralNetwork', 'nn_alpha': 0.00036040563184108905, 'hidden_layer_sizes': 256, 'activation': 'tanh', 'solver': 'lbfgs'}. Best is trial 65 with value: 0.9866666666666667.
[I 2024-08-19 19:07:39,959] Trial 353 finished with value: 0.9466666666666667 and parameters: {'classifier': 'DecisionTree', 'dt_max_depth': 9, 'dt_min_samples_split': 5, 'dt_min_samples_leaf': 6, 'dt_max_features': 'log2'}. Best is trial 65 with value: 0.9866666666666667.
[I 2024-08-19 19:07:42,275] Trial 354 finished with value: 0.98 and parameters: {'classifier': 'NeuralNetwork', 'nn_alpha': 0.0001956104995884441, 'hidden_layer_sizes': 256, 'activation': 'tanh', 'solver': 'sgd'}. Best is trial 65 with value: 0.9866666666666667.
[I 2024-08-19 19:07:44,583] Trial 355 finished with value: 0.98 and parameters: {'classifier': 'NeuralNetwork', 'nn_alpha': 0.00027203668821978186, 'hidden_layer_sizes': 256, 'activation': 'tanh', 'solver': 'sgd'}. Best is trial 65 with value: 0.9866666666666667.
[I 2024-08-19 19:07:46,870] Trial 356 finished with value: 0.98 and parameters: {'classifier': 'NeuralNetwork', 'nn_alpha': 2.3192597018618676e-05, 'hidden_layer_sizes': 256, 'activation': 'tanh', 'solver': 'sgd'}. Best is trial 65 with value: 0.9866666666666667.
[I 2024-08-19 19:07:48,413] Trial 357 finished with value: 0.98 and parameters: {'classifier': 'NeuralNetwork', 'nn_alpha': 0.0001189859160456975, 'hidden_layer_sizes': 256, 'activation': 'relu', 'solver': 'sgd'}. Best is trial 65 with value: 0.9866666666666667.
[I 2024-08-19 19:07:50,672] Trial 358 finished with value: 0.9866666666666667 and parameters: {'classifier': 'NeuralNetwork', 'nn_alpha': 0.00020537483135425316, 'hidden_layer_sizes': 256, 'activation': 'tanh', 'solver': 'sgd'}. Best is trial 65 with value: 0.9866666666666667.
[I 2024-08-19 19:07:52,854] Trial 359 finished with value: 0.9866666666666667 and parameters: {'classifier': 'NeuralNetwork', 'nn_alpha': 9.555584657640838e-05, 'hidden_layer_sizes': 256, 'activation': 'tanh', 'solver': 'sgd'}. Best is trial 65 with value: 0.9866666666666667.
[I 2024-08-19 19:07:55,117] Trial 360 finished with value: 0.9866666666666667 and parameters: {'classifier': 'NeuralNetwork', 'nn_alpha': 0.0005968630745467325, 'hidden_layer_sizes': 256, 'activation': 'tanh', 'solver': 'sgd'}. Best is trial 65 with value: 0.9866666666666667.
[I 2024-08-19 19:07:57,294] Trial 361 finished with value: 0.98 and parameters: {'classifier': 'NeuralNetwork', 'nn_alpha': 0.00016618112367666442, 'hidden_layer_sizes': 256, 'activation': 'tanh', 'solver': 'sgd'}. Best is trial 65 with value: 0.9866666666666667.
[I 2024-08-19 19:07:58,842] Trial 362 finished with value: 0.9866666666666667 and parameters: {'classifier': 'NeuralNetwork', 'nn_alpha': 0.0001348105486141857, 'hidden_layer_sizes': 128, 'activation': 'tanh', 'solver': 'sgd'}. Best is trial 65 with value: 0.9866666666666667.
[I 2024-08-19 19:08:01,325] Trial 363 finished with value: 0.9866666666666667 and parameters: {'classifier': 'NeuralNetwork', 'nn_alpha': 0.00023754474988081452, 'hidden_layer_sizes': 256, 'activation': 'tanh', 'solver': 'sgd'}. Best is trial 65 with value: 0.9866666666666667.
[I 2024-08-19 19:08:03,556] Trial 364 finished with value: 0.98 and parameters: {'classifier': 'NeuralNetwork', 'nn_alpha': 6.927282807116517e-05, 'hidden_layer_sizes': 256, 'activation': 'tanh', 'solver': 'sgd'}. Best is trial 65 with value: 0.9866666666666667.
[I 2024-08-19 19:08:06,566] Trial 365 finished with value: 0.9866666666666667 and parameters: {'classifier': 'NeuralNetwork', 'nn_alpha': 0.0003064939489925132, 'hidden_layer_sizes': 256, 'activation': 'tanh', 'solver': 'sgd'}. Best is trial 65 with value: 0.9866666666666667.
[I 2024-08-19 19:08:06,848] Trial 366 finished with value: 0.96 and parameters: {'classifier': 'RandomForest', 'rf_max_depth': 8, 'rf_min_samples_split': 9, 'rf_min_samples_leaf': 4, 'rf_max_features': 'sqrt'}. Best is trial 65 with value: 0.9866666666666667.
[I 2024-08-19 19:08:09,004] Trial 367 finished with value: 0.9866666666666667 and parameters: {'classifier': 'NeuralNetwork', 'nn_alpha': 0.0001995505833470742, 'hidden_layer_sizes': 256, 'activation': 'tanh', 'solver': 'sgd'}. Best is trial 65 with value: 0.9866666666666667.
[I 2024-08-19 19:08:10,056] Trial 368 finished with value: 0.98 and parameters: {'classifier': 'NeuralNetwork', 'nn_alpha': 0.00045652767624578715, 'hidden_layer_sizes': 256, 'activation': 'tanh', 'solver': 'adam'}. Best is trial 65 with value: 0.9866666666666667.
[I 2024-08-19 19:08:20,318] Trial 369 finished with value: 0.96 and parameters: {'classifier': 'NeuralNetwork', 'nn_alpha': 0.0001481050674233274, 'hidden_layer_sizes': 256, 'activation': 'logistic', 'solver': 'sgd'}. Best is trial 65 with value: 0.9866666666666667.
[I 2024-08-19 19:08:22,555] Trial 370 finished with value: 0.9866666666666667 and parameters: {'classifier': 'NeuralNetwork', 'nn_alpha': 0.00017661160298044785, 'hidden_layer_sizes': 256, 'activation': 'tanh', 'solver': 'sgd'}. Best is trial 65 with value: 0.9866666666666667.
[I 2024-08-19 19:08:24,720] Trial 371 finished with value: 0.9866666666666667 and parameters: {'classifier': 'NeuralNetwork', 'nn_alpha': 0.00011397959855566218, 'hidden_layer_sizes': 256, 'activation': 'tanh', 'solver': 'sgd'}. Best is trial 65 with value: 0.9866666666666667.
[I 2024-08-19 19:08:26,985] Trial 372 finished with value: 0.9866666666666667 and parameters: {'classifier': 'NeuralNetwork', 'nn_alpha': 0.002705834843694883, 'hidden_layer_sizes': 256, 'activation': 'tanh', 'solver': 'sgd'}. Best is trial 65 with value: 0.9866666666666667.
[I 2024-08-19 19:08:28,201] Trial 373 finished with value: 0.98 and parameters: {'classifier': 'NeuralNetwork', 'nn_alpha': 0.0002481471208678879, 'hidden_layer_sizes': 64, 'activation': 'tanh', 'solver': 'sgd'}. Best is trial 65 with value: 0.9866666666666667.
[I 2024-08-19 19:08:30,401] Trial 374 finished with value: 0.9866666666666667 and parameters: {'classifier': 'NeuralNetwork', 'nn_alpha': 0.0003531530657176688, 'hidden_layer_sizes': 256, 'activation': 'tanh', 'solver': 'sgd'}. Best is trial 65 with value: 0.9866666666666667.
[I 2024-08-19 19:08:34,229] Trial 375 finished with value: 0.9866666666666667 and parameters: {'classifier': 'NeuralNetwork', 'nn_alpha': 5.108460829568047e-05, 'hidden_layer_sizes': 512, 'activation': 'tanh', 'solver': 'sgd'}. Best is trial 65 with value: 0.9866666666666667.
[I 2024-08-19 19:08:34,555] Trial 376 finished with value: 0.9666666666666667 and parameters: {'classifier': 'XGBoost', 'xgb_eta': 0.016713444433048116, 'xgb_max_depth': 4, 'xgb_min_child_weight': 0.3023059804055081, 'xgb_subsample': 0.9028012036572262, 'xgb_colsample_bytree': 0.6860428970319414}. Best is trial 65 with value: 0.9866666666666667.
[I 2024-08-19 19:08:34,586] Trial 377 finished with value: 0.32 and parameters: {'classifier': 'SVC', 'svc_c': 7.728652185060469e-07, 'gamma': 'scale', 'kernel': 'rbf'}. Best is trial 65 with value: 0.9866666666666667.
[I 2024-08-19 19:08:35,389] Trial 378 finished with value: 0.9733333333333333 and parameters: {'classifier': 'NeuralNetwork', 'nn_alpha': 9.673359087707703e-05, 'hidden_layer_sizes': 256, 'activation': 'tanh', 'solver': 'lbfgs'}. Best is trial 65 with value: 0.9866666666666667.
[I 2024-08-19 19:08:35,413] Trial 379 finished with value: 0.94 and parameters: {'classifier': 'DecisionTree', 'dt_max_depth': 14, 'dt_min_samples_split': 10, 'dt_min_samples_leaf': 3, 'dt_max_features': 'sqrt'}. Best is trial 65 with value: 0.9866666666666667.
[I 2024-08-19 19:08:36,913] Trial 380 finished with value: 0.9866666666666667 and parameters: {'classifier': 'NeuralNetwork', 'nn_alpha': 0.00020377317386953048, 'hidden_layer_sizes': 128, 'activation': 'tanh', 'solver': 'sgd'}. Best is trial 65 with value: 0.9866666666666667.
[I 2024-08-19 19:08:39,142] Trial 381 finished with value: 0.98 and parameters: {'classifier': 'NeuralNetwork', 'nn_alpha': 0.000292001022799887, 'hidden_layer_sizes': 256, 'activation': 'tanh', 'solver': 'sgd'}. Best is trial 65 with value: 0.9866666666666667.
[I 2024-08-19 19:08:41,336] Trial 382 finished with value: 0.9866666666666667 and parameters: {'classifier': 'NeuralNetwork', 'nn_alpha': 0.00015751468604952777, 'hidden_layer_sizes': 256, 'activation': 'tanh', 'solver': 'sgd'}. Best is trial 65 with value: 0.9866666666666667.
[I 2024-08-19 19:08:43,565] Trial 383 finished with value: 0.9866666666666667 and parameters: {'classifier': 'NeuralNetwork', 'nn_alpha': 0.00023587962089653214, 'hidden_layer_sizes': 256, 'activation': 'tanh', 'solver': 'sgd'}. Best is trial 65 with value: 0.9866666666666667.
[I 2024-08-19 19:08:45,201] Trial 384 finished with value: 0.98 and parameters: {'classifier': 'NeuralNetwork', 'nn_alpha': 0.0001299800394397344, 'hidden_layer_sizes': 256, 'activation': 'relu', 'solver': 'sgd'}. Best is trial 65 with value: 0.9866666666666667.
[I 2024-08-19 19:08:47,414] Trial 385 finished with value: 0.9866666666666667 and parameters: {'classifier': 'NeuralNetwork', 'nn_alpha': 0.00018729437521686825, 'hidden_layer_sizes': 256, 'activation': 'tanh', 'solver': 'sgd'}. Best is trial 65 with value: 0.9866666666666667.
[I 2024-08-19 19:08:49,835] Trial 386 finished with value: 0.9866666666666667 and parameters: {'classifier': 'NeuralNetwork', 'nn_alpha': 7.454909848897134e-05, 'hidden_layer_sizes': 256, 'activation': 'tanh', 'solver': 'sgd'}. Best is trial 65 with value: 0.9866666666666667.
[I 2024-08-19 19:08:52,012] Trial 387 finished with value: 0.9866666666666667 and parameters: {'classifier': 'NeuralNetwork', 'nn_alpha': 0.0004080655414122125, 'hidden_layer_sizes': 256, 'activation': 'tanh', 'solver': 'sgd'}. Best is trial 65 with value: 0.9866666666666667.
[I 2024-08-19 19:08:54,177] Trial 388 finished with value: 0.9866666666666667 and parameters: {'classifier': 'NeuralNetwork', 'nn_alpha': 0.00015785557041761325, 'hidden_layer_sizes': 256, 'activation': 'tanh', 'solver': 'sgd'}. Best is trial 65 with value: 0.9866666666666667.
[I 2024-08-19 19:08:56,466] Trial 389 finished with value: 0.9866666666666667 and parameters: {'classifier': 'NeuralNetwork', 'nn_alpha': 0.0005067890549967601, 'hidden_layer_sizes': 256, 'activation': 'tanh', 'solver': 'sgd'}. Best is trial 65 with value: 0.9866666666666667.
[I 2024-08-19 19:08:58,719] Trial 390 finished with value: 0.9866666666666667 and parameters: {'classifier': 'NeuralNetwork', 'nn_alpha': 0.00026366513051206313, 'hidden_layer_sizes': 256, 'activation': 'tanh', 'solver': 'sgd'}. Best is trial 65 with value: 0.9866666666666667.
[I 2024-08-19 19:09:01,164] Trial 391 finished with value: 0.9866666666666667 and parameters: {'classifier': 'NeuralNetwork', 'nn_alpha': 0.00021520266251790556, 'hidden_layer_sizes': 256, 'activation': 'tanh', 'solver': 'sgd'}. Best is trial 65 with value: 0.9866666666666667.
[I 2024-08-19 19:09:01,510] Trial 392 finished with value: 0.9466666666666667 and parameters: {'classifier': 'RandomForest', 'rf_max_depth': 20, 'rf_min_samples_split': 13, 'rf_min_samples_leaf': 7, 'rf_max_features': 'log2'}. Best is trial 65 with value: 0.9866666666666667.
[I 2024-08-19 19:09:03,258] Trial 393 finished with value: 0.98 and parameters: {'classifier': 'NeuralNetwork', 'nn_alpha': 0.00010616104300046849, 'hidden_layer_sizes': 128, 'activation': 'tanh', 'solver': 'sgd'}. Best is trial 65 with value: 0.9866666666666667.
[I 2024-08-19 19:09:05,627] Trial 394 finished with value: 0.9866666666666667 and parameters: {'classifier': 'NeuralNetwork', 'nn_alpha': 0.0003216116518308607, 'hidden_layer_sizes': 256, 'activation': 'tanh', 'solver': 'sgd'}. Best is trial 65 with value: 0.9866666666666667.
[I 2024-08-19 19:09:07,899] Trial 395 finished with value: 0.98 and parameters: {'classifier': 'NeuralNetwork', 'nn_alpha': 0.00017828777185919414, 'hidden_layer_sizes': 256, 'activation': 'tanh', 'solver': 'sgd'}. Best is trial 65 with value: 0.9866666666666667.
[I 2024-08-19 19:09:08,738] Trial 396 finished with value: 0.98 and parameters: {'classifier': 'NeuralNetwork', 'nn_alpha': 0.00012873677272051738, 'hidden_layer_sizes': 256, 'activation': 'tanh', 'solver': 'adam'}. Best is trial 65 with value: 0.9866666666666667.
[I 2024-08-19 19:09:18,852] Trial 397 finished with value: 0.96 and parameters: {'classifier': 'NeuralNetwork', 'nn_alpha': 0.0006927582396649999, 'hidden_layer_sizes': 256, 'activation': 'logistic', 'solver': 'sgd'}. Best is trial 65 with value: 0.9866666666666667.
[I 2024-08-19 19:09:21,294] Trial 398 finished with value: 0.9866666666666667 and parameters: {'classifier': 'NeuralNetwork', 'nn_alpha': 8.540398187819962e-05, 'hidden_layer_sizes': 256, 'activation': 'tanh', 'solver': 'sgd'}. Best is trial 65 with value: 0.9866666666666667.
[I 2024-08-19 19:09:23,508] Trial 399 finished with value: 0.9866666666666667 and parameters: {'classifier': 'NeuralNetwork', 'nn_alpha': 0.00022005543356231973, 'hidden_layer_sizes': 256, 'activation': 'tanh', 'solver': 'sgd'}. Best is trial 65 with value: 0.9866666666666667.
[I 2024-08-19 19:09:23,526] Trial 400 finished with value: 0.9666666666666667 and parameters: {'classifier': 'SVC', 'svc_c': 0.03352317163221372, 'gamma': 'auto', 'kernel': 'poly'}. Best is trial 65 with value: 0.9866666666666667.
[I 2024-08-19 19:09:25,705] Trial 401 finished with value: 0.9866666666666667 and parameters: {'classifier': 'NeuralNetwork', 'nn_alpha': 0.00014506456257300284, 'hidden_layer_sizes': 256, 'activation': 'tanh', 'solver': 'sgd'}. Best is trial 65 with value: 0.9866666666666667.
[I 2024-08-19 19:09:27,887] Trial 402 finished with value: 0.9866666666666667 and parameters: {'classifier': 'NeuralNetwork', 'nn_alpha': 0.00028983838845821807, 'hidden_layer_sizes': 256, 'activation': 'tanh', 'solver': 'sgd'}. Best is trial 65 with value: 0.9866666666666667.
[I 2024-08-19 19:09:28,171] Trial 403 finished with value: 0.96 and parameters: {'classifier': 'XGBoost', 'xgb_eta': 0.17548187605195922, 'xgb_max_depth': 7, 'xgb_min_child_weight': 0.0035539783683044956, 'xgb_subsample': 0.5859490925607247, 'xgb_colsample_bytree': 0.7949858518037138}. Best is trial 65 with value: 0.9866666666666667.
