[I 2024-08-19 19:20:39,326] Trial 724 finished with value: 0.9866666666666667 and parameters: {'classifier': 'NeuralNetwork', 'nn_alpha': 0.00020592770529932264, 'hidden_layer_sizes': 256, 'activation': 'tanh', 'solver': 'sgd'}. Best is trial 65 with value: 0.9866666666666667.
[I 2024-08-19 19:20:41,702] Trial 725 finished with value: 0.9866666666666667 and parameters: {'classifier': 'NeuralNetwork', 'nn_alpha': 0.00014303780756652544, 'hidden_layer_sizes': 256, 'activation': 'tanh', 'solver': 'sgd'}. Best is trial 65 with value: 0.9866666666666667.
[I 2024-08-19 19:20:44,017] Trial 726 finished with value: 0.98 and parameters: {'classifier': 'NeuralNetwork', 'nn_alpha': 0.0004684804604039314, 'hidden_layer_sizes': 256, 'activation': 'tanh', 'solver': 'sgd'}. Best is trial 65 with value: 0.9866666666666667.
[I 2024-08-19 19:20:45,665] Trial 727 finished with value: 0.9866666666666667 and parameters: {'classifier': 'NeuralNetwork', 'nn_alpha': 0.000283406049552215, 'hidden_layer_sizes': 128, 'activation': 'tanh', 'solver': 'sgd'}. Best is trial 65 with value: 0.9866666666666667.
[I 2024-08-19 19:20:48,000] Trial 728 finished with value: 0.98 and parameters: {'classifier': 'NeuralNetwork', 'nn_alpha': 0.00010190017393375002, 'hidden_layer_sizes': 256, 'activation': 'tanh', 'solver': 'sgd'}. Best is trial 65 with value: 0.9866666666666667.
[I 2024-08-19 19:20:50,402] Trial 729 finished with value: 0.9866666666666667 and parameters: {'classifier': 'NeuralNetwork', 'nn_alpha': 5.8160004894672665e-05, 'hidden_layer_sizes': 256, 'activation': 'tanh', 'solver': 'sgd'}. Best is trial 65 with value: 0.9866666666666667.
[I 2024-08-19 19:20:52,703] Trial 730 finished with value: 0.9866666666666667 and parameters: {'classifier': 'NeuralNetwork', 'nn_alpha': 0.00033924561709385595, 'hidden_layer_sizes': 256, 'activation': 'tanh', 'solver': 'sgd'}. Best is trial 65 with value: 0.9866666666666667.
[I 2024-08-19 19:20:53,033] Trial 731 finished with value: 0.9466666666666667 and parameters: {'classifier': 'RandomForest', 'rf_max_depth': 2, 'rf_min_samples_split': 2, 'rf_min_samples_leaf': 10, 'rf_max_features': 'log2'}. Best is trial 65 with value: 0.9866666666666667.
[I 2024-08-19 19:20:55,419] Trial 732 finished with value: 0.9866666666666667 and parameters: {'classifier': 'NeuralNetwork', 'nn_alpha': 0.0006143862834187208, 'hidden_layer_sizes': 256, 'activation': 'tanh', 'solver': 'sgd'}. Best is trial 65 with value: 0.9866666666666667.
[I 2024-08-19 19:20:56,437] Trial 733 finished with value: 0.98 and parameters: {'classifier': 'NeuralNetwork', 'nn_alpha': 0.00016613316077177865, 'hidden_layer_sizes': 256, 'activation': 'tanh', 'solver': 'adam'}. Best is trial 65 with value: 0.9866666666666667.
[I 2024-08-19 19:20:58,835] Trial 734 finished with value: 0.98 and parameters: {'classifier': 'NeuralNetwork', 'nn_alpha': 0.0016876009926881218, 'hidden_layer_sizes': 256, 'activation': 'tanh', 'solver': 'sgd'}. Best is trial 65 with value: 0.9866666666666667.
[I 2024-08-19 19:21:09,454] Trial 735 finished with value: 0.96 and parameters: {'classifier': 'NeuralNetwork', 'nn_alpha': 0.0235032468256579, 'hidden_layer_sizes': 256, 'activation': 'logistic', 'solver': 'sgd'}. Best is trial 65 with value: 0.9866666666666667.
[I 2024-08-19 19:21:11,798] Trial 736 finished with value: 0.9866666666666667 and parameters: {'classifier': 'NeuralNetwork', 'nn_alpha': 4.634813632049885e-05, 'hidden_layer_sizes': 256, 'activation': 'tanh', 'solver': 'sgd'}. Best is trial 65 with value: 0.9866666666666667.
[I 2024-08-19 19:21:14,287] Trial 737 finished with value: 0.9866666666666667 and parameters: {'classifier': 'NeuralNetwork', 'nn_alpha': 0.0002237737703860178, 'hidden_layer_sizes': 256, 'activation': 'tanh', 'solver': 'sgd'}. Best is trial 65 with value: 0.9866666666666667.
[I 2024-08-19 19:21:16,668] Trial 738 finished with value: 0.9866666666666667 and parameters: {'classifier': 'NeuralNetwork', 'nn_alpha': 0.00014065311619346216, 'hidden_layer_sizes': 256, 'activation': 'tanh', 'solver': 'sgd'}. Best is trial 65 with value: 0.9866666666666667.
[I 2024-08-19 19:21:19,134] Trial 739 finished with value: 0.9866666666666667 and parameters: {'classifier': 'NeuralNetwork', 'nn_alpha': 7.574349939751645e-05, 'hidden_layer_sizes': 256, 'activation': 'tanh', 'solver': 'sgd'}. Best is trial 65 with value: 0.9866666666666667.
[I 2024-08-19 19:21:20,817] Trial 740 finished with value: 0.98 and parameters: {'classifier': 'NeuralNetwork', 'nn_alpha': 0.0009708771775455028, 'hidden_layer_sizes': 128, 'activation': 'tanh', 'solver': 'sgd'}. Best is trial 65 with value: 0.9866666666666667.
[I 2024-08-19 19:21:20,904] Trial 741 finished with value: 0.9533333333333333 and parameters: {'classifier': 'SVC', 'svc_c': 354172441.625434, 'gamma': 'scale', 'kernel': 'poly'}. Best is trial 65 with value: 0.9866666666666667.
[I 2024-08-19 19:21:21,137] Trial 742 finished with value: 0.3333333333333333 and parameters: {'classifier': 'XGBoost', 'xgb_eta': 0.06154232024332006, 'xgb_max_depth': 6, 'xgb_min_child_weight': 93.51183545680368, 'xgb_subsample': 0.9685057456891277, 'xgb_colsample_bytree': 0.7126535212981715}. Best is trial 65 with value: 0.9866666666666667.
[I 2024-08-19 19:21:23,585] Trial 743 finished with value: 0.98 and parameters: {'classifier': 'NeuralNetwork', 'nn_alpha': 0.00020016794117847043, 'hidden_layer_sizes': 256, 'activation': 'tanh', 'solver': 'sgd'}. Best is trial 65 with value: 0.9866666666666667.
[I 2024-08-19 19:21:23,617] Trial 744 finished with value: 0.8533333333333334 and parameters: {'classifier': 'DecisionTree', 'dt_max_depth': 13, 'dt_min_samples_split': 17, 'dt_min_samples_leaf': 10, 'dt_max_features': 'log2'}. Best is trial 65 with value: 0.9866666666666667.
[I 2024-08-19 19:21:26,094] Trial 745 finished with value: 0.98 and parameters: {'classifier': 'NeuralNetwork', 'nn_alpha': 0.00011682277605214502, 'hidden_layer_sizes': 256, 'activation': 'tanh', 'solver': 'sgd'}. Best is trial 65 with value: 0.9866666666666667.
[I 2024-08-19 19:21:27,191] Trial 746 finished with value: 0.9533333333333333 and parameters: {'classifier': 'NeuralNetwork', 'nn_alpha': 0.00024125328822997792, 'hidden_layer_sizes': 256, 'activation': 'tanh', 'solver': 'lbfgs'}. Best is trial 65 with value: 0.9866666666666667.
[I 2024-08-19 19:21:29,511] Trial 747 finished with value: 0.9866666666666667 and parameters: {'classifier': 'NeuralNetwork', 'nn_alpha': 0.00030135492921034847, 'hidden_layer_sizes': 256, 'activation': 'tanh', 'solver': 'sgd'}. Best is trial 65 with value: 0.9866666666666667.
[I 2024-08-19 19:21:32,019] Trial 748 finished with value: 0.9866666666666667 and parameters: {'classifier': 'NeuralNetwork', 'nn_alpha': 0.00017803215512126778, 'hidden_layer_sizes': 256, 'activation': 'tanh', 'solver': 'sgd'}. Best is trial 65 with value: 0.9866666666666667.
[I 2024-08-19 19:21:33,024] Trial 749 finished with value: 0.98 and parameters: {'classifier': 'NeuralNetwork', 'nn_alpha': 9.834738607472046e-05, 'hidden_layer_sizes': 64, 'activation': 'relu', 'solver': 'sgd'}. Best is trial 65 with value: 0.9866666666666667.
[I 2024-08-19 19:21:35,251] Trial 750 finished with value: 0.98 and parameters: {'classifier': 'NeuralNetwork', 'nn_alpha': 0.0001479309362845379, 'hidden_layer_sizes': 256, 'activation': 'tanh', 'solver': 'sgd'}. Best is trial 65 with value: 0.9866666666666667.
[I 2024-08-19 19:21:39,232] Trial 751 finished with value: 0.9866666666666667 and parameters: {'classifier': 'NeuralNetwork', 'nn_alpha': 0.00022216242657519325, 'hidden_layer_sizes': 512, 'activation': 'tanh', 'solver': 'sgd'}. Best is trial 65 with value: 0.9866666666666667.
[I 2024-08-19 19:21:41,423] Trial 752 finished with value: 0.9866666666666667 and parameters: {'classifier': 'NeuralNetwork', 'nn_alpha': 0.00035770772149870304, 'hidden_layer_sizes': 256, 'activation': 'tanh', 'solver': 'sgd'}. Best is trial 65 with value: 0.9866666666666667.
[I 2024-08-19 19:21:43,687] Trial 753 finished with value: 0.9866666666666667 and parameters: {'classifier': 'NeuralNetwork', 'nn_alpha': 0.00016247998975258093, 'hidden_layer_sizes': 256, 'activation': 'tanh', 'solver': 'sgd'}. Best is trial 65 with value: 0.9866666666666667.
[I 2024-08-19 19:21:45,941] Trial 754 finished with value: 0.9866666666666667 and parameters: {'classifier': 'NeuralNetwork', 'nn_alpha': 0.00028005081424442335, 'hidden_layer_sizes': 256, 'activation': 'tanh', 'solver': 'sgd'}. Best is trial 65 with value: 0.9866666666666667.
[I 2024-08-19 19:21:48,268] Trial 755 finished with value: 0.9866666666666667 and parameters: {'classifier': 'NeuralNetwork', 'nn_alpha': 0.00048084538511095526, 'hidden_layer_sizes': 256, 'activation': 'tanh', 'solver': 'sgd'}. Best is trial 65 with value: 0.9866666666666667.
[I 2024-08-19 19:21:50,419] Trial 756 finished with value: 0.9866666666666667 and parameters: {'classifier': 'NeuralNetwork', 'nn_alpha': 0.0001812384162996808, 'hidden_layer_sizes': 256, 'activation': 'tanh', 'solver': 'sgd'}. Best is trial 65 with value: 0.9866666666666667.
[I 2024-08-19 19:21:50,719] Trial 757 finished with value: 0.96 and parameters: {'classifier': 'RandomForest', 'rf_max_depth': 7, 'rf_min_samples_split': 6, 'rf_min_samples_leaf': 1, 'rf_max_features': 'sqrt'}. Best is trial 65 with value: 0.9866666666666667.
[I 2024-08-19 19:21:52,257] Trial 758 finished with value: 0.9866666666666667 and parameters: {'classifier': 'NeuralNetwork', 'nn_alpha': 8.785557938148215e-05, 'hidden_layer_sizes': 128, 'activation': 'tanh', 'solver': 'sgd'}. Best is trial 65 with value: 0.9866666666666667.
[I 2024-08-19 19:21:54,502] Trial 759 finished with value: 0.9866666666666667 and parameters: {'classifier': 'NeuralNetwork', 'nn_alpha': 0.0001191863087783204, 'hidden_layer_sizes': 256, 'activation': 'tanh', 'solver': 'sgd'}. Best is trial 65 with value: 0.9866666666666667.
[I 2024-08-19 19:21:55,363] Trial 760 finished with value: 0.98 and parameters: {'classifier': 'NeuralNetwork', 'nn_alpha': 0.00024827875742862546, 'hidden_layer_sizes': 256, 'activation': 'tanh', 'solver': 'adam'}. Best is trial 65 with value: 0.9866666666666667.
[I 2024-08-19 19:21:57,601] Trial 761 finished with value: 0.98 and parameters: {'classifier': 'NeuralNetwork', 'nn_alpha': 0.00019983725522277045, 'hidden_layer_sizes': 256, 'activation': 'tanh', 'solver': 'sgd'}. Best is trial 65 with value: 0.9866666666666667.
[I 2024-08-19 19:21:59,797] Trial 762 finished with value: 0.9866666666666667 and parameters: {'classifier': 'NeuralNetwork', 'nn_alpha': 0.0001466461131475442, 'hidden_layer_sizes': 256, 'activation': 'tanh', 'solver': 'sgd'}. Best is trial 65 with value: 0.9866666666666667.
[I 2024-08-19 19:22:02,098] Trial 763 finished with value: 0.9866666666666667 and parameters: {'classifier': 'NeuralNetwork', 'nn_alpha': 0.009186803914267787, 'hidden_layer_sizes': 256, 'activation': 'tanh', 'solver': 'sgd'}. Best is trial 65 with value: 0.9866666666666667.
[I 2024-08-19 19:22:12,316] Trial 764 finished with value: 0.96 and parameters: {'classifier': 'NeuralNetwork', 'nn_alpha': 6.928272755454258e-05, 'hidden_layer_sizes': 256, 'activation': 'logistic', 'solver': 'sgd'}. Best is trial 65 with value: 0.9866666666666667.
[I 2024-08-19 19:22:12,338] Trial 765 finished with value: 0.32 and parameters: {'classifier': 'SVC', 'svc_c': 4.935408156277822e-08, 'gamma': 'auto', 'kernel': 'linear'}. Best is trial 65 with value: 0.9866666666666667.
[I 2024-08-19 19:22:14,835] Trial 766 finished with value: 0.9866666666666667 and parameters: {'classifier': 'NeuralNetwork', 'nn_alpha': 0.0007811254595609348, 'hidden_layer_sizes': 256, 'activation': 'tanh', 'solver': 'sgd'}. Best is trial 65 with value: 0.9866666666666667.
[I 2024-08-19 19:22:17,331] Trial 767 finished with value: 0.98 and parameters: {'classifier': 'NeuralNetwork', 'nn_alpha': 0.0002829756869787486, 'hidden_layer_sizes': 256, 'activation': 'tanh', 'solver': 'sgd'}. Best is trial 65 with value: 0.9866666666666667.
[I 2024-08-19 19:22:17,566] Trial 768 finished with value: 0.54 and parameters: {'classifier': 'XGBoost', 'xgb_eta': 0.022028965776432895, 'xgb_max_depth': 3, 'xgb_min_child_weight': 20.878786004361917, 'xgb_subsample': 0.877045888001373, 'xgb_colsample_bytree': 0.8479315291460874}. Best is trial 65 with value: 0.9866666666666667.
[I 2024-08-19 19:22:20,167] Trial 769 finished with value: 0.9866666666666667 and parameters: {'classifier': 'NeuralNetwork', 'nn_alpha': 0.00021905306752422558, 'hidden_layer_sizes': 256, 'activation': 'tanh', 'solver': 'sgd'}. Best is trial 65 with value: 0.9866666666666667.
[I 2024-08-19 19:22:20,204] Trial 770 finished with value: 0.8933333333333332 and parameters: {'classifier': 'DecisionTree', 'dt_max_depth': 26, 'dt_min_samples_split': 10, 'dt_min_samples_leaf': 8, 'dt_max_features': 'sqrt'}. Best is trial 65 with value: 0.9866666666666667.
[I 2024-08-19 19:22:21,051] Trial 771 finished with value: 0.96 and parameters: {'classifier': 'NeuralNetwork', 'nn_alpha': 0.00012518023002284552, 'hidden_layer_sizes': 256, 'activation': 'tanh', 'solver': 'lbfgs'}. Best is trial 65 with value: 0.9866666666666667.
[I 2024-08-19 19:22:23,538] Trial 772 finished with value: 0.9866666666666667 and parameters: {'classifier': 'NeuralNetwork', 'nn_alpha': 0.00037291472015863435, 'hidden_layer_sizes': 256, 'activation': 'tanh', 'solver': 'sgd'}. Best is trial 65 with value: 0.9866666666666667.
[I 2024-08-19 19:22:25,852] Trial 773 finished with value: 0.9866666666666667 and parameters: {'classifier': 'NeuralNetwork', 'nn_alpha': 0.00017331898458850496, 'hidden_layer_sizes': 256, 'activation': 'tanh', 'solver': 'sgd'}. Best is trial 65 with value: 0.9866666666666667.
[I 2024-08-19 19:22:27,591] Trial 774 finished with value: 0.98 and parameters: {'classifier': 'NeuralNetwork', 'nn_alpha': 0.0001898260198534469, 'hidden_layer_sizes': 128, 'activation': 'tanh', 'solver': 'sgd'}. Best is trial 65 with value: 0.9866666666666667.
[I 2024-08-19 19:22:30,140] Trial 775 finished with value: 0.9866666666666667 and parameters: {'classifier': 'NeuralNetwork', 'nn_alpha': 9.929894120926571e-05, 'hidden_layer_sizes': 256, 'activation': 'tanh', 'solver': 'sgd'}. Best is trial 65 with value: 0.9866666666666667.
[I 2024-08-19 19:22:31,998] Trial 776 finished with value: 0.9733333333333333 and parameters: {'classifier': 'NeuralNetwork', 'nn_alpha': 0.00031278603324836116, 'hidden_layer_sizes': 256, 'activation': 'relu', 'solver': 'sgd'}. Best is trial 65 with value: 0.9866666666666667.
[I 2024-08-19 19:22:33,300] Trial 777 finished with value: 0.98 and parameters: {'classifier': 'NeuralNetwork', 'nn_alpha': 0.00013862061622113526, 'hidden_layer_sizes': 64, 'activation': 'tanh', 'solver': 'sgd'}. Best is trial 65 with value: 0.9866666666666667.
[I 2024-08-19 19:22:35,725] Trial 778 finished with value: 0.9866666666666667 and parameters: {'classifier': 'NeuralNetwork', 'nn_alpha': 0.0002277529128812044, 'hidden_layer_sizes': 256, 'activation': 'tanh', 'solver': 'sgd'}. Best is trial 65 with value: 0.9866666666666667.
[I 2024-08-19 19:22:40,158] Trial 779 finished with value: 0.9866666666666667 and parameters: {'classifier': 'NeuralNetwork', 'nn_alpha': 0.00016119977850054338, 'hidden_layer_sizes': 512, 'activation': 'tanh', 'solver': 'sgd'}. Best is trial 65 with value: 0.9866666666666667.
[I 2024-08-19 19:22:42,593] Trial 780 finished with value: 0.9866666666666667 and parameters: {'classifier': 'NeuralNetwork', 'nn_alpha': 0.00040739893059519786, 'hidden_layer_sizes': 256, 'activation': 'tanh', 'solver': 'sgd'}. Best is trial 65 with value: 0.9866666666666667.
[I 2024-08-19 19:22:45,079] Trial 781 finished with value: 0.9866666666666667 and parameters: {'classifier': 'NeuralNetwork', 'nn_alpha': 0.0002602202849021, 'hidden_layer_sizes': 256, 'activation': 'tanh', 'solver': 'sgd'}. Best is trial 65 with value: 0.9866666666666667.
[I 2024-08-19 19:22:47,518] Trial 782 finished with value: 0.98 and parameters: {'classifier': 'NeuralNetwork', 'nn_alpha': 0.0001996683464170043, 'hidden_layer_sizes': 256, 'activation': 'tanh', 'solver': 'sgd'}. Best is trial 65 with value: 0.9866666666666667.
[I 2024-08-19 19:22:47,818] Trial 783 finished with value: 0.9533333333333333 and parameters: {'classifier': 'RandomForest', 'rf_max_depth': 25, 'rf_min_samples_split': 11, 'rf_min_samples_leaf': 10, 'rf_max_features': 'sqrt'}. Best is trial 65 with value: 0.9866666666666667.
[I 2024-08-19 19:22:50,075] Trial 784 finished with value: 0.98 and parameters: {'classifier': 'NeuralNetwork', 'nn_alpha': 0.00011435802570085904, 'hidden_layer_sizes': 256, 'activation': 'tanh', 'solver': 'sgd'}. Best is trial 65 with value: 0.9866666666666667.
[I 2024-08-19 19:22:51,100] Trial 785 finished with value: 0.98 and parameters: {'classifier': 'NeuralNetwork', 'nn_alpha': 0.00031798701994386653, 'hidden_layer_sizes': 256, 'activation': 'tanh', 'solver': 'adam'}. Best is trial 65 with value: 0.9866666666666667.
[I 2024-08-19 19:22:53,500] Trial 786 finished with value: 0.9866666666666667 and parameters: {'classifier': 'NeuralNetwork', 'nn_alpha': 0.0005540108484850244, 'hidden_layer_sizes': 256, 'activation': 'tanh', 'solver': 'sgd'}. Best is trial 65 with value: 0.9866666666666667.
[I 2024-08-19 19:23:04,085] Trial 787 finished with value: 0.96 and parameters: {'classifier': 'NeuralNetwork', 'nn_alpha': 8.046757799051968e-05, 'hidden_layer_sizes': 256, 'activation': 'logistic', 'solver': 'sgd'}. Best is trial 65 with value: 0.9866666666666667.
[I 2024-08-19 19:23:06,685] Trial 788 finished with value: 0.9866666666666667 and parameters: {'classifier': 'NeuralNetwork', 'nn_alpha': 0.00015346157644190227, 'hidden_layer_sizes': 256, 'activation': 'tanh', 'solver': 'sgd'}. Best is trial 65 with value: 0.9866666666666667.
[I 2024-08-19 19:23:08,206] Trial 789 finished with value: 0.9866666666666667 and parameters: {'classifier': 'NeuralNetwork', 'nn_alpha': 0.00023335038685732526, 'hidden_layer_sizes': 128, 'activation': 'tanh', 'solver': 'sgd'}. Best is trial 65 with value: 0.9866666666666667.
[I 2024-08-19 19:23:10,554] Trial 790 finished with value: 0.9866666666666667 and parameters: {'classifier': 'NeuralNetwork', 'nn_alpha': 0.001336864263623112, 'hidden_layer_sizes': 256, 'activation': 'tanh', 'solver': 'sgd'}. Best is trial 65 with value: 0.9866666666666667.
[I 2024-08-19 19:23:10,576] Trial 791 finished with value: 0.96 and parameters: {'classifier': 'SVC', 'svc_c': 0.6549910727420932, 'gamma': 'scale', 'kernel': 'rbf'}. Best is trial 65 with value: 0.9866666666666667.
[I 2024-08-19 19:23:12,868] Trial 792 finished with value: 0.9866666666666667 and parameters: {'classifier': 'NeuralNetwork', 'nn_alpha': 0.00018050197505875413, 'hidden_layer_sizes': 256, 'activation': 'tanh', 'solver': 'sgd'}. Best is trial 65 with value: 0.9866666666666667.
[I 2024-08-19 19:23:15,216] Trial 793 finished with value: 0.9866666666666667 and parameters: {'classifier': 'NeuralNetwork', 'nn_alpha': 0.00013762975795149728, 'hidden_layer_sizes': 256, 'activation': 'tanh', 'solver': 'sgd'}. Best is trial 65 with value: 0.9866666666666667.
[I 2024-08-19 19:23:15,470] Trial 794 finished with value: 0.9533333333333333 and parameters: {'classifier': 'XGBoost', 'xgb_eta': 0.03245085277446417, 'xgb_max_depth': 8, 'xgb_min_child_weight': 3.4791492671206665, 'xgb_subsample': 0.7309379590688162, 'xgb_colsample_bytree': 0.9460593006686475}. Best is trial 65 with value: 0.9866666666666667.
[I 2024-08-19 19:23:17,709] Trial 795 finished with value: 0.9866666666666667 and parameters: {'classifier': 'NeuralNetwork', 'nn_alpha': 0.00026892877798914325, 'hidden_layer_sizes': 256, 'activation': 'tanh', 'solver': 'sgd'}. Best is trial 65 with value: 0.9866666666666667.
[I 2024-08-19 19:23:17,747] Trial 796 finished with value: 0.9333333333333332 and parameters: {'classifier': 'DecisionTree', 'dt_max_depth': 4, 'dt_min_samples_split': 3, 'dt_min_samples_leaf': 7, 'dt_max_features': 'log2'}. Best is trial 65 with value: 0.9866666666666667.
[I 2024-08-19 19:23:18,667] Trial 797 finished with value: 0.9533333333333333 and parameters: {'classifier': 'NeuralNetwork', 'nn_alpha': 3.717225808742103e-05, 'hidden_layer_sizes': 256, 'activation': 'tanh', 'solver': 'lbfgs'}. Best is trial 65 with value: 0.9866666666666667.
[I 2024-08-19 19:23:20,927] Trial 798 finished with value: 0.98 and parameters: {'classifier': 'NeuralNetwork', 'nn_alpha': 6.225761444848711e-05, 'hidden_layer_sizes': 256, 'activation': 'tanh', 'solver': 'sgd'}. Best is trial 65 with value: 0.9866666666666667.
[I 2024-08-19 19:23:23,269] Trial 799 finished with value: 0.9866666666666667 and parameters: {'classifier': 'NeuralNetwork', 'nn_alpha': 0.00010096109375415595, 'hidden_layer_sizes': 256, 'activation': 'tanh', 'solver': 'sgd'}. Best is trial 65 with value: 0.9866666666666667.
[I 2024-08-19 19:23:25,541] Trial 800 finished with value: 0.9866666666666667 and parameters: {'classifier': 'NeuralNetwork', 'nn_alpha': 0.00042734652212105375, 'hidden_layer_sizes': 256, 'activation': 'tanh', 'solver': 'sgd'}. Best is trial 65 with value: 0.9866666666666667.
[I 2024-08-19 19:23:27,114] Trial 801 finished with value: 0.9733333333333333 and parameters: {'classifier': 'NeuralNetwork', 'nn_alpha': 0.00021374313436738507, 'hidden_layer_sizes': 256, 'activation': 'relu', 'solver': 'sgd'}. Best is trial 65 with value: 0.9866666666666667.
[I 2024-08-19 19:23:29,452] Trial 802 finished with value: 0.9866666666666667 and parameters: {'classifier': 'NeuralNetwork', 'nn_alpha': 0.0001609659385449161, 'hidden_layer_sizes': 256, 'activation': 'tanh', 'solver': 'sgd'}. Best is trial 65 with value: 0.9866666666666667.
[I 2024-08-19 19:23:31,705] Trial 803 finished with value: 0.9866666666666667 and parameters: {'classifier': 'NeuralNetwork', 'nn_alpha': 0.00030913167479476605, 'hidden_layer_sizes': 256, 'activation': 'tanh', 'solver': 'sgd'}. Best is trial 65 with value: 0.9866666666666667.
