[I 2024-08-19 19:23:33,208] Trial 804 finished with value: 0.9866666666666667 and parameters: {'classifier': 'NeuralNetwork', 'nn_alpha': 0.00019074826888948172, 'hidden_layer_sizes': 64, 'activation': 'tanh', 'solver': 'sgd'}. Best is trial 65 with value: 0.9866666666666667.
[I 2024-08-19 19:23:34,728] Trial 805 finished with value: 0.98 and parameters: {'classifier': 'NeuralNetwork', 'nn_alpha': 0.00012843864176952, 'hidden_layer_sizes': 128, 'activation': 'tanh', 'solver': 'sgd'}. Best is trial 65 with value: 0.9866666666666667.
[I 2024-08-19 19:23:36,937] Trial 806 finished with value: 0.9866666666666667 and parameters: {'classifier': 'NeuralNetwork', 'nn_alpha': 0.00024160940407807715, 'hidden_layer_sizes': 256, 'activation': 'tanh', 'solver': 'sgd'}. Best is trial 65 with value: 0.9866666666666667.
[I 2024-08-19 19:23:40,854] Trial 807 finished with value: 0.9866666666666667 and parameters: {'classifier': 'NeuralNetwork', 'nn_alpha': 0.00016277983171036954, 'hidden_layer_sizes': 512, 'activation': 'tanh', 'solver': 'sgd'}. Best is trial 65 with value: 0.9866666666666667.
[I 2024-08-19 19:23:43,072] Trial 808 finished with value: 0.9866666666666667 and parameters: {'classifier': 'NeuralNetwork', 'nn_alpha': 0.0003660449803095362, 'hidden_layer_sizes': 256, 'activation': 'tanh', 'solver': 'sgd'}. Best is trial 65 with value: 0.9866666666666667.
[I 2024-08-19 19:23:45,375] Trial 809 finished with value: 0.9866666666666667 and parameters: {'classifier': 'NeuralNetwork', 'nn_alpha': 0.002150238938882522, 'hidden_layer_sizes': 256, 'activation': 'tanh', 'solver': 'sgd'}. Best is trial 65 with value: 0.9866666666666667.
[I 2024-08-19 19:23:45,669] Trial 810 finished with value: 0.94 and parameters: {'classifier': 'RandomForest', 'rf_max_depth': 12, 'rf_min_samples_split': 17, 'rf_min_samples_leaf': 7, 'rf_max_features': 'log2'}. Best is trial 65 with value: 0.9866666666666667.
[I 2024-08-19 19:23:46,570] Trial 811 finished with value: 0.98 and parameters: {'classifier': 'NeuralNetwork', 'nn_alpha': 8.66659383452572e-05, 'hidden_layer_sizes': 256, 'activation': 'tanh', 'solver': 'adam'}. Best is trial 65 with value: 0.9866666666666667.
[I 2024-08-19 19:23:48,762] Trial 812 finished with value: 0.9866666666666667 and parameters: {'classifier': 'NeuralNetwork', 'nn_alpha': 5.1307499479920344e-05, 'hidden_layer_sizes': 256, 'activation': 'tanh', 'solver': 'sgd'}. Best is trial 65 with value: 0.9866666666666667.
[I 2024-08-19 19:23:58,990] Trial 813 finished with value: 0.96 and parameters: {'classifier': 'NeuralNetwork', 'nn_alpha': 0.00011416142571170549, 'hidden_layer_sizes': 256, 'activation': 'logistic', 'solver': 'sgd'}. Best is trial 65 with value: 0.9866666666666667.
[I 2024-08-19 19:24:01,281] Trial 814 finished with value: 0.9866666666666667 and parameters: {'classifier': 'NeuralNetwork', 'nn_alpha': 0.00021910598519064183, 'hidden_layer_sizes': 256, 'activation': 'tanh', 'solver': 'sgd'}. Best is trial 65 with value: 0.9866666666666667.
[I 2024-08-19 19:24:03,747] Trial 815 finished with value: 0.9866666666666667 and parameters: {'classifier': 'NeuralNetwork', 'nn_alpha': 0.000268065447137467, 'hidden_layer_sizes': 256, 'activation': 'tanh', 'solver': 'sgd'}. Best is trial 65 with value: 0.9866666666666667.
[I 2024-08-19 19:24:06,010] Trial 816 finished with value: 0.9866666666666667 and parameters: {'classifier': 'NeuralNetwork', 'nn_alpha': 0.00019218280847508565, 'hidden_layer_sizes': 256, 'activation': 'tanh', 'solver': 'sgd'}. Best is trial 65 with value: 0.9866666666666667.
[I 2024-08-19 19:24:08,161] Trial 817 finished with value: 0.98 and parameters: {'classifier': 'NeuralNetwork', 'nn_alpha': 0.0004848068248402204, 'hidden_layer_sizes': 256, 'activation': 'tanh', 'solver': 'sgd'}. Best is trial 65 with value: 0.9866666666666667.
[I 2024-08-19 19:24:08,185] Trial 818 finished with value: 0.9733333333333333 and parameters: {'classifier': 'SVC', 'svc_c': 0.0021068211640763107, 'gamma': 'auto', 'kernel': 'poly'}. Best is trial 65 with value: 0.9866666666666667.
[I 2024-08-19 19:24:10,438] Trial 819 finished with value: 0.9866666666666667 and parameters: {'classifier': 'NeuralNetwork', 'nn_alpha': 0.000133546366813869, 'hidden_layer_sizes': 256, 'activation': 'tanh', 'solver': 'sgd'}. Best is trial 65 with value: 0.9866666666666667.
[I 2024-08-19 19:24:12,611] Trial 820 finished with value: 0.9866666666666667 and parameters: {'classifier': 'NeuralNetwork', 'nn_alpha': 0.00030899436941842406, 'hidden_layer_sizes': 256, 'activation': 'tanh', 'solver': 'sgd'}. Best is trial 65 with value: 0.9866666666666667.
[I 2024-08-19 19:24:12,901] Trial 821 finished with value: 0.9733333333333333 and parameters: {'classifier': 'XGBoost', 'xgb_eta': 0.10804021037865921, 'xgb_max_depth': 5, 'xgb_min_child_weight': 0.03933181040264988, 'xgb_subsample': 0.5117424701061131, 'xgb_colsample_bytree': 0.5056078061287403}. Best is trial 65 with value: 0.9866666666666667.
[I 2024-08-19 19:24:12,953] Trial 822 finished with value: 0.94 and parameters: {'classifier': 'DecisionTree', 'dt_max_depth': 16, 'dt_min_samples_split': 13, 'dt_min_samples_leaf': 1, 'dt_max_features': 'sqrt'}. Best is trial 65 with value: 0.9866666666666667.
[I 2024-08-19 19:24:13,456] Trial 823 finished with value: 0.96 and parameters: {'classifier': 'NeuralNetwork', 'nn_alpha': 0.00014486020042822075, 'hidden_layer_sizes': 128, 'activation': 'tanh', 'solver': 'lbfgs'}. Best is trial 65 with value: 0.9866666666666667.
[I 2024-08-19 19:24:15,752] Trial 824 finished with value: 0.9866666666666667 and parameters: {'classifier': 'NeuralNetwork', 'nn_alpha': 0.00018536272235276441, 'hidden_layer_sizes': 256, 'activation': 'tanh', 'solver': 'sgd'}. Best is trial 65 with value: 0.9866666666666667.
[I 2024-08-19 19:24:17,961] Trial 825 finished with value: 0.9866666666666667 and parameters: {'classifier': 'NeuralNetwork', 'nn_alpha': 0.0002366979180753012, 'hidden_layer_sizes': 256, 'activation': 'tanh', 'solver': 'sgd'}. Best is trial 65 with value: 0.9866666666666667.
[I 2024-08-19 19:24:20,229] Trial 826 finished with value: 0.9866666666666667 and parameters: {'classifier': 'NeuralNetwork', 'nn_alpha': 0.00010439398446825066, 'hidden_layer_sizes': 256, 'activation': 'tanh', 'solver': 'sgd'}. Best is trial 65 with value: 0.9866666666666667.
[I 2024-08-19 19:24:22,437] Trial 827 finished with value: 0.98 and parameters: {'classifier': 'NeuralNetwork', 'nn_alpha': 0.00016394890186413973, 'hidden_layer_sizes': 256, 'activation': 'tanh', 'solver': 'sgd'}. Best is trial 65 with value: 0.9866666666666667.
[I 2024-08-19 19:24:24,027] Trial 828 finished with value: 0.9733333333333333 and parameters: {'classifier': 'NeuralNetwork', 'nn_alpha': 0.00035299776320692986, 'hidden_layer_sizes': 256, 'activation': 'relu', 'solver': 'sgd'}. Best is trial 65 with value: 0.9866666666666667.
[I 2024-08-19 19:24:26,290] Trial 829 finished with value: 0.9866666666666667 and parameters: {'classifier': 'NeuralNetwork', 'nn_alpha': 0.0006549136578220745, 'hidden_layer_sizes': 256, 'activation': 'tanh', 'solver': 'sgd'}. Best is trial 65 with value: 0.9866666666666667.
[I 2024-08-19 19:24:28,435] Trial 830 finished with value: 0.9866666666666667 and parameters: {'classifier': 'NeuralNetwork', 'nn_alpha': 0.0002738027612289594, 'hidden_layer_sizes': 256, 'activation': 'tanh', 'solver': 'sgd'}. Best is trial 65 with value: 0.9866666666666667.
[I 2024-08-19 19:24:30,629] Trial 831 finished with value: 0.9866666666666667 and parameters: {'classifier': 'NeuralNetwork', 'nn_alpha': 6.890903212419081e-05, 'hidden_layer_sizes': 256, 'activation': 'tanh', 'solver': 'sgd'}. Best is trial 65 with value: 0.9866666666666667.
[I 2024-08-19 19:24:32,847] Trial 832 finished with value: 0.98 and parameters: {'classifier': 'NeuralNetwork', 'nn_alpha': 0.0002137659268389427, 'hidden_layer_sizes': 256, 'activation': 'tanh', 'solver': 'sgd'}. Best is trial 65 with value: 0.9866666666666667.
[I 2024-08-19 19:24:34,258] Trial 833 finished with value: 0.98 and parameters: {'classifier': 'NeuralNetwork', 'nn_alpha': 0.00012505201427418796, 'hidden_layer_sizes': 64, 'activation': 'tanh', 'solver': 'sgd'}. Best is trial 65 with value: 0.9866666666666667.
[I 2024-08-19 19:24:36,492] Trial 834 finished with value: 0.9866666666666667 and parameters: {'classifier': 'NeuralNetwork', 'nn_alpha': 0.00017514037973243048, 'hidden_layer_sizes': 256, 'activation': 'tanh', 'solver': 'sgd'}. Best is trial 65 with value: 0.9866666666666667.
[I 2024-08-19 19:24:36,821] Trial 835 finished with value: 0.9533333333333333 and parameters: {'classifier': 'RandomForest', 'rf_max_depth': 6, 'rf_min_samples_split': 20, 'rf_min_samples_leaf': 5, 'rf_max_features': 'sqrt'}. Best is trial 65 with value: 0.9866666666666667.
[I 2024-08-19 19:24:40,708] Trial 836 finished with value: 0.9866666666666667 and parameters: {'classifier': 'NeuralNetwork', 'nn_alpha': 8.798216577986415e-05, 'hidden_layer_sizes': 512, 'activation': 'tanh', 'solver': 'sgd'}. Best is trial 65 with value: 0.9866666666666667.
[I 2024-08-19 19:24:42,903] Trial 837 finished with value: 0.9866666666666667 and parameters: {'classifier': 'NeuralNetwork', 'nn_alpha': 0.00023261755919144173, 'hidden_layer_sizes': 256, 'activation': 'tanh', 'solver': 'sgd'}. Best is trial 65 with value: 0.9866666666666667.
[I 2024-08-19 19:24:43,761] Trial 838 finished with value: 0.98 and parameters: {'classifier': 'NeuralNetwork', 'nn_alpha': 0.00015554637113875268, 'hidden_layer_sizes': 128, 'activation': 'tanh', 'solver': 'adam'}. Best is trial 65 with value: 0.9866666666666667.
[I 2024-08-19 19:24:53,901] Trial 839 finished with value: 0.96 and parameters: {'classifier': 'NeuralNetwork', 'nn_alpha': 0.0002835425576129885, 'hidden_layer_sizes': 256, 'activation': 'logistic', 'solver': 'sgd'}. Best is trial 65 with value: 0.9866666666666667.
[I 2024-08-19 19:24:56,206] Trial 840 finished with value: 0.9866666666666667 and parameters: {'classifier': 'NeuralNetwork', 'nn_alpha': 0.0004217338180391843, 'hidden_layer_sizes': 256, 'activation': 'tanh', 'solver': 'sgd'}. Best is trial 65 with value: 0.9866666666666667.
[I 2024-08-19 19:24:58,631] Trial 841 finished with value: 0.9866666666666667 and parameters: {'classifier': 'NeuralNetwork', 'nn_alpha': 0.00018350073778414594, 'hidden_layer_sizes': 256, 'activation': 'tanh', 'solver': 'sgd'}. Best is trial 65 with value: 0.9866666666666667.
[I 2024-08-19 19:25:00,863] Trial 842 finished with value: 0.9866666666666667 and parameters: {'classifier': 'NeuralNetwork', 'nn_alpha': 0.00011874482496051078, 'hidden_layer_sizes': 256, 'activation': 'tanh', 'solver': 'sgd'}. Best is trial 65 with value: 0.9866666666666667.
[I 2024-08-19 19:25:00,887] Trial 843 finished with value: 0.32 and parameters: {'classifier': 'SVC', 'svc_c': 1.232864523849252e-05, 'gamma': 'scale', 'kernel': 'linear'}. Best is trial 65 with value: 0.9866666666666667.
[I 2024-08-19 19:25:03,090] Trial 844 finished with value: 0.9866666666666667 and parameters: {'classifier': 'NeuralNetwork', 'nn_alpha': 0.00021336911552375767, 'hidden_layer_sizes': 256, 'activation': 'tanh', 'solver': 'sgd'}. Best is trial 65 with value: 0.9866666666666667.
[I 2024-08-19 19:25:05,402] Trial 845 finished with value: 0.9866666666666667 and parameters: {'classifier': 'NeuralNetwork', 'nn_alpha': 0.00014125288422147547, 'hidden_layer_sizes': 256, 'activation': 'tanh', 'solver': 'sgd'}. Best is trial 65 with value: 0.9866666666666667.
[I 2024-08-19 19:25:05,696] Trial 846 finished with value: 0.96 and parameters: {'classifier': 'XGBoost', 'xgb_eta': 0.019557788649568846, 'xgb_max_depth': 4, 'xgb_min_child_weight': 2.435423822388163e-05, 'xgb_subsample': 0.962514926707903, 'xgb_colsample_bytree': 0.7668172931705608}. Best is trial 65 with value: 0.9866666666666667.
[I 2024-08-19 19:25:07,982] Trial 847 finished with value: 0.9866666666666667 and parameters: {'classifier': 'NeuralNetwork', 'nn_alpha': 0.016031581979172115, 'hidden_layer_sizes': 256, 'activation': 'tanh', 'solver': 'sgd'}. Best is trial 65 with value: 0.9866666666666667.
[I 2024-08-19 19:25:08,978] Trial 848 finished with value: 0.9533333333333333 and parameters: {'classifier': 'NeuralNetwork', 'nn_alpha': 0.0002413261533855098, 'hidden_layer_sizes': 256, 'activation': 'tanh', 'solver': 'lbfgs'}. Best is trial 65 with value: 0.9866666666666667.
[I 2024-08-19 19:25:09,015] Trial 849 finished with value: 0.94 and parameters: {'classifier': 'DecisionTree', 'dt_max_depth': 11, 'dt_min_samples_split': 15, 'dt_min_samples_leaf': 5, 'dt_max_features': 'log2'}. Best is trial 65 with value: 0.9866666666666667.
[I 2024-08-19 19:25:11,417] Trial 850 finished with value: 0.9866666666666667 and parameters: {'classifier': 'NeuralNetwork', 'nn_alpha': 0.00019224784667506116, 'hidden_layer_sizes': 256, 'activation': 'tanh', 'solver': 'sgd'}. Best is trial 65 with value: 0.9866666666666667.
[I 2024-08-19 19:25:13,595] Trial 851 finished with value: 0.98 and parameters: {'classifier': 'NeuralNetwork', 'nn_alpha': 1.995071388756428e-05, 'hidden_layer_sizes': 256, 'activation': 'tanh', 'solver': 'sgd'}. Best is trial 65 with value: 0.9866666666666667.
[I 2024-08-19 19:25:15,838] Trial 852 finished with value: 0.9866666666666667 and parameters: {'classifier': 'NeuralNetwork', 'nn_alpha': 0.00033295457383693706, 'hidden_layer_sizes': 256, 'activation': 'tanh', 'solver': 'sgd'}. Best is trial 65 with value: 0.9866666666666667.
[I 2024-08-19 19:25:17,037] Trial 853 finished with value: 0.9866666666666667 and parameters: {'classifier': 'NeuralNetwork', 'nn_alpha': 0.00014680293973937312, 'hidden_layer_sizes': 128, 'activation': 'relu', 'solver': 'sgd'}. Best is trial 65 with value: 0.9866666666666667.
[I 2024-08-19 19:25:19,396] Trial 854 finished with value: 0.9866666666666667 and parameters: {'classifier': 'NeuralNetwork', 'nn_alpha': 0.00011209809960432478, 'hidden_layer_sizes': 256, 'activation': 'tanh', 'solver': 'sgd'}. Best is trial 65 with value: 0.9866666666666667.
[I 2024-08-19 19:25:21,685] Trial 855 finished with value: 0.9866666666666667 and parameters: {'classifier': 'NeuralNetwork', 'nn_alpha': 7.797376951319875e-05, 'hidden_layer_sizes': 256, 'activation': 'tanh', 'solver': 'sgd'}. Best is trial 65 with value: 0.9866666666666667.
[I 2024-08-19 19:25:23,928] Trial 856 finished with value: 0.98 and parameters: {'classifier': 'NeuralNetwork', 'nn_alpha': 0.00026773543878919325, 'hidden_layer_sizes': 256, 'activation': 'tanh', 'solver': 'sgd'}. Best is trial 65 with value: 0.9866666666666667.
[I 2024-08-19 19:25:26,773] Trial 857 finished with value: 0.9866666666666667 and parameters: {'classifier': 'NeuralNetwork', 'nn_alpha': 9.615656463229808e-05, 'hidden_layer_sizes': 256, 'activation': 'tanh', 'solver': 'sgd'}. Best is trial 65 with value: 0.9866666666666667.
[I 2024-08-19 19:25:29,025] Trial 858 finished with value: 0.9866666666666667 and parameters: {'classifier': 'NeuralNetwork', 'nn_alpha': 0.00020371391209619044, 'hidden_layer_sizes': 256, 'activation': 'tanh', 'solver': 'sgd'}. Best is trial 65 with value: 0.9866666666666667.
[I 2024-08-19 19:25:31,377] Trial 859 finished with value: 0.9866666666666667 and parameters: {'classifier': 'NeuralNetwork', 'nn_alpha': 0.0003470504497600711, 'hidden_layer_sizes': 256, 'activation': 'tanh', 'solver': 'sgd'}. Best is trial 65 with value: 0.9866666666666667.
[I 2024-08-19 19:25:33,654] Trial 860 finished with value: 0.9866666666666667 and parameters: {'classifier': 'NeuralNetwork', 'nn_alpha': 3.0766104999186195e-05, 'hidden_layer_sizes': 256, 'activation': 'tanh', 'solver': 'sgd'}. Best is trial 65 with value: 0.9866666666666667.
[I 2024-08-19 19:25:33,951] Trial 861 finished with value: 0.9666666666666667 and parameters: {'classifier': 'RandomForest', 'rf_max_depth': 5, 'rf_min_samples_split': 11, 'rf_min_samples_leaf': 9, 'rf_max_features': 'log2'}. Best is trial 65 with value: 0.9866666666666667.
[I 2024-08-19 19:25:36,377] Trial 862 finished with value: 0.9866666666666667 and parameters: {'classifier': 'NeuralNetwork', 'nn_alpha': 0.0005886550780134208, 'hidden_layer_sizes': 256, 'activation': 'tanh', 'solver': 'sgd'}. Best is trial 65 with value: 0.9866666666666667.
[I 2024-08-19 19:25:37,069] Trial 863 finished with value: 0.9866666666666667 and parameters: {'classifier': 'NeuralNetwork', 'nn_alpha': 0.00016674658068253892, 'hidden_layer_sizes': 64, 'activation': 'tanh', 'solver': 'adam'}. Best is trial 65 with value: 0.9866666666666667.
[I 2024-08-19 19:25:41,345] Trial 864 finished with value: 0.9866666666666667 and parameters: {'classifier': 'NeuralNetwork', 'nn_alpha': 0.0002544871151301865, 'hidden_layer_sizes': 512, 'activation': 'tanh', 'solver': 'sgd'}. Best is trial 65 with value: 0.9866666666666667.
[I 2024-08-19 19:25:43,810] Trial 865 finished with value: 0.98 and parameters: {'classifier': 'NeuralNetwork', 'nn_alpha': 4.3039768487056366e-05, 'hidden_layer_sizes': 256, 'activation': 'tanh', 'solver': 'sgd'}. Best is trial 65 with value: 0.9866666666666667.
[I 2024-08-19 19:25:54,403] Trial 866 finished with value: 0.96 and parameters: {'classifier': 'NeuralNetwork', 'nn_alpha': 0.0004503464309289046, 'hidden_layer_sizes': 256, 'activation': 'logistic', 'solver': 'sgd'}. Best is trial 65 with value: 0.9866666666666667.
[I 2024-08-19 19:25:56,749] Trial 867 finished with value: 0.98 and parameters: {'classifier': 'NeuralNetwork', 'nn_alpha': 5.6054525761871e-05, 'hidden_layer_sizes': 256, 'activation': 'tanh', 'solver': 'sgd'}. Best is trial 65 with value: 0.9866666666666667.
[I 2024-08-19 19:25:58,315] Trial 868 finished with value: 0.9866666666666667 and parameters: {'classifier': 'NeuralNetwork', 'nn_alpha': 0.000135817020322202, 'hidden_layer_sizes': 128, 'activation': 'tanh', 'solver': 'sgd'}. Best is trial 65 with value: 0.9866666666666667.
[I 2024-08-19 19:25:58,340] Trial 869 finished with value: 0.96 and parameters: {'classifier': 'SVC', 'svc_c': 3096915629.602001, 'gamma': 'auto', 'kernel': 'rbf'}. Best is trial 65 with value: 0.9866666666666667.
[I 2024-08-19 19:26:00,720] Trial 870 finished with value: 0.98 and parameters: {'classifier': 'NeuralNetwork', 'nn_alpha': 0.0002046062944033237, 'hidden_layer_sizes': 256, 'activation': 'tanh', 'solver': 'sgd'}. Best is trial 65 with value: 0.9866666666666667.
[I 2024-08-19 19:26:03,225] Trial 871 finished with value: 0.9866666666666667 and parameters: {'classifier': 'NeuralNetwork', 'nn_alpha': 0.0001692183252390879, 'hidden_layer_sizes': 256, 'activation': 'tanh', 'solver': 'sgd'}. Best is trial 65 with value: 0.9866666666666667.
[I 2024-08-19 19:26:03,631] Trial 872 finished with value: 0.96 and parameters: {'classifier': 'XGBoost', 'xgb_eta': 0.2641545428597934, 'xgb_max_depth': 9, 'xgb_min_child_weight': 0.0005627048964134335, 'xgb_subsample': 0.5585361953623165, 'xgb_colsample_bytree': 0.9981235891202199}. Best is trial 65 with value: 0.9866666666666667.
[I 2024-08-19 19:26:06,244] Trial 873 finished with value: 0.98 and parameters: {'classifier': 'NeuralNetwork', 'nn_alpha': 0.0002979863258720785, 'hidden_layer_sizes': 256, 'activation': 'tanh', 'solver': 'sgd'}. Best is trial 65 with value: 0.9866666666666667.
[I 2024-08-19 19:26:08,643] Trial 874 finished with value: 0.9866666666666667 and parameters: {'classifier': 'NeuralNetwork', 'nn_alpha': 0.00011339222053204098, 'hidden_layer_sizes': 256, 'activation': 'tanh', 'solver': 'sgd'}. Best is trial 65 with value: 0.9866666666666667.
[I 2024-08-19 19:26:08,674] Trial 875 finished with value: 0.96 and parameters: {'classifier': 'DecisionTree', 'dt_max_depth': 5, 'dt_min_samples_split': 18, 'dt_min_samples_leaf': 3, 'dt_max_features': 'sqrt'}. Best is trial 65 with value: 0.9866666666666667.
[I 2024-08-19 19:26:09,945] Trial 876 finished with value: 0.9533333333333333 and parameters: {'classifier': 'NeuralNetwork', 'nn_alpha': 0.00024533057968432575, 'hidden_layer_sizes': 256, 'activation': 'tanh', 'solver': 'lbfgs'}. Best is trial 65 with value: 0.9866666666666667.
[I 2024-08-19 19:26:12,498] Trial 877 finished with value: 0.9866666666666667 and parameters: {'classifier': 'NeuralNetwork', 'nn_alpha': 0.00037620479157716785, 'hidden_layer_sizes': 256, 'activation': 'tanh', 'solver': 'sgd'}. Best is trial 65 with value: 0.9866666666666667.
[I 2024-08-19 19:26:14,873] Trial 878 finished with value: 0.98 and parameters: {'classifier': 'NeuralNetwork', 'nn_alpha': 0.00015252737214077613, 'hidden_layer_sizes': 256, 'activation': 'tanh', 'solver': 'sgd'}. Best is trial 65 with value: 0.9866666666666667.
[I 2024-08-19 19:26:16,436] Trial 879 finished with value: 0.98 and parameters: {'classifier': 'NeuralNetwork', 'nn_alpha': 0.00020716483325858043, 'hidden_layer_sizes': 256, 'activation': 'relu', 'solver': 'sgd'}. Best is trial 65 with value: 0.9866666666666667.
[I 2024-08-19 19:26:18,605] Trial 880 finished with value: 0.9866666666666667 and parameters: {'classifier': 'NeuralNetwork', 'nn_alpha': 9.170642780007956e-05, 'hidden_layer_sizes': 256, 'activation': 'tanh', 'solver': 'sgd'}. Best is trial 65 with value: 0.9866666666666667.
[I 2024-08-19 19:26:20,853] Trial 881 finished with value: 0.9866666666666667 and parameters: {'classifier': 'NeuralNetwork', 'nn_alpha': 0.00031123876846295167, 'hidden_layer_sizes': 256, 'activation': 'tanh', 'solver': 'sgd'}. Best is trial 65 with value: 0.9866666666666667.
[I 2024-08-19 19:26:23,297] Trial 882 finished with value: 0.9866666666666667 and parameters: {'classifier': 'NeuralNetwork', 'nn_alpha': 0.00018413733255362997, 'hidden_layer_sizes': 256, 'activation': 'tanh', 'solver': 'sgd'}. Best is trial 65 with value: 0.9866666666666667.
[I 2024-08-19 19:26:25,697] Trial 883 finished with value: 0.9866666666666667 and parameters: {'classifier': 'NeuralNetwork', 'nn_alpha': 0.0002439348662352806, 'hidden_layer_sizes': 256, 'activation': 'tanh', 'solver': 'sgd'}. Best is trial 65 with value: 0.9866666666666667.
