[I 2024-08-19 18:55:26,039] A new study created in memory with name: no-name-559e835a-ac12-4345-b692-1e1db6e9d3da
[I 2024-08-19 18:55:26,050] Trial 0 finished with value: 0.96 and parameters: {'classifier': 'DecisionTree', 'dt_max_depth': 18, 'dt_min_samples_split': 8, 'dt_min_samples_leaf': 2, 'dt_max_features': 'log2'}. Best is trial 0 with value: 0.96.
[I 2024-08-19 18:55:26,362] Trial 1 finished with value: 0.9533333333333333 and parameters: {'classifier': 'RandomForest', 'rf_max_depth': 12, 'rf_min_samples_split': 11, 'rf_min_samples_leaf': 6, 'rf_max_features': 'sqrt'}. Best is trial 0 with value: 0.96.
[I 2024-08-19 18:55:26,368] Trial 2 finished with value: 0.66 and parameters: {'classifier': 'DecisionTree', 'dt_max_depth': 1, 'dt_min_samples_split': 7, 'dt_min_samples_leaf': 10, 'dt_max_features': 'sqrt'}. Best is trial 0 with value: 0.96.
[I 2024-08-19 18:55:26,375] Trial 3 finished with value: 0.66 and parameters: {'classifier': 'DecisionTree', 'dt_max_depth': 1, 'dt_min_samples_split': 8, 'dt_min_samples_leaf': 2, 'dt_max_features': 'log2'}. Best is trial 0 with value: 0.96.
[I 2024-08-19 18:55:28,155] Trial 4 finished with value: 0.98 and parameters: {'classifier': 'NeuralNetwork', 'nn_alpha': 0.0023490296382847452, 'hidden_layer_sizes': 512, 'activation': 'tanh', 'solver': 'adam'}. Best is trial 4 with value: 0.98.
[I 2024-08-19 18:55:46,473] Trial 5 finished with value: 0.96 and parameters: {'classifier': 'NeuralNetwork', 'nn_alpha': 0.0010981862734862917, 'hidden_layer_sizes': 512, 'activation': 'logistic', 'solver': 'sgd'}. Best is trial 4 with value: 0.98.
[I 2024-08-19 18:55:55,495] Trial 6 finished with value: 0.96 and parameters: {'classifier': 'NeuralNetwork', 'nn_alpha': 0.03028873323008054, 'hidden_layer_sizes': 256, 'activation': 'logistic', 'solver': 'sgd'}. Best is trial 4 with value: 0.98.
[I 2024-08-19 18:55:55,504] Trial 7 finished with value: 0.32 and parameters: {'classifier': 'SVC', 'svc_c': 5.158903690632351e-07, 'gamma': 'scale', 'kernel': 'poly'}. Best is trial 4 with value: 0.98.
[I 2024-08-19 18:55:57,743] Trial 8 finished with value: 0.9733333333333333 and parameters: {'classifier': 'NeuralNetwork', 'nn_alpha': 0.0030214812135979695, 'hidden_layer_sizes': 512, 'activation': 'relu', 'solver': 'sgd'}. Best is trial 4 with value: 0.98.
[I 2024-08-19 18:55:57,749] Trial 9 finished with value: 0.9533333333333333 and parameters: {'classifier': 'DecisionTree', 'dt_max_depth': 11, 'dt_min_samples_split': 9, 'dt_min_samples_leaf': 1, 'dt_max_features': 'log2'}. Best is trial 4 with value: 0.98.
[I 2024-08-19 18:55:58,239] Trial 10 finished with value: 0.96 and parameters: {'classifier': 'XGBoost', 'xgb_eta': 0.2768749409772407, 'xgb_max_depth': 6, 'xgb_min_child_weight': 0.00021831509936842922, 'xgb_subsample': 0.7271053185801094, 'xgb_colsample_bytree': 0.9727967242778319}. Best is trial 4 with value: 0.98.
[I 2024-08-19 18:55:59,586] Trial 11 finished with value: 0.98 and parameters: {'classifier': 'NeuralNetwork', 'nn_alpha': 0.0016778250093421898, 'hidden_layer_sizes': 512, 'activation': 'tanh', 'solver': 'adam'}. Best is trial 4 with value: 0.98.
[I 2024-08-19 18:56:00,703] Trial 12 finished with value: 0.98 and parameters: {'classifier': 'NeuralNetwork', 'nn_alpha': 2.9686835256198316e-05, 'hidden_layer_sizes': 512, 'activation': 'tanh', 'solver': 'adam'}. Best is trial 4 with value: 0.98.
[I 2024-08-19 18:56:01,292] Trial 13 finished with value: 0.98 and parameters: {'classifier': 'NeuralNetwork', 'nn_alpha': 0.0037156866672850624, 'hidden_layer_sizes': 64, 'activation': 'tanh', 'solver': 'adam'}. Best is trial 4 with value: 0.98.
[I 2024-08-19 18:56:01,509] Trial 14 finished with value: 0.96 and parameters: {'classifier': 'SVC', 'svc_c': 65477049.60656801, 'gamma': 'auto', 'kernel': 'linear'}. Best is trial 4 with value: 0.98.
[I 2024-08-19 18:56:01,634] Trial 15 finished with value: 0.3333333333333333 and parameters: {'classifier': 'XGBoost', 'xgb_eta': 0.012027944211703707, 'xgb_max_depth': 3, 'xgb_min_child_weight': 47.13108878339918, 'xgb_subsample': 0.942369803432737, 'xgb_colsample_bytree': 0.5197837403762117}. Best is trial 4 with value: 0.98.
[I 2024-08-19 18:56:01,954] Trial 16 finished with value: 0.94 and parameters: {'classifier': 'RandomForest', 'rf_max_depth': 2, 'rf_min_samples_split': 2, 'rf_min_samples_leaf': 1, 'rf_max_features': 'log2'}. Best is trial 4 with value: 0.98.
[I 2024-08-19 18:56:02,313] Trial 17 finished with value: 0.9666666666666667 and parameters: {'classifier': 'NeuralNetwork', 'nn_alpha': 0.00011991098095956596, 'hidden_layer_sizes': 128, 'activation': 'tanh', 'solver': 'lbfgs'}. Best is trial 4 with value: 0.98.
[I 2024-08-19 18:56:03,718] Trial 18 finished with value: 0.98 and parameters: {'classifier': 'NeuralNetwork', 'nn_alpha': 0.04241844226974263, 'hidden_layer_sizes': 512, 'activation': 'tanh', 'solver': 'adam'}. Best is trial 4 with value: 0.98.
[I 2024-08-19 18:56:04,828] Trial 19 finished with value: 0.98 and parameters: {'classifier': 'NeuralNetwork', 'nn_alpha': 0.000284276784738643, 'hidden_layer_sizes': 512, 'activation': 'tanh', 'solver': 'adam'}. Best is trial 4 with value: 0.98.
[I 2024-08-19 18:56:05,094] Trial 20 finished with value: 0.9466666666666667 and parameters: {'classifier': 'RandomForest', 'rf_max_depth': 30, 'rf_min_samples_split': 19, 'rf_min_samples_leaf': 10, 'rf_max_features': 'log2'}. Best is trial 4 with value: 0.98.
[I 2024-08-19 18:56:06,317] Trial 21 finished with value: 0.98 and parameters: {'classifier': 'NeuralNetwork', 'nn_alpha': 2.6144928217707967e-05, 'hidden_layer_sizes': 512, 'activation': 'tanh', 'solver': 'adam'}. Best is trial 4 with value: 0.98.
[I 2024-08-19 18:56:07,608] Trial 22 finished with value: 0.98 and parameters: {'classifier': 'NeuralNetwork', 'nn_alpha': 0.006286314961268551, 'hidden_layer_sizes': 512, 'activation': 'tanh', 'solver': 'adam'}. Best is trial 4 with value: 0.98.
[I 2024-08-19 18:56:08,794] Trial 23 finished with value: 0.98 and parameters: {'classifier': 'NeuralNetwork', 'nn_alpha': 1.3495107705175665e-05, 'hidden_layer_sizes': 512, 'activation': 'tanh', 'solver': 'adam'}. Best is trial 4 with value: 0.98.
[I 2024-08-19 18:56:09,702] Trial 24 finished with value: 0.98 and parameters: {'classifier': 'NeuralNetwork', 'nn_alpha': 0.0003920323132841246, 'hidden_layer_sizes': 256, 'activation': 'tanh', 'solver': 'adam'}. Best is trial 4 with value: 0.98.
[I 2024-08-19 18:56:09,715] Trial 25 finished with value: 0.96 and parameters: {'classifier': 'SVC', 'svc_c': 4112992909.2540154, 'gamma': 'scale', 'kernel': 'rbf'}. Best is trial 4 with value: 0.98.
[I 2024-08-19 18:56:10,061] Trial 26 finished with value: 0.9666666666666667 and parameters: {'classifier': 'XGBoost', 'xgb_eta': 0.07262835649684342, 'xgb_max_depth': 8, 'xgb_min_child_weight': 1.1922900455452606e-05, 'xgb_subsample': 0.5800803193705761, 'xgb_colsample_bytree': 0.6959970188970874}. Best is trial 4 with value: 0.98.
[I 2024-08-19 18:56:10,308] Trial 27 finished with value: 0.9733333333333333 and parameters: {'classifier': 'NeuralNetwork', 'nn_alpha': 0.0011611383486937507, 'hidden_layer_sizes': 64, 'activation': 'relu', 'solver': 'lbfgs'}. Best is trial 4 with value: 0.98.
[I 2024-08-19 18:56:11,493] Trial 28 finished with value: 0.98 and parameters: {'classifier': 'NeuralNetwork', 'nn_alpha': 0.011734130672702552, 'hidden_layer_sizes': 512, 'activation': 'tanh', 'solver': 'adam'}. Best is trial 4 with value: 0.98.
[I 2024-08-19 18:56:12,132] Trial 29 finished with value: 0.98 and parameters: {'classifier': 'NeuralNetwork', 'nn_alpha': 8.892272575353633e-05, 'hidden_layer_sizes': 128, 'activation': 'tanh', 'solver': 'adam'}. Best is trial 4 with value: 0.98.
[I 2024-08-19 18:56:12,341] Trial 30 finished with value: 0.9333333333333332 and parameters: {'classifier': 'XGBoost', 'xgb_eta': 0.01733663358881048, 'xgb_max_depth': 3, 'xgb_min_child_weight': 3.127267995571604, 'xgb_subsample': 0.9855200230565869, 'xgb_colsample_bytree': 0.9210140111554683}. Best is trial 4 with value: 0.98.
[I 2024-08-19 18:56:13,085] Trial 31 finished with value: 0.98 and parameters: {'classifier': 'NeuralNetwork', 'nn_alpha': 0.0038435563864513524, 'hidden_layer_sizes': 64, 'activation': 'tanh', 'solver': 'adam'}. Best is trial 4 with value: 0.98.
[I 2024-08-19 18:56:13,733] Trial 32 finished with value: 0.98 and parameters: {'classifier': 'NeuralNetwork', 'nn_alpha': 0.0021172379362026173, 'hidden_layer_sizes': 64, 'activation': 'tanh', 'solver': 'adam'}. Best is trial 4 with value: 0.98.
[I 2024-08-19 18:56:14,003] Trial 33 finished with value: 0.9533333333333333 and parameters: {'classifier': 'RandomForest', 'rf_max_depth': 2, 'rf_min_samples_split': 2, 'rf_min_samples_leaf': 1, 'rf_max_features': 'sqrt'}. Best is trial 4 with value: 0.98.
[I 2024-08-19 18:56:14,019] Trial 34 finished with value: 0.9533333333333333 and parameters: {'classifier': 'DecisionTree', 'dt_max_depth': 4, 'dt_min_samples_split': 18, 'dt_min_samples_leaf': 8, 'dt_max_features': 'sqrt'}. Best is trial 4 with value: 0.98.
[I 2024-08-19 18:56:14,638] Trial 35 finished with value: 0.9733333333333333 and parameters: {'classifier': 'NeuralNetwork', 'nn_alpha': 0.012121487282154992, 'hidden_layer_sizes': 64, 'activation': 'tanh', 'solver': 'adam'}. Best is trial 4 with value: 0.98.
[I 2024-08-19 18:56:19,373] Trial 36 finished with value: 0.98 and parameters: {'classifier': 'NeuralNetwork', 'nn_alpha': 0.0003883746355977376, 'hidden_layer_sizes': 512, 'activation': 'logistic', 'solver': 'adam'}. Best is trial 4 with value: 0.98.
[I 2024-08-19 18:56:19,388] Trial 37 finished with value: 0.94 and parameters: {'classifier': 'DecisionTree', 'dt_max_depth': 4, 'dt_min_samples_split': 2, 'dt_min_samples_leaf': 5, 'dt_max_features': 'sqrt'}. Best is trial 4 with value: 0.98.
[I 2024-08-19 18:56:19,844] Trial 38 finished with value: 0.96 and parameters: {'classifier': 'NeuralNetwork', 'nn_alpha': 0.0017307303614596964, 'hidden_layer_sizes': 64, 'activation': 'tanh', 'solver': 'lbfgs'}. Best is trial 4 with value: 0.98.
[I 2024-08-19 18:56:19,856] Trial 39 finished with value: 0.32 and parameters: {'classifier': 'SVC', 'svc_c': 3.2404817791708578e-09, 'gamma': 'auto', 'kernel': 'poly'}. Best is trial 4 with value: 0.98.
[I 2024-08-19 18:56:20,596] Trial 40 finished with value: 0.9733333333333333 and parameters: {'classifier': 'NeuralNetwork', 'nn_alpha': 0.00790246655093892, 'hidden_layer_sizes': 512, 'activation': 'relu', 'solver': 'adam'}. Best is trial 4 with value: 0.98.
[I 2024-08-19 18:56:21,819] Trial 41 finished with value: 0.98 and parameters: {'classifier': 'NeuralNetwork', 'nn_alpha': 0.03360000438945545, 'hidden_layer_sizes': 512, 'activation': 'tanh', 'solver': 'adam'}. Best is trial 4 with value: 0.98.
[I 2024-08-19 18:56:23,044] Trial 42 finished with value: 0.98 and parameters: {'classifier': 'NeuralNetwork', 'nn_alpha': 0.0705239969376992, 'hidden_layer_sizes': 512, 'activation': 'tanh', 'solver': 'adam'}. Best is trial 4 with value: 0.98.
[I 2024-08-19 18:56:24,191] Trial 43 finished with value: 0.98 and parameters: {'classifier': 'NeuralNetwork', 'nn_alpha': 0.0007189679112028736, 'hidden_layer_sizes': 512, 'activation': 'tanh', 'solver': 'adam'}. Best is trial 4 with value: 0.98.
[I 2024-08-19 18:56:25,231] Trial 44 finished with value: 0.98 and parameters: {'classifier': 'NeuralNetwork', 'nn_alpha': 0.005259158320946683, 'hidden_layer_sizes': 512, 'activation': 'tanh', 'solver': 'adam'}. Best is trial 4 with value: 0.98.
[I 2024-08-19 18:56:25,483] Trial 45 finished with value: 0.9533333333333333 and parameters: {'classifier': 'RandomForest', 'rf_max_depth': 6, 'rf_min_samples_split': 20, 'rf_min_samples_leaf': 10, 'rf_max_features': 'sqrt'}. Best is trial 4 with value: 0.98.
[I 2024-08-19 18:56:25,498] Trial 46 finished with value: 0.94 and parameters: {'classifier': 'DecisionTree', 'dt_max_depth': 32, 'dt_min_samples_split': 20, 'dt_min_samples_leaf': 5, 'dt_max_features': 'log2'}. Best is trial 4 with value: 0.98.
[I 2024-08-19 18:56:26,202] Trial 47 finished with value: 0.98 and parameters: {'classifier': 'NeuralNetwork', 'nn_alpha': 0.019111821434684057, 'hidden_layer_sizes': 256, 'activation': 'tanh', 'solver': 'adam'}. Best is trial 4 with value: 0.98.
[I 2024-08-19 18:56:26,212] Trial 48 finished with value: 0.9666666666666667 and parameters: {'classifier': 'SVC', 'svc_c': 1.7350050291506487, 'gamma': 'scale', 'kernel': 'rbf'}. Best is trial 4 with value: 0.98.
[I 2024-08-19 18:56:26,900] Trial 49 finished with value: 0.98 and parameters: {'classifier': 'NeuralNetwork', 'nn_alpha': 0.09712345862666033, 'hidden_layer_sizes': 128, 'activation': 'tanh', 'solver': 'adam'}. Best is trial 4 with value: 0.98.
[I 2024-08-19 18:56:27,107] Trial 50 finished with value: 0.96 and parameters: {'classifier': 'XGBoost', 'xgb_eta': 0.28457906235464403, 'xgb_max_depth': 5, 'xgb_min_child_weight': 0.03613719762342669, 'xgb_subsample': 0.5011747513499559, 'xgb_colsample_bytree': 0.5042129050461946}. Best is trial 4 with value: 0.98.
[I 2024-08-19 18:56:28,264] Trial 51 finished with value: 0.98 and parameters: {'classifier': 'NeuralNetwork', 'nn_alpha': 0.00013900417098922454, 'hidden_layer_sizes': 512, 'activation': 'tanh', 'solver': 'adam'}. Best is trial 4 with value: 0.98.
[I 2024-08-19 18:56:29,428] Trial 52 finished with value: 0.98 and parameters: {'classifier': 'NeuralNetwork', 'nn_alpha': 5.0806332190434334e-05, 'hidden_layer_sizes': 512, 'activation': 'tanh', 'solver': 'adam'}. Best is trial 4 with value: 0.98.
[I 2024-08-19 18:56:30,587] Trial 53 finished with value: 0.98 and parameters: {'classifier': 'NeuralNetwork', 'nn_alpha': 0.00039568998263661337, 'hidden_layer_sizes': 512, 'activation': 'tanh', 'solver': 'adam'}. Best is trial 4 with value: 0.98.
[I 2024-08-19 18:56:48,045] Trial 54 finished with value: 0.96 and parameters: {'classifier': 'NeuralNetwork', 'nn_alpha': 0.0008908911624315056, 'hidden_layer_sizes': 512, 'activation': 'logistic', 'solver': 'sgd'}. Best is trial 4 with value: 0.98.
[I 2024-08-19 18:56:49,150] Trial 55 finished with value: 0.98 and parameters: {'classifier': 'NeuralNetwork', 'nn_alpha': 0.0013316025008503003, 'hidden_layer_sizes': 512, 'activation': 'tanh', 'solver': 'adam'}. Best is trial 4 with value: 0.98.
[I 2024-08-19 18:56:49,414] Trial 56 finished with value: 0.94 and parameters: {'classifier': 'RandomForest', 'rf_max_depth': 6, 'rf_min_samples_split': 11, 'rf_min_samples_leaf': 5, 'rf_max_features': 'log2'}. Best is trial 4 with value: 0.98.
[I 2024-08-19 18:56:52,883] Trial 57 finished with value: 0.9733333333333333 and parameters: {'classifier': 'NeuralNetwork', 'nn_alpha': 0.0024178236580176845, 'hidden_layer_sizes': 64, 'activation': 'logistic', 'solver': 'sgd'}. Best is trial 4 with value: 0.98.
[I 2024-08-19 18:56:53,573] Trial 58 finished with value: 0.9733333333333333 and parameters: {'classifier': 'NeuralNetwork', 'nn_alpha': 0.0006653084670975674, 'hidden_layer_sizes': 512, 'activation': 'relu', 'solver': 'adam'}. Best is trial 4 with value: 0.98.
[I 2024-08-19 18:56:53,583] Trial 59 finished with value: 0.9666666666666667 and parameters: {'classifier': 'SVC', 'svc_c': 8.746472136894859, 'gamma': 'auto', 'kernel': 'linear'}. Best is trial 4 with value: 0.98.
[I 2024-08-19 18:56:53,848] Trial 60 finished with value: 0.96 and parameters: {'classifier': 'XGBoost', 'xgb_eta': 0.053261052691216317, 'xgb_max_depth': 9, 'xgb_min_child_weight': 0.02976504565632221, 'xgb_subsample': 0.7721336864405421, 'xgb_colsample_bytree': 0.7779472319448282}. Best is trial 4 with value: 0.98.
[I 2024-08-19 18:56:55,010] Trial 61 finished with value: 0.98 and parameters: {'classifier': 'NeuralNetwork', 'nn_alpha': 1.3917928274215493e-05, 'hidden_layer_sizes': 512, 'activation': 'tanh', 'solver': 'adam'}. Best is trial 4 with value: 0.98.
[I 2024-08-19 18:56:56,165] Trial 62 finished with value: 0.98 and parameters: {'classifier': 'NeuralNetwork', 'nn_alpha': 3.777775908092086e-05, 'hidden_layer_sizes': 512, 'activation': 'tanh', 'solver': 'adam'}. Best is trial 4 with value: 0.98.
[I 2024-08-19 18:56:57,264] Trial 63 finished with value: 0.98 and parameters: {'classifier': 'NeuralNetwork', 'nn_alpha': 2.7920139912787316e-05, 'hidden_layer_sizes': 512, 'activation': 'tanh', 'solver': 'adam'}. Best is trial 4 with value: 0.98.
[I 2024-08-19 18:56:58,948] Trial 64 finished with value: 0.9466666666666667 and parameters: {'classifier': 'NeuralNetwork', 'nn_alpha': 8.023627369536914e-05, 'hidden_layer_sizes': 512, 'activation': 'tanh', 'solver': 'lbfgs'}. Best is trial 4 with value: 0.98.
[I 2024-08-19 18:57:01,395] Trial 65 finished with value: 0.9866666666666667 and parameters: {'classifier': 'NeuralNetwork', 'nn_alpha': 0.00019506807190652922, 'hidden_layer_sizes': 256, 'activation': 'tanh', 'solver': 'sgd'}. Best is trial 65 with value: 0.9866666666666667.
[I 2024-08-19 18:57:03,468] Trial 66 finished with value: 0.9866666666666667 and parameters: {'classifier': 'NeuralNetwork', 'nn_alpha': 0.0002507837983357799, 'hidden_layer_sizes': 256, 'activation': 'tanh', 'solver': 'sgd'}. Best is trial 65 with value: 0.9866666666666667.
[I 2024-08-19 18:57:03,484] Trial 67 finished with value: 0.9466666666666667 and parameters: {'classifier': 'DecisionTree', 'dt_max_depth': 2, 'dt_min_samples_split': 15, 'dt_min_samples_leaf': 7, 'dt_max_features': 'sqrt'}. Best is trial 65 with value: 0.9866666666666667.
[I 2024-08-19 18:57:05,913] Trial 68 finished with value: 0.98 and parameters: {'classifier': 'NeuralNetwork', 'nn_alpha': 0.0002950628758417201, 'hidden_layer_sizes': 256, 'activation': 'tanh', 'solver': 'sgd'}. Best is trial 65 with value: 0.9866666666666667.
[I 2024-08-19 18:57:08,254] Trial 69 finished with value: 0.9866666666666667 and parameters: {'classifier': 'NeuralNetwork', 'nn_alpha': 0.00021104995917168594, 'hidden_layer_sizes': 256, 'activation': 'tanh', 'solver': 'sgd'}. Best is trial 65 with value: 0.9866666666666667.
[I 2024-08-19 18:57:10,624] Trial 70 finished with value: 0.9866666666666667 and parameters: {'classifier': 'NeuralNetwork', 'nn_alpha': 0.00017647466616997886, 'hidden_layer_sizes': 256, 'activation': 'tanh', 'solver': 'sgd'}. Best is trial 65 with value: 0.9866666666666667.
[I 2024-08-19 18:57:13,019] Trial 71 finished with value: 0.9866666666666667 and parameters: {'classifier': 'NeuralNetwork', 'nn_alpha': 0.0001483381919447399, 'hidden_layer_sizes': 256, 'activation': 'tanh', 'solver': 'sgd'}. Best is trial 65 with value: 0.9866666666666667.
[I 2024-08-19 18:57:15,503] Trial 72 finished with value: 0.9866666666666667 and parameters: {'classifier': 'NeuralNetwork', 'nn_alpha': 0.0001622783072945992, 'hidden_layer_sizes': 256, 'activation': 'tanh', 'solver': 'sgd'}. Best is trial 65 with value: 0.9866666666666667.
[I 2024-08-19 18:57:17,861] Trial 73 finished with value: 0.9866666666666667 and parameters: {'classifier': 'NeuralNetwork', 'nn_alpha': 0.0001755520043975869, 'hidden_layer_sizes': 256, 'activation': 'tanh', 'solver': 'sgd'}. Best is trial 65 with value: 0.9866666666666667.
[I 2024-08-19 18:57:20,322] Trial 74 finished with value: 0.9866666666666667 and parameters: {'classifier': 'NeuralNetwork', 'nn_alpha': 0.0001847978765932264, 'hidden_layer_sizes': 256, 'activation': 'tanh', 'solver': 'sgd'}. Best is trial 65 with value: 0.9866666666666667.
[I 2024-08-19 18:57:22,868] Trial 75 finished with value: 0.98 and parameters: {'classifier': 'NeuralNetwork', 'nn_alpha': 0.00015930325506485776, 'hidden_layer_sizes': 256, 'activation': 'tanh', 'solver': 'sgd'}. Best is trial 65 with value: 0.9866666666666667.
[I 2024-08-19 18:57:25,436] Trial 76 finished with value: 0.9866666666666667 and parameters: {'classifier': 'NeuralNetwork', 'nn_alpha': 0.000197370754416889, 'hidden_layer_sizes': 256, 'activation': 'tanh', 'solver': 'sgd'}. Best is trial 65 with value: 0.9866666666666667.
[I 2024-08-19 18:57:27,116] Trial 77 finished with value: 0.98 and parameters: {'classifier': 'NeuralNetwork', 'nn_alpha': 0.00020890573121085514, 'hidden_layer_sizes': 256, 'activation': 'relu', 'solver': 'sgd'}. Best is trial 65 with value: 0.9866666666666667.
[I 2024-08-19 18:57:29,554] Trial 78 finished with value: 0.98 and parameters: {'classifier': 'NeuralNetwork', 'nn_alpha': 6.902992223005235e-05, 'hidden_layer_sizes': 256, 'activation': 'tanh', 'solver': 'sgd'}. Best is trial 65 with value: 0.9866666666666667.
[I 2024-08-19 18:57:31,960] Trial 79 finished with value: 0.9866666666666667 and parameters: {'classifier': 'NeuralNetwork', 'nn_alpha': 9.873569163860635e-05, 'hidden_layer_sizes': 256, 'activation': 'tanh', 'solver': 'sgd'}. Best is trial 65 with value: 0.9866666666666667.
[I 2024-08-19 18:57:34,324] Trial 80 finished with value: 0.9866666666666667 and parameters: {'classifier': 'NeuralNetwork', 'nn_alpha': 0.00022869823770996507, 'hidden_layer_sizes': 256, 'activation': 'tanh', 'solver': 'sgd'}. Best is trial 65 with value: 0.9866666666666667.
[I 2024-08-19 18:57:36,838] Trial 81 finished with value: 0.9866666666666667 and parameters: {'classifier': 'NeuralNetwork', 'nn_alpha': 0.00016725874845089863, 'hidden_layer_sizes': 256, 'activation': 'tanh', 'solver': 'sgd'}. Best is trial 65 with value: 0.9866666666666667.
[I 2024-08-19 18:57:39,278] Trial 82 finished with value: 0.9866666666666667 and parameters: {'classifier': 'NeuralNetwork', 'nn_alpha': 0.00011952095604075837, 'hidden_layer_sizes': 256, 'activation': 'tanh', 'solver': 'sgd'}. Best is trial 65 with value: 0.9866666666666667.
[I 2024-08-19 18:57:41,599] Trial 83 finished with value: 0.98 and parameters: {'classifier': 'NeuralNetwork', 'nn_alpha': 0.0002693064683507062, 'hidden_layer_sizes': 256, 'activation': 'tanh', 'solver': 'sgd'}. Best is trial 65 with value: 0.9866666666666667.
