[I 2024-08-19 19:17:46,993] Trial 644 finished with value: 0.9866666666666667 and parameters: {'classifier': 'NeuralNetwork', 'nn_alpha': 0.00026896740043954947, 'hidden_layer_sizes': 256, 'activation': 'tanh', 'solver': 'sgd'}. Best is trial 65 with value: 0.9866666666666667.
[I 2024-08-19 19:17:48,577] Trial 645 finished with value: 0.98 and parameters: {'classifier': 'NeuralNetwork', 'nn_alpha': 4.020565390111013e-05, 'hidden_layer_sizes': 256, 'activation': 'relu', 'solver': 'sgd'}. Best is trial 65 with value: 0.9866666666666667.
[I 2024-08-19 19:17:50,756] Trial 646 finished with value: 0.98 and parameters: {'classifier': 'NeuralNetwork', 'nn_alpha': 0.00020078220676623867, 'hidden_layer_sizes': 256, 'activation': 'tanh', 'solver': 'sgd'}. Best is trial 65 with value: 0.9866666666666667.
[I 2024-08-19 19:17:52,329] Trial 647 finished with value: 0.98 and parameters: {'classifier': 'NeuralNetwork', 'nn_alpha': 0.00015527594061247508, 'hidden_layer_sizes': 128, 'activation': 'tanh', 'solver': 'sgd'}. Best is trial 65 with value: 0.9866666666666667.
[I 2024-08-19 19:17:54,459] Trial 648 finished with value: 0.9866666666666667 and parameters: {'classifier': 'NeuralNetwork', 'nn_alpha': 7.52916327889363e-05, 'hidden_layer_sizes': 256, 'activation': 'tanh', 'solver': 'sgd'}. Best is trial 65 with value: 0.9866666666666667.
[I 2024-08-19 19:17:56,631] Trial 649 finished with value: 0.9866666666666667 and parameters: {'classifier': 'NeuralNetwork', 'nn_alpha': 0.00013116702827657323, 'hidden_layer_sizes': 256, 'activation': 'tanh', 'solver': 'sgd'}. Best is trial 65 with value: 0.9866666666666667.
[I 2024-08-19 19:17:58,931] Trial 650 finished with value: 0.9866666666666667 and parameters: {'classifier': 'NeuralNetwork', 'nn_alpha': 9.350115323905586e-05, 'hidden_layer_sizes': 256, 'activation': 'tanh', 'solver': 'sgd'}. Best is trial 65 with value: 0.9866666666666667.
[I 2024-08-19 19:18:01,126] Trial 651 finished with value: 0.98 and parameters: {'classifier': 'NeuralNetwork', 'nn_alpha': 0.00018570773202137162, 'hidden_layer_sizes': 256, 'activation': 'tanh', 'solver': 'sgd'}. Best is trial 65 with value: 0.9866666666666667.
[I 2024-08-19 19:18:03,385] Trial 652 finished with value: 0.98 and parameters: {'classifier': 'NeuralNetwork', 'nn_alpha': 0.00022436138548090814, 'hidden_layer_sizes': 256, 'activation': 'tanh', 'solver': 'sgd'}. Best is trial 65 with value: 0.9866666666666667.
[I 2024-08-19 19:18:03,669] Trial 653 finished with value: 0.9533333333333333 and parameters: {'classifier': 'RandomForest', 'rf_max_depth': 13, 'rf_min_samples_split': 12, 'rf_min_samples_leaf': 5, 'rf_max_features': 'log2'}. Best is trial 65 with value: 0.9866666666666667.
[I 2024-08-19 19:18:05,886] Trial 654 finished with value: 0.9866666666666667 and parameters: {'classifier': 'NeuralNetwork', 'nn_alpha': 0.0003009662558072597, 'hidden_layer_sizes': 256, 'activation': 'tanh', 'solver': 'sgd'}. Best is trial 65 with value: 0.9866666666666667.
[I 2024-08-19 19:18:06,807] Trial 655 finished with value: 0.98 and parameters: {'classifier': 'NeuralNetwork', 'nn_alpha': 0.0001422237552735924, 'hidden_layer_sizes': 256, 'activation': 'tanh', 'solver': 'adam'}. Best is trial 65 with value: 0.9866666666666667.
[I 2024-08-19 19:18:08,982] Trial 656 finished with value: 0.98 and parameters: {'classifier': 'NeuralNetwork', 'nn_alpha': 0.00025801772655000433, 'hidden_layer_sizes': 256, 'activation': 'tanh', 'solver': 'sgd'}. Best is trial 65 with value: 0.9866666666666667.
[I 2024-08-19 19:18:18,893] Trial 657 finished with value: 0.96 and parameters: {'classifier': 'NeuralNetwork', 'nn_alpha': 0.00016752257429884248, 'hidden_layer_sizes': 256, 'activation': 'logistic', 'solver': 'sgd'}. Best is trial 65 with value: 0.9866666666666667.
[I 2024-08-19 19:18:21,093] Trial 658 finished with value: 0.98 and parameters: {'classifier': 'NeuralNetwork', 'nn_alpha': 0.0003667136280493635, 'hidden_layer_sizes': 256, 'activation': 'tanh', 'solver': 'sgd'}. Best is trial 65 with value: 0.9866666666666667.
[I 2024-08-19 19:18:23,340] Trial 659 finished with value: 0.98 and parameters: {'classifier': 'NeuralNetwork', 'nn_alpha': 0.00020490808285135944, 'hidden_layer_sizes': 256, 'activation': 'tanh', 'solver': 'sgd'}. Best is trial 65 with value: 0.9866666666666667.
[I 2024-08-19 19:18:24,682] Trial 660 finished with value: 0.9733333333333333 and parameters: {'classifier': 'NeuralNetwork', 'nn_alpha': 0.00046916679379757886, 'hidden_layer_sizes': 64, 'activation': 'tanh', 'solver': 'sgd'}. Best is trial 65 with value: 0.9866666666666667.
[I 2024-08-19 19:18:26,922] Trial 661 finished with value: 0.9866666666666667 and parameters: {'classifier': 'NeuralNetwork', 'nn_alpha': 0.00011434021207389903, 'hidden_layer_sizes': 256, 'activation': 'tanh', 'solver': 'sgd'}. Best is trial 65 with value: 0.9866666666666667.
[I 2024-08-19 19:18:27,001] Trial 662 finished with value: 0.9466666666666667 and parameters: {'classifier': 'SVC', 'svc_c': 7157.167456122149, 'gamma': 'auto', 'kernel': 'poly'}. Best is trial 65 with value: 0.9866666666666667.
[I 2024-08-19 19:18:28,682] Trial 663 finished with value: 0.9866666666666667 and parameters: {'classifier': 'NeuralNetwork', 'nn_alpha': 0.0001742996210689387, 'hidden_layer_sizes': 128, 'activation': 'tanh', 'solver': 'sgd'}. Best is trial 65 with value: 0.9866666666666667.
[I 2024-08-19 19:18:28,923] Trial 664 finished with value: 0.9533333333333333 and parameters: {'classifier': 'XGBoost', 'xgb_eta': 0.23461744000179072, 'xgb_max_depth': 5, 'xgb_min_child_weight': 0.7580283040660476, 'xgb_subsample': 0.7270539227729019, 'xgb_colsample_bytree': 0.5390804395233433}. Best is trial 65 with value: 0.9866666666666667.
[I 2024-08-19 19:18:32,854] Trial 665 finished with value: 0.9866666666666667 and parameters: {'classifier': 'NeuralNetwork', 'nn_alpha': 0.00023694434220241931, 'hidden_layer_sizes': 512, 'activation': 'tanh', 'solver': 'sgd'}. Best is trial 65 with value: 0.9866666666666667.
[I 2024-08-19 19:18:33,741] Trial 666 finished with value: 0.9733333333333333 and parameters: {'classifier': 'NeuralNetwork', 'nn_alpha': 5.06081098175275e-05, 'hidden_layer_sizes': 256, 'activation': 'tanh', 'solver': 'lbfgs'}. Best is trial 65 with value: 0.9866666666666667.
[I 2024-08-19 19:18:33,770] Trial 667 finished with value: 0.88 and parameters: {'classifier': 'DecisionTree', 'dt_max_depth': 5, 'dt_min_samples_split': 8, 'dt_min_samples_leaf': 10, 'dt_max_features': 'sqrt'}. Best is trial 65 with value: 0.9866666666666667.
[I 2024-08-19 19:18:36,200] Trial 668 finished with value: 0.9866666666666667 and parameters: {'classifier': 'NeuralNetwork', 'nn_alpha': 0.00013801057936350036, 'hidden_layer_sizes': 256, 'activation': 'tanh', 'solver': 'sgd'}. Best is trial 65 with value: 0.9866666666666667.
[I 2024-08-19 19:18:38,602] Trial 669 finished with value: 0.9866666666666667 and parameters: {'classifier': 'NeuralNetwork', 'nn_alpha': 0.0002819687697130712, 'hidden_layer_sizes': 256, 'activation': 'tanh', 'solver': 'sgd'}. Best is trial 65 with value: 0.9866666666666667.
[I 2024-08-19 19:18:40,975] Trial 670 finished with value: 0.9866666666666667 and parameters: {'classifier': 'NeuralNetwork', 'nn_alpha': 0.0002129146467719959, 'hidden_layer_sizes': 256, 'activation': 'tanh', 'solver': 'sgd'}. Best is trial 65 with value: 0.9866666666666667.
[I 2024-08-19 19:18:43,315] Trial 671 finished with value: 0.9866666666666667 and parameters: {'classifier': 'NeuralNetwork', 'nn_alpha': 9.145585102996515e-05, 'hidden_layer_sizes': 256, 'activation': 'tanh', 'solver': 'sgd'}. Best is trial 65 with value: 0.9866666666666667.
[I 2024-08-19 19:18:45,685] Trial 672 finished with value: 0.9866666666666667 and parameters: {'classifier': 'NeuralNetwork', 'nn_alpha': 0.0006828959744800377, 'hidden_layer_sizes': 256, 'activation': 'tanh', 'solver': 'sgd'}. Best is trial 65 with value: 0.9866666666666667.
[I 2024-08-19 19:18:47,461] Trial 673 finished with value: 0.9733333333333333 and parameters: {'classifier': 'NeuralNetwork', 'nn_alpha': 0.00017562437561292627, 'hidden_layer_sizes': 256, 'activation': 'relu', 'solver': 'sgd'}. Best is trial 65 with value: 0.9866666666666667.
[I 2024-08-19 19:18:49,773] Trial 674 finished with value: 0.9866666666666667 and parameters: {'classifier': 'NeuralNetwork', 'nn_alpha': 0.0003551927573368649, 'hidden_layer_sizes': 256, 'activation': 'tanh', 'solver': 'sgd'}. Best is trial 65 with value: 0.9866666666666667.
[I 2024-08-19 19:18:52,087] Trial 675 finished with value: 0.9866666666666667 and parameters: {'classifier': 'NeuralNetwork', 'nn_alpha': 0.0001193098821614709, 'hidden_layer_sizes': 256, 'activation': 'tanh', 'solver': 'sgd'}. Best is trial 65 with value: 0.9866666666666667.
[I 2024-08-19 19:18:54,346] Trial 676 finished with value: 0.9866666666666667 and parameters: {'classifier': 'NeuralNetwork', 'nn_alpha': 0.00024676228248864807, 'hidden_layer_sizes': 256, 'activation': 'tanh', 'solver': 'sgd'}. Best is trial 65 with value: 0.9866666666666667.
[I 2024-08-19 19:18:56,846] Trial 677 finished with value: 0.9866666666666667 and parameters: {'classifier': 'NeuralNetwork', 'nn_alpha': 0.00015407393287103548, 'hidden_layer_sizes': 256, 'activation': 'tanh', 'solver': 'sgd'}. Best is trial 65 with value: 0.9866666666666667.
[I 2024-08-19 19:18:58,637] Trial 678 finished with value: 0.9866666666666667 and parameters: {'classifier': 'NeuralNetwork', 'nn_alpha': 0.00029764859276254984, 'hidden_layer_sizes': 128, 'activation': 'tanh', 'solver': 'sgd'}. Best is trial 65 with value: 0.9866666666666667.
[I 2024-08-19 19:19:01,013] Trial 679 finished with value: 0.9866666666666667 and parameters: {'classifier': 'NeuralNetwork', 'nn_alpha': 0.00020303641960943986, 'hidden_layer_sizes': 256, 'activation': 'tanh', 'solver': 'sgd'}. Best is trial 65 with value: 0.9866666666666667.
[I 2024-08-19 19:19:01,351] Trial 680 finished with value: 0.9466666666666667 and parameters: {'classifier': 'RandomForest', 'rf_max_depth': 25, 'rf_min_samples_split': 3, 'rf_min_samples_leaf': 6, 'rf_max_features': 'sqrt'}. Best is trial 65 with value: 0.9866666666666667.
[I 2024-08-19 19:19:02,325] Trial 681 finished with value: 0.98 and parameters: {'classifier': 'NeuralNetwork', 'nn_alpha': 6.165432821355538e-05, 'hidden_layer_sizes': 256, 'activation': 'tanh', 'solver': 'adam'}. Best is trial 65 with value: 0.9866666666666667.
[I 2024-08-19 19:19:04,744] Trial 682 finished with value: 0.9866666666666667 and parameters: {'classifier': 'NeuralNetwork', 'nn_alpha': 0.0001385463348234399, 'hidden_layer_sizes': 256, 'activation': 'tanh', 'solver': 'sgd'}. Best is trial 65 with value: 0.9866666666666667.
[I 2024-08-19 19:19:15,302] Trial 683 finished with value: 0.96 and parameters: {'classifier': 'NeuralNetwork', 'nn_alpha': 7.258237704936289e-05, 'hidden_layer_sizes': 256, 'activation': 'logistic', 'solver': 'sgd'}. Best is trial 65 with value: 0.9866666666666667.
[I 2024-08-19 19:19:17,777] Trial 684 finished with value: 0.9866666666666667 and parameters: {'classifier': 'NeuralNetwork', 'nn_alpha': 0.00018094359087941726, 'hidden_layer_sizes': 256, 'activation': 'tanh', 'solver': 'sgd'}. Best is trial 65 with value: 0.9866666666666667.
[I 2024-08-19 19:19:20,206] Trial 685 finished with value: 0.9866666666666667 and parameters: {'classifier': 'NeuralNetwork', 'nn_alpha': 0.0004252963446976703, 'hidden_layer_sizes': 256, 'activation': 'tanh', 'solver': 'sgd'}. Best is trial 65 with value: 0.9866666666666667.
[I 2024-08-19 19:19:22,620] Trial 686 finished with value: 0.9866666666666667 and parameters: {'classifier': 'NeuralNetwork', 'nn_alpha': 0.00010106938939825423, 'hidden_layer_sizes': 256, 'activation': 'tanh', 'solver': 'sgd'}. Best is trial 65 with value: 0.9866666666666667.
[I 2024-08-19 19:19:25,022] Trial 687 finished with value: 0.9866666666666667 and parameters: {'classifier': 'NeuralNetwork', 'nn_alpha': 0.00022710614906171594, 'hidden_layer_sizes': 256, 'activation': 'tanh', 'solver': 'sgd'}. Best is trial 65 with value: 0.9866666666666667.
[I 2024-08-19 19:19:27,483] Trial 688 finished with value: 0.9866666666666667 and parameters: {'classifier': 'NeuralNetwork', 'nn_alpha': 0.0003260916865513727, 'hidden_layer_sizes': 256, 'activation': 'tanh', 'solver': 'sgd'}. Best is trial 65 with value: 0.9866666666666667.
[I 2024-08-19 19:19:28,011] Trial 689 finished with value: 0.9666666666666667 and parameters: {'classifier': 'XGBoost', 'xgb_eta': 0.034274739374243995, 'xgb_max_depth': 3, 'xgb_min_child_weight': 0.00020293970789389293, 'xgb_subsample': 0.541682808174355, 'xgb_colsample_bytree': 0.575292848925506}. Best is trial 65 with value: 0.9866666666666667.
[I 2024-08-19 19:19:29,552] Trial 690 finished with value: 0.98 and parameters: {'classifier': 'NeuralNetwork', 'nn_alpha': 0.00025541680251053514, 'hidden_layer_sizes': 64, 'activation': 'tanh', 'solver': 'sgd'}. Best is trial 65 with value: 0.9866666666666667.
[I 2024-08-19 19:19:29,807] Trial 691 finished with value: 0.96 and parameters: {'classifier': 'SVC', 'svc_c': 4419295.103963978, 'gamma': 'scale', 'kernel': 'linear'}. Best is trial 65 with value: 0.9866666666666667.
[I 2024-08-19 19:19:29,838] Trial 692 finished with value: 0.9199999999999999 and parameters: {'classifier': 'DecisionTree', 'dt_max_depth': 8, 'dt_min_samples_split': 9, 'dt_min_samples_leaf': 2, 'dt_max_features': 'log2'}. Best is trial 65 with value: 0.9866666666666667.
[I 2024-08-19 19:19:30,974] Trial 693 finished with value: 0.9533333333333333 and parameters: {'classifier': 'NeuralNetwork', 'nn_alpha': 0.00016299289578061395, 'hidden_layer_sizes': 256, 'activation': 'tanh', 'solver': 'lbfgs'}. Best is trial 65 with value: 0.9866666666666667.
[I 2024-08-19 19:19:35,349] Trial 694 finished with value: 0.9866666666666667 and parameters: {'classifier': 'NeuralNetwork', 'nn_alpha': 0.0001305944023394261, 'hidden_layer_sizes': 512, 'activation': 'tanh', 'solver': 'sgd'}. Best is trial 65 with value: 0.9866666666666667.
[I 2024-08-19 19:19:37,624] Trial 695 finished with value: 0.98 and parameters: {'classifier': 'NeuralNetwork', 'nn_alpha': 0.00019979078658649102, 'hidden_layer_sizes': 256, 'activation': 'tanh', 'solver': 'sgd'}. Best is trial 65 with value: 0.9866666666666667.
[I 2024-08-19 19:19:39,915] Trial 696 finished with value: 0.9866666666666667 and parameters: {'classifier': 'NeuralNetwork', 'nn_alpha': 0.0005300755873423184, 'hidden_layer_sizes': 256, 'activation': 'tanh', 'solver': 'sgd'}. Best is trial 65 with value: 0.9866666666666667.
[I 2024-08-19 19:19:41,154] Trial 697 finished with value: 0.98 and parameters: {'classifier': 'NeuralNetwork', 'nn_alpha': 0.00010481463827425757, 'hidden_layer_sizes': 128, 'activation': 'relu', 'solver': 'sgd'}. Best is trial 65 with value: 0.9866666666666667.
[I 2024-08-19 19:19:43,449] Trial 698 finished with value: 0.9866666666666667 and parameters: {'classifier': 'NeuralNetwork', 'nn_alpha': 0.0002656393681485987, 'hidden_layer_sizes': 256, 'activation': 'tanh', 'solver': 'sgd'}. Best is trial 65 with value: 0.9866666666666667.
[I 2024-08-19 19:19:45,654] Trial 699 finished with value: 0.9866666666666667 and parameters: {'classifier': 'NeuralNetwork', 'nn_alpha': 0.00017452176812922558, 'hidden_layer_sizes': 256, 'activation': 'tanh', 'solver': 'sgd'}. Best is trial 65 with value: 0.9866666666666667.
[I 2024-08-19 19:19:47,877] Trial 700 finished with value: 0.9866666666666667 and parameters: {'classifier': 'NeuralNetwork', 'nn_alpha': 8.01036293759575e-05, 'hidden_layer_sizes': 256, 'activation': 'tanh', 'solver': 'sgd'}. Best is trial 65 with value: 0.9866666666666667.
[I 2024-08-19 19:19:50,190] Trial 701 finished with value: 0.98 and parameters: {'classifier': 'NeuralNetwork', 'nn_alpha': 0.00021297843710776525, 'hidden_layer_sizes': 256, 'activation': 'tanh', 'solver': 'sgd'}. Best is trial 65 with value: 0.9866666666666667.
[I 2024-08-19 19:19:52,410] Trial 702 finished with value: 0.98 and parameters: {'classifier': 'NeuralNetwork', 'nn_alpha': 0.0001406606920694273, 'hidden_layer_sizes': 256, 'activation': 'tanh', 'solver': 'sgd'}. Best is trial 65 with value: 0.9866666666666667.
[I 2024-08-19 19:19:54,577] Trial 703 finished with value: 0.9866666666666667 and parameters: {'classifier': 'NeuralNetwork', 'nn_alpha': 0.0003023965369448884, 'hidden_layer_sizes': 256, 'activation': 'tanh', 'solver': 'sgd'}. Best is trial 65 with value: 0.9866666666666667.
[I 2024-08-19 19:19:56,839] Trial 704 finished with value: 0.9866666666666667 and parameters: {'classifier': 'NeuralNetwork', 'nn_alpha': 0.00039686974725448127, 'hidden_layer_sizes': 256, 'activation': 'tanh', 'solver': 'sgd'}. Best is trial 65 with value: 0.9866666666666667.
[I 2024-08-19 19:19:59,117] Trial 705 finished with value: 0.9866666666666667 and parameters: {'classifier': 'NeuralNetwork', 'nn_alpha': 0.00011269389174038036, 'hidden_layer_sizes': 256, 'activation': 'tanh', 'solver': 'sgd'}. Best is trial 65 with value: 0.9866666666666667.
[I 2024-08-19 19:19:59,574] Trial 706 finished with value: 0.9666666666666667 and parameters: {'classifier': 'RandomForest', 'rf_max_depth': 5, 'rf_min_samples_split': 8, 'rf_min_samples_leaf': 1, 'rf_max_features': 'log2'}. Best is trial 65 with value: 0.9866666666666667.
[I 2024-08-19 19:20:01,715] Trial 707 finished with value: 0.9866666666666667 and parameters: {'classifier': 'NeuralNetwork', 'nn_alpha': 0.00023683031448626927, 'hidden_layer_sizes': 256, 'activation': 'tanh', 'solver': 'sgd'}. Best is trial 65 with value: 0.9866666666666667.
[I 2024-08-19 19:20:02,733] Trial 708 finished with value: 0.98 and parameters: {'classifier': 'NeuralNetwork', 'nn_alpha': 0.0001600609363207538, 'hidden_layer_sizes': 256, 'activation': 'tanh', 'solver': 'adam'}. Best is trial 65 with value: 0.9866666666666667.
[I 2024-08-19 19:20:12,859] Trial 709 finished with value: 0.96 and parameters: {'classifier': 'NeuralNetwork', 'nn_alpha': 0.00019697505930018637, 'hidden_layer_sizes': 256, 'activation': 'logistic', 'solver': 'sgd'}. Best is trial 65 with value: 0.9866666666666667.
[I 2024-08-19 19:20:14,386] Trial 710 finished with value: 0.9866666666666667 and parameters: {'classifier': 'NeuralNetwork', 'nn_alpha': 8.817166354944149e-05, 'hidden_layer_sizes': 128, 'activation': 'tanh', 'solver': 'sgd'}. Best is trial 65 with value: 0.9866666666666667.
[I 2024-08-19 19:20:16,561] Trial 711 finished with value: 0.9866666666666667 and parameters: {'classifier': 'NeuralNetwork', 'nn_alpha': 0.00012547734865376328, 'hidden_layer_sizes': 256, 'activation': 'tanh', 'solver': 'sgd'}. Best is trial 65 with value: 0.9866666666666667.
[I 2024-08-19 19:20:18,758] Trial 712 finished with value: 0.98 and parameters: {'classifier': 'NeuralNetwork', 'nn_alpha': 0.00033248395643907644, 'hidden_layer_sizes': 256, 'activation': 'tanh', 'solver': 'sgd'}. Best is trial 65 with value: 0.9866666666666667.
[I 2024-08-19 19:20:20,985] Trial 713 finished with value: 0.9866666666666667 and parameters: {'classifier': 'NeuralNetwork', 'nn_alpha': 0.0002620882199972558, 'hidden_layer_sizes': 256, 'activation': 'tanh', 'solver': 'sgd'}. Best is trial 65 with value: 0.9866666666666667.
[I 2024-08-19 19:20:23,271] Trial 714 finished with value: 0.9866666666666667 and parameters: {'classifier': 'NeuralNetwork', 'nn_alpha': 0.0001525752746332167, 'hidden_layer_sizes': 256, 'activation': 'tanh', 'solver': 'sgd'}. Best is trial 65 with value: 0.9866666666666667.
[I 2024-08-19 19:20:23,301] Trial 715 finished with value: 0.9666666666666667 and parameters: {'classifier': 'SVC', 'svc_c': 28.257526901058768, 'gamma': 'auto', 'kernel': 'rbf'}. Best is trial 65 with value: 0.9866666666666667.
[I 2024-08-19 19:20:25,651] Trial 716 finished with value: 0.9866666666666667 and parameters: {'classifier': 'NeuralNetwork', 'nn_alpha': 0.00018582093875676233, 'hidden_layer_sizes': 256, 'activation': 'tanh', 'solver': 'sgd'}. Best is trial 65 with value: 0.9866666666666667.
[I 2024-08-19 19:20:26,026] Trial 717 finished with value: 0.96 and parameters: {'classifier': 'XGBoost', 'xgb_eta': 0.013538104224206154, 'xgb_max_depth': 9, 'xgb_min_child_weight': 3.2586123233645195e-05, 'xgb_subsample': 0.6057578783052031, 'xgb_colsample_bytree': 0.6514144846978145}. Best is trial 65 with value: 0.9866666666666667.
[I 2024-08-19 19:20:26,101] Trial 718 finished with value: 0.64 and parameters: {'classifier': 'DecisionTree', 'dt_max_depth': 1, 'dt_min_samples_split': 6, 'dt_min_samples_leaf': 2, 'dt_max_features': 'sqrt'}. Best is trial 65 with value: 0.9866666666666667.
[I 2024-08-19 19:20:27,146] Trial 719 finished with value: 0.96 and parameters: {'classifier': 'NeuralNetwork', 'nn_alpha': 0.00022419123878901327, 'hidden_layer_sizes': 256, 'activation': 'tanh', 'solver': 'lbfgs'}. Best is trial 65 with value: 0.9866666666666667.
[I 2024-08-19 19:20:29,551] Trial 720 finished with value: 0.9866666666666667 and parameters: {'classifier': 'NeuralNetwork', 'nn_alpha': 0.0003889469923140829, 'hidden_layer_sizes': 256, 'activation': 'tanh', 'solver': 'sgd'}. Best is trial 65 with value: 0.9866666666666667.
[I 2024-08-19 19:20:31,037] Trial 721 finished with value: 0.98 and parameters: {'classifier': 'NeuralNetwork', 'nn_alpha': 0.0001775752697157506, 'hidden_layer_sizes': 64, 'activation': 'tanh', 'solver': 'sgd'}. Best is trial 65 with value: 0.9866666666666667.
[I 2024-08-19 19:20:35,252] Trial 722 finished with value: 0.9866666666666667 and parameters: {'classifier': 'NeuralNetwork', 'nn_alpha': 0.00012310869500287814, 'hidden_layer_sizes': 512, 'activation': 'tanh', 'solver': 'sgd'}. Best is trial 65 with value: 0.9866666666666667.
[I 2024-08-19 19:20:36,934] Trial 723 finished with value: 0.9733333333333333 and parameters: {'classifier': 'NeuralNetwork', 'nn_alpha': 0.00026141658611937064, 'hidden_layer_sizes': 256, 'activation': 'relu', 'solver': 'sgd'}. Best is trial 65 with value: 0.9866666666666667.
