[I 2024-06-30 14:16:59,274] A new study created in memory with name: no-name-7b997d11-fd5a-4b9e-9ad2-99f2d424be46
[I 2024-06-30 14:16:59,952] Trial 0 finished with value: 0.96 and parameters: {'classifier': 'XGBoost', 'xgb_eta': 0.014722098744347215, 'xgb_max_depth': 3, 'xgb_min_child_weight': 0.0004900594279804424, 'xgb_subsample': 0.7964775915913105, 'xgb_colsample_bytree': 0.798804164723455}. Best is trial 0 with value: 0.96.
[I 2024-06-30 14:17:00,676] Trial 1 finished with value: 0.94 and parameters: {'classifier': 'RandomForest', 'rf_max_depth': 13, 'rf_min_samples_split': 12, 'rf_min_samples_leaf': 6, 'rf_max_features': 'sqrt'}. Best is trial 0 with value: 0.96.
[I 2024-06-30 14:17:00,697] Trial 2 finished with value: 0.32 and parameters: {'classifier': 'SVC', 'svc_c': 2.453282310506084e-08, 'gamma': 'auto', 'kernel': 'linear'}. Best is trial 0 with value: 0.96.
[I 2024-06-30 14:17:01,048] Trial 3 finished with value: 0.3333333333333333 and parameters: {'classifier': 'XGBoost', 'xgb_eta': 0.16181007067521508, 'xgb_max_depth': 3, 'xgb_min_child_weight': 23.019904458792034, 'xgb_subsample': 0.5856700902200782, 'xgb_colsample_bytree': 0.605678202323146}. Best is trial 0 with value: 0.96.
[I 2024-06-30 14:17:01,487] Trial 4 finished with value: 0.9666666666666667 and parameters: {'classifier': 'XGBoost', 'xgb_eta': 0.03152839553175717, 'xgb_max_depth': 5, 'xgb_min_child_weight': 1.4989830603814014, 'xgb_subsample': 0.657950485583094, 'xgb_colsample_bytree': 0.5166608039420206}. Best is trial 4 with value: 0.9666666666666667.
[I 2024-06-30 14:17:04,608] Trial 5 finished with value: 0.98 and parameters: {'classifier': 'NeuralNetwork', 'nn_alpha': 0.00972755385734405, 'hidden_layer_sizes': 512, 'activation': 'tanh', 'solver': 'adam'}. Best is trial 5 with value: 0.98.
[I 2024-06-30 14:17:10,719] Trial 6 finished with value: 0.98 and parameters: {'classifier': 'NeuralNetwork', 'nn_alpha': 0.0014825516856259563, 'hidden_layer_sizes': 512, 'activation': 'relu', 'solver': 'sgd'}. Best is trial 5 with value: 0.98.
[I 2024-06-30 14:17:16,171] Trial 7 finished with value: 0.98 and parameters: {'classifier': 'NeuralNetwork', 'nn_alpha': 1.9665520417213666e-05, 'hidden_layer_sizes': 256, 'activation': 'logistic', 'solver': 'adam'}. Best is trial 5 with value: 0.98.
[I 2024-06-30 14:17:16,886] Trial 8 finished with value: 0.9533333333333333 and parameters: {'classifier': 'RandomForest', 'rf_max_depth': 18, 'rf_min_samples_split': 5, 'rf_min_samples_leaf': 4, 'rf_max_features': 'log2'}. Best is trial 5 with value: 0.98.
[I 2024-06-30 14:17:20,818] Trial 9 finished with value: 0.98 and parameters: {'classifier': 'NeuralNetwork', 'nn_alpha': 0.017904609144539375, 'hidden_layer_sizes': 128, 'activation': 'tanh', 'solver': 'sgd'}. Best is trial 5 with value: 0.98.
Traceback (most recent call last):
  File "F:\PycharmProjects\pythonProject\机器学习\好用的工具\optuna\分类比拼.py", line 73, in <module>
    wandb.plot.bar({"accuracy": accuracy}, {"accuracy": accuracy})
                                ^^^^^^^^
NameError: name 'accuracy' is not defined
FrozenTrial(number=5, state=1, values=[0.98], datetime_start=datetime.datetime(2024, 6, 30, 14, 17, 1, 487212), datetime_complete=datetime.datetime(2024, 6, 30, 14, 17, 4, 607327), params={'classifier': 'NeuralNetwork', 'nn_alpha': 0.00972755385734405, 'hidden_layer_sizes': 512, 'activation': 'tanh', 'solver': 'adam'}, user_attrs={}, system_attrs={}, intermediate_values={}, distributions={'classifier': CategoricalDistribution(choices=('SVC', 'RandomForest', 'NeuralNetwork', 'XGBoost')), 'nn_alpha': FloatDistribution(high=0.1, log=True, low=1e-05, step=None), 'hidden_layer_sizes': CategoricalDistribution(choices=(64, 128, 256, 512)), 'activation': CategoricalDistribution(choices=('relu', 'tanh', 'logistic')), 'solver': CategoricalDistribution(choices=('sgd', 'adam', 'lbfgs'))}, trial_id=5, value=None)