[I 2024-06-27 16:47:10,735] A new study created in memory with name: no-name-4b9a8ff0-bdc6-4385-9122-3b981210d7f1
[I 2024-06-27 16:47:12,894] Trial 0 finished with value: 0.3333333333333333 and parameters: {'classifier': 'XGBoost', 'xgb_eta': 0.14287647183287655, 'xgb_max_depth': 7, 'xgb_min_child_weight': 67.19984774187948, 'xgb_subsample': 0.9914099596028123, 'xgb_colsample_bytree': 0.823928609248828}. Best is trial 0 with value: 0.3333333333333333.
[I 2024-06-27 16:47:14,228] Trial 1 finished with value: 0.9533333333333333 and parameters: {'classifier': 'XGBoost', 'xgb_eta': 0.07089123070619571, 'xgb_max_depth': 6, 'xgb_min_child_weight': 0.42054019529683984, 'xgb_subsample': 0.9831265860445159, 'xgb_colsample_bytree': 0.7642008098249287}. Best is trial 1 with value: 0.9533333333333333.
[I 2024-06-27 16:47:14,998] Trial 2 finished with value: 0.32 and parameters: {'classifier': 'SVC', 'svc_c': 1.2556702644956906e-10, 'gamma': 'scale', 'kernel': 'linear'}. Best is trial 1 with value: 0.9533333333333333.
[I 2024-06-27 16:47:15,934] Trial 3 finished with value: 0.9533333333333333 and parameters: {'classifier': 'RandomForest', 'rf_max_depth': 17, 'rf_min_samples_split': 7, 'rf_min_samples_leaf': 8, 'rf_max_features': 'log2'}. Best is trial 1 with value: 0.9533333333333333.
[I 2024-06-27 16:47:17,328] Trial 4 finished with value: 0.9666666666666667 and parameters: {'classifier': 'NeuralNetwork', 'nn_alpha': 0.0746862461569861, 'hidden_layer_sizes': 128, 'activation': 'tanh', 'solver': 'lbfgs'}. Best is trial 4 with value: 0.9666666666666667.
[I 2024-06-27 16:47:18,202] Trial 5 finished with value: 0.9533333333333333 and parameters: {'classifier': 'RandomForest', 'rf_max_depth': 5, 'rf_min_samples_split': 5, 'rf_min_samples_leaf': 5, 'rf_max_features': 'sqrt'}. Best is trial 4 with value: 0.9666666666666667.
[I 2024-06-27 16:47:18,426] Trial 6 finished with value: 0.9533333333333333 and parameters: {'classifier': 'RandomForest', 'rf_max_depth': 15, 'rf_min_samples_split': 15, 'rf_min_samples_leaf': 1, 'rf_max_features': 'sqrt'}. Best is trial 4 with value: 0.9666666666666667.
[I 2024-06-27 16:47:18,991] Trial 7 finished with value: 0.9666666666666667 and parameters: {'classifier': 'XGBoost', 'xgb_eta': 0.08988373986935932, 'xgb_max_depth': 7, 'xgb_min_child_weight': 0.00214376547976521, 'xgb_subsample': 0.5167885722197088, 'xgb_colsample_bytree': 0.6276227738376804}. Best is trial 4 with value: 0.9666666666666667.
[I 2024-06-27 16:47:19,628] Trial 8 finished with value: 0.9533333333333333 and parameters: {'classifier': 'XGBoost', 'xgb_eta': 0.11235668897030864, 'xgb_max_depth': 3, 'xgb_min_child_weight': 0.0015106225656329627, 'xgb_subsample': 0.8120810376988385, 'xgb_colsample_bytree': 0.8172166777623519}. Best is trial 4 with value: 0.9666666666666667.
[I 2024-06-27 16:47:19,872] Trial 9 finished with value: 0.9466666666666667 and parameters: {'classifier': 'RandomForest', 'rf_max_depth': 23, 'rf_min_samples_split': 13, 'rf_min_samples_leaf': 5, 'rf_max_features': 'sqrt'}. Best is trial 4 with value: 0.9666666666666667.
Traceback (most recent call last):
  File "F:\PycharmProjects\pythonProject\机器学习\好用的工具\optuna\分类比拼.py", line 137, in <module>
    wandb.plot.bar({"accuracy": accuracy})
                                ^^^^^^^^
NameError: name 'accuracy' is not defined
FrozenTrial(number=4, state=1, values=[0.9666666666666667], datetime_start=datetime.datetime(2024, 6, 27, 16, 47, 15, 934310), datetime_complete=datetime.datetime(2024, 6, 27, 16, 47, 17, 327797), params={'classifier': 'NeuralNetwork', 'nn_alpha': 0.0746862461569861, 'hidden_layer_sizes': 128, 'activation': 'tanh', 'solver': 'lbfgs'}, user_attrs={}, system_attrs={}, intermediate_values={}, distributions={'classifier': CategoricalDistribution(choices=('SVC', 'RandomForest', 'NeuralNetwork', 'XGBoost')), 'nn_alpha': FloatDistribution(high=0.1, log=True, low=1e-05, step=None), 'hidden_layer_sizes': CategoricalDistribution(choices=(64, 128, 256, 512)), 'activation': CategoricalDistribution(choices=('relu', 'tanh', 'logistic')), 'solver': CategoricalDistribution(choices=('adam', 'lbfgs', 'sgd'))}, trial_id=4, value=None)