[I 2024-08-18 23:01:33,232] Trial 80 finished with value: 0.3333333333333333 and parameters: {'classifier': 'XGBoost', 'xgb_eta': 0.07496557578322749, 'xgb_max_depth': 6, 'xgb_min_child_weight': 88.0189896290361, 'xgb_subsample': 0.7202038002126893, 'xgb_colsample_bytree': 0.8189079855305523}. Best is trial 14 with value: 0.9866666666666667.
[I 2024-08-18 23:01:35,906] Trial 81 finished with value: 0.9866666666666667 and parameters: {'classifier': 'NeuralNetwork', 'nn_alpha': 0.027400019474803944, 'hidden_layer_sizes': 256, 'activation': 'tanh', 'solver': 'sgd'}. Best is trial 14 with value: 0.9866666666666667.
[I 2024-08-18 23:01:38,376] Trial 82 finished with value: 0.9866666666666667 and parameters: {'classifier': 'NeuralNetwork', 'nn_alpha': 0.06786077476045715, 'hidden_layer_sizes': 256, 'activation': 'tanh', 'solver': 'sgd'}. Best is trial 14 with value: 0.9866666666666667.
[I 2024-08-18 23:01:42,261] Trial 83 finished with value: 0.98 and parameters: {'classifier': 'NeuralNetwork', 'nn_alpha': 0.042430171266222, 'hidden_layer_sizes': 256, 'activation': 'tanh', 'solver': 'sgd'}. Best is trial 14 with value: 0.9866666666666667.
[I 2024-08-18 23:01:45,627] Trial 84 finished with value: 0.98 and parameters: {'classifier': 'NeuralNetwork', 'nn_alpha': 0.023215371568403566, 'hidden_layer_sizes': 256, 'activation': 'logistic', 'solver': 'adam'}. Best is trial 14 with value: 0.9866666666666667.
[I 2024-08-18 23:01:45,654] Trial 85 finished with value: 0.9533333333333333 and parameters: {'classifier': 'DecisionTree', 'dt_max_depth': 11, 'dt_min_samples_split': 8, 'dt_min_samples_leaf': 6, 'dt_max_features': 'sqrt'}. Best is trial 14 with value: 0.9866666666666667.
[I 2024-08-18 23:01:48,819] Trial 86 finished with value: 0.98 and parameters: {'classifier': 'NeuralNetwork', 'nn_alpha': 0.01353562207461958, 'hidden_layer_sizes': 256, 'activation': 'logistic', 'solver': 'adam'}. Best is trial 14 with value: 0.9866666666666667.
[I 2024-08-18 23:01:50,781] Trial 87 finished with value: 0.9733333333333333 and parameters: {'classifier': 'NeuralNetwork', 'nn_alpha': 0.03437309864349407, 'hidden_layer_sizes': 64, 'activation': 'tanh', 'solver': 'sgd'}. Best is trial 14 with value: 0.9866666666666667.
[I 2024-08-18 23:01:51,321] Trial 88 finished with value: 0.9466666666666667 and parameters: {'classifier': 'RandomForest', 'rf_max_depth': 3, 'rf_min_samples_split': 15, 'rf_min_samples_leaf': 8, 'rf_max_features': 'sqrt'}. Best is trial 14 with value: 0.9866666666666667.
[I 2024-08-18 23:01:54,657] Trial 89 finished with value: 0.9866666666666667 and parameters: {'classifier': 'NeuralNetwork', 'nn_alpha': 0.07724661109113164, 'hidden_layer_sizes': 256, 'activation': 'logistic', 'solver': 'adam'}. Best is trial 14 with value: 0.9866666666666667.
[I 2024-08-18 23:01:54,681] Trial 90 finished with value: 0.32 and parameters: {'classifier': 'SVC', 'svc_c': 2.305027282398838e-06, 'gamma': 'scale', 'kernel': 'linear'}. Best is trial 14 with value: 0.9866666666666667.
[I 2024-08-18 23:01:57,468] Trial 91 finished with value: 0.98 and parameters: {'classifier': 'NeuralNetwork', 'nn_alpha': 0.0071999635077080555, 'hidden_layer_sizes': 256, 'activation': 'tanh', 'solver': 'sgd'}. Best is trial 14 with value: 0.9866666666666667.
[I 2024-08-18 23:02:00,493] Trial 92 finished with value: 0.98 and parameters: {'classifier': 'NeuralNetwork', 'nn_alpha': 0.005639736616291194, 'hidden_layer_sizes': 256, 'activation': 'tanh', 'solver': 'sgd'}. Best is trial 14 with value: 0.9866666666666667.
[I 2024-08-18 23:02:03,314] Trial 93 finished with value: 0.9866666666666667 and parameters: {'classifier': 'NeuralNetwork', 'nn_alpha': 0.020567091014636045, 'hidden_layer_sizes': 256, 'activation': 'tanh', 'solver': 'sgd'}. Best is trial 14 with value: 0.9866666666666667.
[I 2024-08-18 23:02:07,908] Trial 94 finished with value: 0.98 and parameters: {'classifier': 'NeuralNetwork', 'nn_alpha': 0.0027102426299595197, 'hidden_layer_sizes': 512, 'activation': 'logistic', 'solver': 'adam'}. Best is trial 14 with value: 0.9866666666666667.
[I 2024-08-18 23:02:10,540] Trial 95 finished with value: 0.98 and parameters: {'classifier': 'NeuralNetwork', 'nn_alpha': 0.04438026436126745, 'hidden_layer_sizes': 256, 'activation': 'logistic', 'solver': 'adam'}. Best is trial 14 with value: 0.9866666666666667.
[I 2024-08-18 23:02:11,810] Trial 96 finished with value: 0.9866666666666667 and parameters: {'classifier': 'NeuralNetwork', 'nn_alpha': 0.015330861398663024, 'hidden_layer_sizes': 64, 'activation': 'tanh', 'solver': 'sgd'}. Best is trial 14 with value: 0.9866666666666667.
[I 2024-08-18 23:02:12,378] Trial 97 finished with value: 0.98 and parameters: {'classifier': 'NeuralNetwork', 'nn_alpha': 0.00857919577448386, 'hidden_layer_sizes': 256, 'activation': 'relu', 'solver': 'adam'}. Best is trial 14 with value: 0.9866666666666667.
[I 2024-08-18 23:02:14,097] Trial 98 finished with value: 0.98 and parameters: {'classifier': 'NeuralNetwork', 'nn_alpha': 0.07831658922302387, 'hidden_layer_sizes': 256, 'activation': 'logistic', 'solver': 'lbfgs'}. Best is trial 14 with value: 0.9866666666666667.
[I 2024-08-18 23:02:14,809] Trial 99 finished with value: 0.96 and parameters: {'classifier': 'XGBoost', 'xgb_eta': 0.02744495007058731, 'xgb_max_depth': 4, 'xgb_min_child_weight': 1.2993741724931967e-05, 'xgb_subsample': 0.8619054158025082, 'xgb_colsample_bytree': 0.6361269901514254}. Best is trial 14 with value: 0.9866666666666667.
FrozenTrial(number=14, state=1, values=[0.9866666666666667], datetime_start=datetime.datetime(2024, 8, 18, 22, 59, 40, 148656), datetime_complete=datetime.datetime(2024, 8, 18, 22, 59, 42, 899162), params={'classifier': 'NeuralNetwork', 'nn_alpha': 0.08670209786195497, 'hidden_layer_sizes': 256, 'activation': 'logistic', 'solver': 'adam'}, user_attrs={}, system_attrs={}, intermediate_values={}, distributions={'classifier': CategoricalDistribution(choices=('SVC', 'RandomForest', 'NeuralNetwork', 'XGBoost', 'DecisionTree')), 'nn_alpha': FloatDistribution(high=0.1, log=True, low=1e-05, step=None), 'hidden_layer_sizes': CategoricalDistribution(choices=(64, 128, 256, 512)), 'activation': CategoricalDistribution(choices=('relu', 'tanh', 'logistic')), 'solver': CategoricalDistribution(choices=('sgd', 'adam', 'lbfgs'))}, trial_id=14, value=None)