[I 2024-08-18 22:59:34,655] A new study created in memory with name: no-name-5dee26ad-f0c0-4e11-b6cf-5f446ceb384b
[I 2024-08-18 22:59:34,964] Trial 0 finished with value: 0.9666666666666667 and parameters: {'classifier': 'NeuralNetwork', 'nn_alpha': 0.0017679992471319205, 'hidden_layer_sizes': 128, 'activation': 'relu', 'solver': 'lbfgs'}. Best is trial 0 with value: 0.9666666666666667.
[I 2024-08-18 22:59:35,300] Trial 1 finished with value: 0.96 and parameters: {'classifier': 'SVC', 'svc_c': 7042297992.670851, 'gamma': 'auto', 'kernel': 'linear'}. Best is trial 0 with value: 0.9666666666666667.
[I 2024-08-18 22:59:35,636] Trial 2 finished with value: 0.9466666666666667 and parameters: {'classifier': 'RandomForest', 'rf_max_depth': 30, 'rf_min_samples_split': 13, 'rf_min_samples_leaf': 9, 'rf_max_features': 'sqrt'}. Best is trial 0 with value: 0.9666666666666667.
[I 2024-08-18 22:59:35,897] Trial 3 finished with value: 0.96 and parameters: {'classifier': 'RandomForest', 'rf_max_depth': 25, 'rf_min_samples_split': 20, 'rf_min_samples_leaf': 1, 'rf_max_features': 'log2'}. Best is trial 0 with value: 0.9666666666666667.
[I 2024-08-18 22:59:36,180] Trial 4 finished with value: 0.96 and parameters: {'classifier': 'SVC', 'svc_c': 9348840996.885998, 'gamma': 'auto', 'kernel': 'linear'}. Best is trial 0 with value: 0.9666666666666667.
[I 2024-08-18 22:59:36,187] Trial 5 finished with value: 0.32 and parameters: {'classifier': 'SVC', 'svc_c': 8.14421049961369e-09, 'gamma': 'auto', 'kernel': 'linear'}. Best is trial 0 with value: 0.9666666666666667.
[I 2024-08-18 22:59:36,195] Trial 6 finished with value: 0.96 and parameters: {'classifier': 'SVC', 'svc_c': 17602.848668610404, 'gamma': 'auto', 'kernel': 'rbf'}. Best is trial 0 with value: 0.9666666666666667.
[I 2024-08-18 22:59:36,656] Trial 7 finished with value: 0.96 and parameters: {'classifier': 'XGBoost', 'xgb_eta': 0.06295595717783634, 'xgb_max_depth': 5, 'xgb_min_child_weight': 2.1093244012923256, 'xgb_subsample': 0.5963537283061816, 'xgb_colsample_bytree': 0.9996318699170494}. Best is trial 0 with value: 0.9666666666666667.
[I 2024-08-18 22:59:36,766] Trial 8 finished with value: 0.9466666666666667 and parameters: {'classifier': 'SVC', 'svc_c': 3205924373.9094696, 'gamma': 'auto', 'kernel': 'poly'}. Best is trial 0 with value: 0.9666666666666667.
[I 2024-08-18 22:59:36,774] Trial 9 finished with value: 0.6533333333333333 and parameters: {'classifier': 'DecisionTree', 'dt_max_depth': 1, 'dt_min_samples_split': 3, 'dt_min_samples_leaf': 9, 'dt_max_features': 'log2'}. Best is trial 0 with value: 0.9666666666666667.
[I 2024-08-18 22:59:37,114] Trial 10 finished with value: 0.9733333333333333 and parameters: {'classifier': 'NeuralNetwork', 'nn_alpha': 0.0017968579065801246, 'hidden_layer_sizes': 128, 'activation': 'relu', 'solver': 'lbfgs'}. Best is trial 10 with value: 0.9733333333333333.
[I 2024-08-18 22:59:37,302] Trial 11 finished with value: 0.9666666666666667 and parameters: {'classifier': 'NeuralNetwork', 'nn_alpha': 0.002113494699208687, 'hidden_layer_sizes': 128, 'activation': 'relu', 'solver': 'lbfgs'}. Best is trial 10 with value: 0.9733333333333333.
[I 2024-08-18 22:59:37,629] Trial 12 finished with value: 0.9733333333333333 and parameters: {'classifier': 'NeuralNetwork', 'nn_alpha': 0.002627756299556308, 'hidden_layer_sizes': 128, 'activation': 'relu', 'solver': 'lbfgs'}. Best is trial 10 with value: 0.9733333333333333.
[I 2024-08-18 22:59:40,147] Trial 13 finished with value: 0.98 and parameters: {'classifier': 'NeuralNetwork', 'nn_alpha': 0.0519274177602422, 'hidden_layer_sizes': 256, 'activation': 'logistic', 'solver': 'adam'}. Best is trial 13 with value: 0.98.
[I 2024-08-18 22:59:42,899] Trial 14 finished with value: 0.9866666666666667 and parameters: {'classifier': 'NeuralNetwork', 'nn_alpha': 0.08670209786195497, 'hidden_layer_sizes': 256, 'activation': 'logistic', 'solver': 'adam'}. Best is trial 14 with value: 0.9866666666666667.
[I 2024-08-18 22:59:45,268] Trial 15 finished with value: 0.9866666666666667 and parameters: {'classifier': 'NeuralNetwork', 'nn_alpha': 0.07540909559512594, 'hidden_layer_sizes': 256, 'activation': 'logistic', 'solver': 'adam'}. Best is trial 14 with value: 0.9866666666666667.
[I 2024-08-18 22:59:45,288] Trial 16 finished with value: 0.9333333333333332 and parameters: {'classifier': 'DecisionTree', 'dt_max_depth': 29, 'dt_min_samples_split': 20, 'dt_min_samples_leaf': 1, 'dt_max_features': 'sqrt'}. Best is trial 14 with value: 0.9866666666666667.
[I 2024-08-18 22:59:45,567] Trial 17 finished with value: 0.9666666666666667 and parameters: {'classifier': 'XGBoost', 'xgb_eta': 0.01160759860969099, 'xgb_max_depth': 9, 'xgb_min_child_weight': 1.875522313796313e-05, 'xgb_subsample': 0.9881562236655148, 'xgb_colsample_bytree': 0.5050212193129073}. Best is trial 14 with value: 0.9866666666666667.
[I 2024-08-18 22:59:47,957] Trial 18 finished with value: 0.9866666666666667 and parameters: {'classifier': 'NeuralNetwork', 'nn_alpha': 0.08806569067232269, 'hidden_layer_sizes': 256, 'activation': 'logistic', 'solver': 'adam'}. Best is trial 14 with value: 0.9866666666666667.
[I 2024-08-18 22:59:52,296] Trial 19 finished with value: 0.98 and parameters: {'classifier': 'NeuralNetwork', 'nn_alpha': 1.633457914598958e-05, 'hidden_layer_sizes': 512, 'activation': 'logistic', 'solver': 'adam'}. Best is trial 14 with value: 0.9866666666666667.
[I 2024-08-18 22:59:54,685] Trial 20 finished with value: 0.9866666666666667 and parameters: {'classifier': 'NeuralNetwork', 'nn_alpha': 0.02144505373601665, 'hidden_layer_sizes': 256, 'activation': 'tanh', 'solver': 'sgd'}. Best is trial 14 with value: 0.9866666666666667.
[I 2024-08-18 22:59:57,461] Trial 21 finished with value: 0.9866666666666667 and parameters: {'classifier': 'NeuralNetwork', 'nn_alpha': 0.07978440699345667, 'hidden_layer_sizes': 256, 'activation': 'logistic', 'solver': 'adam'}. Best is trial 14 with value: 0.9866666666666667.
[I 2024-08-18 22:59:59,046] Trial 22 finished with value: 0.9866666666666667 and parameters: {'classifier': 'NeuralNetwork', 'nn_alpha': 0.019543761138458734, 'hidden_layer_sizes': 64, 'activation': 'logistic', 'solver': 'adam'}. Best is trial 14 with value: 0.9866666666666667.
[I 2024-08-18 23:00:01,554] Trial 23 finished with value: 0.98 and parameters: {'classifier': 'NeuralNetwork', 'nn_alpha': 0.08771237414183157, 'hidden_layer_sizes': 256, 'activation': 'logistic', 'solver': 'adam'}. Best is trial 14 with value: 0.9866666666666667.
[I 2024-08-18 23:00:01,807] Trial 24 finished with value: 0.96 and parameters: {'classifier': 'XGBoost', 'xgb_eta': 0.2937280016671778, 'xgb_max_depth': 3, 'xgb_min_child_weight': 0.0005370868207697575, 'xgb_subsample': 0.890700444837337, 'xgb_colsample_bytree': 0.7591501953999723}. Best is trial 14 with value: 0.9866666666666667.
[I 2024-08-18 23:00:02,166] Trial 25 finished with value: 0.9533333333333333 and parameters: {'classifier': 'RandomForest', 'rf_max_depth': 2, 'rf_min_samples_split': 2, 'rf_min_samples_leaf': 3, 'rf_max_features': 'log2'}. Best is trial 14 with value: 0.9866666666666667.
[I 2024-08-18 23:00:05,041] Trial 26 finished with value: 0.98 and parameters: {'classifier': 'NeuralNetwork', 'nn_alpha': 0.012205593269360859, 'hidden_layer_sizes': 256, 'activation': 'logistic', 'solver': 'adam'}. Best is trial 14 with value: 0.9866666666666667.
[I 2024-08-18 23:00:05,064] Trial 27 finished with value: 0.9533333333333333 and parameters: {'classifier': 'DecisionTree', 'dt_max_depth': 12, 'dt_min_samples_split': 13, 'dt_min_samples_leaf': 3, 'dt_max_features': 'log2'}. Best is trial 14 with value: 0.9866666666666667.
[I 2024-08-18 23:00:07,711] Trial 28 finished with value: 0.98 and parameters: {'classifier': 'NeuralNetwork', 'nn_alpha': 0.00012086601216548637, 'hidden_layer_sizes': 256, 'activation': 'logistic', 'solver': 'adam'}. Best is trial 14 with value: 0.9866666666666667.
[I 2024-08-18 23:00:10,082] Trial 29 finished with value: 0.9866666666666667 and parameters: {'classifier': 'NeuralNetwork', 'nn_alpha': 0.009529930822202434, 'hidden_layer_sizes': 256, 'activation': 'tanh', 'solver': 'sgd'}. Best is trial 14 with value: 0.9866666666666667.
[I 2024-08-18 23:00:14,179] Trial 30 finished with value: 0.98 and parameters: {'classifier': 'NeuralNetwork', 'nn_alpha': 0.0349023435404548, 'hidden_layer_sizes': 512, 'activation': 'logistic', 'solver': 'adam'}. Best is trial 14 with value: 0.9866666666666667.
[I 2024-08-18 23:00:16,414] Trial 31 finished with value: 0.9866666666666667 and parameters: {'classifier': 'NeuralNetwork', 'nn_alpha': 0.08093929310015767, 'hidden_layer_sizes': 256, 'activation': 'tanh', 'solver': 'sgd'}. Best is trial 14 with value: 0.9866666666666667.
[I 2024-08-18 23:00:18,782] Trial 32 finished with value: 0.9866666666666667 and parameters: {'classifier': 'NeuralNetwork', 'nn_alpha': 0.026843266336491464, 'hidden_layer_sizes': 256, 'activation': 'tanh', 'solver': 'sgd'}. Best is trial 14 with value: 0.9866666666666667.
[I 2024-08-18 23:00:21,097] Trial 33 finished with value: 0.9866666666666667 and parameters: {'classifier': 'NeuralNetwork', 'nn_alpha': 0.007297490156123271, 'hidden_layer_sizes': 256, 'activation': 'tanh', 'solver': 'sgd'}. Best is trial 14 with value: 0.9866666666666667.
[I 2024-08-18 23:00:21,414] Trial 34 finished with value: 0.9533333333333333 and parameters: {'classifier': 'RandomForest', 'rf_max_depth': 2, 'rf_min_samples_split': 2, 'rf_min_samples_leaf': 10, 'rf_max_features': 'sqrt'}. Best is trial 14 with value: 0.9866666666666667.
[I 2024-08-18 23:00:22,993] Trial 35 finished with value: 0.98 and parameters: {'classifier': 'NeuralNetwork', 'nn_alpha': 0.0324804957993407, 'hidden_layer_sizes': 64, 'activation': 'logistic', 'solver': 'adam'}. Best is trial 14 with value: 0.9866666666666667.
[I 2024-08-18 23:00:25,361] Trial 36 finished with value: 0.9866666666666667 and parameters: {'classifier': 'NeuralNetwork', 'nn_alpha': 0.0003845101774654426, 'hidden_layer_sizes': 256, 'activation': 'tanh', 'solver': 'sgd'}. Best is trial 14 with value: 0.9866666666666667.
[I 2024-08-18 23:00:25,693] Trial 37 finished with value: 0.94 and parameters: {'classifier': 'RandomForest', 'rf_max_depth': 8, 'rf_min_samples_split': 10, 'rf_min_samples_leaf': 6, 'rf_max_features': 'log2'}. Best is trial 14 with value: 0.9866666666666667.
[I 2024-08-18 23:00:25,818] Trial 38 finished with value: 0.3333333333333333 and parameters: {'classifier': 'XGBoost', 'xgb_eta': 0.012609745831544084, 'xgb_max_depth': 9, 'xgb_min_child_weight': 49.04421543072858, 'xgb_subsample': 0.5254020775189145, 'xgb_colsample_bytree': 0.5211099474852043}. Best is trial 14 with value: 0.9866666666666667.
[I 2024-08-18 23:00:25,835] Trial 39 finished with value: 0.32 and parameters: {'classifier': 'SVC', 'svc_c': 4.180362013311913e-10, 'gamma': 'scale', 'kernel': 'poly'}. Best is trial 14 with value: 0.9866666666666667.
[I 2024-08-18 23:00:25,862] Trial 40 finished with value: 0.66 and parameters: {'classifier': 'DecisionTree', 'dt_max_depth': 1, 'dt_min_samples_split': 2, 'dt_min_samples_leaf': 10, 'dt_max_features': 'sqrt'}. Best is trial 14 with value: 0.9866666666666667.
[I 2024-08-18 23:00:28,280] Trial 41 finished with value: 0.9866666666666667 and parameters: {'classifier': 'NeuralNetwork', 'nn_alpha': 0.09522853146136336, 'hidden_layer_sizes': 256, 'activation': 'logistic', 'solver': 'adam'}. Best is trial 14 with value: 0.9866666666666667.
[I 2024-08-18 23:00:30,684] Trial 42 finished with value: 0.9866666666666667 and parameters: {'classifier': 'NeuralNetwork', 'nn_alpha': 0.09847303300621306, 'hidden_layer_sizes': 256, 'activation': 'logistic', 'solver': 'adam'}. Best is trial 14 with value: 0.9866666666666667.
[I 2024-08-18 23:00:33,067] Trial 43 finished with value: 0.98 and parameters: {'classifier': 'NeuralNetwork', 'nn_alpha': 0.03775623586369123, 'hidden_layer_sizes': 256, 'activation': 'logistic', 'solver': 'adam'}. Best is trial 14 with value: 0.9866666666666667.
[I 2024-08-18 23:00:35,549] Trial 44 finished with value: 0.98 and parameters: {'classifier': 'NeuralNetwork', 'nn_alpha': 0.04292023498943521, 'hidden_layer_sizes': 256, 'activation': 'logistic', 'solver': 'adam'}. Best is trial 14 with value: 0.9866666666666667.
[I 2024-08-18 23:00:35,561] Trial 45 finished with value: 0.32 and parameters: {'classifier': 'SVC', 'svc_c': 0.006127217360837639, 'gamma': 'scale', 'kernel': 'rbf'}. Best is trial 14 with value: 0.9866666666666667.
[I 2024-08-18 23:00:38,211] Trial 46 finished with value: 0.98 and parameters: {'classifier': 'NeuralNetwork', 'nn_alpha': 0.017283559006809404, 'hidden_layer_sizes': 256, 'activation': 'logistic', 'solver': 'adam'}. Best is trial 14 with value: 0.9866666666666667.
[I 2024-08-18 23:00:40,746] Trial 47 finished with value: 0.9866666666666667 and parameters: {'classifier': 'NeuralNetwork', 'nn_alpha': 0.05617927215156095, 'hidden_layer_sizes': 256, 'activation': 'logistic', 'solver': 'adam'}. Best is trial 14 with value: 0.9866666666666667.
[I 2024-08-18 23:00:43,092] Trial 48 finished with value: 0.98 and parameters: {'classifier': 'NeuralNetwork', 'nn_alpha': 0.005218164963993814, 'hidden_layer_sizes': 256, 'activation': 'tanh', 'solver': 'sgd'}. Best is trial 14 with value: 0.9866666666666667.
[I 2024-08-18 23:00:43,298] Trial 49 finished with value: 0.96 and parameters: {'classifier': 'XGBoost', 'xgb_eta': 0.25045971250326704, 'xgb_max_depth': 3, 'xgb_min_child_weight': 0.05941950593769385, 'xgb_subsample': 0.7314585239222795, 'xgb_colsample_bytree': 0.9730449781306113}. Best is trial 14 with value: 0.9866666666666667.
[I 2024-08-18 23:00:43,324] Trial 50 finished with value: 0.94 and parameters: {'classifier': 'DecisionTree', 'dt_max_depth': 4, 'dt_min_samples_split': 11, 'dt_min_samples_leaf': 5, 'dt_max_features': 'log2'}. Best is trial 14 with value: 0.9866666666666667.
[I 2024-08-18 23:00:44,822] Trial 51 finished with value: 0.9866666666666667 and parameters: {'classifier': 'NeuralNetwork', 'nn_alpha': 0.017988033032183045, 'hidden_layer_sizes': 64, 'activation': 'logistic', 'solver': 'adam'}. Best is trial 14 with value: 0.9866666666666667.
[I 2024-08-18 23:00:46,335] Trial 52 finished with value: 0.9733333333333333 and parameters: {'classifier': 'NeuralNetwork', 'nn_alpha': 0.021876178915099964, 'hidden_layer_sizes': 64, 'activation': 'logistic', 'solver': 'adam'}. Best is trial 14 with value: 0.9866666666666667.
[I 2024-08-18 23:00:47,843] Trial 53 finished with value: 0.98 and parameters: {'classifier': 'NeuralNetwork', 'nn_alpha': 0.05639562675122423, 'hidden_layer_sizes': 64, 'activation': 'logistic', 'solver': 'adam'}. Best is trial 14 with value: 0.9866666666666667.
[I 2024-08-18 23:00:49,342] Trial 54 finished with value: 0.9866666666666667 and parameters: {'classifier': 'NeuralNetwork', 'nn_alpha': 0.09845880787650597, 'hidden_layer_sizes': 64, 'activation': 'logistic', 'solver': 'adam'}. Best is trial 14 with value: 0.9866666666666667.
[I 2024-08-18 23:00:49,666] Trial 55 finished with value: 0.94 and parameters: {'classifier': 'RandomForest', 'rf_max_depth': 7, 'rf_min_samples_split': 20, 'rf_min_samples_leaf': 6, 'rf_max_features': 'sqrt'}. Best is trial 14 with value: 0.9866666666666667.
[I 2024-08-18 23:00:53,293] Trial 56 finished with value: 0.98 and parameters: {'classifier': 'NeuralNetwork', 'nn_alpha': 0.051506167711759275, 'hidden_layer_sizes': 512, 'activation': 'logistic', 'solver': 'adam'}. Best is trial 14 with value: 0.9866666666666667.
[I 2024-08-18 23:00:53,310] Trial 57 finished with value: 0.8733333333333334 and parameters: {'classifier': 'SVC', 'svc_c': 0.006420008314815306, 'gamma': 'scale', 'kernel': 'poly'}. Best is trial 14 with value: 0.9866666666666667.
[I 2024-08-18 23:00:53,791] Trial 58 finished with value: 0.98 and parameters: {'classifier': 'NeuralNetwork', 'nn_alpha': 0.01609237713260305, 'hidden_layer_sizes': 256, 'activation': 'relu', 'solver': 'lbfgs'}. Best is trial 14 with value: 0.9866666666666667.
[I 2024-08-18 23:00:55,444] Trial 59 finished with value: 0.9866666666666667 and parameters: {'classifier': 'NeuralNetwork', 'nn_alpha': 0.028202615524093415, 'hidden_layer_sizes': 64, 'activation': 'logistic', 'solver': 'adam'}. Best is trial 14 with value: 0.9866666666666667.
[I 2024-08-18 23:00:55,713] Trial 60 finished with value: 0.98 and parameters: {'classifier': 'NeuralNetwork', 'nn_alpha': 0.003815771660071306, 'hidden_layer_sizes': 128, 'activation': 'relu', 'solver': 'lbfgs'}. Best is trial 14 with value: 0.9866666666666667.
[I 2024-08-18 23:00:58,094] Trial 61 finished with value: 0.98 and parameters: {'classifier': 'NeuralNetwork', 'nn_alpha': 0.0006912606301525356, 'hidden_layer_sizes': 256, 'activation': 'tanh', 'solver': 'sgd'}. Best is trial 14 with value: 0.9866666666666667.
[I 2024-08-18 23:01:00,611] Trial 62 finished with value: 0.9866666666666667 and parameters: {'classifier': 'NeuralNetwork', 'nn_alpha': 0.008395965814072025, 'hidden_layer_sizes': 256, 'activation': 'tanh', 'solver': 'sgd'}. Best is trial 14 with value: 0.9866666666666667.
[I 2024-08-18 23:01:02,250] Trial 63 finished with value: 0.9866666666666667 and parameters: {'classifier': 'NeuralNetwork', 'nn_alpha': 0.011549805880887836, 'hidden_layer_sizes': 128, 'activation': 'tanh', 'solver': 'sgd'}. Best is trial 14 with value: 0.9866666666666667.
[I 2024-08-18 23:01:04,595] Trial 64 finished with value: 0.9866666666666667 and parameters: {'classifier': 'NeuralNetwork', 'nn_alpha': 0.05668948131542447, 'hidden_layer_sizes': 256, 'activation': 'tanh', 'solver': 'sgd'}. Best is trial 14 with value: 0.9866666666666667.
[I 2024-08-18 23:01:04,843] Trial 65 finished with value: 0.96 and parameters: {'classifier': 'XGBoost', 'xgb_eta': 0.045875616124109314, 'xgb_max_depth': 5, 'xgb_min_child_weight': 0.010235086348070363, 'xgb_subsample': 0.7512750435480523, 'xgb_colsample_bytree': 0.7219707010306747}. Best is trial 14 with value: 0.9866666666666667.
[I 2024-08-18 23:01:07,339] Trial 66 finished with value: 0.9866666666666667 and parameters: {'classifier': 'NeuralNetwork', 'nn_alpha': 0.06145056325506431, 'hidden_layer_sizes': 256, 'activation': 'logistic', 'solver': 'adam'}. Best is trial 14 with value: 0.9866666666666667.
[I 2024-08-18 23:01:07,363] Trial 67 finished with value: 0.9466666666666667 and parameters: {'classifier': 'DecisionTree', 'dt_max_depth': 4, 'dt_min_samples_split': 20, 'dt_min_samples_leaf': 7, 'dt_max_features': 'sqrt'}. Best is trial 14 with value: 0.9866666666666667.
[I 2024-08-18 23:01:07,717] Trial 68 finished with value: 0.98 and parameters: {'classifier': 'NeuralNetwork', 'nn_alpha': 0.025555640167632208, 'hidden_layer_sizes': 256, 'activation': 'relu', 'solver': 'lbfgs'}. Best is trial 14 with value: 0.9866666666666667.
[I 2024-08-18 23:01:08,059] Trial 69 finished with value: 0.9533333333333333 and parameters: {'classifier': 'RandomForest', 'rf_max_depth': 13, 'rf_min_samples_split': 10, 'rf_min_samples_leaf': 3, 'rf_max_features': 'log2'}. Best is trial 14 with value: 0.9866666666666667.
[I 2024-08-18 23:01:12,804] Trial 70 finished with value: 0.98 and parameters: {'classifier': 'NeuralNetwork', 'nn_alpha': 0.0014515586674648333, 'hidden_layer_sizes': 512, 'activation': 'logistic', 'solver': 'adam'}. Best is trial 14 with value: 0.9866666666666667.
[I 2024-08-18 23:01:15,118] Trial 71 finished with value: 0.9866666666666667 and parameters: {'classifier': 'NeuralNetwork', 'nn_alpha': 0.0721018955638187, 'hidden_layer_sizes': 256, 'activation': 'tanh', 'solver': 'sgd'}. Best is trial 14 with value: 0.9866666666666667.
[I 2024-08-18 23:01:17,619] Trial 72 finished with value: 0.9866666666666667 and parameters: {'classifier': 'NeuralNetwork', 'nn_alpha': 0.040958174257618406, 'hidden_layer_sizes': 256, 'activation': 'tanh', 'solver': 'sgd'}. Best is trial 14 with value: 0.9866666666666667.
[I 2024-08-18 23:01:20,004] Trial 73 finished with value: 0.9866666666666667 and parameters: {'classifier': 'NeuralNetwork', 'nn_alpha': 0.06977047299577022, 'hidden_layer_sizes': 256, 'activation': 'tanh', 'solver': 'sgd'}. Best is trial 14 with value: 0.9866666666666667.
[I 2024-08-18 23:01:22,655] Trial 74 finished with value: 0.9866666666666667 and parameters: {'classifier': 'NeuralNetwork', 'nn_alpha': 0.09989728646484754, 'hidden_layer_sizes': 256, 'activation': 'tanh', 'solver': 'sgd'}. Best is trial 14 with value: 0.9866666666666667.
[I 2024-08-18 23:01:22,671] Trial 75 finished with value: 0.96 and parameters: {'classifier': 'SVC', 'svc_c': 2161.667093178096, 'gamma': 'scale', 'kernel': 'rbf'}. Best is trial 14 with value: 0.9866666666666667.
[I 2024-08-18 23:01:25,153] Trial 76 finished with value: 0.9866666666666667 and parameters: {'classifier': 'NeuralNetwork', 'nn_alpha': 0.010747659523147273, 'hidden_layer_sizes': 256, 'activation': 'tanh', 'solver': 'sgd'}. Best is trial 14 with value: 0.9866666666666667.
[I 2024-08-18 23:01:28,193] Trial 77 finished with value: 0.9733333333333333 and parameters: {'classifier': 'NeuralNetwork', 'nn_alpha': 0.03614000618604661, 'hidden_layer_sizes': 256, 'activation': 'logistic', 'solver': 'adam'}. Best is trial 14 with value: 0.9866666666666667.
[I 2024-08-18 23:01:30,272] Trial 78 finished with value: 0.98 and parameters: {'classifier': 'NeuralNetwork', 'nn_alpha': 1.031517363492737e-05, 'hidden_layer_sizes': 128, 'activation': 'logistic', 'solver': 'adam'}. Best is trial 14 with value: 0.9866666666666667.
[I 2024-08-18 23:01:33,058] Trial 79 finished with value: 0.9866666666666667 and parameters: {'classifier': 'NeuralNetwork', 'nn_alpha': 0.000133472342124367, 'hidden_layer_sizes': 256, 'activation': 'tanh', 'solver': 'sgd'}. Best is trial 14 with value: 0.9866666666666667.
