[I 2024-06-27 16:35:33,455] A new study created in memory with name: no-name-3ceb0ccc-0392-4f85-8b24-af9b6174586f
[I 2024-06-27 16:35:35,710] Trial 0 finished with value: 0.9666666666666667 and parameters: {'classifier': 'XGBoost', 'xgb_eta': 0.011120723439644544, 'xgb_max_depth': 3, 'xgb_min_child_weight': 6.860311457697763e-05, 'xgb_subsample': 0.6821868735902363, 'xgb_colsample_bytree': 0.9989660719708728}. Best is trial 0 with value: 0.9666666666666667.
[I 2024-06-27 16:35:37,087] Trial 1 finished with value: 0.9733333333333333 and parameters: {'classifier': 'XGBoost', 'xgb_eta': 0.05698237693570401, 'xgb_max_depth': 5, 'xgb_min_child_weight': 0.34299690318925535, 'xgb_subsample': 0.6396321297984566, 'xgb_colsample_bytree': 0.7184826193277851}. Best is trial 1 with value: 0.9733333333333333.
[I 2024-06-27 16:35:38,003] Trial 2 finished with value: 0.9733333333333333 and parameters: {'classifier': 'NeuralNetwork', 'nn_alpha': 0.021800150876245816, 'hidden_layer_sizes': 128, 'activation': 'relu', 'solver': 'adam'}. Best is trial 1 with value: 0.9733333333333333.
[I 2024-06-27 16:35:39,348] Trial 3 finished with value: 0.96 and parameters: {'classifier': 'XGBoost', 'xgb_eta': 0.1622278049401038, 'xgb_max_depth': 3, 'xgb_min_child_weight': 0.00011606813589722841, 'xgb_subsample': 0.6284305508244354, 'xgb_colsample_bytree': 0.9932722346114173}. Best is trial 1 with value: 0.9733333333333333.
[I 2024-06-27 16:35:40,796] Trial 4 finished with value: 0.9733333333333333 and parameters: {'classifier': 'XGBoost', 'xgb_eta': 0.0996594727737503, 'xgb_max_depth': 3, 'xgb_min_child_weight': 0.009860224925489068, 'xgb_subsample': 0.5496640061851386, 'xgb_colsample_bytree': 0.5750822187738703}. Best is trial 1 with value: 0.9733333333333333.
[I 2024-06-27 16:35:41,673] Trial 5 finished with value: 0.9533333333333333 and parameters: {'classifier': 'RandomForest', 'rf_max_depth': 6, 'rf_min_samples_split': 14, 'rf_min_samples_leaf': 5, 'rf_max_features': 'log2'}. Best is trial 1 with value: 0.9733333333333333.
[I 2024-06-27 16:35:42,020] Trial 6 finished with value: 0.98 and parameters: {'classifier': 'NeuralNetwork', 'nn_alpha': 0.0005136772057212599, 'hidden_layer_sizes': 128, 'activation': 'relu', 'solver': 'sgd'}. Best is trial 6 with value: 0.98.
[I 2024-06-27 16:35:42,669] Trial 7 finished with value: 0.9666666666666667 and parameters: {'classifier': 'XGBoost', 'xgb_eta': 0.10756521737032143, 'xgb_max_depth': 7, 'xgb_min_child_weight': 0.0001503986217073284, 'xgb_subsample': 0.7754345909593128, 'xgb_colsample_bytree': 0.505759445321978}. Best is trial 6 with value: 0.98.
[I 2024-06-27 16:35:42,777] Trial 8 finished with value: 0.9533333333333333 and parameters: {'classifier': 'SVC', 'svc_c': 928971696.1152207, 'gamma': 'scale', 'kernel': 'poly'}. Best is trial 6 with value: 0.98.
[I 2024-06-27 16:35:43,020] Trial 9 finished with value: 0.9533333333333333 and parameters: {'classifier': 'RandomForest', 'rf_max_depth': 4, 'rf_min_samples_split': 20, 'rf_min_samples_leaf': 2, 'rf_max_features': 'log2'}. Best is trial 6 with value: 0.98.
[I 2024-06-27 16:35:44,413] Trial 10 finished with value: 0.9866666666666667 and parameters: {'classifier': 'NeuralNetwork', 'nn_alpha': 4.185105287420501e-05, 'hidden_layer_sizes': 512, 'activation': 'tanh', 'solver': 'sgd'}. Best is trial 10 with value: 0.9866666666666667.
[I 2024-06-27 16:35:45,895] Trial 11 finished with value: 0.9866666666666667 and parameters: {'classifier': 'NeuralNetwork', 'nn_alpha': 2.8684422998328806e-05, 'hidden_layer_sizes': 512, 'activation': 'tanh', 'solver': 'sgd'}. Best is trial 10 with value: 0.9866666666666667.
[I 2024-06-27 16:35:47,303] Trial 12 finished with value: 0.9866666666666667 and parameters: {'classifier': 'NeuralNetwork', 'nn_alpha': 1.475911957502625e-05, 'hidden_layer_sizes': 512, 'activation': 'tanh', 'solver': 'sgd'}. Best is trial 10 with value: 0.9866666666666667.
[I 2024-06-27 16:35:48,174] Trial 13 finished with value: 0.9666666666666667 and parameters: {'classifier': 'NeuralNetwork', 'nn_alpha': 1.662904521586341e-05, 'hidden_layer_sizes': 512, 'activation': 'tanh', 'solver': 'lbfgs'}. Best is trial 10 with value: 0.9866666666666667.
[I 2024-06-27 16:35:49,586] Trial 14 finished with value: 0.9866666666666667 and parameters: {'classifier': 'NeuralNetwork', 'nn_alpha': 0.00019628910371854126, 'hidden_layer_sizes': 512, 'activation': 'tanh', 'solver': 'sgd'}. Best is trial 10 with value: 0.9866666666666667.
[I 2024-06-27 16:35:49,646] Trial 15 finished with value: 0.32 and parameters: {'classifier': 'SVC', 'svc_c': 2.703426305656013e-09, 'gamma': 'auto', 'kernel': 'rbf'}. Best is trial 10 with value: 0.9866666666666667.
[I 2024-06-27 16:35:51,198] Trial 16 finished with value: 0.9066666666666666 and parameters: {'classifier': 'NeuralNetwork', 'nn_alpha': 7.969307385153486e-05, 'hidden_layer_sizes': 256, 'activation': 'logistic', 'solver': 'sgd'}. Best is trial 10 with value: 0.9866666666666667.
[I 2024-06-27 16:35:51,550] Trial 17 finished with value: 0.98 and parameters: {'classifier': 'NeuralNetwork', 'nn_alpha': 0.004884762752299261, 'hidden_layer_sizes': 64, 'activation': 'tanh', 'solver': 'sgd'}. Best is trial 10 with value: 0.9866666666666667.
[I 2024-06-27 16:35:52,081] Trial 18 finished with value: 0.98 and parameters: {'classifier': 'NeuralNetwork', 'nn_alpha': 5.9828601456113074e-05, 'hidden_layer_sizes': 512, 'activation': 'tanh', 'solver': 'adam'}. Best is trial 10 with value: 0.9866666666666667.
[I 2024-06-27 16:35:52,293] Trial 19 finished with value: 0.9466666666666667 and parameters: {'classifier': 'RandomForest', 'rf_max_depth': 28, 'rf_min_samples_split': 2, 'rf_min_samples_leaf': 10, 'rf_max_features': 'sqrt'}. Best is trial 10 with value: 0.9866666666666667.
[I 2024-06-27 16:35:52,311] Trial 20 finished with value: 0.9666666666666667 and parameters: {'classifier': 'SVC', 'svc_c': 22.824954234158078, 'gamma': 'scale', 'kernel': 'linear'}. Best is trial 10 with value: 0.9866666666666667.
[I 2024-06-27 16:35:53,554] Trial 21 finished with value: 0.9866666666666667 and parameters: {'classifier': 'NeuralNetwork', 'nn_alpha': 1.0493496360686793e-05, 'hidden_layer_sizes': 512, 'activation': 'tanh', 'solver': 'sgd'}. Best is trial 10 with value: 0.9866666666666667.
[I 2024-06-27 16:35:54,960] Trial 22 finished with value: 0.9866666666666667 and parameters: {'classifier': 'NeuralNetwork', 'nn_alpha': 2.725777244684285e-05, 'hidden_layer_sizes': 512, 'activation': 'tanh', 'solver': 'sgd'}. Best is trial 10 with value: 0.9866666666666667.
[I 2024-06-27 16:35:56,275] Trial 23 finished with value: 0.9866666666666667 and parameters: {'classifier': 'NeuralNetwork', 'nn_alpha': 1.0498106251769273e-05, 'hidden_layer_sizes': 512, 'activation': 'tanh', 'solver': 'sgd'}. Best is trial 10 with value: 0.9866666666666667.
[I 2024-06-27 16:35:58,574] Trial 24 finished with value: 0.9733333333333333 and parameters: {'classifier': 'NeuralNetwork', 'nn_alpha': 0.0001022626187188266, 'hidden_layer_sizes': 512, 'activation': 'logistic', 'solver': 'lbfgs'}. Best is trial 10 with value: 0.9866666666666667.
[I 2024-06-27 16:35:59,280] Trial 25 finished with value: 0.9866666666666667 and parameters: {'classifier': 'NeuralNetwork', 'nn_alpha': 0.0006105319415009336, 'hidden_layer_sizes': 256, 'activation': 'tanh', 'solver': 'sgd'}. Best is trial 10 with value: 0.9866666666666667.
[I 2024-06-27 16:35:59,632] Trial 26 finished with value: 0.9733333333333333 and parameters: {'classifier': 'NeuralNetwork', 'nn_alpha': 3.974240902266801e-05, 'hidden_layer_sizes': 64, 'activation': 'tanh', 'solver': 'sgd'}. Best is trial 10 with value: 0.9866666666666667.
[I 2024-06-27 16:36:00,868] Trial 27 finished with value: 0.9866666666666667 and parameters: {'classifier': 'NeuralNetwork', 'nn_alpha': 0.00020002226001636093, 'hidden_layer_sizes': 512, 'activation': 'tanh', 'solver': 'sgd'}. Best is trial 10 with value: 0.9866666666666667.
[I 2024-06-27 16:36:01,077] Trial 28 finished with value: 0.96 and parameters: {'classifier': 'RandomForest', 'rf_max_depth': 2, 'rf_min_samples_split': 2, 'rf_min_samples_leaf': 10, 'rf_max_features': 'sqrt'}. Best is trial 10 with value: 0.9866666666666667.
[I 2024-06-27 16:36:01,138] Trial 29 finished with value: 0.32 and parameters: {'classifier': 'SVC', 'svc_c': 1.3467715749415665e-09, 'gamma': 'auto', 'kernel': 'rbf'}. Best is trial 10 with value: 0.9866666666666667.
[I 2024-06-27 16:36:01,449] Trial 30 finished with value: 0.9666666666666667 and parameters: {'classifier': 'NeuralNetwork', 'nn_alpha': 0.002100056643339856, 'hidden_layer_sizes': 512, 'activation': 'relu', 'solver': 'lbfgs'}. Best is trial 10 with value: 0.9866666666666667.
[I 2024-06-27 16:36:02,746] Trial 31 finished with value: 0.9866666666666667 and parameters: {'classifier': 'NeuralNetwork', 'nn_alpha': 0.00022978819350448167, 'hidden_layer_sizes': 512, 'activation': 'tanh', 'solver': 'sgd'}. Best is trial 10 with value: 0.9866666666666667.
[I 2024-06-27 16:36:04,185] Trial 32 finished with value: 0.9866666666666667 and parameters: {'classifier': 'NeuralNetwork', 'nn_alpha': 3.080938001214289e-05, 'hidden_layer_sizes': 512, 'activation': 'tanh', 'solver': 'sgd'}. Best is trial 10 with value: 0.9866666666666667.
[I 2024-06-27 16:36:05,693] Trial 33 finished with value: 0.9866666666666667 and parameters: {'classifier': 'NeuralNetwork', 'nn_alpha': 0.0001524095546067573, 'hidden_layer_sizes': 512, 'activation': 'tanh', 'solver': 'sgd'}. Best is trial 10 with value: 0.9866666666666667.
[I 2024-06-27 16:36:07,220] Trial 34 finished with value: 0.98 and parameters: {'classifier': 'NeuralNetwork', 'nn_alpha': 3.512435363630778e-05, 'hidden_layer_sizes': 512, 'activation': 'logistic', 'solver': 'adam'}. Best is trial 10 with value: 0.9866666666666667.
[I 2024-06-27 16:36:07,272] Trial 35 finished with value: 0.3333333333333333 and parameters: {'classifier': 'XGBoost', 'xgb_eta': 0.015162167993817036, 'xgb_max_depth': 9, 'xgb_min_child_weight': 57.46173946733501, 'xgb_subsample': 0.9884212111036069, 'xgb_colsample_bytree': 0.8030707810864436}. Best is trial 10 with value: 0.9866666666666667.
[I 2024-06-27 16:36:08,819] Trial 36 finished with value: 0.9866666666666667 and parameters: {'classifier': 'NeuralNetwork', 'nn_alpha': 7.398160113743742e-05, 'hidden_layer_sizes': 512, 'activation': 'tanh', 'solver': 'sgd'}. Best is trial 10 with value: 0.9866666666666667.
[I 2024-06-27 16:36:08,870] Trial 37 finished with value: 0.3333333333333333 and parameters: {'classifier': 'XGBoost', 'xgb_eta': 0.2820102655532947, 'xgb_max_depth': 5, 'xgb_min_child_weight': 43.58187332401847, 'xgb_subsample': 0.8922920362409907, 'xgb_colsample_bytree': 0.8205776818022638}. Best is trial 10 with value: 0.9866666666666667.
[I 2024-06-27 16:36:09,306] Trial 38 finished with value: 0.98 and parameters: {'classifier': 'NeuralNetwork', 'nn_alpha': 0.09627287459559714, 'hidden_layer_sizes': 64, 'activation': 'tanh', 'solver': 'sgd'}. Best is trial 10 with value: 0.9866666666666667.
[I 2024-06-27 16:36:10,158] Trial 39 finished with value: 0.9866666666666667 and parameters: {'classifier': 'NeuralNetwork', 'nn_alpha': 2.017243246212738e-05, 'hidden_layer_sizes': 256, 'activation': 'tanh', 'solver': 'sgd'}. Best is trial 10 with value: 0.9866666666666667.
[I 2024-06-27 16:36:10,380] Trial 40 finished with value: 0.9666666666666667 and parameters: {'classifier': 'RandomForest', 'rf_max_depth': 30, 'rf_min_samples_split': 9, 'rf_min_samples_leaf': 1, 'rf_max_features': 'log2'}. Best is trial 10 with value: 0.9866666666666667.
[I 2024-06-27 16:36:11,956] Trial 41 finished with value: 0.9866666666666667 and parameters: {'classifier': 'NeuralNetwork', 'nn_alpha': 1.2635027519155476e-05, 'hidden_layer_sizes': 512, 'activation': 'tanh', 'solver': 'sgd'}. Best is trial 10 with value: 0.9866666666666667.
[I 2024-06-27 16:36:13,495] Trial 42 finished with value: 0.9866666666666667 and parameters: {'classifier': 'NeuralNetwork', 'nn_alpha': 1.0884439452166201e-05, 'hidden_layer_sizes': 512, 'activation': 'tanh', 'solver': 'sgd'}. Best is trial 10 with value: 0.9866666666666667.
[I 2024-06-27 16:36:15,013] Trial 43 finished with value: 0.9866666666666667 and parameters: {'classifier': 'NeuralNetwork', 'nn_alpha': 4.6085646669278615e-05, 'hidden_layer_sizes': 512, 'activation': 'tanh', 'solver': 'sgd'}. Best is trial 10 with value: 0.9866666666666667.
[I 2024-06-27 16:36:15,640] Trial 44 finished with value: 0.9666666666666667 and parameters: {'classifier': 'XGBoost', 'xgb_eta': 0.02686667750276515, 'xgb_max_depth': 4, 'xgb_min_child_weight': 0.20040726579133505, 'xgb_subsample': 0.5034735687957674, 'xgb_colsample_bytree': 0.6682112540481266}. Best is trial 10 with value: 0.9866666666666667.
[I 2024-06-27 16:36:17,180] Trial 45 finished with value: 0.9866666666666667 and parameters: {'classifier': 'NeuralNetwork', 'nn_alpha': 2.3308384495511633e-05, 'hidden_layer_sizes': 512, 'activation': 'tanh', 'solver': 'sgd'}. Best is trial 10 with value: 0.9866666666666667.
[I 2024-06-27 16:36:17,416] Trial 46 finished with value: 0.96 and parameters: {'classifier': 'SVC', 'svc_c': 8039936374.240333, 'gamma': 'auto', 'kernel': 'linear'}. Best is trial 10 with value: 0.9866666666666667.
[I 2024-06-27 16:36:17,968] Trial 47 finished with value: 0.9866666666666667 and parameters: {'classifier': 'NeuralNetwork', 'nn_alpha': 2.0759663121125917e-05, 'hidden_layer_sizes': 128, 'activation': 'tanh', 'solver': 'sgd'}. Best is trial 10 with value: 0.9866666666666667.
[I 2024-06-27 16:36:19,528] Trial 48 finished with value: 0.9866666666666667 and parameters: {'classifier': 'NeuralNetwork', 'nn_alpha': 0.00013167365266956687, 'hidden_layer_sizes': 512, 'activation': 'tanh', 'solver': 'sgd'}. Best is trial 10 with value: 0.9866666666666667.
[I 2024-06-27 16:36:19,781] Trial 49 finished with value: 0.9466666666666667 and parameters: {'classifier': 'RandomForest', 'rf_max_depth': 14, 'rf_min_samples_split': 10, 'rf_min_samples_leaf': 6, 'rf_max_features': 'sqrt'}. Best is trial 10 with value: 0.9866666666666667.
[I 2024-06-27 16:36:20,032] Trial 50 finished with value: 0.9866666666666667 and parameters: {'classifier': 'NeuralNetwork', 'nn_alpha': 0.0002541020960738515, 'hidden_layer_sizes': 128, 'activation': 'relu', 'solver': 'adam'}. Best is trial 10 with value: 0.9866666666666667.
[I 2024-06-27 16:36:21,550] Trial 51 finished with value: 0.9866666666666667 and parameters: {'classifier': 'NeuralNetwork', 'nn_alpha': 3.068873547770345e-05, 'hidden_layer_sizes': 512, 'activation': 'tanh', 'solver': 'sgd'}. Best is trial 10 with value: 0.9866666666666667.
[I 2024-06-27 16:36:23,111] Trial 52 finished with value: 0.9866666666666667 and parameters: {'classifier': 'NeuralNetwork', 'nn_alpha': 1.0492401144225907e-05, 'hidden_layer_sizes': 512, 'activation': 'tanh', 'solver': 'sgd'}. Best is trial 10 with value: 0.9866666666666667.
[I 2024-06-27 16:36:24,098] Trial 53 finished with value: 0.98 and parameters: {'classifier': 'NeuralNetwork', 'nn_alpha': 5.285373131450348e-05, 'hidden_layer_sizes': 512, 'activation': 'relu', 'solver': 'sgd'}. Best is trial 10 with value: 0.9866666666666667.
[I 2024-06-27 16:36:24,867] Trial 54 finished with value: 0.9533333333333333 and parameters: {'classifier': 'NeuralNetwork', 'nn_alpha': 1.941398033840055e-05, 'hidden_layer_sizes': 512, 'activation': 'tanh', 'solver': 'lbfgs'}. Best is trial 10 with value: 0.9866666666666667.
[I 2024-06-27 16:36:25,770] Trial 55 finished with value: 0.9199999999999999 and parameters: {'classifier': 'NeuralNetwork', 'nn_alpha': 0.00038677409741823265, 'hidden_layer_sizes': 128, 'activation': 'logistic', 'solver': 'sgd'}. Best is trial 10 with value: 0.9866666666666667.
[I 2024-06-27 16:36:25,792] Trial 56 finished with value: 0.98 and parameters: {'classifier': 'SVC', 'svc_c': 0.15258147424671253, 'gamma': 'scale', 'kernel': 'poly'}. Best is trial 10 with value: 0.9866666666666667.
[I 2024-06-27 16:36:27,340] Trial 57 finished with value: 0.9866666666666667 and parameters: {'classifier': 'NeuralNetwork', 'nn_alpha': 2.1112689670558287e-05, 'hidden_layer_sizes': 512, 'activation': 'tanh', 'solver': 'sgd'}. Best is trial 10 with value: 0.9866666666666667.
[I 2024-06-27 16:36:27,402] Trial 58 finished with value: 0.96 and parameters: {'classifier': 'XGBoost', 'xgb_eta': 0.03557806844466299, 'xgb_max_depth': 7, 'xgb_min_child_weight': 0.006439625039856354, 'xgb_subsample': 0.8050776819707386, 'xgb_colsample_bytree': 0.8333039113577044}. Best is trial 10 with value: 0.9866666666666667.
[I 2024-06-27 16:36:27,810] Trial 59 finished with value: 0.98 and parameters: {'classifier': 'NeuralNetwork', 'nn_alpha': 6.804259687725957e-05, 'hidden_layer_sizes': 256, 'activation': 'tanh', 'solver': 'adam'}. Best is trial 10 with value: 0.9866666666666667.
[I 2024-06-27 16:36:27,950] Trial 60 finished with value: 0.94 and parameters: {'classifier': 'RandomForest', 'rf_max_depth': 2, 'rf_min_samples_split': 19, 'rf_min_samples_leaf': 6, 'rf_max_features': 'sqrt'}. Best is trial 10 with value: 0.9866666666666667.
[I 2024-06-27 16:36:29,505] Trial 61 finished with value: 0.9866666666666667 and parameters: {'classifier': 'NeuralNetwork', 'nn_alpha': 1.049448969577477e-05, 'hidden_layer_sizes': 512, 'activation': 'tanh', 'solver': 'sgd'}. Best is trial 10 with value: 0.9866666666666667.
[I 2024-06-27 16:36:31,121] Trial 62 finished with value: 0.9866666666666667 and parameters: {'classifier': 'NeuralNetwork', 'nn_alpha': 1.4925835676550168e-05, 'hidden_layer_sizes': 512, 'activation': 'tanh', 'solver': 'sgd'}. Best is trial 10 with value: 0.9866666666666667.
[I 2024-06-27 16:36:32,697] Trial 63 finished with value: 0.9866666666666667 and parameters: {'classifier': 'NeuralNetwork', 'nn_alpha': 2.94791891407778e-05, 'hidden_layer_sizes': 512, 'activation': 'tanh', 'solver': 'sgd'}. Best is trial 10 with value: 0.9866666666666667.
[I 2024-06-27 16:36:34,187] Trial 64 finished with value: 0.9866666666666667 and parameters: {'classifier': 'NeuralNetwork', 'nn_alpha': 0.0011910088544323624, 'hidden_layer_sizes': 512, 'activation': 'tanh', 'solver': 'sgd'}. Best is trial 10 with value: 0.9866666666666667.
[I 2024-06-27 16:36:34,376] Trial 65 finished with value: 0.9666666666666667 and parameters: {'classifier': 'NeuralNetwork', 'nn_alpha': 1.5844786089678315e-05, 'hidden_layer_sizes': 64, 'activation': 'logistic', 'solver': 'lbfgs'}. Best is trial 10 with value: 0.9866666666666667.
[I 2024-06-27 16:36:35,798] Trial 66 finished with value: 0.9866666666666667 and parameters: {'classifier': 'NeuralNetwork', 'nn_alpha': 8.939250220340745e-05, 'hidden_layer_sizes': 512, 'activation': 'tanh', 'solver': 'sgd'}. Best is trial 10 with value: 0.9866666666666667.
[I 2024-06-27 16:36:35,820] Trial 67 finished with value: 0.9533333333333333 and parameters: {'classifier': 'SVC', 'svc_c': 0.039085918651563044, 'gamma': 'auto', 'kernel': 'linear'}. Best is trial 10 with value: 0.9866666666666667.
[I 2024-06-27 16:36:36,666] Trial 68 finished with value: 0.9733333333333333 and parameters: {'classifier': 'NeuralNetwork', 'nn_alpha': 4.7515163905515836e-05, 'hidden_layer_sizes': 512, 'activation': 'relu', 'solver': 'sgd'}. Best is trial 10 with value: 0.9866666666666667.
[I 2024-06-27 16:36:38,034] Trial 69 finished with value: 0.9866666666666667 and parameters: {'classifier': 'NeuralNetwork', 'nn_alpha': 1.603617575767279e-05, 'hidden_layer_sizes': 512, 'activation': 'tanh', 'solver': 'sgd'}. Best is trial 10 with value: 0.9866666666666667.
[I 2024-06-27 16:36:39,356] Trial 70 finished with value: 0.9866666666666667 and parameters: {'classifier': 'NeuralNetwork', 'nn_alpha': 2.9095698390486855e-05, 'hidden_layer_sizes': 512, 'activation': 'tanh', 'solver': 'sgd'}. Best is trial 10 with value: 0.9866666666666667.
[I 2024-06-27 16:36:40,074] Trial 71 finished with value: 0.9866666666666667 and parameters: {'classifier': 'NeuralNetwork', 'nn_alpha': 0.0007387416403619334, 'hidden_layer_sizes': 256, 'activation': 'tanh', 'solver': 'sgd'}. Best is trial 10 with value: 0.9866666666666667.
[I 2024-06-27 16:36:40,846] Trial 72 finished with value: 0.9866666666666667 and parameters: {'classifier': 'NeuralNetwork', 'nn_alpha': 0.0016723696580125433, 'hidden_layer_sizes': 256, 'activation': 'tanh', 'solver': 'sgd'}. Best is trial 10 with value: 0.9866666666666667.
[I 2024-06-27 16:36:41,544] Trial 73 finished with value: 0.9866666666666667 and parameters: {'classifier': 'NeuralNetwork', 'nn_alpha': 0.004412108713842425, 'hidden_layer_sizes': 256, 'activation': 'tanh', 'solver': 'sgd'}. Best is trial 10 with value: 0.9866666666666667.
[I 2024-06-27 16:36:42,264] Trial 74 finished with value: 0.9866666666666667 and parameters: {'classifier': 'NeuralNetwork', 'nn_alpha': 0.0007971597443407511, 'hidden_layer_sizes': 256, 'activation': 'tanh', 'solver': 'sgd'}. Best is trial 10 with value: 0.9866666666666667.
[I 2024-06-27 16:36:42,314] Trial 75 finished with value: 0.96 and parameters: {'classifier': 'XGBoost', 'xgb_eta': 0.02239264885689201, 'xgb_max_depth': 4, 'xgb_min_child_weight': 1.070743388101618e-05, 'xgb_subsample': 0.9956684916400911, 'xgb_colsample_bytree': 0.8978438829720867}. Best is trial 10 with value: 0.9866666666666667.
[I 2024-06-27 16:36:42,461] Trial 76 finished with value: 0.96 and parameters: {'classifier': 'NeuralNetwork', 'nn_alpha': 0.0004756053991883502, 'hidden_layer_sizes': 64, 'activation': 'tanh', 'solver': 'lbfgs'}. Best is trial 10 with value: 0.9866666666666667.
[I 2024-06-27 16:36:43,837] Trial 77 finished with value: 0.9866666666666667 and parameters: {'classifier': 'NeuralNetwork', 'nn_alpha': 0.00031864170724539846, 'hidden_layer_sizes': 512, 'activation': 'tanh', 'solver': 'sgd'}. Best is trial 10 with value: 0.9866666666666667.
