[I 2024-06-27 16:36:45,557] Trial 78 finished with value: 0.9733333333333333 and parameters: {'classifier': 'NeuralNetwork', 'nn_alpha': 3.89412412202913e-05, 'hidden_layer_sizes': 512, 'activation': 'logistic', 'solver': 'adam'}. Best is trial 10 with value: 0.9866666666666667.
[I 2024-06-27 16:36:45,777] Trial 79 finished with value: 0.96 and parameters: {'classifier': 'RandomForest', 'rf_max_depth': 12, 'rf_min_samples_split': 6, 'rf_min_samples_leaf': 4, 'rf_max_features': 'log2'}. Best is trial 10 with value: 0.9866666666666667.
[I 2024-06-27 16:36:47,269] Trial 80 finished with value: 0.9866666666666667 and parameters: {'classifier': 'NeuralNetwork', 'nn_alpha': 0.00012474762697498682, 'hidden_layer_sizes': 512, 'activation': 'tanh', 'solver': 'sgd'}. Best is trial 10 with value: 0.9866666666666667.
[I 2024-06-27 16:36:48,622] Trial 81 finished with value: 0.9866666666666667 and parameters: {'classifier': 'NeuralNetwork', 'nn_alpha': 0.0001851624170895485, 'hidden_layer_sizes': 512, 'activation': 'tanh', 'solver': 'sgd'}. Best is trial 10 with value: 0.9866666666666667.
[I 2024-06-27 16:36:49,975] Trial 82 finished with value: 0.9866666666666667 and parameters: {'classifier': 'NeuralNetwork', 'nn_alpha': 1.3839977114025456e-05, 'hidden_layer_sizes': 512, 'activation': 'tanh', 'solver': 'sgd'}. Best is trial 10 with value: 0.9866666666666667.
[I 2024-06-27 16:36:51,259] Trial 83 finished with value: 0.9866666666666667 and parameters: {'classifier': 'NeuralNetwork', 'nn_alpha': 2.6417961622115017e-05, 'hidden_layer_sizes': 512, 'activation': 'tanh', 'solver': 'sgd'}. Best is trial 10 with value: 0.9866666666666667.
[I 2024-06-27 16:36:52,540] Trial 84 finished with value: 0.9866666666666667 and parameters: {'classifier': 'NeuralNetwork', 'nn_alpha': 9.037909925044023e-05, 'hidden_layer_sizes': 512, 'activation': 'tanh', 'solver': 'sgd'}. Best is trial 10 with value: 0.9866666666666667.
[I 2024-06-27 16:36:52,559] Trial 85 finished with value: 0.96 and parameters: {'classifier': 'SVC', 'svc_c': 24815.146806876302, 'gamma': 'scale', 'kernel': 'rbf'}. Best is trial 10 with value: 0.9866666666666667.
[I 2024-06-27 16:36:53,850] Trial 86 finished with value: 0.98 and parameters: {'classifier': 'NeuralNetwork', 'nn_alpha': 5.4074913715027337e-05, 'hidden_layer_sizes': 512, 'activation': 'tanh', 'solver': 'sgd'}. Best is trial 10 with value: 0.9866666666666667.
[I 2024-06-27 16:36:54,297] Trial 87 finished with value: 0.9866666666666667 and parameters: {'classifier': 'NeuralNetwork', 'nn_alpha': 1.0510873854220278e-05, 'hidden_layer_sizes': 128, 'activation': 'tanh', 'solver': 'sgd'}. Best is trial 10 with value: 0.9866666666666667.
[I 2024-06-27 16:36:54,985] Trial 88 finished with value: 0.9866666666666667 and parameters: {'classifier': 'NeuralNetwork', 'nn_alpha': 0.0001999192864758551, 'hidden_layer_sizes': 256, 'activation': 'tanh', 'solver': 'sgd'}. Best is trial 10 with value: 0.9866666666666667.
[I 2024-06-27 16:36:55,035] Trial 89 finished with value: 0.9533333333333333 and parameters: {'classifier': 'XGBoost', 'xgb_eta': 0.29795968026302666, 'xgb_max_depth': 7, 'xgb_min_child_weight': 2.3248555510223126, 'xgb_subsample': 0.8751076859300595, 'xgb_colsample_bytree': 0.6513331553557153}. Best is trial 10 with value: 0.9866666666666667.
[I 2024-06-27 16:36:55,811] Trial 90 finished with value: 0.9733333333333333 and parameters: {'classifier': 'NeuralNetwork', 'nn_alpha': 1.8908561047608744e-05, 'hidden_layer_sizes': 512, 'activation': 'relu', 'solver': 'sgd'}. Best is trial 10 with value: 0.9866666666666667.
[I 2024-06-27 16:36:57,070] Trial 91 finished with value: 0.98 and parameters: {'classifier': 'NeuralNetwork', 'nn_alpha': 0.00027417939448976924, 'hidden_layer_sizes': 512, 'activation': 'tanh', 'solver': 'sgd'}. Best is trial 10 with value: 0.9866666666666667.
[I 2024-06-27 16:36:58,276] Trial 92 finished with value: 0.9866666666666667 and parameters: {'classifier': 'NeuralNetwork', 'nn_alpha': 0.0001919139265586297, 'hidden_layer_sizes': 512, 'activation': 'tanh', 'solver': 'sgd'}. Best is trial 10 with value: 0.9866666666666667.
[I 2024-06-27 16:36:59,545] Trial 93 finished with value: 0.9866666666666667 and parameters: {'classifier': 'NeuralNetwork', 'nn_alpha': 0.0006156146725487776, 'hidden_layer_sizes': 512, 'activation': 'tanh', 'solver': 'sgd'}. Best is trial 10 with value: 0.9866666666666667.
[I 2024-06-27 16:37:00,058] Trial 94 finished with value: 0.98 and parameters: {'classifier': 'NeuralNetwork', 'nn_alpha': 0.0003745618707924435, 'hidden_layer_sizes': 512, 'activation': 'tanh', 'solver': 'adam'}. Best is trial 10 with value: 0.9866666666666667.
[I 2024-06-27 16:37:00,267] Trial 95 finished with value: 0.9466666666666667 and parameters: {'classifier': 'RandomForest', 'rf_max_depth': 4, 'rf_min_samples_split': 15, 'rf_min_samples_leaf': 8, 'rf_max_features': 'log2'}. Best is trial 10 with value: 0.9866666666666667.
[I 2024-06-27 16:37:01,536] Trial 96 finished with value: 0.9866666666666667 and parameters: {'classifier': 'NeuralNetwork', 'nn_alpha': 0.05849796216232381, 'hidden_layer_sizes': 512, 'activation': 'tanh', 'solver': 'sgd'}. Best is trial 10 with value: 0.9866666666666667.
[I 2024-06-27 16:37:01,889] Trial 97 finished with value: 0.98 and parameters: {'classifier': 'NeuralNetwork', 'nn_alpha': 0.0001232132213376574, 'hidden_layer_sizes': 64, 'activation': 'tanh', 'solver': 'sgd'}. Best is trial 10 with value: 0.9866666666666667.
[I 2024-06-27 16:37:02,636] Trial 98 finished with value: 0.98 and parameters: {'classifier': 'NeuralNetwork', 'nn_alpha': 3.554708699634972e-05, 'hidden_layer_sizes': 512, 'activation': 'tanh', 'solver': 'lbfgs'}. Best is trial 10 with value: 0.9866666666666667.
[I 2024-06-27 16:37:05,340] Trial 99 finished with value: 0.9333333333333332 and parameters: {'classifier': 'NeuralNetwork', 'nn_alpha': 6.431805396734207e-05, 'hidden_layer_sizes': 512, 'activation': 'logistic', 'solver': 'sgd'}. Best is trial 10 with value: 0.9866666666666667.
FrozenTrial(number=10, state=1, values=[0.9866666666666667], datetime_start=datetime.datetime(2024, 6, 27, 16, 35, 43, 20300), datetime_complete=datetime.datetime(2024, 6, 27, 16, 35, 44, 412428), params={'classifier': 'NeuralNetwork', 'nn_alpha': 4.185105287420501e-05, 'hidden_layer_sizes': 512, 'activation': 'tanh', 'solver': 'sgd'}, user_attrs={}, system_attrs={}, intermediate_values={}, distributions={'classifier': CategoricalDistribution(choices=('SVC', 'RandomForest', 'NeuralNetwork', 'XGBoost')), 'nn_alpha': FloatDistribution(high=0.1, log=True, low=1e-05, step=None), 'hidden_layer_sizes': CategoricalDistribution(choices=(64, 128, 256, 512)), 'activation': CategoricalDistribution(choices=('relu', 'tanh', 'logistic')), 'solver': CategoricalDistribution(choices=('adam', 'lbfgs', 'sgd'))}, trial_id=10, value=None)