[I 2024-06-27 16:38:51,461] Trial 80 finished with value: 0.9666666666666667 and parameters: {'classifier': 'RandomForest', 'rf_max_depth': 4, 'rf_min_samples_split': 6, 'rf_min_samples_leaf': 1, 'rf_max_features': 'sqrt'}. Best is trial 10 with value: 0.9866666666666667.
[I 2024-06-27 16:38:52,207] Trial 81 finished with value: 0.9866666666666667 and parameters: {'classifier': 'NeuralNetwork', 'nn_alpha': 0.04024728271432207, 'hidden_layer_sizes': 256, 'activation': 'tanh', 'solver': 'sgd'}. Best is trial 10 with value: 0.9866666666666667.
[I 2024-06-27 16:38:52,925] Trial 82 finished with value: 0.9866666666666667 and parameters: {'classifier': 'NeuralNetwork', 'nn_alpha': 0.018811381883340233, 'hidden_layer_sizes': 256, 'activation': 'tanh', 'solver': 'sgd'}. Best is trial 10 with value: 0.9866666666666667.
[I 2024-06-27 16:38:53,630] Trial 83 finished with value: 0.98 and parameters: {'classifier': 'NeuralNetwork', 'nn_alpha': 0.06767955518172752, 'hidden_layer_sizes': 256, 'activation': 'tanh', 'solver': 'sgd'}. Best is trial 10 with value: 0.9866666666666667.
[I 2024-06-27 16:38:54,844] Trial 84 finished with value: 0.9866666666666667 and parameters: {'classifier': 'NeuralNetwork', 'nn_alpha': 0.03531967475466966, 'hidden_layer_sizes': 512, 'activation': 'tanh', 'solver': 'sgd'}. Best is trial 10 with value: 0.9866666666666667.
[I 2024-06-27 16:38:54,884] Trial 85 finished with value: 0.9466666666666667 and parameters: {'classifier': 'XGBoost', 'xgb_eta': 0.1232767561129363, 'xgb_max_depth': 4, 'xgb_min_child_weight': 3.8505691947054954, 'xgb_subsample': 0.8679143599078019, 'xgb_colsample_bytree': 0.6551896706514366}. Best is trial 10 with value: 0.9866666666666667.
[I 2024-06-27 16:38:55,399] Trial 86 finished with value: 0.98 and parameters: {'classifier': 'NeuralNetwork', 'nn_alpha': 0.005283318593059632, 'hidden_layer_sizes': 256, 'activation': 'relu', 'solver': 'sgd'}. Best is trial 10 with value: 0.9866666666666667.
[I 2024-06-27 16:38:55,419] Trial 87 finished with value: 0.32 and parameters: {'classifier': 'SVC', 'svc_c': 4.428280260705474e-05, 'gamma': 'auto', 'kernel': 'linear'}. Best is trial 10 with value: 0.9866666666666667.
[I 2024-06-27 16:38:55,669] Trial 88 finished with value: 0.98 and parameters: {'classifier': 'NeuralNetwork', 'nn_alpha': 0.012390982160412487, 'hidden_layer_sizes': 64, 'activation': 'tanh', 'solver': 'adam'}. Best is trial 10 with value: 0.9866666666666667.
[I 2024-06-27 16:38:56,368] Trial 89 finished with value: 0.9866666666666667 and parameters: {'classifier': 'NeuralNetwork', 'nn_alpha': 0.029462600720456672, 'hidden_layer_sizes': 256, 'activation': 'tanh', 'solver': 'sgd'}. Best is trial 10 with value: 0.9866666666666667.
[I 2024-06-27 16:38:59,472] Trial 90 finished with value: 0.96 and parameters: {'classifier': 'NeuralNetwork', 'nn_alpha': 0.086809762760194, 'hidden_layer_sizes': 256, 'activation': 'logistic', 'solver': 'sgd'}. Best is trial 10 with value: 0.9866666666666667.
[I 2024-06-27 16:39:00,771] Trial 91 finished with value: 0.9866666666666667 and parameters: {'classifier': 'NeuralNetwork', 'nn_alpha': 0.005912894373922752, 'hidden_layer_sizes': 512, 'activation': 'tanh', 'solver': 'sgd'}. Best is trial 10 with value: 0.9866666666666667.
[I 2024-06-27 16:39:02,028] Trial 92 finished with value: 0.9866666666666667 and parameters: {'classifier': 'NeuralNetwork', 'nn_alpha': 0.0046248080818422094, 'hidden_layer_sizes': 512, 'activation': 'tanh', 'solver': 'sgd'}. Best is trial 10 with value: 0.9866666666666667.
[I 2024-06-27 16:39:03,311] Trial 93 finished with value: 0.9866666666666667 and parameters: {'classifier': 'NeuralNetwork', 'nn_alpha': 0.0027373907608272308, 'hidden_layer_sizes': 512, 'activation': 'tanh', 'solver': 'sgd'}. Best is trial 10 with value: 0.9866666666666667.
[I 2024-06-27 16:39:04,589] Trial 94 finished with value: 0.9866666666666667 and parameters: {'classifier': 'NeuralNetwork', 'nn_alpha': 0.009276442684169928, 'hidden_layer_sizes': 512, 'activation': 'tanh', 'solver': 'sgd'}. Best is trial 10 with value: 0.9866666666666667.
[I 2024-06-27 16:39:05,317] Trial 95 finished with value: 0.9866666666666667 and parameters: {'classifier': 'NeuralNetwork', 'nn_alpha': 0.04539932351073363, 'hidden_layer_sizes': 256, 'activation': 'tanh', 'solver': 'sgd'}. Best is trial 10 with value: 0.9866666666666667.
[I 2024-06-27 16:39:05,712] Trial 96 finished with value: 0.98 and parameters: {'classifier': 'NeuralNetwork', 'nn_alpha': 0.02074249272730249, 'hidden_layer_sizes': 128, 'activation': 'relu', 'solver': 'sgd'}. Best is trial 10 with value: 0.9866666666666667.
[I 2024-06-27 16:39:05,820] Trial 97 finished with value: 0.96 and parameters: {'classifier': 'RandomForest', 'rf_max_depth': 13, 'rf_min_samples_split': 15, 'rf_min_samples_leaf': 3, 'rf_max_features': 'log2'}. Best is trial 10 with value: 0.9866666666666667.
[I 2024-06-27 16:39:06,059] Trial 98 finished with value: 0.9866666666666667 and parameters: {'classifier': 'NeuralNetwork', 'nn_alpha': 0.003630366845306845, 'hidden_layer_sizes': 64, 'activation': 'tanh', 'solver': 'adam'}. Best is trial 10 with value: 0.9866666666666667.
[I 2024-06-27 16:39:07,160] Trial 99 finished with value: 0.9666666666666667 and parameters: {'classifier': 'NeuralNetwork', 'nn_alpha': 0.008292234131287149, 'hidden_layer_sizes': 256, 'activation': 'tanh', 'solver': 'lbfgs'}. Best is trial 10 with value: 0.9866666666666667.
FrozenTrial(number=10, state=1, values=[0.9866666666666667], datetime_start=datetime.datetime(2024, 6, 27, 16, 38, 1, 421201), datetime_complete=datetime.datetime(2024, 6, 27, 16, 38, 1, 762817), params={'classifier': 'NeuralNetwork', 'nn_alpha': 0.006467554111551574, 'hidden_layer_sizes': 64, 'activation': 'relu', 'solver': 'sgd'}, user_attrs={}, system_attrs={}, intermediate_values={}, distributions={'classifier': CategoricalDistribution(choices=('SVC', 'RandomForest', 'NeuralNetwork', 'XGBoost')), 'nn_alpha': FloatDistribution(high=0.1, log=True, low=1e-05, step=None), 'hidden_layer_sizes': CategoricalDistribution(choices=(64, 128, 256, 512)), 'activation': CategoricalDistribution(choices=('relu', 'tanh', 'logistic')), 'solver': CategoricalDistribution(choices=('adam', 'lbfgs', 'sgd'))}, trial_id=10, value=None)