[I 2024-06-27 16:37:52,257] A new study created in memory with name: no-name-cb4fde10-1d40-46c0-b48c-042a56e12b23
[I 2024-06-27 16:37:55,069] Trial 0 finished with value: 0.98 and parameters: {'classifier': 'NeuralNetwork', 'nn_alpha': 0.0006967900138896056, 'hidden_layer_sizes': 64, 'activation': 'logistic', 'solver': 'sgd'}. Best is trial 0 with value: 0.98.
[I 2024-06-27 16:37:56,426] Trial 1 finished with value: 0.96 and parameters: {'classifier': 'XGBoost', 'xgb_eta': 0.27297833570481556, 'xgb_max_depth': 3, 'xgb_min_child_weight': 0.40852730237484663, 'xgb_subsample': 0.6147496256210834, 'xgb_colsample_bytree': 0.6121550049462102}. Best is trial 0 with value: 0.98.
[I 2024-06-27 16:37:57,358] Trial 2 finished with value: 0.9666666666666667 and parameters: {'classifier': 'RandomForest', 'rf_max_depth': 2, 'rf_min_samples_split': 12, 'rf_min_samples_leaf': 5, 'rf_max_features': 'sqrt'}. Best is trial 0 with value: 0.98.
[I 2024-06-27 16:37:58,371] Trial 3 finished with value: 0.9533333333333333 and parameters: {'classifier': 'NeuralNetwork', 'nn_alpha': 1.3721878501136789e-05, 'hidden_layer_sizes': 128, 'activation': 'logistic', 'solver': 'lbfgs'}. Best is trial 0 with value: 0.98.
[I 2024-06-27 16:37:59,299] Trial 4 finished with value: 0.9533333333333333 and parameters: {'classifier': 'RandomForest', 'rf_max_depth': 22, 'rf_min_samples_split': 18, 'rf_min_samples_leaf': 3, 'rf_max_features': 'sqrt'}. Best is trial 0 with value: 0.98.
[I 2024-06-27 16:38:00,479] Trial 5 finished with value: 0.96 and parameters: {'classifier': 'XGBoost', 'xgb_eta': 0.02361086550071708, 'xgb_max_depth': 7, 'xgb_min_child_weight': 8.046333122752224e-05, 'xgb_subsample': 0.9186892498548864, 'xgb_colsample_bytree': 0.9751890478364711}. Best is trial 0 with value: 0.98.
[I 2024-06-27 16:38:00,961] Trial 6 finished with value: 0.96 and parameters: {'classifier': 'XGBoost', 'xgb_eta': 0.11909233428255944, 'xgb_max_depth': 9, 'xgb_min_child_weight': 0.013821954253436557, 'xgb_subsample': 0.5641013228394476, 'xgb_colsample_bytree': 0.9088146596075082}. Best is trial 0 with value: 0.98.
[I 2024-06-27 16:38:01,162] Trial 7 finished with value: 0.9533333333333333 and parameters: {'classifier': 'RandomForest', 'rf_max_depth': 8, 'rf_min_samples_split': 20, 'rf_min_samples_leaf': 1, 'rf_max_features': 'sqrt'}. Best is trial 0 with value: 0.98.
[I 2024-06-27 16:38:01,219] Trial 8 finished with value: 0.32 and parameters: {'classifier': 'SVC', 'svc_c': 1.5852418825663785e-08, 'gamma': 'auto', 'kernel': 'rbf'}. Best is trial 0 with value: 0.98.
[I 2024-06-27 16:38:01,420] Trial 9 finished with value: 0.9533333333333333 and parameters: {'classifier': 'RandomForest', 'rf_max_depth': 27, 'rf_min_samples_split': 11, 'rf_min_samples_leaf': 5, 'rf_max_features': 'log2'}. Best is trial 0 with value: 0.98.
[I 2024-06-27 16:38:01,763] Trial 10 finished with value: 0.9866666666666667 and parameters: {'classifier': 'NeuralNetwork', 'nn_alpha': 0.006467554111551574, 'hidden_layer_sizes': 64, 'activation': 'relu', 'solver': 'sgd'}. Best is trial 10 with value: 0.9866666666666667.
[I 2024-06-27 16:38:02,091] Trial 11 finished with value: 0.9733333333333333 and parameters: {'classifier': 'NeuralNetwork', 'nn_alpha': 0.007508775270340694, 'hidden_layer_sizes': 64, 'activation': 'relu', 'solver': 'sgd'}. Best is trial 10 with value: 0.9866666666666667.
[I 2024-06-27 16:38:02,410] Trial 12 finished with value: 0.9733333333333333 and parameters: {'classifier': 'NeuralNetwork', 'nn_alpha': 0.0012004007825142755, 'hidden_layer_sizes': 64, 'activation': 'relu', 'solver': 'sgd'}. Best is trial 10 with value: 0.9866666666666667.
[I 2024-06-27 16:38:02,886] Trial 13 finished with value: 0.9866666666666667 and parameters: {'classifier': 'NeuralNetwork', 'nn_alpha': 0.06150798993403863, 'hidden_layer_sizes': 64, 'activation': 'logistic', 'solver': 'adam'}. Best is trial 10 with value: 0.9866666666666667.
[I 2024-06-27 16:38:03,174] Trial 14 finished with value: 0.98 and parameters: {'classifier': 'NeuralNetwork', 'nn_alpha': 0.07289958009403205, 'hidden_layer_sizes': 256, 'activation': 'tanh', 'solver': 'adam'}. Best is trial 10 with value: 0.9866666666666667.
[I 2024-06-27 16:38:03,275] Trial 15 finished with value: 0.9533333333333333 and parameters: {'classifier': 'SVC', 'svc_c': 351029233.8653627, 'gamma': 'scale', 'kernel': 'poly'}. Best is trial 10 with value: 0.9866666666666667.
[I 2024-06-27 16:38:03,511] Trial 16 finished with value: 0.9733333333333333 and parameters: {'classifier': 'NeuralNetwork', 'nn_alpha': 0.08097245503438186, 'hidden_layer_sizes': 512, 'activation': 'relu', 'solver': 'adam'}. Best is trial 10 with value: 0.9866666666666667.
[I 2024-06-27 16:38:03,966] Trial 17 finished with value: 0.98 and parameters: {'classifier': 'NeuralNetwork', 'nn_alpha': 0.00808008092164412, 'hidden_layer_sizes': 64, 'activation': 'logistic', 'solver': 'adam'}. Best is trial 10 with value: 0.9866666666666667.
[I 2024-06-27 16:38:04,493] Trial 18 finished with value: 0.96 and parameters: {'classifier': 'NeuralNetwork', 'nn_alpha': 0.00995683465910993, 'hidden_layer_sizes': 64, 'activation': 'tanh', 'solver': 'lbfgs'}. Best is trial 10 with value: 0.9866666666666667.
[I 2024-06-27 16:38:04,729] Trial 19 finished with value: 0.96 and parameters: {'classifier': 'SVC', 'svc_c': 9797085289.296762, 'gamma': 'scale', 'kernel': 'linear'}. Best is trial 10 with value: 0.9866666666666667.
[I 2024-06-27 16:38:05,651] Trial 20 finished with value: 0.98 and parameters: {'classifier': 'NeuralNetwork', 'nn_alpha': 0.021091292756292943, 'hidden_layer_sizes': 256, 'activation': 'logistic', 'solver': 'adam'}. Best is trial 10 with value: 0.9866666666666667.
[I 2024-06-27 16:38:06,841] Trial 21 finished with value: 0.9733333333333333 and parameters: {'classifier': 'NeuralNetwork', 'nn_alpha': 0.0004970628417406645, 'hidden_layer_sizes': 64, 'activation': 'logistic', 'solver': 'sgd'}. Best is trial 10 with value: 0.9866666666666667.
[I 2024-06-27 16:38:08,129] Trial 22 finished with value: 0.9733333333333333 and parameters: {'classifier': 'NeuralNetwork', 'nn_alpha': 0.0006337773837291609, 'hidden_layer_sizes': 64, 'activation': 'logistic', 'solver': 'sgd'}. Best is trial 10 with value: 0.9866666666666667.
[I 2024-06-27 16:38:08,437] Trial 23 finished with value: 0.98 and parameters: {'classifier': 'NeuralNetwork', 'nn_alpha': 0.0018784063728519943, 'hidden_layer_sizes': 64, 'activation': 'relu', 'solver': 'sgd'}. Best is trial 10 with value: 0.9866666666666667.
[I 2024-06-27 16:38:10,337] Trial 24 finished with value: 0.9733333333333333 and parameters: {'classifier': 'NeuralNetwork', 'nn_alpha': 0.00012022666529513025, 'hidden_layer_sizes': 128, 'activation': 'logistic', 'solver': 'sgd'}. Best is trial 10 with value: 0.9866666666666667.
[I 2024-06-27 16:38:16,204] Trial 25 finished with value: 0.96 and parameters: {'classifier': 'NeuralNetwork', 'nn_alpha': 0.0001371411674949785, 'hidden_layer_sizes': 512, 'activation': 'logistic', 'solver': 'sgd'}. Best is trial 10 with value: 0.9866666666666667.
[I 2024-06-27 16:38:16,440] Trial 26 finished with value: 0.98 and parameters: {'classifier': 'NeuralNetwork', 'nn_alpha': 0.002826227023344985, 'hidden_layer_sizes': 64, 'activation': 'relu', 'solver': 'adam'}. Best is trial 10 with value: 0.9866666666666667.
[I 2024-06-27 16:38:16,500] Trial 27 finished with value: 0.32 and parameters: {'classifier': 'SVC', 'svc_c': 1.862928610990403e-09, 'gamma': 'auto', 'kernel': 'poly'}. Best is trial 10 with value: 0.9866666666666667.
[I 2024-06-27 16:38:17,026] Trial 28 finished with value: 0.3333333333333333 and parameters: {'classifier': 'XGBoost', 'xgb_eta': 0.01035695383898935, 'xgb_max_depth': 3, 'xgb_min_child_weight': 94.80373136857595, 'xgb_subsample': 0.9729225183329824, 'xgb_colsample_bytree': 0.5169809988561687}. Best is trial 10 with value: 0.9866666666666667.
[I 2024-06-27 16:38:17,664] Trial 29 finished with value: 0.96 and parameters: {'classifier': 'XGBoost', 'xgb_eta': 0.05396040185758962, 'xgb_max_depth': 5, 'xgb_min_child_weight': 8.450982258493964e-05, 'xgb_subsample': 0.7667435231380652, 'xgb_colsample_bytree': 0.7587546968207197}. Best is trial 10 with value: 0.9866666666666667.
[I 2024-06-27 16:38:17,903] Trial 30 finished with value: 0.9733333333333333 and parameters: {'classifier': 'NeuralNetwork', 'nn_alpha': 0.025246139626703575, 'hidden_layer_sizes': 64, 'activation': 'logistic', 'solver': 'lbfgs'}. Best is trial 10 with value: 0.9866666666666667.
[I 2024-06-27 16:38:18,256] Trial 31 finished with value: 0.98 and parameters: {'classifier': 'NeuralNetwork', 'nn_alpha': 0.07998514880631681, 'hidden_layer_sizes': 256, 'activation': 'tanh', 'solver': 'adam'}. Best is trial 10 with value: 0.9866666666666667.
[I 2024-06-27 16:38:18,628] Trial 32 finished with value: 0.98 and parameters: {'classifier': 'NeuralNetwork', 'nn_alpha': 0.03467948082580797, 'hidden_layer_sizes': 256, 'activation': 'tanh', 'solver': 'adam'}. Best is trial 10 with value: 0.9866666666666667.
[I 2024-06-27 16:38:18,939] Trial 33 finished with value: 0.98 and parameters: {'classifier': 'NeuralNetwork', 'nn_alpha': 0.09597231189799535, 'hidden_layer_sizes': 256, 'activation': 'tanh', 'solver': 'adam'}. Best is trial 10 with value: 0.9866666666666667.
[I 2024-06-27 16:38:19,108] Trial 34 finished with value: 0.9466666666666667 and parameters: {'classifier': 'RandomForest', 'rf_max_depth': 2, 'rf_min_samples_split': 2, 'rf_min_samples_leaf': 10, 'rf_max_features': 'log2'}. Best is trial 10 with value: 0.9866666666666667.
[I 2024-06-27 16:38:19,845] Trial 35 finished with value: 0.9866666666666667 and parameters: {'classifier': 'NeuralNetwork', 'nn_alpha': 0.0036349504393204408, 'hidden_layer_sizes': 256, 'activation': 'tanh', 'solver': 'sgd'}. Best is trial 10 with value: 0.9866666666666667.
[I 2024-06-27 16:38:20,276] Trial 36 finished with value: 0.98 and parameters: {'classifier': 'NeuralNetwork', 'nn_alpha': 0.0036029985844792845, 'hidden_layer_sizes': 64, 'activation': 'tanh', 'solver': 'sgd'}. Best is trial 10 with value: 0.9866666666666667.
[I 2024-06-27 16:38:20,763] Trial 37 finished with value: 0.3333333333333333 and parameters: {'classifier': 'XGBoost', 'xgb_eta': 0.28410780240464384, 'xgb_max_depth': 5, 'xgb_min_child_weight': 68.68245330207066, 'xgb_subsample': 0.7399902689979044, 'xgb_colsample_bytree': 0.7857571763845265}. Best is trial 10 with value: 0.9866666666666667.
[I 2024-06-27 16:38:20,975] Trial 38 finished with value: 0.9466666666666667 and parameters: {'classifier': 'RandomForest', 'rf_max_depth': 6, 'rf_min_samples_split': 2, 'rf_min_samples_leaf': 10, 'rf_max_features': 'log2'}. Best is trial 10 with value: 0.9866666666666667.
[I 2024-06-27 16:38:21,378] Trial 39 finished with value: 0.9733333333333333 and parameters: {'classifier': 'NeuralNetwork', 'nn_alpha': 0.00021388766797174132, 'hidden_layer_sizes': 128, 'activation': 'relu', 'solver': 'sgd'}. Best is trial 10 with value: 0.9866666666666667.
[I 2024-06-27 16:38:21,397] Trial 40 finished with value: 0.9666666666666667 and parameters: {'classifier': 'SVC', 'svc_c': 3.77920546771311, 'gamma': 'auto', 'kernel': 'linear'}. Best is trial 10 with value: 0.9866666666666667.
[I 2024-06-27 16:38:22,090] Trial 41 finished with value: 0.9866666666666667 and parameters: {'classifier': 'NeuralNetwork', 'nn_alpha': 0.030462436992745975, 'hidden_layer_sizes': 256, 'activation': 'tanh', 'solver': 'sgd'}. Best is trial 10 with value: 0.9866666666666667.
[I 2024-06-27 16:38:22,812] Trial 42 finished with value: 0.9866666666666667 and parameters: {'classifier': 'NeuralNetwork', 'nn_alpha': 0.015982367648241198, 'hidden_layer_sizes': 256, 'activation': 'tanh', 'solver': 'sgd'}. Best is trial 10 with value: 0.9866666666666667.
[I 2024-06-27 16:38:23,515] Trial 43 finished with value: 0.9866666666666667 and parameters: {'classifier': 'NeuralNetwork', 'nn_alpha': 0.019398933996053854, 'hidden_layer_sizes': 256, 'activation': 'tanh', 'solver': 'sgd'}. Best is trial 10 with value: 0.9866666666666667.
[I 2024-06-27 16:38:24,281] Trial 44 finished with value: 0.98 and parameters: {'classifier': 'NeuralNetwork', 'nn_alpha': 0.011786053997515393, 'hidden_layer_sizes': 256, 'activation': 'tanh', 'solver': 'sgd'}. Best is trial 10 with value: 0.9866666666666667.
[I 2024-06-27 16:38:25,026] Trial 45 finished with value: 0.9866666666666667 and parameters: {'classifier': 'NeuralNetwork', 'nn_alpha': 0.00414657145751833, 'hidden_layer_sizes': 256, 'activation': 'tanh', 'solver': 'sgd'}. Best is trial 10 with value: 0.9866666666666667.
[I 2024-06-27 16:38:25,732] Trial 46 finished with value: 0.9866666666666667 and parameters: {'classifier': 'NeuralNetwork', 'nn_alpha': 0.03317161859347242, 'hidden_layer_sizes': 256, 'activation': 'tanh', 'solver': 'sgd'}. Best is trial 10 with value: 0.9866666666666667.
[I 2024-06-27 16:38:25,907] Trial 47 finished with value: 0.94 and parameters: {'classifier': 'RandomForest', 'rf_max_depth': 7, 'rf_min_samples_split': 8, 'rf_min_samples_leaf': 8, 'rf_max_features': 'sqrt'}. Best is trial 10 with value: 0.9866666666666667.
[I 2024-06-27 16:38:26,601] Trial 48 finished with value: 0.9866666666666667 and parameters: {'classifier': 'NeuralNetwork', 'nn_alpha': 0.04277008228311049, 'hidden_layer_sizes': 256, 'activation': 'tanh', 'solver': 'sgd'}. Best is trial 10 with value: 0.9866666666666667.
[I 2024-06-27 16:38:27,857] Trial 49 finished with value: 0.9866666666666667 and parameters: {'classifier': 'NeuralNetwork', 'nn_alpha': 0.00560432458492233, 'hidden_layer_sizes': 512, 'activation': 'tanh', 'solver': 'sgd'}. Best is trial 10 with value: 0.9866666666666667.
[I 2024-06-27 16:38:28,393] Trial 50 finished with value: 0.96 and parameters: {'classifier': 'XGBoost', 'xgb_eta': 0.05383415264545477, 'xgb_max_depth': 4, 'xgb_min_child_weight': 0.023574393856545993, 'xgb_subsample': 0.7493469010311274, 'xgb_colsample_bytree': 0.6287240170398875}. Best is trial 10 with value: 0.9866666666666667.
[I 2024-06-27 16:38:29,089] Trial 51 finished with value: 0.98 and parameters: {'classifier': 'NeuralNetwork', 'nn_alpha': 0.015533834847467797, 'hidden_layer_sizes': 256, 'activation': 'tanh', 'solver': 'sgd'}. Best is trial 10 with value: 0.9866666666666667.
[I 2024-06-27 16:38:29,801] Trial 52 finished with value: 0.98 and parameters: {'classifier': 'NeuralNetwork', 'nn_alpha': 0.016450502393228386, 'hidden_layer_sizes': 256, 'activation': 'tanh', 'solver': 'sgd'}. Best is trial 10 with value: 0.9866666666666667.
[I 2024-06-27 16:38:30,514] Trial 53 finished with value: 0.9866666666666667 and parameters: {'classifier': 'NeuralNetwork', 'nn_alpha': 0.04011379823238947, 'hidden_layer_sizes': 256, 'activation': 'tanh', 'solver': 'sgd'}. Best is trial 10 with value: 0.9866666666666667.
[I 2024-06-27 16:38:32,022] Trial 54 finished with value: 0.96 and parameters: {'classifier': 'NeuralNetwork', 'nn_alpha': 0.01403775647263821, 'hidden_layer_sizes': 256, 'activation': 'tanh', 'solver': 'lbfgs'}. Best is trial 10 with value: 0.9866666666666667.
[I 2024-06-27 16:38:32,540] Trial 55 finished with value: 0.9733333333333333 and parameters: {'classifier': 'NeuralNetwork', 'nn_alpha': 0.0067501353904946175, 'hidden_layer_sizes': 256, 'activation': 'relu', 'solver': 'sgd'}. Best is trial 10 with value: 0.9866666666666667.
[I 2024-06-27 16:38:33,060] Trial 56 finished with value: 0.9866666666666667 and parameters: {'classifier': 'NeuralNetwork', 'nn_alpha': 0.04922642919619124, 'hidden_layer_sizes': 128, 'activation': 'tanh', 'solver': 'sgd'}. Best is trial 10 with value: 0.9866666666666667.
[I 2024-06-27 16:38:33,080] Trial 57 finished with value: 0.9533333333333333 and parameters: {'classifier': 'SVC', 'svc_c': 0.3355798308584266, 'gamma': 'scale', 'kernel': 'rbf'}. Best is trial 10 with value: 0.9866666666666667.
[I 2024-06-27 16:38:33,606] Trial 58 finished with value: 0.98 and parameters: {'classifier': 'NeuralNetwork', 'nn_alpha': 0.021724049650697835, 'hidden_layer_sizes': 256, 'activation': 'relu', 'solver': 'sgd'}. Best is trial 10 with value: 0.9866666666666667.
[I 2024-06-27 16:38:34,355] Trial 59 finished with value: 0.9866666666666667 and parameters: {'classifier': 'NeuralNetwork', 'nn_alpha': 0.009236694144158007, 'hidden_layer_sizes': 256, 'activation': 'tanh', 'solver': 'sgd'}. Best is trial 10 with value: 0.9866666666666667.
[I 2024-06-27 16:38:34,472] Trial 60 finished with value: 0.96 and parameters: {'classifier': 'RandomForest', 'rf_max_depth': 14, 'rf_min_samples_split': 15, 'rf_min_samples_leaf': 7, 'rf_max_features': 'log2'}. Best is trial 10 with value: 0.9866666666666667.
[I 2024-06-27 16:38:35,222] Trial 61 finished with value: 0.9866666666666667 and parameters: {'classifier': 'NeuralNetwork', 'nn_alpha': 0.0028803383191265543, 'hidden_layer_sizes': 256, 'activation': 'tanh', 'solver': 'sgd'}. Best is trial 10 with value: 0.9866666666666667.
[I 2024-06-27 16:38:35,930] Trial 62 finished with value: 0.9866666666666667 and parameters: {'classifier': 'NeuralNetwork', 'nn_alpha': 0.003848446766882054, 'hidden_layer_sizes': 256, 'activation': 'tanh', 'solver': 'sgd'}. Best is trial 10 with value: 0.9866666666666667.
[I 2024-06-27 16:38:36,657] Trial 63 finished with value: 0.9866666666666667 and parameters: {'classifier': 'NeuralNetwork', 'nn_alpha': 0.007898745719913051, 'hidden_layer_sizes': 256, 'activation': 'tanh', 'solver': 'sgd'}. Best is trial 10 with value: 0.9866666666666667.
[I 2024-06-27 16:38:36,845] Trial 64 finished with value: 0.9666666666666667 and parameters: {'classifier': 'NeuralNetwork', 'nn_alpha': 0.001211597398036369, 'hidden_layer_sizes': 64, 'activation': 'tanh', 'solver': 'lbfgs'}. Best is trial 10 with value: 0.9866666666666667.
[I 2024-06-27 16:38:37,741] Trial 65 finished with value: 0.9733333333333333 and parameters: {'classifier': 'NeuralNetwork', 'nn_alpha': 0.0051672334405982005, 'hidden_layer_sizes': 512, 'activation': 'relu', 'solver': 'sgd'}. Best is trial 10 with value: 0.9866666666666667.
[I 2024-06-27 16:38:38,208] Trial 66 finished with value: 0.9866666666666667 and parameters: {'classifier': 'NeuralNetwork', 'nn_alpha': 0.024040416546517285, 'hidden_layer_sizes': 64, 'activation': 'logistic', 'solver': 'adam'}. Best is trial 10 with value: 0.9866666666666667.
[I 2024-06-27 16:38:38,935] Trial 67 finished with value: 0.98 and parameters: {'classifier': 'NeuralNetwork', 'nn_alpha': 0.0018446453370098486, 'hidden_layer_sizes': 256, 'activation': 'tanh', 'solver': 'sgd'}. Best is trial 10 with value: 0.9866666666666667.
[I 2024-06-27 16:38:38,955] Trial 68 finished with value: 0.96 and parameters: {'classifier': 'SVC', 'svc_c': 252.73898666456392, 'gamma': 'scale', 'kernel': 'poly'}. Best is trial 10 with value: 0.9866666666666667.
[I 2024-06-27 16:38:39,527] Trial 69 finished with value: 0.9733333333333333 and parameters: {'classifier': 'XGBoost', 'xgb_eta': 0.013176663376050083, 'xgb_max_depth': 7, 'xgb_min_child_weight': 1.2142964288461018e-05, 'xgb_subsample': 0.5105442257872257, 'xgb_colsample_bytree': 0.8645413772567182}. Best is trial 10 with value: 0.9866666666666667.
[I 2024-06-27 16:38:40,711] Trial 70 finished with value: 0.98 and parameters: {'classifier': 'NeuralNetwork', 'nn_alpha': 0.052342182301338525, 'hidden_layer_sizes': 64, 'activation': 'logistic', 'solver': 'sgd'}. Best is trial 10 with value: 0.9866666666666667.
[I 2024-06-27 16:38:41,449] Trial 71 finished with value: 0.9866666666666667 and parameters: {'classifier': 'NeuralNetwork', 'nn_alpha': 1.034524937519835e-05, 'hidden_layer_sizes': 256, 'activation': 'tanh', 'solver': 'sgd'}. Best is trial 10 with value: 0.9866666666666667.
[I 2024-06-27 16:38:42,146] Trial 72 finished with value: 0.9866666666666667 and parameters: {'classifier': 'NeuralNetwork', 'nn_alpha': 0.029786059349814667, 'hidden_layer_sizes': 256, 'activation': 'tanh', 'solver': 'sgd'}. Best is trial 10 with value: 0.9866666666666667.
[I 2024-06-27 16:38:42,863] Trial 73 finished with value: 0.9866666666666667 and parameters: {'classifier': 'NeuralNetwork', 'nn_alpha': 0.054749503049527685, 'hidden_layer_sizes': 256, 'activation': 'tanh', 'solver': 'sgd'}. Best is trial 10 with value: 0.9866666666666667.
[I 2024-06-27 16:38:43,601] Trial 74 finished with value: 0.9866666666666667 and parameters: {'classifier': 'NeuralNetwork', 'nn_alpha': 0.01707275580965196, 'hidden_layer_sizes': 256, 'activation': 'tanh', 'solver': 'sgd'}. Best is trial 10 with value: 0.9866666666666667.
[I 2024-06-27 16:38:43,820] Trial 75 finished with value: 0.9866666666666667 and parameters: {'classifier': 'NeuralNetwork', 'nn_alpha': 0.011565899354645472, 'hidden_layer_sizes': 64, 'activation': 'relu', 'solver': 'adam'}. Best is trial 10 with value: 0.9866666666666667.
[I 2024-06-27 16:38:47,000] Trial 76 finished with value: 0.96 and parameters: {'classifier': 'NeuralNetwork', 'nn_alpha': 0.06716549860070462, 'hidden_layer_sizes': 256, 'activation': 'logistic', 'solver': 'sgd'}. Best is trial 10 with value: 0.9866666666666667.
[I 2024-06-27 16:38:47,909] Trial 77 finished with value: 0.96 and parameters: {'classifier': 'NeuralNetwork', 'nn_alpha': 0.030021313764679224, 'hidden_layer_sizes': 128, 'activation': 'tanh', 'solver': 'lbfgs'}. Best is trial 10 with value: 0.9866666666666667.
[I 2024-06-27 16:38:48,138] Trial 78 finished with value: 0.98 and parameters: {'classifier': 'NeuralNetwork', 'nn_alpha': 4.010565864116718e-05, 'hidden_layer_sizes': 64, 'activation': 'tanh', 'solver': 'adam'}. Best is trial 10 with value: 0.9866666666666667.
[I 2024-06-27 16:38:51,351] Trial 79 finished with value: 0.96 and parameters: {'classifier': 'NeuralNetwork', 'nn_alpha': 0.0018217649607992937, 'hidden_layer_sizes': 256, 'activation': 'logistic', 'solver': 'sgd'}. Best is trial 10 with value: 0.9866666666666667.
