[I 2024-06-27 16:46:29,282] Trial 82 finished with value: 0.9866666666666667 and parameters: {'classifier': 'NeuralNetwork', 'nn_alpha': 0.019786367564056547, 'hidden_layer_sizes': 64, 'activation': 'relu', 'solver': 'adam'}. Best is trial 36 with value: 0.9866666666666667.
[I 2024-06-27 16:46:29,490] Trial 83 finished with value: 0.98 and parameters: {'classifier': 'NeuralNetwork', 'nn_alpha': 0.018640667592444413, 'hidden_layer_sizes': 64, 'activation': 'relu', 'solver': 'adam'}. Best is trial 36 with value: 0.9866666666666667.
[I 2024-06-27 16:46:29,697] Trial 84 finished with value: 0.9866666666666667 and parameters: {'classifier': 'NeuralNetwork', 'nn_alpha': 0.011803474715135142, 'hidden_layer_sizes': 64, 'activation': 'relu', 'solver': 'adam'}. Best is trial 36 with value: 0.9866666666666667.
[I 2024-06-27 16:46:29,914] Trial 85 finished with value: 0.98 and parameters: {'classifier': 'NeuralNetwork', 'nn_alpha': 0.00664981646312362, 'hidden_layer_sizes': 64, 'activation': 'relu', 'solver': 'adam'}. Best is trial 36 with value: 0.9866666666666667.
[I 2024-06-27 16:46:30,131] Trial 86 finished with value: 0.98 and parameters: {'classifier': 'NeuralNetwork', 'nn_alpha': 0.03583649609255857, 'hidden_layer_sizes': 256, 'activation': 'relu', 'solver': 'adam'}. Best is trial 36 with value: 0.9866666666666667.
[I 2024-06-27 16:46:30,606] Trial 87 finished with value: 0.9733333333333333 and parameters: {'classifier': 'NeuralNetwork', 'nn_alpha': 0.022739527629866, 'hidden_layer_sizes': 64, 'activation': 'logistic', 'solver': 'adam'}. Best is trial 36 with value: 0.9866666666666667.
[I 2024-06-27 16:46:30,869] Trial 88 finished with value: 0.9733333333333333 and parameters: {'classifier': 'NeuralNetwork', 'nn_alpha': 0.0036250214748646094, 'hidden_layer_sizes': 512, 'activation': 'relu', 'solver': 'adam'}. Best is trial 36 with value: 0.9866666666666667.
[I 2024-06-27 16:46:30,966] Trial 89 finished with value: 0.96 and parameters: {'classifier': 'RandomForest', 'rf_max_depth': 15, 'rf_min_samples_split': 15, 'rf_min_samples_leaf': 3, 'rf_max_features': 'sqrt'}. Best is trial 36 with value: 0.9866666666666667.
[I 2024-06-27 16:46:30,985] Trial 90 finished with value: 0.32 and parameters: {'classifier': 'SVC', 'svc_c': 0.00010605453185724631, 'gamma': 'scale', 'kernel': 'linear'}. Best is trial 36 with value: 0.9866666666666667.
[I 2024-06-27 16:46:31,182] Trial 91 finished with value: 0.98 and parameters: {'classifier': 'NeuralNetwork', 'nn_alpha': 0.012567780195302306, 'hidden_layer_sizes': 64, 'activation': 'relu', 'solver': 'adam'}. Best is trial 36 with value: 0.9866666666666667.
[I 2024-06-27 16:46:31,431] Trial 92 finished with value: 0.98 and parameters: {'classifier': 'NeuralNetwork', 'nn_alpha': 0.010762174638201083, 'hidden_layer_sizes': 64, 'activation': 'relu', 'solver': 'adam'}. Best is trial 36 with value: 0.9866666666666667.
[I 2024-06-27 16:46:31,681] Trial 93 finished with value: 0.98 and parameters: {'classifier': 'NeuralNetwork', 'nn_alpha': 0.029797134015854307, 'hidden_layer_sizes': 64, 'activation': 'relu', 'solver': 'adam'}. Best is trial 36 with value: 0.9866666666666667.
[I 2024-06-27 16:46:31,899] Trial 94 finished with value: 0.9733333333333333 and parameters: {'classifier': 'NeuralNetwork', 'nn_alpha': 0.01644016091645737, 'hidden_layer_sizes': 64, 'activation': 'relu', 'solver': 'adam'}. Best is trial 36 with value: 0.9866666666666667.
[I 2024-06-27 16:46:32,200] Trial 95 finished with value: 0.9733333333333333 and parameters: {'classifier': 'NeuralNetwork', 'nn_alpha': 0.04584295043127535, 'hidden_layer_sizes': 64, 'activation': 'relu', 'solver': 'sgd'}. Best is trial 36 with value: 0.9866666666666667.
[I 2024-06-27 16:46:32,472] Trial 96 finished with value: 0.98 and parameters: {'classifier': 'NeuralNetwork', 'nn_alpha': 0.07077482294613294, 'hidden_layer_sizes': 64, 'activation': 'tanh', 'solver': 'adam'}. Best is trial 36 with value: 0.9866666666666667.
[I 2024-06-27 16:46:32,702] Trial 97 finished with value: 0.98 and parameters: {'classifier': 'NeuralNetwork', 'nn_alpha': 0.04368375668359742, 'hidden_layer_sizes': 64, 'activation': 'relu', 'solver': 'adam'}. Best is trial 36 with value: 0.9866666666666667.
[I 2024-06-27 16:46:32,753] Trial 98 finished with value: 0.9733333333333333 and parameters: {'classifier': 'XGBoost', 'xgb_eta': 0.14021643252390031, 'xgb_max_depth': 9, 'xgb_min_child_weight': 0.0006391879534193866, 'xgb_subsample': 0.6155300278744867, 'xgb_colsample_bytree': 0.6358938693483769}. Best is trial 36 with value: 0.9866666666666667.
[I 2024-06-27 16:46:32,949] Trial 99 finished with value: 0.9866666666666667 and parameters: {'classifier': 'NeuralNetwork', 'nn_alpha': 0.027565830474438717, 'hidden_layer_sizes': 64, 'activation': 'relu', 'solver': 'adam'}. Best is trial 36 with value: 0.9866666666666667.
Traceback (most recent call last):
  File "F:\PycharmProjects\pythonProject\机器学习\好用的工具\optuna\分类比拼.py", line 137, in <module>
    wandb.plot.bar({"accuracy": trial.value})
                                ^^^^^
NameError: name 'trial' is not defined
FrozenTrial(number=36, state=1, values=[0.9866666666666667], datetime_start=datetime.datetime(2024, 6, 27, 16, 46, 16, 289620), datetime_complete=datetime.datetime(2024, 6, 27, 16, 46, 16, 514308), params={'classifier': 'NeuralNetwork', 'nn_alpha': 0.04689432117975763, 'hidden_layer_sizes': 64, 'activation': 'relu', 'solver': 'adam'}, user_attrs={}, system_attrs={}, intermediate_values={}, distributions={'classifier': CategoricalDistribution(choices=('SVC', 'RandomForest', 'NeuralNetwork', 'XGBoost')), 'nn_alpha': FloatDistribution(high=0.1, log=True, low=1e-05, step=None), 'hidden_layer_sizes': CategoricalDistribution(choices=(64, 128, 256, 512)), 'activation': CategoricalDistribution(choices=('relu', 'tanh', 'logistic')), 'solver': CategoricalDistribution(choices=('adam', 'lbfgs', 'sgd'))}, trial_id=36, value=None)