[I 2024-06-27 16:45:58,713] A new study created in memory with name: no-name-7906615a-de24-4724-babc-73dae848d87c
[I 2024-06-27 16:46:00,395] Trial 0 finished with value: 0.9466666666666667 and parameters: {'classifier': 'SVC', 'svc_c': 2276801043.757896, 'gamma': 'auto', 'kernel': 'poly'}. Best is trial 0 with value: 0.9466666666666667.
[I 2024-06-27 16:46:01,172] Trial 1 finished with value: 0.45999999999999996 and parameters: {'classifier': 'SVC', 'svc_c': 0.0011649898637835106, 'gamma': 'scale', 'kernel': 'linear'}. Best is trial 0 with value: 0.9466666666666667.
[I 2024-06-27 16:46:02,152] Trial 2 finished with value: 0.9666666666666667 and parameters: {'classifier': 'RandomForest', 'rf_max_depth': 7, 'rf_min_samples_split': 11, 'rf_min_samples_leaf': 4, 'rf_max_features': 'log2'}. Best is trial 2 with value: 0.9666666666666667.
[I 2024-06-27 16:46:03,058] Trial 3 finished with value: 0.9666666666666667 and parameters: {'classifier': 'NeuralNetwork', 'nn_alpha': 4.9963630111879865e-05, 'hidden_layer_sizes': 64, 'activation': 'logistic', 'solver': 'lbfgs'}. Best is trial 2 with value: 0.9666666666666667.
[I 2024-06-27 16:46:04,394] Trial 4 finished with value: 0.3333333333333333 and parameters: {'classifier': 'XGBoost', 'xgb_eta': 0.08544662549584768, 'xgb_max_depth': 8, 'xgb_min_child_weight': 53.75285215179577, 'xgb_subsample': 0.810359631096919, 'xgb_colsample_bytree': 0.6554976194986426}. Best is trial 2 with value: 0.9666666666666667.
[I 2024-06-27 16:46:05,114] Trial 5 finished with value: 0.32 and parameters: {'classifier': 'SVC', 'svc_c': 1.8560375826482198e-06, 'gamma': 'scale', 'kernel': 'poly'}. Best is trial 2 with value: 0.9666666666666667.
[I 2024-06-27 16:46:05,754] Trial 6 finished with value: 0.9533333333333333 and parameters: {'classifier': 'XGBoost', 'xgb_eta': 0.2991287775329054, 'xgb_max_depth': 3, 'xgb_min_child_weight': 0.1277644502866879, 'xgb_subsample': 0.9881516260904131, 'xgb_colsample_bytree': 0.9601818844246626}. Best is trial 2 with value: 0.9666666666666667.
[I 2024-06-27 16:46:06,414] Trial 7 finished with value: 0.96 and parameters: {'classifier': 'XGBoost', 'xgb_eta': 0.07763444748342647, 'xgb_max_depth': 8, 'xgb_min_child_weight': 2.3246970247352144e-05, 'xgb_subsample': 0.9102832766609795, 'xgb_colsample_bytree': 0.7829888602413828}. Best is trial 2 with value: 0.9666666666666667.
[I 2024-06-27 16:46:06,471] Trial 8 finished with value: 0.32 and parameters: {'classifier': 'SVC', 'svc_c': 1.7761055088656809e-10, 'gamma': 'scale', 'kernel': 'rbf'}. Best is trial 2 with value: 0.9666666666666667.
[I 2024-06-27 16:46:06,692] Trial 9 finished with value: 0.96 and parameters: {'classifier': 'RandomForest', 'rf_max_depth': 2, 'rf_min_samples_split': 15, 'rf_min_samples_leaf': 6, 'rf_max_features': 'sqrt'}. Best is trial 2 with value: 0.9666666666666667.
[I 2024-06-27 16:46:06,915] Trial 10 finished with value: 0.9666666666666667 and parameters: {'classifier': 'RandomForest', 'rf_max_depth': 17, 'rf_min_samples_split': 3, 'rf_min_samples_leaf': 1, 'rf_max_features': 'log2'}. Best is trial 2 with value: 0.9666666666666667.
[I 2024-06-27 16:46:07,100] Trial 11 finished with value: 0.9733333333333333 and parameters: {'classifier': 'NeuralNetwork', 'nn_alpha': 4.0247498379560334e-05, 'hidden_layer_sizes': 64, 'activation': 'logistic', 'solver': 'lbfgs'}. Best is trial 11 with value: 0.9733333333333333.
[I 2024-06-27 16:46:10,388] Trial 12 finished with value: 0.96 and parameters: {'classifier': 'NeuralNetwork', 'nn_alpha': 1.2636830373808519e-05, 'hidden_layer_sizes': 256, 'activation': 'logistic', 'solver': 'sgd'}. Best is trial 11 with value: 0.9733333333333333.
[I 2024-06-27 16:46:10,566] Trial 13 finished with value: 0.9533333333333333 and parameters: {'classifier': 'RandomForest', 'rf_max_depth': 6, 'rf_min_samples_split': 9, 'rf_min_samples_leaf': 10, 'rf_max_features': 'log2'}. Best is trial 11 with value: 0.9733333333333333.
[I 2024-06-27 16:46:10,793] Trial 14 finished with value: 0.98 and parameters: {'classifier': 'NeuralNetwork', 'nn_alpha': 0.05994396585048644, 'hidden_layer_sizes': 64, 'activation': 'relu', 'solver': 'adam'}. Best is trial 14 with value: 0.98.
[I 2024-06-27 16:46:11,009] Trial 15 finished with value: 0.98 and parameters: {'classifier': 'NeuralNetwork', 'nn_alpha': 0.08377186106380019, 'hidden_layer_sizes': 64, 'activation': 'relu', 'solver': 'adam'}. Best is trial 14 with value: 0.98.
[I 2024-06-27 16:46:11,214] Trial 16 finished with value: 0.98 and parameters: {'classifier': 'NeuralNetwork', 'nn_alpha': 0.09488935296673469, 'hidden_layer_sizes': 64, 'activation': 'relu', 'solver': 'adam'}. Best is trial 14 with value: 0.98.
[I 2024-06-27 16:46:11,462] Trial 17 finished with value: 0.9733333333333333 and parameters: {'classifier': 'NeuralNetwork', 'nn_alpha': 0.08647520518752809, 'hidden_layer_sizes': 512, 'activation': 'relu', 'solver': 'adam'}. Best is trial 14 with value: 0.98.
[I 2024-06-27 16:46:11,721] Trial 18 finished with value: 0.98 and parameters: {'classifier': 'NeuralNetwork', 'nn_alpha': 0.005077808878376346, 'hidden_layer_sizes': 128, 'activation': 'tanh', 'solver': 'adam'}. Best is trial 14 with value: 0.98.
[I 2024-06-27 16:46:11,925] Trial 19 finished with value: 0.9733333333333333 and parameters: {'classifier': 'NeuralNetwork', 'nn_alpha': 0.007789465610779389, 'hidden_layer_sizes': 64, 'activation': 'relu', 'solver': 'adam'}. Best is trial 14 with value: 0.98.
[I 2024-06-27 16:46:12,151] Trial 20 finished with value: 0.98 and parameters: {'classifier': 'NeuralNetwork', 'nn_alpha': 0.012466124785878739, 'hidden_layer_sizes': 64, 'activation': 'relu', 'solver': 'adam'}. Best is trial 14 with value: 0.98.
[I 2024-06-27 16:46:12,379] Trial 21 finished with value: 0.98 and parameters: {'classifier': 'NeuralNetwork', 'nn_alpha': 0.08563296105066348, 'hidden_layer_sizes': 64, 'activation': 'relu', 'solver': 'adam'}. Best is trial 14 with value: 0.98.
[I 2024-06-27 16:46:12,564] Trial 22 finished with value: 0.98 and parameters: {'classifier': 'NeuralNetwork', 'nn_alpha': 0.08367358381381093, 'hidden_layer_sizes': 64, 'activation': 'relu', 'solver': 'adam'}. Best is trial 14 with value: 0.98.
[I 2024-06-27 16:46:12,800] Trial 23 finished with value: 0.98 and parameters: {'classifier': 'NeuralNetwork', 'nn_alpha': 0.023921851195915465, 'hidden_layer_sizes': 64, 'activation': 'relu', 'solver': 'adam'}. Best is trial 14 with value: 0.98.
[I 2024-06-27 16:46:13,682] Trial 24 finished with value: 0.9733333333333333 and parameters: {'classifier': 'NeuralNetwork', 'nn_alpha': 0.0012427221880876938, 'hidden_layer_sizes': 512, 'activation': 'relu', 'solver': 'sgd'}. Best is trial 14 with value: 0.98.
[I 2024-06-27 16:46:13,920] Trial 25 finished with value: 0.98 and parameters: {'classifier': 'NeuralNetwork', 'nn_alpha': 0.027421264328727317, 'hidden_layer_sizes': 128, 'activation': 'tanh', 'solver': 'adam'}. Best is trial 14 with value: 0.98.
[I 2024-06-27 16:46:14,137] Trial 26 finished with value: 0.9733333333333333 and parameters: {'classifier': 'NeuralNetwork', 'nn_alpha': 0.0016269916893888593, 'hidden_layer_sizes': 256, 'activation': 'relu', 'solver': 'adam'}. Best is trial 14 with value: 0.98.
[I 2024-06-27 16:46:14,354] Trial 27 finished with value: 0.98 and parameters: {'classifier': 'NeuralNetwork', 'nn_alpha': 0.03180129426659219, 'hidden_layer_sizes': 64, 'activation': 'relu', 'solver': 'adam'}. Best is trial 14 with value: 0.98.
[I 2024-06-27 16:46:14,891] Trial 28 finished with value: 0.96 and parameters: {'classifier': 'XGBoost', 'xgb_eta': 0.010462973783804702, 'xgb_max_depth': 3, 'xgb_min_child_weight': 1.474562665990074e-05, 'xgb_subsample': 0.5008334529640093, 'xgb_colsample_bytree': 0.5095930312334774}. Best is trial 14 with value: 0.98.
[I 2024-06-27 16:46:14,908] Trial 29 finished with value: 0.96 and parameters: {'classifier': 'SVC', 'svc_c': 484362.2359424268, 'gamma': 'auto', 'kernel': 'rbf'}. Best is trial 14 with value: 0.98.
[I 2024-06-27 16:46:14,960] Trial 30 finished with value: 0.9666666666666667 and parameters: {'classifier': 'NeuralNetwork', 'nn_alpha': 0.00018426663614977198, 'hidden_layer_sizes': 64, 'activation': 'relu', 'solver': 'lbfgs'}. Best is trial 14 with value: 0.98.
[I 2024-06-27 16:46:15,218] Trial 31 finished with value: 0.98 and parameters: {'classifier': 'NeuralNetwork', 'nn_alpha': 0.005501808970322922, 'hidden_layer_sizes': 128, 'activation': 'tanh', 'solver': 'adam'}. Best is trial 14 with value: 0.98.
[I 2024-06-27 16:46:15,507] Trial 32 finished with value: 0.98 and parameters: {'classifier': 'NeuralNetwork', 'nn_alpha': 0.004041621193168232, 'hidden_layer_sizes': 128, 'activation': 'tanh', 'solver': 'adam'}. Best is trial 14 with value: 0.98.
[I 2024-06-27 16:46:15,745] Trial 33 finished with value: 0.9733333333333333 and parameters: {'classifier': 'NeuralNetwork', 'nn_alpha': 0.03940222836866943, 'hidden_layer_sizes': 128, 'activation': 'tanh', 'solver': 'adam'}. Best is trial 14 with value: 0.98.
[I 2024-06-27 16:46:16,271] Trial 34 finished with value: 0.98 and parameters: {'classifier': 'NeuralNetwork', 'nn_alpha': 0.014346489285666838, 'hidden_layer_sizes': 128, 'activation': 'tanh', 'solver': 'sgd'}. Best is trial 14 with value: 0.98.
[I 2024-06-27 16:46:16,289] Trial 35 finished with value: 0.9666666666666667 and parameters: {'classifier': 'SVC', 'svc_c': 24.174965327015887, 'gamma': 'auto', 'kernel': 'linear'}. Best is trial 14 with value: 0.98.
[I 2024-06-27 16:46:16,514] Trial 36 finished with value: 0.9866666666666667 and parameters: {'classifier': 'NeuralNetwork', 'nn_alpha': 0.04689432117975763, 'hidden_layer_sizes': 64, 'activation': 'relu', 'solver': 'adam'}. Best is trial 36 with value: 0.9866666666666667.
[I 2024-06-27 16:46:16,683] Trial 37 finished with value: 0.9466666666666667 and parameters: {'classifier': 'RandomForest', 'rf_max_depth': 27, 'rf_min_samples_split': 17, 'rf_min_samples_leaf': 10, 'rf_max_features': 'sqrt'}. Best is trial 36 with value: 0.9866666666666667.
[I 2024-06-27 16:46:16,721] Trial 38 finished with value: 0.3333333333333333 and parameters: {'classifier': 'XGBoost', 'xgb_eta': 0.010486260335205236, 'xgb_max_depth': 5, 'xgb_min_child_weight': 76.39828740047213, 'xgb_subsample': 0.5706795798188489, 'xgb_colsample_bytree': 0.9659098949149276}. Best is trial 36 with value: 0.9866666666666667.
[I 2024-06-27 16:46:16,938] Trial 39 finished with value: 0.9866666666666667 and parameters: {'classifier': 'NeuralNetwork', 'nn_alpha': 0.04686314097066722, 'hidden_layer_sizes': 64, 'activation': 'relu', 'solver': 'adam'}. Best is trial 36 with value: 0.9866666666666667.
[I 2024-06-27 16:46:16,957] Trial 40 finished with value: 0.9666666666666667 and parameters: {'classifier': 'SVC', 'svc_c': 222.80125505819177, 'gamma': 'scale', 'kernel': 'linear'}. Best is trial 36 with value: 0.9866666666666667.
[I 2024-06-27 16:46:17,174] Trial 41 finished with value: 0.9866666666666667 and parameters: {'classifier': 'NeuralNetwork', 'nn_alpha': 0.04770612054015414, 'hidden_layer_sizes': 64, 'activation': 'relu', 'solver': 'adam'}. Best is trial 36 with value: 0.9866666666666667.
[I 2024-06-27 16:46:17,390] Trial 42 finished with value: 0.98 and parameters: {'classifier': 'NeuralNetwork', 'nn_alpha': 0.037200398090946975, 'hidden_layer_sizes': 64, 'activation': 'relu', 'solver': 'adam'}. Best is trial 36 with value: 0.9866666666666667.
[I 2024-06-27 16:46:17,616] Trial 43 finished with value: 0.98 and parameters: {'classifier': 'NeuralNetwork', 'nn_alpha': 0.05034433824593762, 'hidden_layer_sizes': 64, 'activation': 'relu', 'solver': 'adam'}. Best is trial 36 with value: 0.9866666666666667.
[I 2024-06-27 16:46:17,833] Trial 44 finished with value: 0.9733333333333333 and parameters: {'classifier': 'NeuralNetwork', 'nn_alpha': 0.01766513918811479, 'hidden_layer_sizes': 64, 'activation': 'relu', 'solver': 'adam'}. Best is trial 36 with value: 0.9866666666666667.
[I 2024-06-27 16:46:18,347] Trial 45 finished with value: 0.96 and parameters: {'classifier': 'XGBoost', 'xgb_eta': 0.030880360420593268, 'xgb_max_depth': 5, 'xgb_min_child_weight': 0.013168943812729593, 'xgb_subsample': 0.6810625093914844, 'xgb_colsample_bytree': 0.7642571763364104}. Best is trial 36 with value: 0.9866666666666667.
[I 2024-06-27 16:46:18,526] Trial 46 finished with value: 0.9666666666666667 and parameters: {'classifier': 'RandomForest', 'rf_max_depth': 2, 'rf_min_samples_split': 2, 'rf_min_samples_leaf': 6, 'rf_max_features': 'sqrt'}. Best is trial 36 with value: 0.9866666666666667.
[I 2024-06-27 16:46:18,732] Trial 47 finished with value: 0.98 and parameters: {'classifier': 'NeuralNetwork', 'nn_alpha': 0.05071411870094114, 'hidden_layer_sizes': 64, 'activation': 'relu', 'solver': 'adam'}. Best is trial 36 with value: 0.9866666666666667.
[I 2024-06-27 16:46:18,938] Trial 48 finished with value: 0.9866666666666667 and parameters: {'classifier': 'NeuralNetwork', 'nn_alpha': 0.012317779996282134, 'hidden_layer_sizes': 64, 'activation': 'relu', 'solver': 'adam'}. Best is trial 36 with value: 0.9866666666666667.
[I 2024-06-27 16:46:19,145] Trial 49 finished with value: 0.98 and parameters: {'classifier': 'NeuralNetwork', 'nn_alpha': 0.01079783787390849, 'hidden_layer_sizes': 64, 'activation': 'relu', 'solver': 'adam'}. Best is trial 36 with value: 0.9866666666666667.
[I 2024-06-27 16:46:19,164] Trial 50 finished with value: 0.32 and parameters: {'classifier': 'SVC', 'svc_c': 2.0358304241822696e-10, 'gamma': 'auto', 'kernel': 'poly'}. Best is trial 36 with value: 0.9866666666666667.
[I 2024-06-27 16:46:19,361] Trial 51 finished with value: 0.98 and parameters: {'classifier': 'NeuralNetwork', 'nn_alpha': 0.052599028403287174, 'hidden_layer_sizes': 64, 'activation': 'relu', 'solver': 'adam'}. Best is trial 36 with value: 0.9866666666666667.
[I 2024-06-27 16:46:19,568] Trial 52 finished with value: 0.9733333333333333 and parameters: {'classifier': 'NeuralNetwork', 'nn_alpha': 0.021693394499045584, 'hidden_layer_sizes': 64, 'activation': 'relu', 'solver': 'adam'}. Best is trial 36 with value: 0.9866666666666667.
[I 2024-06-27 16:46:19,765] Trial 53 finished with value: 0.9666666666666667 and parameters: {'classifier': 'NeuralNetwork', 'nn_alpha': 0.04605877445459088, 'hidden_layer_sizes': 64, 'activation': 'relu', 'solver': 'lbfgs'}. Best is trial 36 with value: 0.9866666666666667.
[I 2024-06-27 16:46:20,013] Trial 54 finished with value: 0.94 and parameters: {'classifier': 'NeuralNetwork', 'nn_alpha': 0.0002744933876485382, 'hidden_layer_sizes': 64, 'activation': 'logistic', 'solver': 'lbfgs'}. Best is trial 36 with value: 0.9866666666666667.
[I 2024-06-27 16:46:22,919] Trial 55 finished with value: 0.6333333333333333 and parameters: {'classifier': 'NeuralNetwork', 'nn_alpha': 0.06322874710570407, 'hidden_layer_sizes': 256, 'activation': 'logistic', 'solver': 'sgd'}. Best is trial 36 with value: 0.9866666666666667.
[I 2024-06-27 16:46:23,026] Trial 56 finished with value: 0.96 and parameters: {'classifier': 'RandomForest', 'rf_max_depth': 7, 'rf_min_samples_split': 7, 'rf_min_samples_leaf': 1, 'rf_max_features': 'sqrt'}. Best is trial 36 with value: 0.9866666666666667.
[I 2024-06-27 16:46:23,234] Trial 57 finished with value: 0.9733333333333333 and parameters: {'classifier': 'NeuralNetwork', 'nn_alpha': 0.022034375714478006, 'hidden_layer_sizes': 64, 'activation': 'relu', 'solver': 'adam'}. Best is trial 36 with value: 0.9866666666666667.
[I 2024-06-27 16:46:23,451] Trial 58 finished with value: 0.9733333333333333 and parameters: {'classifier': 'NeuralNetwork', 'nn_alpha': 0.0969785677737181, 'hidden_layer_sizes': 512, 'activation': 'relu', 'solver': 'adam'}. Best is trial 36 with value: 0.9866666666666667.
[I 2024-06-27 16:46:23,502] Trial 59 finished with value: 0.9666666666666667 and parameters: {'classifier': 'XGBoost', 'xgb_eta': 0.27635484525246423, 'xgb_max_depth': 4, 'xgb_min_child_weight': 0.021580209739637257, 'xgb_subsample': 0.7135443024003673, 'xgb_colsample_bytree': 0.5237101394138897}. Best is trial 36 with value: 0.9866666666666667.
[I 2024-06-27 16:46:23,957] Trial 60 finished with value: 0.98 and parameters: {'classifier': 'NeuralNetwork', 'nn_alpha': 0.0022411056108787193, 'hidden_layer_sizes': 64, 'activation': 'logistic', 'solver': 'adam'}. Best is trial 36 with value: 0.9866666666666667.
[I 2024-06-27 16:46:24,154] Trial 61 finished with value: 0.9866666666666667 and parameters: {'classifier': 'NeuralNetwork', 'nn_alpha': 0.07227181739846472, 'hidden_layer_sizes': 64, 'activation': 'relu', 'solver': 'adam'}. Best is trial 36 with value: 0.9866666666666667.
[I 2024-06-27 16:46:24,361] Trial 62 finished with value: 0.98 and parameters: {'classifier': 'NeuralNetwork', 'nn_alpha': 0.06166234625100576, 'hidden_layer_sizes': 64, 'activation': 'relu', 'solver': 'adam'}. Best is trial 36 with value: 0.9866666666666667.
[I 2024-06-27 16:46:24,546] Trial 63 finished with value: 0.98 and parameters: {'classifier': 'NeuralNetwork', 'nn_alpha': 0.03446699652147804, 'hidden_layer_sizes': 64, 'activation': 'relu', 'solver': 'adam'}. Best is trial 36 with value: 0.9866666666666667.
[I 2024-06-27 16:46:24,733] Trial 64 finished with value: 0.98 and parameters: {'classifier': 'NeuralNetwork', 'nn_alpha': 0.099634609019521, 'hidden_layer_sizes': 64, 'activation': 'relu', 'solver': 'adam'}. Best is trial 36 with value: 0.9866666666666667.
[I 2024-06-27 16:46:24,960] Trial 65 finished with value: 0.98 and parameters: {'classifier': 'NeuralNetwork', 'nn_alpha': 1.0018473568475399e-05, 'hidden_layer_sizes': 64, 'activation': 'relu', 'solver': 'adam'}. Best is trial 36 with value: 0.9866666666666667.
[I 2024-06-27 16:46:25,167] Trial 66 finished with value: 0.9733333333333333 and parameters: {'classifier': 'NeuralNetwork', 'nn_alpha': 0.06414519891657999, 'hidden_layer_sizes': 256, 'activation': 'relu', 'solver': 'adam'}. Best is trial 36 with value: 0.9866666666666667.
[I 2024-06-27 16:46:25,395] Trial 67 finished with value: 0.98 and parameters: {'classifier': 'NeuralNetwork', 'nn_alpha': 0.0005071386189166366, 'hidden_layer_sizes': 64, 'activation': 'relu', 'solver': 'adam'}. Best is trial 36 with value: 0.9866666666666667.
[I 2024-06-27 16:46:26,202] Trial 68 finished with value: 0.98 and parameters: {'classifier': 'NeuralNetwork', 'nn_alpha': 0.008878072840336858, 'hidden_layer_sizes': 512, 'activation': 'relu', 'solver': 'sgd'}. Best is trial 36 with value: 0.9866666666666667.
[I 2024-06-27 16:46:26,372] Trial 69 finished with value: 0.9466666666666667 and parameters: {'classifier': 'RandomForest', 'rf_max_depth': 4, 'rf_min_samples_split': 20, 'rf_min_samples_leaf': 8, 'rf_max_features': 'log2'}. Best is trial 36 with value: 0.9866666666666667.
[I 2024-06-27 16:46:26,475] Trial 70 finished with value: 0.9666666666666667 and parameters: {'classifier': 'NeuralNetwork', 'nn_alpha': 0.029097165644530503, 'hidden_layer_sizes': 64, 'activation': 'relu', 'solver': 'lbfgs'}. Best is trial 36 with value: 0.9866666666666667.
[I 2024-06-27 16:46:26,671] Trial 71 finished with value: 0.9733333333333333 and parameters: {'classifier': 'NeuralNetwork', 'nn_alpha': 0.09857012303715504, 'hidden_layer_sizes': 64, 'activation': 'relu', 'solver': 'adam'}. Best is trial 36 with value: 0.9866666666666667.
[I 2024-06-27 16:46:26,890] Trial 72 finished with value: 0.98 and parameters: {'classifier': 'NeuralNetwork', 'nn_alpha': 0.06542092999820054, 'hidden_layer_sizes': 64, 'activation': 'relu', 'solver': 'adam'}. Best is trial 36 with value: 0.9866666666666667.
[I 2024-06-27 16:46:27,097] Trial 73 finished with value: 0.9866666666666667 and parameters: {'classifier': 'NeuralNetwork', 'nn_alpha': 0.037757070738042325, 'hidden_layer_sizes': 64, 'activation': 'relu', 'solver': 'adam'}. Best is trial 36 with value: 0.9866666666666667.
[I 2024-06-27 16:46:27,314] Trial 74 finished with value: 0.9866666666666667 and parameters: {'classifier': 'NeuralNetwork', 'nn_alpha': 0.019939006149514327, 'hidden_layer_sizes': 64, 'activation': 'relu', 'solver': 'adam'}. Best is trial 36 with value: 0.9866666666666667.
[I 2024-06-27 16:46:27,533] Trial 75 finished with value: 0.98 and parameters: {'classifier': 'NeuralNetwork', 'nn_alpha': 0.01627741317341682, 'hidden_layer_sizes': 64, 'activation': 'relu', 'solver': 'adam'}. Best is trial 36 with value: 0.9866666666666667.
[I 2024-06-27 16:46:27,552] Trial 76 finished with value: 0.96 and parameters: {'classifier': 'SVC', 'svc_c': 8729298413.398523, 'gamma': 'auto', 'kernel': 'rbf'}. Best is trial 36 with value: 0.9866666666666667.
[I 2024-06-27 16:46:27,780] Trial 77 finished with value: 0.9733333333333333 and parameters: {'classifier': 'NeuralNetwork', 'nn_alpha': 2.8974673325636702e-05, 'hidden_layer_sizes': 64, 'activation': 'relu', 'solver': 'adam'}. Best is trial 36 with value: 0.9866666666666667.
[I 2024-06-27 16:46:28,463] Trial 78 finished with value: 0.96 and parameters: {'classifier': 'XGBoost', 'xgb_eta': 0.03446640351239466, 'xgb_max_depth': 6, 'xgb_min_child_weight': 0.7053931527407997, 'xgb_subsample': 0.8472722445833752, 'xgb_colsample_bytree': 0.8570510838856572}. Best is trial 36 with value: 0.9866666666666667.
[I 2024-06-27 16:46:28,650] Trial 79 finished with value: 0.98 and parameters: {'classifier': 'NeuralNetwork', 'nn_alpha': 0.026219410577374692, 'hidden_layer_sizes': 64, 'activation': 'relu', 'solver': 'adam'}. Best is trial 36 with value: 0.9866666666666667.
[I 2024-06-27 16:46:28,868] Trial 80 finished with value: 0.9866666666666667 and parameters: {'classifier': 'NeuralNetwork', 'nn_alpha': 0.041124371598961346, 'hidden_layer_sizes': 64, 'activation': 'relu', 'solver': 'adam'}. Best is trial 36 with value: 0.9866666666666667.
[I 2024-06-27 16:46:29,074] Trial 81 finished with value: 0.98 and parameters: {'classifier': 'NeuralNetwork', 'nn_alpha': 0.040164862843194406, 'hidden_layer_sizes': 64, 'activation': 'relu', 'solver': 'adam'}. Best is trial 36 with value: 0.9866666666666667.
