[I 2024-06-30 14:07:40,112] A new study created in memory with name: no-name-53c6eea8-efbf-45a1-b94a-92c7d005c05e
[I 2024-06-30 14:07:41,127] Trial 0 finished with value: 0.9666666666666667 and parameters: {'classifier': 'XGBoost', 'xgb_eta': 0.04086823871029331, 'xgb_max_depth': 4, 'xgb_min_child_weight': 0.0012188344298312854, 'xgb_subsample': 0.6330215572759402, 'xgb_colsample_bytree': 0.6581894483623845}. Best is trial 0 with value: 0.9666666666666667.
[I 2024-06-30 14:07:41,161] Trial 1 finished with value: 0.96 and parameters: {'classifier': 'SVC', 'svc_c': 1086130.47262645, 'gamma': 'scale', 'kernel': 'rbf'}. Best is trial 0 with value: 0.9666666666666667.
[I 2024-06-30 14:07:46,919] Trial 2 finished with value: 0.98 and parameters: {'classifier': 'NeuralNetwork', 'nn_alpha': 3.8384844906654606e-05, 'hidden_layer_sizes': 256, 'activation': 'logistic', 'solver': 'adam'}. Best is trial 2 with value: 0.98.
[I 2024-06-30 14:07:47,351] Trial 3 finished with value: 0.96 and parameters: {'classifier': 'XGBoost', 'xgb_eta': 0.1405928027523158, 'xgb_max_depth': 5, 'xgb_min_child_weight': 0.0004458411957458991, 'xgb_subsample': 0.7550381596149366, 'xgb_colsample_bytree': 0.812245090909193}. Best is trial 2 with value: 0.98.
[I 2024-06-30 14:07:47,375] Trial 4 finished with value: 0.32 and parameters: {'classifier': 'SVC', 'svc_c': 1.9424550599227354e-09, 'gamma': 'auto', 'kernel': 'rbf'}. Best is trial 2 with value: 0.98.
[I 2024-06-30 14:07:47,825] Trial 5 finished with value: 0.96 and parameters: {'classifier': 'XGBoost', 'xgb_eta': 0.05261361332525123, 'xgb_max_depth': 8, 'xgb_min_child_weight': 0.0006586886608424369, 'xgb_subsample': 0.9649927634565714, 'xgb_colsample_bytree': 0.991237163689618}. Best is trial 2 with value: 0.98.
[I 2024-06-30 14:07:47,850] Trial 6 finished with value: 0.96 and parameters: {'classifier': 'SVC', 'svc_c': 5357031552.410281, 'gamma': 'scale', 'kernel': 'rbf'}. Best is trial 2 with value: 0.98.
[I 2024-06-30 14:07:48,514] Trial 7 finished with value: 0.96 and parameters: {'classifier': 'RandomForest', 'rf_max_depth': 2, 'rf_min_samples_split': 9, 'rf_min_samples_leaf': 3, 'rf_max_features': 'sqrt'}. Best is trial 2 with value: 0.98.
[I 2024-06-30 14:07:48,897] Trial 8 finished with value: 0.9666666666666667 and parameters: {'classifier': 'XGBoost', 'xgb_eta': 0.221427299356725, 'xgb_max_depth': 6, 'xgb_min_child_weight': 2.077274010714863e-05, 'xgb_subsample': 0.6357686232552268, 'xgb_colsample_bytree': 0.636250624457994}. Best is trial 2 with value: 0.98.
[I 2024-06-30 14:07:49,067] Trial 9 finished with value: 0.9533333333333333 and parameters: {'classifier': 'SVC', 'svc_c': 1509446800.1595614, 'gamma': 'scale', 'kernel': 'poly'}. Best is trial 2 with value: 0.98.
Traceback (most recent call last):
  File "F:\PycharmProjects\pythonProject\机器学习\好用的工具\optuna\分类比拼.py", line 76, in <module>
    wandb.plot.bar({"accuracy": study.best_trial})
TypeError: bar() missing 2 required positional arguments: 'label' and 'value'
FrozenTrial(number=2, state=1, values=[0.98], datetime_start=datetime.datetime(2024, 6, 30, 14, 7, 41, 161338), datetime_complete=datetime.datetime(2024, 6, 30, 14, 7, 46, 918396), params={'classifier': 'NeuralNetwork', 'nn_alpha': 3.8384844906654606e-05, 'hidden_layer_sizes': 256, 'activation': 'logistic', 'solver': 'adam'}, user_attrs={}, system_attrs={}, intermediate_values={}, distributions={'classifier': CategoricalDistribution(choices=('SVC', 'RandomForest', 'NeuralNetwork', 'XGBoost')), 'nn_alpha': FloatDistribution(high=0.1, log=True, low=1e-05, step=None), 'hidden_layer_sizes': CategoricalDistribution(choices=(64, 128, 256, 512)), 'activation': CategoricalDistribution(choices=('relu', 'tanh', 'logistic')), 'solver': CategoricalDistribution(choices=('adam', 'lbfgs', 'sgd', 'adagrad', 'adadelta'))}, trial_id=2, value=None)