
[I 2024-06-27 16:48:44,353] A new study created in memory with name: no-name-13a2fc23-46da-498d-bd67-f03f9885e0d7
[I 2024-06-27 16:48:47,495] Trial 0 finished with value: 0.98 and parameters: {'classifier': 'NeuralNetwork', 'nn_alpha': 0.00013720394655021057, 'hidden_layer_sizes': 64, 'activation': 'logistic', 'solver': 'sgd'}. Best is trial 0 with value: 0.98.
[I 2024-06-27 16:48:50,053] Trial 1 finished with value: 0.9733333333333333 and parameters: {'classifier': 'NeuralNetwork', 'nn_alpha': 4.612888444564182e-05, 'hidden_layer_sizes': 512, 'activation': 'logistic', 'solver': 'lbfgs'}. Best is trial 0 with value: 0.98.
[I 2024-06-27 16:48:51,021] Trial 2 finished with value: 0.9466666666666667 and parameters: {'classifier': 'RandomForest', 'rf_max_depth': 10, 'rf_min_samples_split': 5, 'rf_min_samples_leaf': 3, 'rf_max_features': 'sqrt'}. Best is trial 0 with value: 0.98.
[I 2024-06-27 16:48:52,282] Trial 3 finished with value: 0.98 and parameters: {'classifier': 'NeuralNetwork', 'nn_alpha': 0.08847830566586795, 'hidden_layer_sizes': 128, 'activation': 'tanh', 'solver': 'sgd'}. Best is trial 0 with value: 0.98.
[I 2024-06-27 16:48:53,543] Trial 4 finished with value: 0.98 and parameters: {'classifier': 'NeuralNetwork', 'nn_alpha': 0.030415611345329892, 'hidden_layer_sizes': 64, 'activation': 'relu', 'solver': 'sgd'}. Best is trial 0 with value: 0.98.
[I 2024-06-27 16:48:54,865] Trial 5 finished with value: 0.9666666666666667 and parameters: {'classifier': 'XGBoost', 'xgb_eta': 0.01721481872103034, 'xgb_max_depth': 8, 'xgb_min_child_weight': 0.0010672868647101964, 'xgb_subsample': 0.6653907975681574, 'xgb_colsample_bytree': 0.6373837439219312}. Best is trial 0 with value: 0.98.
[I 2024-06-27 16:48:55,587] Trial 6 finished with value: 0.3333333333333333 and parameters: {'classifier': 'XGBoost', 'xgb_eta': 0.022780070343854732, 'xgb_max_depth': 6, 'xgb_min_child_weight': 18.74578212501367, 'xgb_subsample': 0.6050574510615643, 'xgb_colsample_bytree': 0.7714834018589575}. Best is trial 0 with value: 0.98.
[I 2024-06-27 16:48:55,820] Trial 7 finished with value: 0.9466666666666667 and parameters: {'classifier': 'RandomForest', 'rf_max_depth': 3, 'rf_min_samples_split': 20, 'rf_min_samples_leaf': 3, 'rf_max_features': 'sqrt'}. Best is trial 0 with value: 0.98.
[I 2024-06-27 16:48:55,886] Trial 8 finished with value: 0.96 and parameters: {'classifier': 'SVC', 'svc_c': 0.3989277064128039, 'gamma': 'auto', 'kernel': 'poly'}. Best is trial 0 with value: 0.98.
[I 2024-06-27 16:48:55,953] Trial 9 finished with value: 0.9733333333333333 and parameters: {'classifier': 'SVC', 'svc_c': 2.312949522809141, 'gamma': 'auto', 'kernel': 'rbf'}. Best is trial 0 with value: 0.98.
Traceback (most recent call last):
  File "F:\PycharmProjects\pythonProject\机器学习\好用的工具\optuna\分类比拼.py", line 137, in <module>
    wandb.plot.bar({"accuracy": study.best_trial})
TypeError: bar() missing 2 required positional arguments: 'label' and 'value'
FrozenTrial(number=0, state=1, values=[0.98], datetime_start=datetime.datetime(2024, 6, 27, 16, 48, 44, 353328), datetime_complete=datetime.datetime(2024, 6, 27, 16, 48, 47, 495341), params={'classifier': 'NeuralNetwork', 'nn_alpha': 0.00013720394655021057, 'hidden_layer_sizes': 64, 'activation': 'logistic', 'solver': 'sgd'}, user_attrs={}, system_attrs={}, intermediate_values={}, distributions={'classifier': CategoricalDistribution(choices=('SVC', 'RandomForest', 'NeuralNetwork', 'XGBoost')), 'nn_alpha': FloatDistribution(high=0.1, log=True, low=1e-05, step=None), 'hidden_layer_sizes': CategoricalDistribution(choices=(64, 128, 256, 512)), 'activation': CategoricalDistribution(choices=('relu', 'tanh', 'logistic')), 'solver': CategoricalDistribution(choices=('adam', 'lbfgs', 'sgd'))}, trial_id=0, value=None)