[I 2024-08-19 18:53:51,869] Trial 80 finished with value: 0.9866666666666667 and parameters: {'classifier': 'NeuralNetwork', 'nn_alpha': 0.0010207945126463139, 'hidden_layer_sizes': 128, 'activation': 'tanh', 'solver': 'sgd'}. Best is trial 7 with value: 0.9866666666666667.
[I 2024-08-19 18:53:55,703] Trial 81 finished with value: 0.9866666666666667 and parameters: {'classifier': 'NeuralNetwork', 'nn_alpha': 0.0005565552446638006, 'hidden_layer_sizes': 512, 'activation': 'tanh', 'solver': 'sgd'}. Best is trial 7 with value: 0.9866666666666667.
[I 2024-08-19 18:53:59,572] Trial 82 finished with value: 0.9866666666666667 and parameters: {'classifier': 'NeuralNetwork', 'nn_alpha': 0.000588424326575653, 'hidden_layer_sizes': 512, 'activation': 'tanh', 'solver': 'sgd'}. Best is trial 7 with value: 0.9866666666666667.
[I 2024-08-19 18:54:03,621] Trial 83 finished with value: 0.9866666666666667 and parameters: {'classifier': 'NeuralNetwork', 'nn_alpha': 0.00013082092540139115, 'hidden_layer_sizes': 512, 'activation': 'tanh', 'solver': 'sgd'}. Best is trial 7 with value: 0.9866666666666667.
[I 2024-08-19 18:54:04,552] Trial 84 finished with value: 0.9733333333333333 and parameters: {'classifier': 'NeuralNetwork', 'nn_alpha': 0.00023707312093393398, 'hidden_layer_sizes': 512, 'activation': 'relu', 'solver': 'adam'}. Best is trial 7 with value: 0.9866666666666667.
[I 2024-08-19 18:54:05,954] Trial 85 finished with value: 0.98 and parameters: {'classifier': 'NeuralNetwork', 'nn_alpha': 0.0004418214840647852, 'hidden_layer_sizes': 64, 'activation': 'tanh', 'solver': 'sgd'}. Best is trial 7 with value: 0.9866666666666667.
[I 2024-08-19 18:54:06,278] Trial 86 finished with value: 0.9666666666666667 and parameters: {'classifier': 'RandomForest', 'rf_max_depth': 5, 'rf_min_samples_split': 7, 'rf_min_samples_leaf': 4, 'rf_max_features': 'log2'}. Best is trial 7 with value: 0.9866666666666667.
[I 2024-08-19 18:54:11,543] Trial 87 finished with value: 0.9666666666666667 and parameters: {'classifier': 'NeuralNetwork', 'nn_alpha': 0.012495692051993915, 'hidden_layer_sizes': 512, 'activation': 'tanh', 'solver': 'lbfgs'}. Best is trial 7 with value: 0.9866666666666667.
[I 2024-08-19 18:54:11,559] Trial 88 finished with value: 0.9266666666666666 and parameters: {'classifier': 'DecisionTree', 'dt_max_depth': 2, 'dt_min_samples_split': 7, 'dt_min_samples_leaf': 8, 'dt_max_features': 'log2'}. Best is trial 7 with value: 0.9866666666666667.
[I 2024-08-19 18:54:28,759] Trial 89 finished with value: 0.96 and parameters: {'classifier': 'NeuralNetwork', 'nn_alpha': 0.0023154877733139257, 'hidden_layer_sizes': 512, 'activation': 'logistic', 'solver': 'sgd'}. Best is trial 7 with value: 0.9866666666666667.
[I 2024-08-19 18:54:30,141] Trial 90 finished with value: 0.98 and parameters: {'classifier': 'NeuralNetwork', 'nn_alpha': 0.001274951446954529, 'hidden_layer_sizes': 512, 'activation': 'tanh', 'solver': 'adam'}. Best is trial 7 with value: 0.9866666666666667.
[I 2024-08-19 18:54:34,063] Trial 91 finished with value: 0.9866666666666667 and parameters: {'classifier': 'NeuralNetwork', 'nn_alpha': 9.984638756882009e-05, 'hidden_layer_sizes': 512, 'activation': 'tanh', 'solver': 'sgd'}. Best is trial 7 with value: 0.9866666666666667.
[I 2024-08-19 18:54:36,418] Trial 92 finished with value: 0.9866666666666667 and parameters: {'classifier': 'NeuralNetwork', 'nn_alpha': 7.53767815017979e-05, 'hidden_layer_sizes': 256, 'activation': 'tanh', 'solver': 'sgd'}. Best is trial 7 with value: 0.9866666666666667.
[I 2024-08-19 18:54:40,308] Trial 93 finished with value: 0.9866666666666667 and parameters: {'classifier': 'NeuralNetwork', 'nn_alpha': 0.00016930980786041688, 'hidden_layer_sizes': 512, 'activation': 'tanh', 'solver': 'sgd'}. Best is trial 7 with value: 0.9866666666666667.
[I 2024-08-19 18:54:44,204] Trial 94 finished with value: 0.9866666666666667 and parameters: {'classifier': 'NeuralNetwork', 'nn_alpha': 5.907995343654512e-05, 'hidden_layer_sizes': 512, 'activation': 'tanh', 'solver': 'sgd'}. Best is trial 7 with value: 0.9866666666666667.
[I 2024-08-19 18:54:44,220] Trial 95 finished with value: 0.9666666666666667 and parameters: {'classifier': 'SVC', 'svc_c': 1892.7423720884208, 'gamma': 'auto', 'kernel': 'linear'}. Best is trial 7 with value: 0.9866666666666667.
[I 2024-08-19 18:54:45,585] Trial 96 finished with value: 0.9866666666666667 and parameters: {'classifier': 'NeuralNetwork', 'nn_alpha': 0.00032571820239264763, 'hidden_layer_sizes': 128, 'activation': 'relu', 'solver': 'sgd'}. Best is trial 7 with value: 0.9866666666666667.
[I 2024-08-19 18:54:45,886] Trial 97 finished with value: 0.96 and parameters: {'classifier': 'XGBoost', 'xgb_eta': 0.010449920769856224, 'xgb_max_depth': 6, 'xgb_min_child_weight': 0.0014783725349236858, 'xgb_subsample': 0.6572408726987774, 'xgb_colsample_bytree': 0.8483143226447188}. Best is trial 7 with value: 0.9866666666666667.
[I 2024-08-19 18:54:50,020] Trial 98 finished with value: 0.9866666666666667 and parameters: {'classifier': 'NeuralNetwork', 'nn_alpha': 2.4621938381146598e-05, 'hidden_layer_sizes': 512, 'activation': 'tanh', 'solver': 'sgd'}. Best is trial 7 with value: 0.9866666666666667.
[I 2024-08-19 18:54:54,743] Trial 99 finished with value: 0.98 and parameters: {'classifier': 'NeuralNetwork', 'nn_alpha': 0.0008018372562512997, 'hidden_layer_sizes': 512, 'activation': 'logistic', 'solver': 'adam'}. Best is trial 7 with value: 0.9866666666666667.
FrozenTrial(number=7, state=1, values=[0.9866666666666667], datetime_start=datetime.datetime(2024, 8, 19, 18, 50, 48, 284046), datetime_complete=datetime.datetime(2024, 8, 19, 18, 50, 52, 494040), params={'classifier': 'NeuralNetwork', 'nn_alpha': 0.0037042205825021366, 'hidden_layer_sizes': 512, 'activation': 'tanh', 'solver': 'sgd'}, user_attrs={}, system_attrs={}, intermediate_values={}, distributions={'classifier': CategoricalDistribution(choices=('SVC', 'RandomForest', 'NeuralNetwork', 'XGBoost', 'DecisionTree')), 'nn_alpha': FloatDistribution(high=0.1, log=True, low=1e-05, step=None), 'hidden_layer_sizes': CategoricalDistribution(choices=(64, 128, 256, 512)), 'activation': CategoricalDistribution(choices=('relu', 'tanh', 'logistic')), 'solver': CategoricalDistribution(choices=('sgd', 'adam', 'lbfgs'))}, trial_id=7, value=None)