[I 2024-08-19 18:50:41,683] A new study created in memory with name: no-name-143e158a-08e8-4033-ac18-8e79638f8dfe
[I 2024-08-19 18:50:41,721] Trial 0 finished with value: 0.9466666666666667 and parameters: {'classifier': 'DecisionTree', 'dt_max_depth': 3, 'dt_min_samples_split': 20, 'dt_min_samples_leaf': 6, 'dt_max_features': 'sqrt'}. Best is trial 0 with value: 0.9466666666666667.
[I 2024-08-19 18:50:41,747] Trial 1 finished with value: 0.9533333333333333 and parameters: {'classifier': 'SVC', 'svc_c': 5490.8744946124625, 'gamma': 'scale', 'kernel': 'poly'}. Best is trial 1 with value: 0.9533333333333333.
[I 2024-08-19 18:50:42,078] Trial 2 finished with value: 0.9533333333333333 and parameters: {'classifier': 'RandomForest', 'rf_max_depth': 14, 'rf_min_samples_split': 14, 'rf_min_samples_leaf': 3, 'rf_max_features': 'log2'}. Best is trial 1 with value: 0.9533333333333333.
[I 2024-08-19 18:50:45,814] Trial 3 finished with value: 0.98 and parameters: {'classifier': 'NeuralNetwork', 'nn_alpha': 0.05789064227487179, 'hidden_layer_sizes': 512, 'activation': 'logistic', 'solver': 'adam'}. Best is trial 3 with value: 0.98.
[I 2024-08-19 18:50:46,357] Trial 4 finished with value: 0.96 and parameters: {'classifier': 'XGBoost', 'xgb_eta': 0.025042411471876448, 'xgb_max_depth': 4, 'xgb_min_child_weight': 0.4142372039303884, 'xgb_subsample': 0.9420876541800461, 'xgb_colsample_bytree': 0.8880051530024806}. Best is trial 3 with value: 0.98.
[I 2024-08-19 18:50:46,691] Trial 5 finished with value: 0.96 and parameters: {'classifier': 'RandomForest', 'rf_max_depth': 5, 'rf_min_samples_split': 18, 'rf_min_samples_leaf': 3, 'rf_max_features': 'sqrt'}. Best is trial 3 with value: 0.98.
[I 2024-08-19 18:50:48,284] Trial 6 finished with value: 0.96 and parameters: {'classifier': 'NeuralNetwork', 'nn_alpha': 0.06002436525835332, 'hidden_layer_sizes': 64, 'activation': 'tanh', 'solver': 'lbfgs'}. Best is trial 3 with value: 0.98.
[I 2024-08-19 18:50:52,494] Trial 7 finished with value: 0.9866666666666667 and parameters: {'classifier': 'NeuralNetwork', 'nn_alpha': 0.0037042205825021366, 'hidden_layer_sizes': 512, 'activation': 'tanh', 'solver': 'sgd'}. Best is trial 7 with value: 0.9866666666666667.
[I 2024-08-19 18:50:53,803] Trial 8 finished with value: 0.98 and parameters: {'classifier': 'NeuralNetwork', 'nn_alpha': 0.00359695835370766, 'hidden_layer_sizes': 512, 'activation': 'tanh', 'solver': 'adam'}. Best is trial 7 with value: 0.9866666666666667.
[I 2024-08-19 18:50:53,810] Trial 9 finished with value: 0.9066666666666667 and parameters: {'classifier': 'DecisionTree', 'dt_max_depth': 29, 'dt_min_samples_split': 5, 'dt_min_samples_leaf': 6, 'dt_max_features': 'sqrt'}. Best is trial 7 with value: 0.9866666666666667.
[I 2024-08-19 18:50:53,834] Trial 10 finished with value: 0.32 and parameters: {'classifier': 'SVC', 'svc_c': 5.226255518364234e-10, 'gamma': 'auto', 'kernel': 'linear'}. Best is trial 7 with value: 0.9866666666666667.
[I 2024-08-19 18:51:11,469] Trial 11 finished with value: 0.96 and parameters: {'classifier': 'NeuralNetwork', 'nn_alpha': 0.01497079255857635, 'hidden_layer_sizes': 512, 'activation': 'logistic', 'solver': 'sgd'}. Best is trial 7 with value: 0.9866666666666667.
[I 2024-08-19 18:51:29,178] Trial 12 finished with value: 0.96 and parameters: {'classifier': 'NeuralNetwork', 'nn_alpha': 6.124728832191759e-05, 'hidden_layer_sizes': 512, 'activation': 'logistic', 'solver': 'sgd'}. Best is trial 7 with value: 0.9866666666666667.
[I 2024-08-19 18:51:29,865] Trial 13 finished with value: 0.9866666666666667 and parameters: {'classifier': 'NeuralNetwork', 'nn_alpha': 0.0005006305790130891, 'hidden_layer_sizes': 128, 'activation': 'relu', 'solver': 'adam'}. Best is trial 7 with value: 0.9866666666666667.
[I 2024-08-19 18:51:30,205] Trial 14 finished with value: 0.96 and parameters: {'classifier': 'XGBoost', 'xgb_eta': 0.28293568960644655, 'xgb_max_depth': 9, 'xgb_min_child_weight': 5.0600541381037626e-05, 'xgb_subsample': 0.5005642540193007, 'xgb_colsample_bytree': 0.5223641543844357}. Best is trial 7 with value: 0.9866666666666667.
[I 2024-08-19 18:51:30,891] Trial 15 finished with value: 0.98 and parameters: {'classifier': 'NeuralNetwork', 'nn_alpha': 0.00031574931009615, 'hidden_layer_sizes': 128, 'activation': 'relu', 'solver': 'adam'}. Best is trial 7 with value: 0.9866666666666667.
[I 2024-08-19 18:51:32,281] Trial 16 finished with value: 0.98 and parameters: {'classifier': 'NeuralNetwork', 'nn_alpha': 0.0006413794952283386, 'hidden_layer_sizes': 128, 'activation': 'relu', 'solver': 'sgd'}. Best is trial 7 with value: 0.9866666666666667.
[I 2024-08-19 18:51:34,440] Trial 17 finished with value: 0.96 and parameters: {'classifier': 'NeuralNetwork', 'nn_alpha': 0.002521406444092285, 'hidden_layer_sizes': 256, 'activation': 'tanh', 'solver': 'lbfgs'}. Best is trial 7 with value: 0.9866666666666667.
[I 2024-08-19 18:51:34,595] Trial 18 finished with value: 0.3333333333333333 and parameters: {'classifier': 'XGBoost', 'xgb_eta': 0.010110132673781115, 'xgb_max_depth': 3, 'xgb_min_child_weight': 65.10937272687018, 'xgb_subsample': 0.6442693679474308, 'xgb_colsample_bytree': 0.6072094111132664}. Best is trial 7 with value: 0.9866666666666667.
[I 2024-08-19 18:51:34,948] Trial 19 finished with value: 0.9466666666666667 and parameters: {'classifier': 'RandomForest', 'rf_max_depth': 2, 'rf_min_samples_split': 2, 'rf_min_samples_leaf': 10, 'rf_max_features': 'sqrt'}. Best is trial 7 with value: 0.9866666666666667.
[I 2024-08-19 18:51:34,969] Trial 20 finished with value: 0.6266666666666666 and parameters: {'classifier': 'DecisionTree', 'dt_max_depth': 1, 'dt_min_samples_split': 17, 'dt_min_samples_leaf': 1, 'dt_max_features': 'log2'}. Best is trial 7 with value: 0.9866666666666667.
[I 2024-08-19 18:51:38,965] Trial 21 finished with value: 0.9866666666666667 and parameters: {'classifier': 'NeuralNetwork', 'nn_alpha': 0.0933362975555239, 'hidden_layer_sizes': 512, 'activation': 'logistic', 'solver': 'adam'}. Best is trial 7 with value: 0.9866666666666667.
[I 2024-08-19 18:51:39,604] Trial 22 finished with value: 0.9733333333333333 and parameters: {'classifier': 'NeuralNetwork', 'nn_alpha': 0.00011734413006109279, 'hidden_layer_sizes': 128, 'activation': 'relu', 'solver': 'adam'}. Best is trial 7 with value: 0.9866666666666667.
[I 2024-08-19 18:51:40,676] Trial 23 finished with value: 0.98 and parameters: {'classifier': 'NeuralNetwork', 'nn_alpha': 1.0264973429718768e-05, 'hidden_layer_sizes': 512, 'activation': 'relu', 'solver': 'adam'}. Best is trial 7 with value: 0.9866666666666667.
[I 2024-08-19 18:51:50,788] Trial 24 finished with value: 0.96 and parameters: {'classifier': 'NeuralNetwork', 'nn_alpha': 0.007561938380163186, 'hidden_layer_sizes': 256, 'activation': 'logistic', 'solver': 'sgd'}. Best is trial 7 with value: 0.9866666666666667.
[I 2024-08-19 18:51:50,800] Trial 25 finished with value: 0.96 and parameters: {'classifier': 'SVC', 'svc_c': 6757427920.456146, 'gamma': 'auto', 'kernel': 'rbf'}. Best is trial 7 with value: 0.9866666666666667.
[I 2024-08-19 18:51:51,610] Trial 26 finished with value: 0.98 and parameters: {'classifier': 'NeuralNetwork', 'nn_alpha': 0.0012102596420512613, 'hidden_layer_sizes': 64, 'activation': 'tanh', 'solver': 'adam'}. Best is trial 7 with value: 0.9866666666666667.
[I 2024-08-19 18:51:53,371] Trial 27 finished with value: 0.98 and parameters: {'classifier': 'NeuralNetwork', 'nn_alpha': 0.019989798247227106, 'hidden_layer_sizes': 128, 'activation': 'logistic', 'solver': 'adam'}. Best is trial 7 with value: 0.9866666666666667.
[I 2024-08-19 18:51:57,143] Trial 28 finished with value: 0.9866666666666667 and parameters: {'classifier': 'NeuralNetwork', 'nn_alpha': 0.00032287178197389435, 'hidden_layer_sizes': 512, 'activation': 'tanh', 'solver': 'sgd'}. Best is trial 7 with value: 0.9866666666666667.
[I 2024-08-19 18:51:57,168] Trial 29 finished with value: 0.9266666666666666 and parameters: {'classifier': 'DecisionTree', 'dt_max_depth': 26, 'dt_min_samples_split': 2, 'dt_min_samples_leaf': 10, 'dt_max_features': 'log2'}. Best is trial 7 with value: 0.9866666666666667.
[I 2024-08-19 18:51:57,469] Trial 30 finished with value: 0.9533333333333333 and parameters: {'classifier': 'RandomForest', 'rf_max_depth': 31, 'rf_min_samples_split': 5, 'rf_min_samples_leaf': 9, 'rf_max_features': 'log2'}. Best is trial 7 with value: 0.9866666666666667.
[I 2024-08-19 18:52:01,216] Trial 31 finished with value: 0.9866666666666667 and parameters: {'classifier': 'NeuralNetwork', 'nn_alpha': 0.0002620443081570308, 'hidden_layer_sizes': 512, 'activation': 'tanh', 'solver': 'sgd'}. Best is trial 7 with value: 0.9866666666666667.
[I 2024-08-19 18:52:04,978] Trial 32 finished with value: 0.98 and parameters: {'classifier': 'NeuralNetwork', 'nn_alpha': 0.0009356149969718143, 'hidden_layer_sizes': 512, 'activation': 'tanh', 'solver': 'sgd'}. Best is trial 7 with value: 0.9866666666666667.
[I 2024-08-19 18:52:04,991] Trial 33 finished with value: 0.32 and parameters: {'classifier': 'SVC', 'svc_c': 2.1072476822067618e-10, 'gamma': 'scale', 'kernel': 'rbf'}. Best is trial 7 with value: 0.9866666666666667.
[I 2024-08-19 18:52:08,919] Trial 34 finished with value: 0.9866666666666667 and parameters: {'classifier': 'NeuralNetwork', 'nn_alpha': 3.9042710875958525e-05, 'hidden_layer_sizes': 512, 'activation': 'tanh', 'solver': 'sgd'}. Best is trial 7 with value: 0.9866666666666667.
[I 2024-08-19 18:52:09,975] Trial 35 finished with value: 0.9666666666666667 and parameters: {'classifier': 'NeuralNetwork', 'nn_alpha': 0.00022869054315674203, 'hidden_layer_sizes': 512, 'activation': 'relu', 'solver': 'lbfgs'}. Best is trial 7 with value: 0.9866666666666667.
[I 2024-08-19 18:52:10,278] Trial 36 finished with value: 0.9533333333333333 and parameters: {'classifier': 'XGBoost', 'xgb_eta': 0.1847697863719835, 'xgb_max_depth': 8, 'xgb_min_child_weight': 1.1989468047817871e-05, 'xgb_subsample': 0.9960962005742853, 'xgb_colsample_bytree': 0.965568945651605}. Best is trial 7 with value: 0.9866666666666667.
[I 2024-08-19 18:52:10,985] Trial 37 finished with value: 0.98 and parameters: {'classifier': 'NeuralNetwork', 'nn_alpha': 0.002496914878871758, 'hidden_layer_sizes': 128, 'activation': 'tanh', 'solver': 'adam'}. Best is trial 7 with value: 0.9866666666666667.
[I 2024-08-19 18:52:11,298] Trial 38 finished with value: 0.9466666666666667 and parameters: {'classifier': 'RandomForest', 'rf_max_depth': 2, 'rf_min_samples_split': 9, 'rf_min_samples_leaf': 6, 'rf_max_features': 'sqrt'}. Best is trial 7 with value: 0.9866666666666667.
[I 2024-08-19 18:52:11,317] Trial 39 finished with value: 0.9333333333333332 and parameters: {'classifier': 'DecisionTree', 'dt_max_depth': 6, 'dt_min_samples_split': 11, 'dt_min_samples_leaf': 1, 'dt_max_features': 'sqrt'}. Best is trial 7 with value: 0.9866666666666667.
[I 2024-08-19 18:52:11,331] Trial 40 finished with value: 0.9133333333333334 and parameters: {'classifier': 'SVC', 'svc_c': 0.016400871522863403, 'gamma': 'auto', 'kernel': 'linear'}. Best is trial 7 with value: 0.9866666666666667.
[I 2024-08-19 18:52:15,440] Trial 41 finished with value: 0.9866666666666667 and parameters: {'classifier': 'NeuralNetwork', 'nn_alpha': 0.0003495427724877151, 'hidden_layer_sizes': 512, 'activation': 'tanh', 'solver': 'sgd'}. Best is trial 7 with value: 0.9866666666666667.
[I 2024-08-19 18:52:19,062] Trial 42 finished with value: 0.9866666666666667 and parameters: {'classifier': 'NeuralNetwork', 'nn_alpha': 0.00017895808746673278, 'hidden_layer_sizes': 512, 'activation': 'tanh', 'solver': 'sgd'}. Best is trial 7 with value: 0.9866666666666667.
[I 2024-08-19 18:52:22,691] Trial 43 finished with value: 0.9866666666666667 and parameters: {'classifier': 'NeuralNetwork', 'nn_alpha': 0.0005495441129532466, 'hidden_layer_sizes': 512, 'activation': 'tanh', 'solver': 'sgd'}. Best is trial 7 with value: 0.9866666666666667.
[I 2024-08-19 18:52:26,571] Trial 44 finished with value: 0.9866666666666667 and parameters: {'classifier': 'NeuralNetwork', 'nn_alpha': 8.03992494387757e-05, 'hidden_layer_sizes': 512, 'activation': 'tanh', 'solver': 'sgd'}. Best is trial 7 with value: 0.9866666666666667.
[I 2024-08-19 18:52:29,380] Trial 45 finished with value: 0.98 and parameters: {'classifier': 'NeuralNetwork', 'nn_alpha': 0.0015049270715641184, 'hidden_layer_sizes': 512, 'activation': 'relu', 'solver': 'sgd'}. Best is trial 7 with value: 0.9866666666666667.
[I 2024-08-19 18:52:30,934] Trial 46 finished with value: 0.9866666666666667 and parameters: {'classifier': 'NeuralNetwork', 'nn_alpha': 0.00046872306111947785, 'hidden_layer_sizes': 64, 'activation': 'logistic', 'solver': 'adam'}. Best is trial 7 with value: 0.9866666666666667.
[I 2024-08-19 18:52:31,197] Trial 47 finished with value: 0.96 and parameters: {'classifier': 'XGBoost', 'xgb_eta': 0.06061374770394387, 'xgb_max_depth': 6, 'xgb_min_child_weight': 0.0041512135524866345, 'xgb_subsample': 0.7936867132047418, 'xgb_colsample_bytree': 0.7253527653606402}. Best is trial 7 with value: 0.9866666666666667.
[I 2024-08-19 18:52:33,565] Trial 48 finished with value: 0.9866666666666667 and parameters: {'classifier': 'NeuralNetwork', 'nn_alpha': 0.02486758767897914, 'hidden_layer_sizes': 256, 'activation': 'tanh', 'solver': 'sgd'}. Best is trial 7 with value: 0.9866666666666667.
[I 2024-08-19 18:52:37,521] Trial 49 finished with value: 0.9866666666666667 and parameters: {'classifier': 'NeuralNetwork', 'nn_alpha': 0.00015242289388681977, 'hidden_layer_sizes': 512, 'activation': 'tanh', 'solver': 'sgd'}. Best is trial 7 with value: 0.9866666666666667.
[I 2024-08-19 18:52:37,860] Trial 50 finished with value: 0.9533333333333333 and parameters: {'classifier': 'RandomForest', 'rf_max_depth': 7, 'rf_min_samples_split': 20, 'rf_min_samples_leaf': 1, 'rf_max_features': 'log2'}. Best is trial 7 with value: 0.9866666666666667.
[I 2024-08-19 18:52:41,814] Trial 51 finished with value: 0.9866666666666667 and parameters: {'classifier': 'NeuralNetwork', 'nn_alpha': 3.262879856409349e-05, 'hidden_layer_sizes': 512, 'activation': 'tanh', 'solver': 'sgd'}. Best is trial 7 with value: 0.9866666666666667.
[I 2024-08-19 18:52:45,766] Trial 52 finished with value: 0.9866666666666667 and parameters: {'classifier': 'NeuralNetwork', 'nn_alpha': 3.1006415118406244e-05, 'hidden_layer_sizes': 512, 'activation': 'tanh', 'solver': 'sgd'}. Best is trial 7 with value: 0.9866666666666667.
[I 2024-08-19 18:52:49,736] Trial 53 finished with value: 0.98 and parameters: {'classifier': 'NeuralNetwork', 'nn_alpha': 0.00769588603397037, 'hidden_layer_sizes': 512, 'activation': 'logistic', 'solver': 'adam'}. Best is trial 7 with value: 0.9866666666666667.
[I 2024-08-19 18:52:53,661] Trial 54 finished with value: 0.9866666666666667 and parameters: {'classifier': 'NeuralNetwork', 'nn_alpha': 1.3113976767926717e-05, 'hidden_layer_sizes': 512, 'activation': 'tanh', 'solver': 'sgd'}. Best is trial 7 with value: 0.9866666666666667.
[I 2024-08-19 18:52:55,983] Trial 55 finished with value: 0.96 and parameters: {'classifier': 'NeuralNetwork', 'nn_alpha': 0.04354263989194182, 'hidden_layer_sizes': 128, 'activation': 'tanh', 'solver': 'lbfgs'}. Best is trial 7 with value: 0.9866666666666667.
[I 2024-08-19 18:52:56,002] Trial 56 finished with value: 0.6533333333333333 and parameters: {'classifier': 'DecisionTree', 'dt_max_depth': 1, 'dt_min_samples_split': 11, 'dt_min_samples_leaf': 10, 'dt_max_features': 'log2'}. Best is trial 7 with value: 0.9866666666666667.
[I 2024-08-19 18:52:57,362] Trial 57 finished with value: 0.98 and parameters: {'classifier': 'NeuralNetwork', 'nn_alpha': 0.0007578546510422911, 'hidden_layer_sizes': 512, 'activation': 'tanh', 'solver': 'adam'}. Best is trial 7 with value: 0.9866666666666667.
[I 2024-08-19 18:53:01,292] Trial 58 finished with value: 0.9733333333333333 and parameters: {'classifier': 'NeuralNetwork', 'nn_alpha': 4.220594795349271e-05, 'hidden_layer_sizes': 64, 'activation': 'logistic', 'solver': 'sgd'}. Best is trial 7 with value: 0.9866666666666667.
[I 2024-08-19 18:53:01,304] Trial 59 finished with value: 0.68 and parameters: {'classifier': 'SVC', 'svc_c': 0.0006299416122634125, 'gamma': 'scale', 'kernel': 'poly'}. Best is trial 7 with value: 0.9866666666666667.
[I 2024-08-19 18:53:01,422] Trial 60 finished with value: 0.3333333333333333 and parameters: {'classifier': 'XGBoost', 'xgb_eta': 0.10177141706244526, 'xgb_max_depth': 3, 'xgb_min_child_weight': 94.68211991416293, 'xgb_subsample': 0.7818928833775163, 'xgb_colsample_bytree': 0.7898609494225108}. Best is trial 7 with value: 0.9866666666666667.
[I 2024-08-19 18:53:05,688] Trial 61 finished with value: 0.9866666666666667 and parameters: {'classifier': 'NeuralNetwork', 'nn_alpha': 0.09296091629220485, 'hidden_layer_sizes': 512, 'activation': 'tanh', 'solver': 'sgd'}. Best is trial 7 with value: 0.9866666666666667.
[I 2024-08-19 18:53:09,748] Trial 62 finished with value: 0.98 and parameters: {'classifier': 'NeuralNetwork', 'nn_alpha': 0.00028725206462863734, 'hidden_layer_sizes': 512, 'activation': 'tanh', 'solver': 'sgd'}. Best is trial 7 with value: 0.9866666666666667.
[I 2024-08-19 18:53:13,673] Trial 63 finished with value: 0.9866666666666667 and parameters: {'classifier': 'NeuralNetwork', 'nn_alpha': 0.00039780742156326235, 'hidden_layer_sizes': 512, 'activation': 'tanh', 'solver': 'sgd'}. Best is trial 7 with value: 0.9866666666666667.
[I 2024-08-19 18:53:16,483] Trial 64 finished with value: 0.9733333333333333 and parameters: {'classifier': 'NeuralNetwork', 'nn_alpha': 9.660294119783585e-05, 'hidden_layer_sizes': 512, 'activation': 'relu', 'solver': 'sgd'}. Best is trial 7 with value: 0.9866666666666667.
[I 2024-08-19 18:53:20,500] Trial 65 finished with value: 0.9866666666666667 and parameters: {'classifier': 'NeuralNetwork', 'nn_alpha': 0.00041764095934346675, 'hidden_layer_sizes': 512, 'activation': 'tanh', 'solver': 'sgd'}. Best is trial 7 with value: 0.9866666666666667.
[I 2024-08-19 18:53:22,311] Trial 66 finished with value: 0.9866666666666667 and parameters: {'classifier': 'NeuralNetwork', 'nn_alpha': 0.005485369071139049, 'hidden_layer_sizes': 128, 'activation': 'logistic', 'solver': 'adam'}. Best is trial 7 with value: 0.9866666666666667.
[I 2024-08-19 18:53:23,378] Trial 67 finished with value: 0.96 and parameters: {'classifier': 'NeuralNetwork', 'nn_alpha': 0.0017667365600477108, 'hidden_layer_sizes': 512, 'activation': 'relu', 'solver': 'lbfgs'}. Best is trial 7 with value: 0.9866666666666667.
[I 2024-08-19 18:53:23,692] Trial 68 finished with value: 0.9533333333333333 and parameters: {'classifier': 'RandomForest', 'rf_max_depth': 29, 'rf_min_samples_split': 11, 'rf_min_samples_leaf': 7, 'rf_max_features': 'sqrt'}. Best is trial 7 with value: 0.9866666666666667.
[I 2024-08-19 18:53:27,615] Trial 69 finished with value: 0.9866666666666667 and parameters: {'classifier': 'NeuralNetwork', 'nn_alpha': 0.00021730038298537776, 'hidden_layer_sizes': 512, 'activation': 'tanh', 'solver': 'sgd'}. Best is trial 7 with value: 0.9866666666666667.
[I 2024-08-19 18:53:28,680] Trial 70 finished with value: 0.98 and parameters: {'classifier': 'NeuralNetwork', 'nn_alpha': 0.0007536480637397112, 'hidden_layer_sizes': 256, 'activation': 'tanh', 'solver': 'adam'}. Best is trial 7 with value: 0.9866666666666667.
[I 2024-08-19 18:53:32,619] Trial 71 finished with value: 0.98 and parameters: {'classifier': 'NeuralNetwork', 'nn_alpha': 0.00019164724922123594, 'hidden_layer_sizes': 512, 'activation': 'tanh', 'solver': 'sgd'}. Best is trial 7 with value: 0.9866666666666667.
[I 2024-08-19 18:53:36,564] Trial 72 finished with value: 0.9866666666666667 and parameters: {'classifier': 'NeuralNetwork', 'nn_alpha': 0.0002875272621335925, 'hidden_layer_sizes': 512, 'activation': 'tanh', 'solver': 'sgd'}. Best is trial 7 with value: 0.9866666666666667.
[I 2024-08-19 18:53:36,584] Trial 73 finished with value: 0.8933333333333332 and parameters: {'classifier': 'DecisionTree', 'dt_max_depth': 7, 'dt_min_samples_split': 15, 'dt_min_samples_leaf': 4, 'dt_max_features': 'sqrt'}. Best is trial 7 with value: 0.9866666666666667.
[I 2024-08-19 18:53:40,480] Trial 74 finished with value: 0.9866666666666667 and parameters: {'classifier': 'NeuralNetwork', 'nn_alpha': 0.00015006567142832476, 'hidden_layer_sizes': 512, 'activation': 'tanh', 'solver': 'sgd'}. Best is trial 7 with value: 0.9866666666666667.
[I 2024-08-19 18:53:41,880] Trial 75 finished with value: 0.9733333333333333 and parameters: {'classifier': 'NeuralNetwork', 'nn_alpha': 0.0003315643553982971, 'hidden_layer_sizes': 128, 'activation': 'relu', 'solver': 'sgd'}. Best is trial 7 with value: 0.9866666666666667.
[I 2024-08-19 18:53:41,899] Trial 76 finished with value: 0.96 and parameters: {'classifier': 'SVC', 'svc_c': 2984653496.4013896, 'gamma': 'scale', 'kernel': 'rbf'}. Best is trial 7 with value: 0.9866666666666667.
[I 2024-08-19 18:53:45,953] Trial 77 finished with value: 0.98 and parameters: {'classifier': 'NeuralNetwork', 'nn_alpha': 1.6686660588981542e-05, 'hidden_layer_sizes': 512, 'activation': 'logistic', 'solver': 'adam'}. Best is trial 7 with value: 0.9866666666666667.
[I 2024-08-19 18:53:46,190] Trial 78 finished with value: 0.9666666666666667 and parameters: {'classifier': 'XGBoost', 'xgb_eta': 0.02314138689101955, 'xgb_max_depth': 5, 'xgb_min_child_weight': 0.12231234561795185, 'xgb_subsample': 0.5175535122451487, 'xgb_colsample_bytree': 0.6913398372901681}. Best is trial 7 with value: 0.9866666666666667.
[I 2024-08-19 18:53:50,174] Trial 79 finished with value: 0.9866666666666667 and parameters: {'classifier': 'NeuralNetwork', 'nn_alpha': 5.758507941374469e-05, 'hidden_layer_sizes': 512, 'activation': 'tanh', 'solver': 'sgd'}. Best is trial 7 with value: 0.9866666666666667.
