[I 2024-06-27 16:33:37,309] A new study created in memory with name: no-name-a3376464-1867-4a4e-b23b-f61300deae4e
[I 2024-06-27 16:33:39,266] Trial 0 finished with value: 0.94 and parameters: {'classifier': 'RandomForest', 'rf_max_depth': 3, 'rf_min_samples_split': 9, 'rf_min_samples_leaf': 6, 'rf_max_features': 'log2'}. Best is trial 0 with value: 0.94.
[I 2024-06-27 16:33:40,394] Trial 1 finished with value: 0.9466666666666667 and parameters: {'classifier': 'RandomForest', 'rf_max_depth': 13, 'rf_min_samples_split': 11, 'rf_min_samples_leaf': 6, 'rf_max_features': 'log2'}. Best is trial 1 with value: 0.9466666666666667.
F:\PycharmProjects\venv\Lib\site-packages\optuna\distributions.py:524: UserWarning: Choices for a categorical distribution should be a tuple of None, bool, int, float and str for persistent storage but contains (64,) which is of type tuple.
  warnings.warn(message)
F:\PycharmProjects\venv\Lib\site-packages\optuna\distributions.py:524: UserWarning: Choices for a categorical distribution should be a tuple of None, bool, int, float and str for persistent storage but contains (128,) which is of type tuple.
  warnings.warn(message)
F:\PycharmProjects\venv\Lib\site-packages\optuna\distributions.py:524: UserWarning: Choices for a categorical distribution should be a tuple of None, bool, int, float and str for persistent storage but contains (256,) which is of type tuple.
  warnings.warn(message)
F:\PycharmProjects\venv\Lib\site-packages\optuna\distributions.py:524: UserWarning: Choices for a categorical distribution should be a tuple of None, bool, int, float and str for persistent storage but contains (512,) which is of type tuple.
  warnings.warn(message)
[I 2024-06-27 16:33:41,993] Trial 2 finished with value: 0.8799999999999999 and parameters: {'classifier': 'NeuralNetwork', 'nn_alpha': 0.001641642294109542, 'hidden_layer_sizes': (64,), 'activation': 'logistic', 'solver': 'sgd'}. Best is trial 1 with value: 0.9466666666666667.
[I 2024-06-27 16:33:42,962] Trial 3 finished with value: 0.9533333333333333 and parameters: {'classifier': 'RandomForest', 'rf_max_depth': 16, 'rf_min_samples_split': 5, 'rf_min_samples_leaf': 7, 'rf_max_features': 'log2'}. Best is trial 3 with value: 0.9533333333333333.
[I 2024-06-27 16:33:44,358] Trial 4 finished with value: 0.9666666666666667 and parameters: {'classifier': 'XGBoost', 'xgb_eta': 0.0158701606669363, 'xgb_max_depth': 7}. Best is trial 4 with value: 0.9666666666666667.
[I 2024-06-27 16:33:45,649] Trial 5 finished with value: 0.9533333333333333 and parameters: {'classifier': 'XGBoost', 'xgb_eta': 0.04627405290721529, 'xgb_max_depth': 5}. Best is trial 4 with value: 0.9666666666666667.
[I 2024-06-27 16:33:46,432] Trial 6 finished with value: 0.9533333333333333 and parameters: {'classifier': 'XGBoost', 'xgb_eta': 0.11220531118018773, 'xgb_max_depth': 6}. Best is trial 4 with value: 0.9666666666666667.
[I 2024-06-27 16:33:46,686] Trial 7 finished with value: 0.96 and parameters: {'classifier': 'RandomForest', 'rf_max_depth': 3, 'rf_min_samples_split': 14, 'rf_min_samples_leaf': 1, 'rf_max_features': 'log2'}. Best is trial 4 with value: 0.9666666666666667.
F:\PycharmProjects\venv\Lib\site-packages\optuna\distributions.py:524: UserWarning: Choices for a categorical distribution should be a tuple of None, bool, int, float and str for persistent storage but contains (64,) which is of type tuple.
  warnings.warn(message)
F:\PycharmProjects\venv\Lib\site-packages\optuna\distributions.py:524: UserWarning: Choices for a categorical distribution should be a tuple of None, bool, int, float and str for persistent storage but contains (128,) which is of type tuple.
  warnings.warn(message)
F:\PycharmProjects\venv\Lib\site-packages\optuna\distributions.py:524: UserWarning: Choices for a categorical distribution should be a tuple of None, bool, int, float and str for persistent storage but contains (256,) which is of type tuple.
  warnings.warn(message)
F:\PycharmProjects\venv\Lib\site-packages\optuna\distributions.py:524: UserWarning: Choices for a categorical distribution should be a tuple of None, bool, int, float and str for persistent storage but contains (512,) which is of type tuple.
  warnings.warn(message)
[I 2024-06-27 16:33:47,667] Trial 8 finished with value: 0.98 and parameters: {'classifier': 'NeuralNetwork', 'nn_alpha': 0.002053654930919785, 'hidden_layer_sizes': (256,), 'activation': 'logistic', 'solver': 'adam'}. Best is trial 8 with value: 0.98.
[I 2024-06-27 16:33:47,890] Trial 9 finished with value: 0.96 and parameters: {'classifier': 'RandomForest', 'rf_max_depth': 2, 'rf_min_samples_split': 15, 'rf_min_samples_leaf': 10, 'rf_max_features': 'log2'}. Best is trial 8 with value: 0.98.
F:\PycharmProjects\venv\Lib\site-packages\optuna\distributions.py:524: UserWarning: Choices for a categorical distribution should be a tuple of None, bool, int, float and str for persistent storage but contains (64,) which is of type tuple.
  warnings.warn(message)
F:\PycharmProjects\venv\Lib\site-packages\optuna\distributions.py:524: UserWarning: Choices for a categorical distribution should be a tuple of None, bool, int, float and str for persistent storage but contains (128,) which is of type tuple.
  warnings.warn(message)
F:\PycharmProjects\venv\Lib\site-packages\optuna\distributions.py:524: UserWarning: Choices for a categorical distribution should be a tuple of None, bool, int, float and str for persistent storage but contains (256,) which is of type tuple.
  warnings.warn(message)
F:\PycharmProjects\venv\Lib\site-packages\optuna\distributions.py:524: UserWarning: Choices for a categorical distribution should be a tuple of None, bool, int, float and str for persistent storage but contains (512,) which is of type tuple.
  warnings.warn(message)
[I 2024-06-27 16:33:48,242] Trial 10 finished with value: 0.98 and parameters: {'classifier': 'NeuralNetwork', 'nn_alpha': 0.050086351184357635, 'hidden_layer_sizes': (256,), 'activation': 'tanh', 'solver': 'adam'}. Best is trial 8 with value: 0.98.
F:\PycharmProjects\venv\Lib\site-packages\optuna\distributions.py:524: UserWarning: Choices for a categorical distribution should be a tuple of None, bool, int, float and str for persistent storage but contains (64,) which is of type tuple.
  warnings.warn(message)
F:\PycharmProjects\venv\Lib\site-packages\optuna\distributions.py:524: UserWarning: Choices for a categorical distribution should be a tuple of None, bool, int, float and str for persistent storage but contains (128,) which is of type tuple.
  warnings.warn(message)
F:\PycharmProjects\venv\Lib\site-packages\optuna\distributions.py:524: UserWarning: Choices for a categorical distribution should be a tuple of None, bool, int, float and str for persistent storage but contains (256,) which is of type tuple.
  warnings.warn(message)
F:\PycharmProjects\venv\Lib\site-packages\optuna\distributions.py:524: UserWarning: Choices for a categorical distribution should be a tuple of None, bool, int, float and str for persistent storage but contains (512,) which is of type tuple.
  warnings.warn(message)
[I 2024-06-27 16:33:48,550] Trial 11 finished with value: 0.98 and parameters: {'classifier': 'NeuralNetwork', 'nn_alpha': 0.06578232270753291, 'hidden_layer_sizes': (256,), 'activation': 'tanh', 'solver': 'adam'}. Best is trial 8 with value: 0.98.
[I 2024-06-27 16:33:48,569] Trial 12 finished with value: 0.32 and parameters: {'classifier': 'SVC', 'svc_c': 3.461118645972625e-07, 'gamma': 'auto', 'kernel': 'linear'}. Best is trial 8 with value: 0.98.
F:\PycharmProjects\venv\Lib\site-packages\optuna\distributions.py:524: UserWarning: Choices for a categorical distribution should be a tuple of None, bool, int, float and str for persistent storage but contains (64,) which is of type tuple.
  warnings.warn(message)
F:\PycharmProjects\venv\Lib\site-packages\optuna\distributions.py:524: UserWarning: Choices for a categorical distribution should be a tuple of None, bool, int, float and str for persistent storage but contains (128,) which is of type tuple.
  warnings.warn(message)
F:\PycharmProjects\venv\Lib\site-packages\optuna\distributions.py:524: UserWarning: Choices for a categorical distribution should be a tuple of None, bool, int, float and str for persistent storage but contains (256,) which is of type tuple.
  warnings.warn(message)
F:\PycharmProjects\venv\Lib\site-packages\optuna\distributions.py:524: UserWarning: Choices for a categorical distribution should be a tuple of None, bool, int, float and str for persistent storage but contains (512,) which is of type tuple.
  warnings.warn(message)
[I 2024-06-27 16:33:49,605] Trial 13 finished with value: 0.98 and parameters: {'classifier': 'NeuralNetwork', 'nn_alpha': 0.012642359993524135, 'hidden_layer_sizes': (256,), 'activation': 'logistic', 'solver': 'adam'}. Best is trial 8 with value: 0.98.
F:\PycharmProjects\venv\Lib\site-packages\optuna\distributions.py:524: UserWarning: Choices for a categorical distribution should be a tuple of None, bool, int, float and str for persistent storage but contains (64,) which is of type tuple.
  warnings.warn(message)
F:\PycharmProjects\venv\Lib\site-packages\optuna\distributions.py:524: UserWarning: Choices for a categorical distribution should be a tuple of None, bool, int, float and str for persistent storage but contains (128,) which is of type tuple.
  warnings.warn(message)
F:\PycharmProjects\venv\Lib\site-packages\optuna\distributions.py:524: UserWarning: Choices for a categorical distribution should be a tuple of None, bool, int, float and str for persistent storage but contains (256,) which is of type tuple.
  warnings.warn(message)
F:\PycharmProjects\venv\Lib\site-packages\optuna\distributions.py:524: UserWarning: Choices for a categorical distribution should be a tuple of None, bool, int, float and str for persistent storage but contains (512,) which is of type tuple.
  warnings.warn(message)
[I 2024-06-27 16:33:49,937] Trial 14 finished with value: 0.9666666666666667 and parameters: {'classifier': 'NeuralNetwork', 'nn_alpha': 1.722930863719433e-05, 'hidden_layer_sizes': (256,), 'activation': 'relu', 'solver': 'lbfgs'}. Best is trial 8 with value: 0.98.
F:\PycharmProjects\venv\Lib\site-packages\optuna\distributions.py:524: UserWarning: Choices for a categorical distribution should be a tuple of None, bool, int, float and str for persistent storage but contains (64,) which is of type tuple.
  warnings.warn(message)
F:\PycharmProjects\venv\Lib\site-packages\optuna\distributions.py:524: UserWarning: Choices for a categorical distribution should be a tuple of None, bool, int, float and str for persistent storage but contains (128,) which is of type tuple.
  warnings.warn(message)
F:\PycharmProjects\venv\Lib\site-packages\optuna\distributions.py:524: UserWarning: Choices for a categorical distribution should be a tuple of None, bool, int, float and str for persistent storage but contains (256,) which is of type tuple.
  warnings.warn(message)
F:\PycharmProjects\venv\Lib\site-packages\optuna\distributions.py:524: UserWarning: Choices for a categorical distribution should be a tuple of None, bool, int, float and str for persistent storage but contains (512,) which is of type tuple.
  warnings.warn(message)
[I 2024-06-27 16:33:50,173] Trial 15 finished with value: 0.98 and parameters: {'classifier': 'NeuralNetwork', 'nn_alpha': 0.0003220942404661197, 'hidden_layer_sizes': (128,), 'activation': 'tanh', 'solver': 'adam'}. Best is trial 8 with value: 0.98.
[I 2024-06-27 16:33:50,235] Trial 16 finished with value: 0.96 and parameters: {'classifier': 'SVC', 'svc_c': 4314374118.59828, 'gamma': 'scale', 'kernel': 'rbf'}. Best is trial 8 with value: 0.98.
F:\PycharmProjects\venv\Lib\site-packages\optuna\distributions.py:524: UserWarning: Choices for a categorical distribution should be a tuple of None, bool, int, float and str for persistent storage but contains (64,) which is of type tuple.
  warnings.warn(message)
F:\PycharmProjects\venv\Lib\site-packages\optuna\distributions.py:524: UserWarning: Choices for a categorical distribution should be a tuple of None, bool, int, float and str for persistent storage but contains (128,) which is of type tuple.
  warnings.warn(message)
F:\PycharmProjects\venv\Lib\site-packages\optuna\distributions.py:524: UserWarning: Choices for a categorical distribution should be a tuple of None, bool, int, float and str for persistent storage but contains (256,) which is of type tuple.
  warnings.warn(message)
F:\PycharmProjects\venv\Lib\site-packages\optuna\distributions.py:524: UserWarning: Choices for a categorical distribution should be a tuple of None, bool, int, float and str for persistent storage but contains (512,) which is of type tuple.
  warnings.warn(message)
[I 2024-06-27 16:33:51,713] Trial 17 finished with value: 0.98 and parameters: {'classifier': 'NeuralNetwork', 'nn_alpha': 0.003802487556540223, 'hidden_layer_sizes': (512,), 'activation': 'logistic', 'solver': 'adam'}. Best is trial 8 with value: 0.98.
F:\PycharmProjects\venv\Lib\site-packages\optuna\distributions.py:524: UserWarning: Choices for a categorical distribution should be a tuple of None, bool, int, float and str for persistent storage but contains (64,) which is of type tuple.
  warnings.warn(message)
F:\PycharmProjects\venv\Lib\site-packages\optuna\distributions.py:524: UserWarning: Choices for a categorical distribution should be a tuple of None, bool, int, float and str for persistent storage but contains (128,) which is of type tuple.
  warnings.warn(message)
F:\PycharmProjects\venv\Lib\site-packages\optuna\distributions.py:524: UserWarning: Choices for a categorical distribution should be a tuple of None, bool, int, float and str for persistent storage but contains (256,) which is of type tuple.
  warnings.warn(message)
F:\PycharmProjects\venv\Lib\site-packages\optuna\distributions.py:524: UserWarning: Choices for a categorical distribution should be a tuple of None, bool, int, float and str for persistent storage but contains (512,) which is of type tuple.
  warnings.warn(message)
[I 2024-06-27 16:33:52,072] Trial 18 finished with value: 0.9733333333333333 and parameters: {'classifier': 'NeuralNetwork', 'nn_alpha': 0.06990597033234949, 'hidden_layer_sizes': (256,), 'activation': 'tanh', 'solver': 'adam'}. Best is trial 8 with value: 0.98.
F:\PycharmProjects\venv\Lib\site-packages\optuna\distributions.py:524: UserWarning: Choices for a categorical distribution should be a tuple of None, bool, int, float and str for persistent storage but contains (64,) which is of type tuple.
  warnings.warn(message)
F:\PycharmProjects\venv\Lib\site-packages\optuna\distributions.py:524: UserWarning: Choices for a categorical distribution should be a tuple of None, bool, int, float and str for persistent storage but contains (128,) which is of type tuple.
  warnings.warn(message)
F:\PycharmProjects\venv\Lib\site-packages\optuna\distributions.py:524: UserWarning: Choices for a categorical distribution should be a tuple of None, bool, int, float and str for persistent storage but contains (256,) which is of type tuple.
  warnings.warn(message)
F:\PycharmProjects\venv\Lib\site-packages\optuna\distributions.py:524: UserWarning: Choices for a categorical distribution should be a tuple of None, bool, int, float and str for persistent storage but contains (512,) which is of type tuple.
  warnings.warn(message)
[I 2024-06-27 16:33:52,331] Trial 19 finished with value: 0.9733333333333333 and parameters: {'classifier': 'NeuralNetwork', 'nn_alpha': 0.0001950395594882656, 'hidden_layer_sizes': (256,), 'activation': 'relu', 'solver': 'lbfgs'}. Best is trial 8 with value: 0.98.
[I 2024-06-27 16:33:52,390] Trial 20 finished with value: 0.9533333333333333 and parameters: {'classifier': 'SVC', 'svc_c': 375145.0691802148, 'gamma': 'scale', 'kernel': 'poly'}. Best is trial 8 with value: 0.98.
F:\PycharmProjects\venv\Lib\site-packages\optuna\distributions.py:524: UserWarning: Choices for a categorical distribution should be a tuple of None, bool, int, float and str for persistent storage but contains (64,) which is of type tuple.
  warnings.warn(message)
F:\PycharmProjects\venv\Lib\site-packages\optuna\distributions.py:524: UserWarning: Choices for a categorical distribution should be a tuple of None, bool, int, float and str for persistent storage but contains (128,) which is of type tuple.
  warnings.warn(message)
F:\PycharmProjects\venv\Lib\site-packages\optuna\distributions.py:524: UserWarning: Choices for a categorical distribution should be a tuple of None, bool, int, float and str for persistent storage but contains (256,) which is of type tuple.
  warnings.warn(message)
F:\PycharmProjects\venv\Lib\site-packages\optuna\distributions.py:524: UserWarning: Choices for a categorical distribution should be a tuple of None, bool, int, float and str for persistent storage but contains (512,) which is of type tuple.
  warnings.warn(message)
[I 2024-06-27 16:33:52,712] Trial 21 finished with value: 0.98 and parameters: {'classifier': 'NeuralNetwork', 'nn_alpha': 0.05728591838201086, 'hidden_layer_sizes': (256,), 'activation': 'tanh', 'solver': 'adam'}. Best is trial 8 with value: 0.98.
F:\PycharmProjects\venv\Lib\site-packages\optuna\distributions.py:524: UserWarning: Choices for a categorical distribution should be a tuple of None, bool, int, float and str for persistent storage but contains (64,) which is of type tuple.
  warnings.warn(message)
F:\PycharmProjects\venv\Lib\site-packages\optuna\distributions.py:524: UserWarning: Choices for a categorical distribution should be a tuple of None, bool, int, float and str for persistent storage but contains (128,) which is of type tuple.
  warnings.warn(message)
F:\PycharmProjects\venv\Lib\site-packages\optuna\distributions.py:524: UserWarning: Choices for a categorical distribution should be a tuple of None, bool, int, float and str for persistent storage but contains (256,) which is of type tuple.
  warnings.warn(message)
F:\PycharmProjects\venv\Lib\site-packages\optuna\distributions.py:524: UserWarning: Choices for a categorical distribution should be a tuple of None, bool, int, float and str for persistent storage but contains (512,) which is of type tuple.
  warnings.warn(message)
[I 2024-06-27 16:33:53,055] Trial 22 finished with value: 0.98 and parameters: {'classifier': 'NeuralNetwork', 'nn_alpha': 0.023255257439261188, 'hidden_layer_sizes': (256,), 'activation': 'tanh', 'solver': 'adam'}. Best is trial 8 with value: 0.98.
F:\PycharmProjects\venv\Lib\site-packages\optuna\distributions.py:524: UserWarning: Choices for a categorical distribution should be a tuple of None, bool, int, float and str for persistent storage but contains (64,) which is of type tuple.
  warnings.warn(message)
F:\PycharmProjects\venv\Lib\site-packages\optuna\distributions.py:524: UserWarning: Choices for a categorical distribution should be a tuple of None, bool, int, float and str for persistent storage but contains (128,) which is of type tuple.
  warnings.warn(message)
F:\PycharmProjects\venv\Lib\site-packages\optuna\distributions.py:524: UserWarning: Choices for a categorical distribution should be a tuple of None, bool, int, float and str for persistent storage but contains (256,) which is of type tuple.
  warnings.warn(message)
F:\PycharmProjects\venv\Lib\site-packages\optuna\distributions.py:524: UserWarning: Choices for a categorical distribution should be a tuple of None, bool, int, float and str for persistent storage but contains (512,) which is of type tuple.
  warnings.warn(message)
[I 2024-06-27 16:33:53,365] Trial 23 finished with value: 0.98 and parameters: {'classifier': 'NeuralNetwork', 'nn_alpha': 0.010771281127875476, 'hidden_layer_sizes': (256,), 'activation': 'tanh', 'solver': 'adam'}. Best is trial 8 with value: 0.98.
F:\PycharmProjects\venv\Lib\site-packages\optuna\distributions.py:524: UserWarning: Choices for a categorical distribution should be a tuple of None, bool, int, float and str for persistent storage but contains (64,) which is of type tuple.
  warnings.warn(message)
F:\PycharmProjects\venv\Lib\site-packages\optuna\distributions.py:524: UserWarning: Choices for a categorical distribution should be a tuple of None, bool, int, float and str for persistent storage but contains (128,) which is of type tuple.
  warnings.warn(message)
F:\PycharmProjects\venv\Lib\site-packages\optuna\distributions.py:524: UserWarning: Choices for a categorical distribution should be a tuple of None, bool, int, float and str for persistent storage but contains (256,) which is of type tuple.
  warnings.warn(message)
F:\PycharmProjects\venv\Lib\site-packages\optuna\distributions.py:524: UserWarning: Choices for a categorical distribution should be a tuple of None, bool, int, float and str for persistent storage but contains (512,) which is of type tuple.
  warnings.warn(message)
