[I 2024-06-27 16:34:28,234] Trial 65 finished with value: 0.9466666666666667 and parameters: {'classifier': 'RandomForest', 'rf_max_depth': 27, 'rf_min_samples_split': 7, 'rf_min_samples_leaf': 4, 'rf_max_features': 'sqrt'}. Best is trial 25 with value: 0.9866666666666667.
F:\PycharmProjects\venv\Lib\site-packages\optuna\distributions.py:524: UserWarning: Choices for a categorical distribution should be a tuple of None, bool, int, float and str for persistent storage but contains (64,) which is of type tuple.
  warnings.warn(message)
F:\PycharmProjects\venv\Lib\site-packages\optuna\distributions.py:524: UserWarning: Choices for a categorical distribution should be a tuple of None, bool, int, float and str for persistent storage but contains (128,) which is of type tuple.
  warnings.warn(message)
F:\PycharmProjects\venv\Lib\site-packages\optuna\distributions.py:524: UserWarning: Choices for a categorical distribution should be a tuple of None, bool, int, float and str for persistent storage but contains (256,) which is of type tuple.
  warnings.warn(message)
F:\PycharmProjects\venv\Lib\site-packages\optuna\distributions.py:524: UserWarning: Choices for a categorical distribution should be a tuple of None, bool, int, float and str for persistent storage but contains (512,) which is of type tuple.
  warnings.warn(message)
[I 2024-06-27 16:34:28,720] Trial 66 finished with value: 0.9866666666666667 and parameters: {'classifier': 'NeuralNetwork', 'nn_alpha': 0.0057042532109087924, 'hidden_layer_sizes': (128,), 'activation': 'tanh', 'solver': 'sgd'}. Best is trial 25 with value: 0.9866666666666667.
F:\PycharmProjects\venv\Lib\site-packages\optuna\distributions.py:524: UserWarning: Choices for a categorical distribution should be a tuple of None, bool, int, float and str for persistent storage but contains (64,) which is of type tuple.
  warnings.warn(message)
F:\PycharmProjects\venv\Lib\site-packages\optuna\distributions.py:524: UserWarning: Choices for a categorical distribution should be a tuple of None, bool, int, float and str for persistent storage but contains (128,) which is of type tuple.
  warnings.warn(message)
F:\PycharmProjects\venv\Lib\site-packages\optuna\distributions.py:524: UserWarning: Choices for a categorical distribution should be a tuple of None, bool, int, float and str for persistent storage but contains (256,) which is of type tuple.
  warnings.warn(message)
F:\PycharmProjects\venv\Lib\site-packages\optuna\distributions.py:524: UserWarning: Choices for a categorical distribution should be a tuple of None, bool, int, float and str for persistent storage but contains (512,) which is of type tuple.
  warnings.warn(message)
[I 2024-06-27 16:34:31,484] Trial 67 finished with value: 0.9333333333333332 and parameters: {'classifier': 'NeuralNetwork', 'nn_alpha': 0.015438797657408994, 'hidden_layer_sizes': (512,), 'activation': 'logistic', 'solver': 'sgd'}. Best is trial 25 with value: 0.9866666666666667.
F:\PycharmProjects\venv\Lib\site-packages\optuna\distributions.py:524: UserWarning: Choices for a categorical distribution should be a tuple of None, bool, int, float and str for persistent storage but contains (64,) which is of type tuple.
  warnings.warn(message)
F:\PycharmProjects\venv\Lib\site-packages\optuna\distributions.py:524: UserWarning: Choices for a categorical distribution should be a tuple of None, bool, int, float and str for persistent storage but contains (128,) which is of type tuple.
  warnings.warn(message)
F:\PycharmProjects\venv\Lib\site-packages\optuna\distributions.py:524: UserWarning: Choices for a categorical distribution should be a tuple of None, bool, int, float and str for persistent storage but contains (256,) which is of type tuple.
  warnings.warn(message)
F:\PycharmProjects\venv\Lib\site-packages\optuna\distributions.py:524: UserWarning: Choices for a categorical distribution should be a tuple of None, bool, int, float and str for persistent storage but contains (512,) which is of type tuple.
  warnings.warn(message)
[I 2024-06-27 16:34:33,031] Trial 68 finished with value: 0.9866666666666667 and parameters: {'classifier': 'NeuralNetwork', 'nn_alpha': 0.00748799102559539, 'hidden_layer_sizes': (512,), 'activation': 'tanh', 'solver': 'sgd'}. Best is trial 25 with value: 0.9866666666666667.
F:\PycharmProjects\venv\Lib\site-packages\optuna\distributions.py:524: UserWarning: Choices for a categorical distribution should be a tuple of None, bool, int, float and str for persistent storage but contains (64,) which is of type tuple.
  warnings.warn(message)
F:\PycharmProjects\venv\Lib\site-packages\optuna\distributions.py:524: UserWarning: Choices for a categorical distribution should be a tuple of None, bool, int, float and str for persistent storage but contains (128,) which is of type tuple.
  warnings.warn(message)
F:\PycharmProjects\venv\Lib\site-packages\optuna\distributions.py:524: UserWarning: Choices for a categorical distribution should be a tuple of None, bool, int, float and str for persistent storage but contains (256,) which is of type tuple.
  warnings.warn(message)
F:\PycharmProjects\venv\Lib\site-packages\optuna\distributions.py:524: UserWarning: Choices for a categorical distribution should be a tuple of None, bool, int, float and str for persistent storage but contains (512,) which is of type tuple.
  warnings.warn(message)
[I 2024-06-27 16:34:33,282] Trial 69 finished with value: 0.98 and parameters: {'classifier': 'NeuralNetwork', 'nn_alpha': 7.709446471257692e-05, 'hidden_layer_sizes': (512,), 'activation': 'relu', 'solver': 'lbfgs'}. Best is trial 25 with value: 0.9866666666666667.
[I 2024-06-27 16:34:33,335] Trial 70 finished with value: 0.9666666666666667 and parameters: {'classifier': 'XGBoost', 'xgb_eta': 0.02457380740246407, 'xgb_max_depth': 9}. Best is trial 25 with value: 0.9866666666666667.
F:\PycharmProjects\venv\Lib\site-packages\optuna\distributions.py:524: UserWarning: Choices for a categorical distribution should be a tuple of None, bool, int, float and str for persistent storage but contains (64,) which is of type tuple.
  warnings.warn(message)
F:\PycharmProjects\venv\Lib\site-packages\optuna\distributions.py:524: UserWarning: Choices for a categorical distribution should be a tuple of None, bool, int, float and str for persistent storage but contains (128,) which is of type tuple.
  warnings.warn(message)
F:\PycharmProjects\venv\Lib\site-packages\optuna\distributions.py:524: UserWarning: Choices for a categorical distribution should be a tuple of None, bool, int, float and str for persistent storage but contains (256,) which is of type tuple.
  warnings.warn(message)
F:\PycharmProjects\venv\Lib\site-packages\optuna\distributions.py:524: UserWarning: Choices for a categorical distribution should be a tuple of None, bool, int, float and str for persistent storage but contains (512,) which is of type tuple.
  warnings.warn(message)
[I 2024-06-27 16:34:34,906] Trial 71 finished with value: 0.9866666666666667 and parameters: {'classifier': 'NeuralNetwork', 'nn_alpha': 0.0006594914502846979, 'hidden_layer_sizes': (512,), 'activation': 'tanh', 'solver': 'sgd'}. Best is trial 25 with value: 0.9866666666666667.
F:\PycharmProjects\venv\Lib\site-packages\optuna\distributions.py:524: UserWarning: Choices for a categorical distribution should be a tuple of None, bool, int, float and str for persistent storage but contains (64,) which is of type tuple.
  warnings.warn(message)
F:\PycharmProjects\venv\Lib\site-packages\optuna\distributions.py:524: UserWarning: Choices for a categorical distribution should be a tuple of None, bool, int, float and str for persistent storage but contains (128,) which is of type tuple.
  warnings.warn(message)
F:\PycharmProjects\venv\Lib\site-packages\optuna\distributions.py:524: UserWarning: Choices for a categorical distribution should be a tuple of None, bool, int, float and str for persistent storage but contains (256,) which is of type tuple.
  warnings.warn(message)
F:\PycharmProjects\venv\Lib\site-packages\optuna\distributions.py:524: UserWarning: Choices for a categorical distribution should be a tuple of None, bool, int, float and str for persistent storage but contains (512,) which is of type tuple.
  warnings.warn(message)
[I 2024-06-27 16:34:36,478] Trial 72 finished with value: 0.9866666666666667 and parameters: {'classifier': 'NeuralNetwork', 'nn_alpha': 0.0010670807080857014, 'hidden_layer_sizes': (512,), 'activation': 'tanh', 'solver': 'sgd'}. Best is trial 25 with value: 0.9866666666666667.
F:\PycharmProjects\venv\Lib\site-packages\optuna\distributions.py:524: UserWarning: Choices for a categorical distribution should be a tuple of None, bool, int, float and str for persistent storage but contains (64,) which is of type tuple.
  warnings.warn(message)
F:\PycharmProjects\venv\Lib\site-packages\optuna\distributions.py:524: UserWarning: Choices for a categorical distribution should be a tuple of None, bool, int, float and str for persistent storage but contains (128,) which is of type tuple.
  warnings.warn(message)
F:\PycharmProjects\venv\Lib\site-packages\optuna\distributions.py:524: UserWarning: Choices for a categorical distribution should be a tuple of None, bool, int, float and str for persistent storage but contains (256,) which is of type tuple.
  warnings.warn(message)
F:\PycharmProjects\venv\Lib\site-packages\optuna\distributions.py:524: UserWarning: Choices for a categorical distribution should be a tuple of None, bool, int, float and str for persistent storage but contains (512,) which is of type tuple.
  warnings.warn(message)
[I 2024-06-27 16:34:38,016] Trial 73 finished with value: 0.98 and parameters: {'classifier': 'NeuralNetwork', 'nn_alpha': 0.001955006463778726, 'hidden_layer_sizes': (512,), 'activation': 'tanh', 'solver': 'sgd'}. Best is trial 25 with value: 0.9866666666666667.
F:\PycharmProjects\venv\Lib\site-packages\optuna\distributions.py:524: UserWarning: Choices for a categorical distribution should be a tuple of None, bool, int, float and str for persistent storage but contains (64,) which is of type tuple.
  warnings.warn(message)
F:\PycharmProjects\venv\Lib\site-packages\optuna\distributions.py:524: UserWarning: Choices for a categorical distribution should be a tuple of None, bool, int, float and str for persistent storage but contains (128,) which is of type tuple.
  warnings.warn(message)
F:\PycharmProjects\venv\Lib\site-packages\optuna\distributions.py:524: UserWarning: Choices for a categorical distribution should be a tuple of None, bool, int, float and str for persistent storage but contains (256,) which is of type tuple.
  warnings.warn(message)
F:\PycharmProjects\venv\Lib\site-packages\optuna\distributions.py:524: UserWarning: Choices for a categorical distribution should be a tuple of None, bool, int, float and str for persistent storage but contains (512,) which is of type tuple.
  warnings.warn(message)
[I 2024-06-27 16:34:38,299] Trial 74 finished with value: 0.98 and parameters: {'classifier': 'NeuralNetwork', 'nn_alpha': 0.003283688199810481, 'hidden_layer_sizes': (128,), 'activation': 'tanh', 'solver': 'adam'}. Best is trial 25 with value: 0.9866666666666667.
F:\PycharmProjects\venv\Lib\site-packages\optuna\distributions.py:524: UserWarning: Choices for a categorical distribution should be a tuple of None, bool, int, float and str for persistent storage but contains (64,) which is of type tuple.
  warnings.warn(message)
F:\PycharmProjects\venv\Lib\site-packages\optuna\distributions.py:524: UserWarning: Choices for a categorical distribution should be a tuple of None, bool, int, float and str for persistent storage but contains (128,) which is of type tuple.
  warnings.warn(message)
F:\PycharmProjects\venv\Lib\site-packages\optuna\distributions.py:524: UserWarning: Choices for a categorical distribution should be a tuple of None, bool, int, float and str for persistent storage but contains (256,) which is of type tuple.
  warnings.warn(message)
F:\PycharmProjects\venv\Lib\site-packages\optuna\distributions.py:524: UserWarning: Choices for a categorical distribution should be a tuple of None, bool, int, float and str for persistent storage but contains (512,) which is of type tuple.
  warnings.warn(message)
[I 2024-06-27 16:34:39,867] Trial 75 finished with value: 0.9866666666666667 and parameters: {'classifier': 'NeuralNetwork', 'nn_alpha': 0.00024455587354484294, 'hidden_layer_sizes': (512,), 'activation': 'tanh', 'solver': 'sgd'}. Best is trial 25 with value: 0.9866666666666667.
[I 2024-06-27 16:34:39,938] Trial 76 finished with value: 0.9466666666666667 and parameters: {'classifier': 'SVC', 'svc_c': 11242.109699094595, 'gamma': 'auto', 'kernel': 'poly'}. Best is trial 25 with value: 0.9866666666666667.
F:\PycharmProjects\venv\Lib\site-packages\optuna\distributions.py:524: UserWarning: Choices for a categorical distribution should be a tuple of None, bool, int, float and str for persistent storage but contains (64,) which is of type tuple.
  warnings.warn(message)
F:\PycharmProjects\venv\Lib\site-packages\optuna\distributions.py:524: UserWarning: Choices for a categorical distribution should be a tuple of None, bool, int, float and str for persistent storage but contains (128,) which is of type tuple.
  warnings.warn(message)
F:\PycharmProjects\venv\Lib\site-packages\optuna\distributions.py:524: UserWarning: Choices for a categorical distribution should be a tuple of None, bool, int, float and str for persistent storage but contains (256,) which is of type tuple.
  warnings.warn(message)
F:\PycharmProjects\venv\Lib\site-packages\optuna\distributions.py:524: UserWarning: Choices for a categorical distribution should be a tuple of None, bool, int, float and str for persistent storage but contains (512,) which is of type tuple.
  warnings.warn(message)
[I 2024-06-27 16:34:40,551] Trial 77 finished with value: 0.98 and parameters: {'classifier': 'NeuralNetwork', 'nn_alpha': 0.0007070837734450642, 'hidden_layer_sizes': (512,), 'activation': 'tanh', 'solver': 'adam'}. Best is trial 25 with value: 0.9866666666666667.
[I 2024-06-27 16:34:40,692] Trial 78 finished with value: 0.94 and parameters: {'classifier': 'RandomForest', 'rf_max_depth': 10, 'rf_min_samples_split': 15, 'rf_min_samples_leaf': 8, 'rf_max_features': 'sqrt'}. Best is trial 25 with value: 0.9866666666666667.
F:\PycharmProjects\venv\Lib\site-packages\optuna\distributions.py:524: UserWarning: Choices for a categorical distribution should be a tuple of None, bool, int, float and str for persistent storage but contains (64,) which is of type tuple.
  warnings.warn(message)
F:\PycharmProjects\venv\Lib\site-packages\optuna\distributions.py:524: UserWarning: Choices for a categorical distribution should be a tuple of None, bool, int, float and str for persistent storage but contains (128,) which is of type tuple.
  warnings.warn(message)
F:\PycharmProjects\venv\Lib\site-packages\optuna\distributions.py:524: UserWarning: Choices for a categorical distribution should be a tuple of None, bool, int, float and str for persistent storage but contains (256,) which is of type tuple.
  warnings.warn(message)
F:\PycharmProjects\venv\Lib\site-packages\optuna\distributions.py:524: UserWarning: Choices for a categorical distribution should be a tuple of None, bool, int, float and str for persistent storage but contains (512,) which is of type tuple.
  warnings.warn(message)
[I 2024-06-27 16:34:43,593] Trial 79 finished with value: 0.9333333333333332 and parameters: {'classifier': 'NeuralNetwork', 'nn_alpha': 0.010534452366643533, 'hidden_layer_sizes': (512,), 'activation': 'logistic', 'solver': 'sgd'}. Best is trial 25 with value: 0.9866666666666667.
F:\PycharmProjects\venv\Lib\site-packages\optuna\distributions.py:524: UserWarning: Choices for a categorical distribution should be a tuple of None, bool, int, float and str for persistent storage but contains (64,) which is of type tuple.
  warnings.warn(message)
F:\PycharmProjects\venv\Lib\site-packages\optuna\distributions.py:524: UserWarning: Choices for a categorical distribution should be a tuple of None, bool, int, float and str for persistent storage but contains (128,) which is of type tuple.
  warnings.warn(message)
F:\PycharmProjects\venv\Lib\site-packages\optuna\distributions.py:524: UserWarning: Choices for a categorical distribution should be a tuple of None, bool, int, float and str for persistent storage but contains (256,) which is of type tuple.
  warnings.warn(message)
F:\PycharmProjects\venv\Lib\site-packages\optuna\distributions.py:524: UserWarning: Choices for a categorical distribution should be a tuple of None, bool, int, float and str for persistent storage but contains (512,) which is of type tuple.
  warnings.warn(message)
[I 2024-06-27 16:34:44,042] Trial 80 finished with value: 0.9866666666666667 and parameters: {'classifier': 'NeuralNetwork', 'nn_alpha': 0.005130300039348046, 'hidden_layer_sizes': (64,), 'activation': 'tanh', 'solver': 'sgd'}. Best is trial 25 with value: 0.9866666666666667.
F:\PycharmProjects\venv\Lib\site-packages\optuna\distributions.py:524: UserWarning: Choices for a categorical distribution should be a tuple of None, bool, int, float and str for persistent storage but contains (64,) which is of type tuple.
  warnings.warn(message)
F:\PycharmProjects\venv\Lib\site-packages\optuna\distributions.py:524: UserWarning: Choices for a categorical distribution should be a tuple of None, bool, int, float and str for persistent storage but contains (128,) which is of type tuple.
  warnings.warn(message)
F:\PycharmProjects\venv\Lib\site-packages\optuna\distributions.py:524: UserWarning: Choices for a categorical distribution should be a tuple of None, bool, int, float and str for persistent storage but contains (256,) which is of type tuple.
  warnings.warn(message)
F:\PycharmProjects\venv\Lib\site-packages\optuna\distributions.py:524: UserWarning: Choices for a categorical distribution should be a tuple of None, bool, int, float and str for persistent storage but contains (512,) which is of type tuple.
  warnings.warn(message)
[I 2024-06-27 16:34:45,635] Trial 81 finished with value: 0.9866666666666667 and parameters: {'classifier': 'NeuralNetwork', 'nn_alpha': 0.004571994906489865, 'hidden_layer_sizes': (512,), 'activation': 'tanh', 'solver': 'sgd'}. Best is trial 25 with value: 0.9866666666666667.
F:\PycharmProjects\venv\Lib\site-packages\optuna\distributions.py:524: UserWarning: Choices for a categorical distribution should be a tuple of None, bool, int, float and str for persistent storage but contains (64,) which is of type tuple.
  warnings.warn(message)
F:\PycharmProjects\venv\Lib\site-packages\optuna\distributions.py:524: UserWarning: Choices for a categorical distribution should be a tuple of None, bool, int, float and str for persistent storage but contains (128,) which is of type tuple.
  warnings.warn(message)
F:\PycharmProjects\venv\Lib\site-packages\optuna\distributions.py:524: UserWarning: Choices for a categorical distribution should be a tuple of None, bool, int, float and str for persistent storage but contains (256,) which is of type tuple.
  warnings.warn(message)
F:\PycharmProjects\venv\Lib\site-packages\optuna\distributions.py:524: UserWarning: Choices for a categorical distribution should be a tuple of None, bool, int, float and str for persistent storage but contains (512,) which is of type tuple.
  warnings.warn(message)
[I 2024-06-27 16:34:47,163] Trial 82 finished with value: 0.9866666666666667 and parameters: {'classifier': 'NeuralNetwork', 'nn_alpha': 0.007441699658717453, 'hidden_layer_sizes': (512,), 'activation': 'tanh', 'solver': 'sgd'}. Best is trial 25 with value: 0.9866666666666667.
F:\PycharmProjects\venv\Lib\site-packages\optuna\distributions.py:524: UserWarning: Choices for a categorical distribution should be a tuple of None, bool, int, float and str for persistent storage but contains (64,) which is of type tuple.
  warnings.warn(message)
F:\PycharmProjects\venv\Lib\site-packages\optuna\distributions.py:524: UserWarning: Choices for a categorical distribution should be a tuple of None, bool, int, float and str for persistent storage but contains (128,) which is of type tuple.
  warnings.warn(message)
F:\PycharmProjects\venv\Lib\site-packages\optuna\distributions.py:524: UserWarning: Choices for a categorical distribution should be a tuple of None, bool, int, float and str for persistent storage but contains (256,) which is of type tuple.
  warnings.warn(message)
F:\PycharmProjects\venv\Lib\site-packages\optuna\distributions.py:524: UserWarning: Choices for a categorical distribution should be a tuple of None, bool, int, float and str for persistent storage but contains (512,) which is of type tuple.
  warnings.warn(message)
