[I 2024-06-27 16:34:12,100] Trial 46 finished with value: 0.9533333333333333 and parameters: {'classifier': 'RandomForest', 'rf_max_depth': 6, 'rf_min_samples_split': 20, 'rf_min_samples_leaf': 3, 'rf_max_features': 'sqrt'}. Best is trial 25 with value: 0.9866666666666667.
F:\PycharmProjects\venv\Lib\site-packages\optuna\distributions.py:524: UserWarning: Choices for a categorical distribution should be a tuple of None, bool, int, float and str for persistent storage but contains (64,) which is of type tuple.
  warnings.warn(message)
F:\PycharmProjects\venv\Lib\site-packages\optuna\distributions.py:524: UserWarning: Choices for a categorical distribution should be a tuple of None, bool, int, float and str for persistent storage but contains (128,) which is of type tuple.
  warnings.warn(message)
F:\PycharmProjects\venv\Lib\site-packages\optuna\distributions.py:524: UserWarning: Choices for a categorical distribution should be a tuple of None, bool, int, float and str for persistent storage but contains (256,) which is of type tuple.
  warnings.warn(message)
F:\PycharmProjects\venv\Lib\site-packages\optuna\distributions.py:524: UserWarning: Choices for a categorical distribution should be a tuple of None, bool, int, float and str for persistent storage but contains (512,) which is of type tuple.
  warnings.warn(message)
[I 2024-06-27 16:34:12,580] Trial 47 finished with value: 0.9866666666666667 and parameters: {'classifier': 'NeuralNetwork', 'nn_alpha': 0.009021621467849005, 'hidden_layer_sizes': (128,), 'activation': 'tanh', 'solver': 'sgd'}. Best is trial 25 with value: 0.9866666666666667.
F:\PycharmProjects\venv\Lib\site-packages\optuna\distributions.py:524: UserWarning: Choices for a categorical distribution should be a tuple of None, bool, int, float and str for persistent storage but contains (64,) which is of type tuple.
  warnings.warn(message)
F:\PycharmProjects\venv\Lib\site-packages\optuna\distributions.py:524: UserWarning: Choices for a categorical distribution should be a tuple of None, bool, int, float and str for persistent storage but contains (128,) which is of type tuple.
  warnings.warn(message)
F:\PycharmProjects\venv\Lib\site-packages\optuna\distributions.py:524: UserWarning: Choices for a categorical distribution should be a tuple of None, bool, int, float and str for persistent storage but contains (256,) which is of type tuple.
  warnings.warn(message)
F:\PycharmProjects\venv\Lib\site-packages\optuna\distributions.py:524: UserWarning: Choices for a categorical distribution should be a tuple of None, bool, int, float and str for persistent storage but contains (512,) which is of type tuple.
  warnings.warn(message)
[I 2024-06-27 16:34:13,932] Trial 48 finished with value: 0.9866666666666667 and parameters: {'classifier': 'NeuralNetwork', 'nn_alpha': 0.004070346603354814, 'hidden_layer_sizes': (512,), 'activation': 'tanh', 'solver': 'sgd'}. Best is trial 25 with value: 0.9866666666666667.
[I 2024-06-27 16:34:13,952] Trial 49 finished with value: 0.9733333333333333 and parameters: {'classifier': 'SVC', 'svc_c': 0.1243216576162927, 'gamma': 'scale', 'kernel': 'poly'}. Best is trial 25 with value: 0.9866666666666667.
F:\PycharmProjects\venv\Lib\site-packages\optuna\distributions.py:524: UserWarning: Choices for a categorical distribution should be a tuple of None, bool, int, float and str for persistent storage but contains (64,) which is of type tuple.
  warnings.warn(message)
F:\PycharmProjects\venv\Lib\site-packages\optuna\distributions.py:524: UserWarning: Choices for a categorical distribution should be a tuple of None, bool, int, float and str for persistent storage but contains (128,) which is of type tuple.
  warnings.warn(message)
F:\PycharmProjects\venv\Lib\site-packages\optuna\distributions.py:524: UserWarning: Choices for a categorical distribution should be a tuple of None, bool, int, float and str for persistent storage but contains (256,) which is of type tuple.
  warnings.warn(message)
F:\PycharmProjects\venv\Lib\site-packages\optuna\distributions.py:524: UserWarning: Choices for a categorical distribution should be a tuple of None, bool, int, float and str for persistent storage but contains (512,) which is of type tuple.
  warnings.warn(message)
[I 2024-06-27 16:34:14,287] Trial 50 finished with value: 0.9866666666666667 and parameters: {'classifier': 'NeuralNetwork', 'nn_alpha': 0.0019421892313434392, 'hidden_layer_sizes': (64,), 'activation': 'tanh', 'solver': 'sgd'}. Best is trial 25 with value: 0.9866666666666667.
F:\PycharmProjects\venv\Lib\site-packages\optuna\distributions.py:524: UserWarning: Choices for a categorical distribution should be a tuple of None, bool, int, float and str for persistent storage but contains (64,) which is of type tuple.
  warnings.warn(message)
F:\PycharmProjects\venv\Lib\site-packages\optuna\distributions.py:524: UserWarning: Choices for a categorical distribution should be a tuple of None, bool, int, float and str for persistent storage but contains (128,) which is of type tuple.
  warnings.warn(message)
F:\PycharmProjects\venv\Lib\site-packages\optuna\distributions.py:524: UserWarning: Choices for a categorical distribution should be a tuple of None, bool, int, float and str for persistent storage but contains (256,) which is of type tuple.
  warnings.warn(message)
F:\PycharmProjects\venv\Lib\site-packages\optuna\distributions.py:524: UserWarning: Choices for a categorical distribution should be a tuple of None, bool, int, float and str for persistent storage but contains (512,) which is of type tuple.
  warnings.warn(message)
[I 2024-06-27 16:34:15,677] Trial 51 finished with value: 0.9866666666666667 and parameters: {'classifier': 'NeuralNetwork', 'nn_alpha': 0.005448772265652221, 'hidden_layer_sizes': (512,), 'activation': 'tanh', 'solver': 'sgd'}. Best is trial 25 with value: 0.9866666666666667.
F:\PycharmProjects\venv\Lib\site-packages\optuna\distributions.py:524: UserWarning: Choices for a categorical distribution should be a tuple of None, bool, int, float and str for persistent storage but contains (64,) which is of type tuple.
  warnings.warn(message)
F:\PycharmProjects\venv\Lib\site-packages\optuna\distributions.py:524: UserWarning: Choices for a categorical distribution should be a tuple of None, bool, int, float and str for persistent storage but contains (128,) which is of type tuple.
  warnings.warn(message)
F:\PycharmProjects\venv\Lib\site-packages\optuna\distributions.py:524: UserWarning: Choices for a categorical distribution should be a tuple of None, bool, int, float and str for persistent storage but contains (256,) which is of type tuple.
  warnings.warn(message)
F:\PycharmProjects\venv\Lib\site-packages\optuna\distributions.py:524: UserWarning: Choices for a categorical distribution should be a tuple of None, bool, int, float and str for persistent storage but contains (512,) which is of type tuple.
  warnings.warn(message)
[I 2024-06-27 16:34:17,030] Trial 52 finished with value: 0.9866666666666667 and parameters: {'classifier': 'NeuralNetwork', 'nn_alpha': 0.008135031637595162, 'hidden_layer_sizes': (512,), 'activation': 'tanh', 'solver': 'sgd'}. Best is trial 25 with value: 0.9866666666666667.
F:\PycharmProjects\venv\Lib\site-packages\optuna\distributions.py:524: UserWarning: Choices for a categorical distribution should be a tuple of None, bool, int, float and str for persistent storage but contains (64,) which is of type tuple.
  warnings.warn(message)
F:\PycharmProjects\venv\Lib\site-packages\optuna\distributions.py:524: UserWarning: Choices for a categorical distribution should be a tuple of None, bool, int, float and str for persistent storage but contains (128,) which is of type tuple.
  warnings.warn(message)
F:\PycharmProjects\venv\Lib\site-packages\optuna\distributions.py:524: UserWarning: Choices for a categorical distribution should be a tuple of None, bool, int, float and str for persistent storage but contains (256,) which is of type tuple.
  warnings.warn(message)
F:\PycharmProjects\venv\Lib\site-packages\optuna\distributions.py:524: UserWarning: Choices for a categorical distribution should be a tuple of None, bool, int, float and str for persistent storage but contains (512,) which is of type tuple.
  warnings.warn(message)
[I 2024-06-27 16:34:18,366] Trial 53 finished with value: 0.9866666666666667 and parameters: {'classifier': 'NeuralNetwork', 'nn_alpha': 0.0025507914036883342, 'hidden_layer_sizes': (512,), 'activation': 'tanh', 'solver': 'sgd'}. Best is trial 25 with value: 0.9866666666666667.
F:\PycharmProjects\venv\Lib\site-packages\optuna\distributions.py:524: UserWarning: Choices for a categorical distribution should be a tuple of None, bool, int, float and str for persistent storage but contains (64,) which is of type tuple.
  warnings.warn(message)
F:\PycharmProjects\venv\Lib\site-packages\optuna\distributions.py:524: UserWarning: Choices for a categorical distribution should be a tuple of None, bool, int, float and str for persistent storage but contains (128,) which is of type tuple.
  warnings.warn(message)
F:\PycharmProjects\venv\Lib\site-packages\optuna\distributions.py:524: UserWarning: Choices for a categorical distribution should be a tuple of None, bool, int, float and str for persistent storage but contains (256,) which is of type tuple.
  warnings.warn(message)
F:\PycharmProjects\venv\Lib\site-packages\optuna\distributions.py:524: UserWarning: Choices for a categorical distribution should be a tuple of None, bool, int, float and str for persistent storage but contains (512,) which is of type tuple.
  warnings.warn(message)
[I 2024-06-27 16:34:19,683] Trial 54 finished with value: 0.9866666666666667 and parameters: {'classifier': 'NeuralNetwork', 'nn_alpha': 0.03176456436809011, 'hidden_layer_sizes': (512,), 'activation': 'tanh', 'solver': 'sgd'}. Best is trial 25 with value: 0.9866666666666667.
F:\PycharmProjects\venv\Lib\site-packages\optuna\distributions.py:524: UserWarning: Choices for a categorical distribution should be a tuple of None, bool, int, float and str for persistent storage but contains (64,) which is of type tuple.
  warnings.warn(message)
F:\PycharmProjects\venv\Lib\site-packages\optuna\distributions.py:524: UserWarning: Choices for a categorical distribution should be a tuple of None, bool, int, float and str for persistent storage but contains (128,) which is of type tuple.
  warnings.warn(message)
F:\PycharmProjects\venv\Lib\site-packages\optuna\distributions.py:524: UserWarning: Choices for a categorical distribution should be a tuple of None, bool, int, float and str for persistent storage but contains (256,) which is of type tuple.
  warnings.warn(message)
F:\PycharmProjects\venv\Lib\site-packages\optuna\distributions.py:524: UserWarning: Choices for a categorical distribution should be a tuple of None, bool, int, float and str for persistent storage but contains (512,) which is of type tuple.
  warnings.warn(message)
[I 2024-06-27 16:34:21,181] Trial 55 finished with value: 0.9666666666666667 and parameters: {'classifier': 'NeuralNetwork', 'nn_alpha': 0.013293447231850218, 'hidden_layer_sizes': (512,), 'activation': 'tanh', 'solver': 'lbfgs'}. Best is trial 25 with value: 0.9866666666666667.
F:\PycharmProjects\venv\Lib\site-packages\optuna\distributions.py:524: UserWarning: Choices for a categorical distribution should be a tuple of None, bool, int, float and str for persistent storage but contains (64,) which is of type tuple.
  warnings.warn(message)
F:\PycharmProjects\venv\Lib\site-packages\optuna\distributions.py:524: UserWarning: Choices for a categorical distribution should be a tuple of None, bool, int, float and str for persistent storage but contains (128,) which is of type tuple.
  warnings.warn(message)
F:\PycharmProjects\venv\Lib\site-packages\optuna\distributions.py:524: UserWarning: Choices for a categorical distribution should be a tuple of None, bool, int, float and str for persistent storage but contains (256,) which is of type tuple.
  warnings.warn(message)
F:\PycharmProjects\venv\Lib\site-packages\optuna\distributions.py:524: UserWarning: Choices for a categorical distribution should be a tuple of None, bool, int, float and str for persistent storage but contains (512,) which is of type tuple.
  warnings.warn(message)
[I 2024-06-27 16:34:21,640] Trial 56 finished with value: 0.9866666666666667 and parameters: {'classifier': 'NeuralNetwork', 'nn_alpha': 0.006682652972064445, 'hidden_layer_sizes': (128,), 'activation': 'tanh', 'solver': 'sgd'}. Best is trial 25 with value: 0.9866666666666667.
[I 2024-06-27 16:34:22,232] Trial 57 finished with value: 0.9533333333333333 and parameters: {'classifier': 'XGBoost', 'xgb_eta': 0.14235780998402886, 'xgb_max_depth': 4}. Best is trial 25 with value: 0.9866666666666667.
F:\PycharmProjects\venv\Lib\site-packages\optuna\distributions.py:524: UserWarning: Choices for a categorical distribution should be a tuple of None, bool, int, float and str for persistent storage but contains (64,) which is of type tuple.
  warnings.warn(message)
F:\PycharmProjects\venv\Lib\site-packages\optuna\distributions.py:524: UserWarning: Choices for a categorical distribution should be a tuple of None, bool, int, float and str for persistent storage but contains (128,) which is of type tuple.
  warnings.warn(message)
F:\PycharmProjects\venv\Lib\site-packages\optuna\distributions.py:524: UserWarning: Choices for a categorical distribution should be a tuple of None, bool, int, float and str for persistent storage but contains (256,) which is of type tuple.
  warnings.warn(message)
F:\PycharmProjects\venv\Lib\site-packages\optuna\distributions.py:524: UserWarning: Choices for a categorical distribution should be a tuple of None, bool, int, float and str for persistent storage but contains (512,) which is of type tuple.
  warnings.warn(message)
[I 2024-06-27 16:34:23,080] Trial 58 finished with value: 0.9733333333333333 and parameters: {'classifier': 'NeuralNetwork', 'nn_alpha': 0.001451761127676785, 'hidden_layer_sizes': (512,), 'activation': 'relu', 'solver': 'sgd'}. Best is trial 25 with value: 0.9866666666666667.
[I 2024-06-27 16:34:23,099] Trial 59 finished with value: 0.96 and parameters: {'classifier': 'SVC', 'svc_c': 0.28361874515850416, 'gamma': 'auto', 'kernel': 'linear'}. Best is trial 25 with value: 0.9866666666666667.
F:\PycharmProjects\venv\Lib\site-packages\optuna\distributions.py:524: UserWarning: Choices for a categorical distribution should be a tuple of None, bool, int, float and str for persistent storage but contains (64,) which is of type tuple.
  warnings.warn(message)
F:\PycharmProjects\venv\Lib\site-packages\optuna\distributions.py:524: UserWarning: Choices for a categorical distribution should be a tuple of None, bool, int, float and str for persistent storage but contains (128,) which is of type tuple.
  warnings.warn(message)
F:\PycharmProjects\venv\Lib\site-packages\optuna\distributions.py:524: UserWarning: Choices for a categorical distribution should be a tuple of None, bool, int, float and str for persistent storage but contains (256,) which is of type tuple.
  warnings.warn(message)
F:\PycharmProjects\venv\Lib\site-packages\optuna\distributions.py:524: UserWarning: Choices for a categorical distribution should be a tuple of None, bool, int, float and str for persistent storage but contains (512,) which is of type tuple.
  warnings.warn(message)
[I 2024-06-27 16:34:23,449] Trial 60 finished with value: 0.9733333333333333 and parameters: {'classifier': 'NeuralNetwork', 'nn_alpha': 0.0032288605222339744, 'hidden_layer_sizes': (64,), 'activation': 'tanh', 'solver': 'sgd'}. Best is trial 25 with value: 0.9866666666666667.
F:\PycharmProjects\venv\Lib\site-packages\optuna\distributions.py:524: UserWarning: Choices for a categorical distribution should be a tuple of None, bool, int, float and str for persistent storage but contains (64,) which is of type tuple.
  warnings.warn(message)
F:\PycharmProjects\venv\Lib\site-packages\optuna\distributions.py:524: UserWarning: Choices for a categorical distribution should be a tuple of None, bool, int, float and str for persistent storage but contains (128,) which is of type tuple.
  warnings.warn(message)
F:\PycharmProjects\venv\Lib\site-packages\optuna\distributions.py:524: UserWarning: Choices for a categorical distribution should be a tuple of None, bool, int, float and str for persistent storage but contains (256,) which is of type tuple.
  warnings.warn(message)
F:\PycharmProjects\venv\Lib\site-packages\optuna\distributions.py:524: UserWarning: Choices for a categorical distribution should be a tuple of None, bool, int, float and str for persistent storage but contains (512,) which is of type tuple.
  warnings.warn(message)
[I 2024-06-27 16:34:24,769] Trial 61 finished with value: 0.9866666666666667 and parameters: {'classifier': 'NeuralNetwork', 'nn_alpha': 0.01570477758054988, 'hidden_layer_sizes': (512,), 'activation': 'tanh', 'solver': 'sgd'}. Best is trial 25 with value: 0.9866666666666667.
F:\PycharmProjects\venv\Lib\site-packages\optuna\distributions.py:524: UserWarning: Choices for a categorical distribution should be a tuple of None, bool, int, float and str for persistent storage but contains (64,) which is of type tuple.
  warnings.warn(message)
F:\PycharmProjects\venv\Lib\site-packages\optuna\distributions.py:524: UserWarning: Choices for a categorical distribution should be a tuple of None, bool, int, float and str for persistent storage but contains (128,) which is of type tuple.
  warnings.warn(message)
F:\PycharmProjects\venv\Lib\site-packages\optuna\distributions.py:524: UserWarning: Choices for a categorical distribution should be a tuple of None, bool, int, float and str for persistent storage but contains (256,) which is of type tuple.
  warnings.warn(message)
F:\PycharmProjects\venv\Lib\site-packages\optuna\distributions.py:524: UserWarning: Choices for a categorical distribution should be a tuple of None, bool, int, float and str for persistent storage but contains (512,) which is of type tuple.
  warnings.warn(message)
[I 2024-06-27 16:34:26,175] Trial 62 finished with value: 0.98 and parameters: {'classifier': 'NeuralNetwork', 'nn_alpha': 0.019282452752263965, 'hidden_layer_sizes': (512,), 'activation': 'tanh', 'solver': 'sgd'}. Best is trial 25 with value: 0.9866666666666667.
F:\PycharmProjects\venv\Lib\site-packages\optuna\distributions.py:524: UserWarning: Choices for a categorical distribution should be a tuple of None, bool, int, float and str for persistent storage but contains (64,) which is of type tuple.
  warnings.warn(message)
F:\PycharmProjects\venv\Lib\site-packages\optuna\distributions.py:524: UserWarning: Choices for a categorical distribution should be a tuple of None, bool, int, float and str for persistent storage but contains (128,) which is of type tuple.
  warnings.warn(message)
F:\PycharmProjects\venv\Lib\site-packages\optuna\distributions.py:524: UserWarning: Choices for a categorical distribution should be a tuple of None, bool, int, float and str for persistent storage but contains (256,) which is of type tuple.
  warnings.warn(message)
F:\PycharmProjects\venv\Lib\site-packages\optuna\distributions.py:524: UserWarning: Choices for a categorical distribution should be a tuple of None, bool, int, float and str for persistent storage but contains (512,) which is of type tuple.
  warnings.warn(message)
[I 2024-06-27 16:34:27,472] Trial 63 finished with value: 0.9866666666666667 and parameters: {'classifier': 'NeuralNetwork', 'nn_alpha': 0.010918867864474676, 'hidden_layer_sizes': (512,), 'activation': 'tanh', 'solver': 'sgd'}. Best is trial 25 with value: 0.9866666666666667.
F:\PycharmProjects\venv\Lib\site-packages\optuna\distributions.py:524: UserWarning: Choices for a categorical distribution should be a tuple of None, bool, int, float and str for persistent storage but contains (64,) which is of type tuple.
  warnings.warn(message)
F:\PycharmProjects\venv\Lib\site-packages\optuna\distributions.py:524: UserWarning: Choices for a categorical distribution should be a tuple of None, bool, int, float and str for persistent storage but contains (128,) which is of type tuple.
  warnings.warn(message)
F:\PycharmProjects\venv\Lib\site-packages\optuna\distributions.py:524: UserWarning: Choices for a categorical distribution should be a tuple of None, bool, int, float and str for persistent storage but contains (256,) which is of type tuple.
  warnings.warn(message)
F:\PycharmProjects\venv\Lib\site-packages\optuna\distributions.py:524: UserWarning: Choices for a categorical distribution should be a tuple of None, bool, int, float and str for persistent storage but contains (512,) which is of type tuple.
  warnings.warn(message)
[I 2024-06-27 16:34:28,115] Trial 64 finished with value: 0.9733333333333333 and parameters: {'classifier': 'NeuralNetwork', 'nn_alpha': 0.038065397471757065, 'hidden_layer_sizes': (512,), 'activation': 'tanh', 'solver': 'lbfgs'}. Best is trial 25 with value: 0.9866666666666667.
