[I 2024-06-27 16:34:48,715] Trial 83 finished with value: 0.9866666666666667 and parameters: {'classifier': 'NeuralNetwork', 'nn_alpha': 0.0028689315572304097, 'hidden_layer_sizes': (512,), 'activation': 'tanh', 'solver': 'sgd'}. Best is trial 25 with value: 0.9866666666666667.
F:\PycharmProjects\venv\Lib\site-packages\optuna\distributions.py:524: UserWarning: Choices for a categorical distribution should be a tuple of None, bool, int, float and str for persistent storage but contains (64,) which is of type tuple.
  warnings.warn(message)
F:\PycharmProjects\venv\Lib\site-packages\optuna\distributions.py:524: UserWarning: Choices for a categorical distribution should be a tuple of None, bool, int, float and str for persistent storage but contains (128,) which is of type tuple.
  warnings.warn(message)
F:\PycharmProjects\venv\Lib\site-packages\optuna\distributions.py:524: UserWarning: Choices for a categorical distribution should be a tuple of None, bool, int, float and str for persistent storage but contains (256,) which is of type tuple.
  warnings.warn(message)
F:\PycharmProjects\venv\Lib\site-packages\optuna\distributions.py:524: UserWarning: Choices for a categorical distribution should be a tuple of None, bool, int, float and str for persistent storage but contains (512,) which is of type tuple.
  warnings.warn(message)
[I 2024-06-27 16:34:49,050] Trial 84 finished with value: 0.98 and parameters: {'classifier': 'NeuralNetwork', 'nn_alpha': 0.025182626804655724, 'hidden_layer_sizes': (128,), 'activation': 'tanh', 'solver': 'adam'}. Best is trial 25 with value: 0.9866666666666667.
F:\PycharmProjects\venv\Lib\site-packages\optuna\distributions.py:524: UserWarning: Choices for a categorical distribution should be a tuple of None, bool, int, float and str for persistent storage but contains (64,) which is of type tuple.
  warnings.warn(message)
F:\PycharmProjects\venv\Lib\site-packages\optuna\distributions.py:524: UserWarning: Choices for a categorical distribution should be a tuple of None, bool, int, float and str for persistent storage but contains (128,) which is of type tuple.
  warnings.warn(message)
F:\PycharmProjects\venv\Lib\site-packages\optuna\distributions.py:524: UserWarning: Choices for a categorical distribution should be a tuple of None, bool, int, float and str for persistent storage but contains (256,) which is of type tuple.
  warnings.warn(message)
F:\PycharmProjects\venv\Lib\site-packages\optuna\distributions.py:524: UserWarning: Choices for a categorical distribution should be a tuple of None, bool, int, float and str for persistent storage but contains (512,) which is of type tuple.
  warnings.warn(message)
[I 2024-06-27 16:34:50,644] Trial 85 finished with value: 0.9866666666666667 and parameters: {'classifier': 'NeuralNetwork', 'nn_alpha': 1.0448714199345444e-05, 'hidden_layer_sizes': (512,), 'activation': 'tanh', 'solver': 'sgd'}. Best is trial 25 with value: 0.9866666666666667.
F:\PycharmProjects\venv\Lib\site-packages\optuna\distributions.py:524: UserWarning: Choices for a categorical distribution should be a tuple of None, bool, int, float and str for persistent storage but contains (64,) which is of type tuple.
  warnings.warn(message)
F:\PycharmProjects\venv\Lib\site-packages\optuna\distributions.py:524: UserWarning: Choices for a categorical distribution should be a tuple of None, bool, int, float and str for persistent storage but contains (128,) which is of type tuple.
  warnings.warn(message)
F:\PycharmProjects\venv\Lib\site-packages\optuna\distributions.py:524: UserWarning: Choices for a categorical distribution should be a tuple of None, bool, int, float and str for persistent storage but contains (256,) which is of type tuple.
  warnings.warn(message)
F:\PycharmProjects\venv\Lib\site-packages\optuna\distributions.py:524: UserWarning: Choices for a categorical distribution should be a tuple of None, bool, int, float and str for persistent storage but contains (512,) which is of type tuple.
  warnings.warn(message)
[I 2024-06-27 16:34:51,499] Trial 86 finished with value: 0.9866666666666667 and parameters: {'classifier': 'NeuralNetwork', 'nn_alpha': 0.004989474382068689, 'hidden_layer_sizes': (256,), 'activation': 'tanh', 'solver': 'sgd'}. Best is trial 25 with value: 0.9866666666666667.
F:\PycharmProjects\venv\Lib\site-packages\optuna\distributions.py:524: UserWarning: Choices for a categorical distribution should be a tuple of None, bool, int, float and str for persistent storage but contains (64,) which is of type tuple.
  warnings.warn(message)
F:\PycharmProjects\venv\Lib\site-packages\optuna\distributions.py:524: UserWarning: Choices for a categorical distribution should be a tuple of None, bool, int, float and str for persistent storage but contains (128,) which is of type tuple.
  warnings.warn(message)
F:\PycharmProjects\venv\Lib\site-packages\optuna\distributions.py:524: UserWarning: Choices for a categorical distribution should be a tuple of None, bool, int, float and str for persistent storage but contains (256,) which is of type tuple.
  warnings.warn(message)
F:\PycharmProjects\venv\Lib\site-packages\optuna\distributions.py:524: UserWarning: Choices for a categorical distribution should be a tuple of None, bool, int, float and str for persistent storage but contains (512,) which is of type tuple.
  warnings.warn(message)
[I 2024-06-27 16:34:53,082] Trial 87 finished with value: 0.9866666666666667 and parameters: {'classifier': 'NeuralNetwork', 'nn_alpha': 0.009483623865750298, 'hidden_layer_sizes': (512,), 'activation': 'tanh', 'solver': 'sgd'}. Best is trial 25 with value: 0.9866666666666667.
[I 2024-06-27 16:34:53,815] Trial 88 finished with value: 0.9533333333333333 and parameters: {'classifier': 'XGBoost', 'xgb_eta': 0.07957678545656004, 'xgb_max_depth': 4}. Best is trial 25 with value: 0.9866666666666667.
F:\PycharmProjects\venv\Lib\site-packages\optuna\distributions.py:524: UserWarning: Choices for a categorical distribution should be a tuple of None, bool, int, float and str for persistent storage but contains (64,) which is of type tuple.
  warnings.warn(message)
F:\PycharmProjects\venv\Lib\site-packages\optuna\distributions.py:524: UserWarning: Choices for a categorical distribution should be a tuple of None, bool, int, float and str for persistent storage but contains (128,) which is of type tuple.
  warnings.warn(message)
F:\PycharmProjects\venv\Lib\site-packages\optuna\distributions.py:524: UserWarning: Choices for a categorical distribution should be a tuple of None, bool, int, float and str for persistent storage but contains (256,) which is of type tuple.
  warnings.warn(message)
F:\PycharmProjects\venv\Lib\site-packages\optuna\distributions.py:524: UserWarning: Choices for a categorical distribution should be a tuple of None, bool, int, float and str for persistent storage but contains (512,) which is of type tuple.
  warnings.warn(message)
[I 2024-06-27 16:34:54,139] Trial 89 finished with value: 0.9733333333333333 and parameters: {'classifier': 'NeuralNetwork', 'nn_alpha': 0.015419175182688365, 'hidden_layer_sizes': (512,), 'activation': 'relu', 'solver': 'adam'}. Best is trial 25 with value: 0.9866666666666667.
[I 2024-06-27 16:34:54,161] Trial 90 finished with value: 0.32 and parameters: {'classifier': 'SVC', 'svc_c': 7.556206865020751e-05, 'gamma': 'scale', 'kernel': 'rbf'}. Best is trial 25 with value: 0.9866666666666667.
F:\PycharmProjects\venv\Lib\site-packages\optuna\distributions.py:524: UserWarning: Choices for a categorical distribution should be a tuple of None, bool, int, float and str for persistent storage but contains (64,) which is of type tuple.
  warnings.warn(message)
F:\PycharmProjects\venv\Lib\site-packages\optuna\distributions.py:524: UserWarning: Choices for a categorical distribution should be a tuple of None, bool, int, float and str for persistent storage but contains (128,) which is of type tuple.
  warnings.warn(message)
F:\PycharmProjects\venv\Lib\site-packages\optuna\distributions.py:524: UserWarning: Choices for a categorical distribution should be a tuple of None, bool, int, float and str for persistent storage but contains (256,) which is of type tuple.
  warnings.warn(message)
F:\PycharmProjects\venv\Lib\site-packages\optuna\distributions.py:524: UserWarning: Choices for a categorical distribution should be a tuple of None, bool, int, float and str for persistent storage but contains (512,) which is of type tuple.
  warnings.warn(message)
[I 2024-06-27 16:34:55,746] Trial 91 finished with value: 0.9866666666666667 and parameters: {'classifier': 'NeuralNetwork', 'nn_alpha': 0.006818028834958779, 'hidden_layer_sizes': (512,), 'activation': 'tanh', 'solver': 'sgd'}. Best is trial 25 with value: 0.9866666666666667.
F:\PycharmProjects\venv\Lib\site-packages\optuna\distributions.py:524: UserWarning: Choices for a categorical distribution should be a tuple of None, bool, int, float and str for persistent storage but contains (64,) which is of type tuple.
  warnings.warn(message)
F:\PycharmProjects\venv\Lib\site-packages\optuna\distributions.py:524: UserWarning: Choices for a categorical distribution should be a tuple of None, bool, int, float and str for persistent storage but contains (128,) which is of type tuple.
  warnings.warn(message)
F:\PycharmProjects\venv\Lib\site-packages\optuna\distributions.py:524: UserWarning: Choices for a categorical distribution should be a tuple of None, bool, int, float and str for persistent storage but contains (256,) which is of type tuple.
  warnings.warn(message)
F:\PycharmProjects\venv\Lib\site-packages\optuna\distributions.py:524: UserWarning: Choices for a categorical distribution should be a tuple of None, bool, int, float and str for persistent storage but contains (512,) which is of type tuple.
  warnings.warn(message)
[I 2024-06-27 16:34:57,428] Trial 92 finished with value: 0.9866666666666667 and parameters: {'classifier': 'NeuralNetwork', 'nn_alpha': 0.0039896980525390546, 'hidden_layer_sizes': (512,), 'activation': 'tanh', 'solver': 'sgd'}. Best is trial 25 with value: 0.9866666666666667.
F:\PycharmProjects\venv\Lib\site-packages\optuna\distributions.py:524: UserWarning: Choices for a categorical distribution should be a tuple of None, bool, int, float and str for persistent storage but contains (64,) which is of type tuple.
  warnings.warn(message)
F:\PycharmProjects\venv\Lib\site-packages\optuna\distributions.py:524: UserWarning: Choices for a categorical distribution should be a tuple of None, bool, int, float and str for persistent storage but contains (128,) which is of type tuple.
  warnings.warn(message)
F:\PycharmProjects\venv\Lib\site-packages\optuna\distributions.py:524: UserWarning: Choices for a categorical distribution should be a tuple of None, bool, int, float and str for persistent storage but contains (256,) which is of type tuple.
  warnings.warn(message)
F:\PycharmProjects\venv\Lib\site-packages\optuna\distributions.py:524: UserWarning: Choices for a categorical distribution should be a tuple of None, bool, int, float and str for persistent storage but contains (512,) which is of type tuple.
  warnings.warn(message)
[I 2024-06-27 16:34:58,925] Trial 93 finished with value: 0.9866666666666667 and parameters: {'classifier': 'NeuralNetwork', 'nn_alpha': 0.011636649230144331, 'hidden_layer_sizes': (512,), 'activation': 'tanh', 'solver': 'sgd'}. Best is trial 25 with value: 0.9866666666666667.
F:\PycharmProjects\venv\Lib\site-packages\optuna\distributions.py:524: UserWarning: Choices for a categorical distribution should be a tuple of None, bool, int, float and str for persistent storage but contains (64,) which is of type tuple.
  warnings.warn(message)
F:\PycharmProjects\venv\Lib\site-packages\optuna\distributions.py:524: UserWarning: Choices for a categorical distribution should be a tuple of None, bool, int, float and str for persistent storage but contains (128,) which is of type tuple.
  warnings.warn(message)
F:\PycharmProjects\venv\Lib\site-packages\optuna\distributions.py:524: UserWarning: Choices for a categorical distribution should be a tuple of None, bool, int, float and str for persistent storage but contains (256,) which is of type tuple.
  warnings.warn(message)
F:\PycharmProjects\venv\Lib\site-packages\optuna\distributions.py:524: UserWarning: Choices for a categorical distribution should be a tuple of None, bool, int, float and str for persistent storage but contains (512,) which is of type tuple.
  warnings.warn(message)
[I 2024-06-27 16:34:59,393] Trial 94 finished with value: 0.98 and parameters: {'classifier': 'NeuralNetwork', 'nn_alpha': 0.0021764414175137544, 'hidden_layer_sizes': (128,), 'activation': 'tanh', 'solver': 'sgd'}. Best is trial 25 with value: 0.9866666666666667.
F:\PycharmProjects\venv\Lib\site-packages\optuna\distributions.py:524: UserWarning: Choices for a categorical distribution should be a tuple of None, bool, int, float and str for persistent storage but contains (64,) which is of type tuple.
  warnings.warn(message)
F:\PycharmProjects\venv\Lib\site-packages\optuna\distributions.py:524: UserWarning: Choices for a categorical distribution should be a tuple of None, bool, int, float and str for persistent storage but contains (128,) which is of type tuple.
  warnings.warn(message)
F:\PycharmProjects\venv\Lib\site-packages\optuna\distributions.py:524: UserWarning: Choices for a categorical distribution should be a tuple of None, bool, int, float and str for persistent storage but contains (256,) which is of type tuple.
  warnings.warn(message)
F:\PycharmProjects\venv\Lib\site-packages\optuna\distributions.py:524: UserWarning: Choices for a categorical distribution should be a tuple of None, bool, int, float and str for persistent storage but contains (512,) which is of type tuple.
  warnings.warn(message)
[I 2024-06-27 16:35:00,734] Trial 95 finished with value: 0.9866666666666667 and parameters: {'classifier': 'NeuralNetwork', 'nn_alpha': 0.006652378353855268, 'hidden_layer_sizes': (512,), 'activation': 'tanh', 'solver': 'sgd'}. Best is trial 25 with value: 0.9866666666666667.
[I 2024-06-27 16:35:00,851] Trial 96 finished with value: 0.9533333333333333 and parameters: {'classifier': 'RandomForest', 'rf_max_depth': 4, 'rf_min_samples_split': 2, 'rf_min_samples_leaf': 4, 'rf_max_features': 'sqrt'}. Best is trial 25 with value: 0.9866666666666667.
F:\PycharmProjects\venv\Lib\site-packages\optuna\distributions.py:524: UserWarning: Choices for a categorical distribution should be a tuple of None, bool, int, float and str for persistent storage but contains (64,) which is of type tuple.
  warnings.warn(message)
F:\PycharmProjects\venv\Lib\site-packages\optuna\distributions.py:524: UserWarning: Choices for a categorical distribution should be a tuple of None, bool, int, float and str for persistent storage but contains (128,) which is of type tuple.
  warnings.warn(message)
F:\PycharmProjects\venv\Lib\site-packages\optuna\distributions.py:524: UserWarning: Choices for a categorical distribution should be a tuple of None, bool, int, float and str for persistent storage but contains (256,) which is of type tuple.
  warnings.warn(message)
F:\PycharmProjects\venv\Lib\site-packages\optuna\distributions.py:524: UserWarning: Choices for a categorical distribution should be a tuple of None, bool, int, float and str for persistent storage but contains (512,) which is of type tuple.
  warnings.warn(message)
[I 2024-06-27 16:35:02,254] Trial 97 finished with value: 0.9866666666666667 and parameters: {'classifier': 'NeuralNetwork', 'nn_alpha': 0.008598016671737171, 'hidden_layer_sizes': (512,), 'activation': 'tanh', 'solver': 'sgd'}. Best is trial 25 with value: 0.9866666666666667.
F:\PycharmProjects\venv\Lib\site-packages\optuna\distributions.py:524: UserWarning: Choices for a categorical distribution should be a tuple of None, bool, int, float and str for persistent storage but contains (64,) which is of type tuple.
  warnings.warn(message)
F:\PycharmProjects\venv\Lib\site-packages\optuna\distributions.py:524: UserWarning: Choices for a categorical distribution should be a tuple of None, bool, int, float and str for persistent storage but contains (128,) which is of type tuple.
  warnings.warn(message)
F:\PycharmProjects\venv\Lib\site-packages\optuna\distributions.py:524: UserWarning: Choices for a categorical distribution should be a tuple of None, bool, int, float and str for persistent storage but contains (256,) which is of type tuple.
  warnings.warn(message)
F:\PycharmProjects\venv\Lib\site-packages\optuna\distributions.py:524: UserWarning: Choices for a categorical distribution should be a tuple of None, bool, int, float and str for persistent storage but contains (512,) which is of type tuple.
  warnings.warn(message)
[I 2024-06-27 16:35:03,015] Trial 98 finished with value: 0.9733333333333333 and parameters: {'classifier': 'NeuralNetwork', 'nn_alpha': 0.018686588639215712, 'hidden_layer_sizes': (512,), 'activation': 'logistic', 'solver': 'lbfgs'}. Best is trial 25 with value: 0.9866666666666667.
F:\PycharmProjects\venv\Lib\site-packages\optuna\distributions.py:524: UserWarning: Choices for a categorical distribution should be a tuple of None, bool, int, float and str for persistent storage but contains (64,) which is of type tuple.
  warnings.warn(message)
F:\PycharmProjects\venv\Lib\site-packages\optuna\distributions.py:524: UserWarning: Choices for a categorical distribution should be a tuple of None, bool, int, float and str for persistent storage but contains (128,) which is of type tuple.
  warnings.warn(message)
F:\PycharmProjects\venv\Lib\site-packages\optuna\distributions.py:524: UserWarning: Choices for a categorical distribution should be a tuple of None, bool, int, float and str for persistent storage but contains (256,) which is of type tuple.
  warnings.warn(message)
F:\PycharmProjects\venv\Lib\site-packages\optuna\distributions.py:524: UserWarning: Choices for a categorical distribution should be a tuple of None, bool, int, float and str for persistent storage but contains (512,) which is of type tuple.
  warnings.warn(message)
[I 2024-06-27 16:35:03,370] Trial 99 finished with value: 0.98 and parameters: {'classifier': 'NeuralNetwork', 'nn_alpha': 0.0038139421520920016, 'hidden_layer_sizes': (64,), 'activation': 'tanh', 'solver': 'sgd'}. Best is trial 25 with value: 0.9866666666666667.
FrozenTrial(number=25, state=1, values=[0.9866666666666667], datetime_start=datetime.datetime(2024, 6, 27, 16, 33, 53, 903854), datetime_complete=datetime.datetime(2024, 6, 27, 16, 33, 54, 131627), params={'classifier': 'NeuralNetwork', 'nn_alpha': 0.003822585225577289, 'hidden_layer_sizes': (128,), 'activation': 'tanh', 'solver': 'adam'}, user_attrs={}, system_attrs={}, intermediate_values={}, distributions={'classifier': CategoricalDistribution(choices=('SVC', 'RandomForest', 'NeuralNetwork', 'XGBoost')), 'nn_alpha': FloatDistribution(high=0.1, log=True, low=1e-05, step=None), 'hidden_layer_sizes': CategoricalDistribution(choices=((64,), (128,), (256,), (512,))), 'activation': CategoricalDistribution(choices=('relu', 'tanh', 'logistic')), 'solver': CategoricalDistribution(choices=('adam', 'lbfgs', 'sgd'))}, trial_id=25, value=None)