[I 2024-06-27 16:33:53,902] Trial 24 finished with value: 0.8866666666666667 and parameters: {'classifier': 'NeuralNetwork', 'nn_alpha': 0.07801994490906909, 'hidden_layer_sizes': (64,), 'activation': 'logistic', 'solver': 'sgd'}. Best is trial 8 with value: 0.98.
F:\PycharmProjects\venv\Lib\site-packages\optuna\distributions.py:524: UserWarning: Choices for a categorical distribution should be a tuple of None, bool, int, float and str for persistent storage but contains (64,) which is of type tuple.
  warnings.warn(message)
F:\PycharmProjects\venv\Lib\site-packages\optuna\distributions.py:524: UserWarning: Choices for a categorical distribution should be a tuple of None, bool, int, float and str for persistent storage but contains (128,) which is of type tuple.
  warnings.warn(message)
F:\PycharmProjects\venv\Lib\site-packages\optuna\distributions.py:524: UserWarning: Choices for a categorical distribution should be a tuple of None, bool, int, float and str for persistent storage but contains (256,) which is of type tuple.
  warnings.warn(message)
F:\PycharmProjects\venv\Lib\site-packages\optuna\distributions.py:524: UserWarning: Choices for a categorical distribution should be a tuple of None, bool, int, float and str for persistent storage but contains (512,) which is of type tuple.
  warnings.warn(message)
[I 2024-06-27 16:33:54,131] Trial 25 finished with value: 0.9866666666666667 and parameters: {'classifier': 'NeuralNetwork', 'nn_alpha': 0.003822585225577289, 'hidden_layer_sizes': (128,), 'activation': 'tanh', 'solver': 'adam'}. Best is trial 25 with value: 0.9866666666666667.
F:\PycharmProjects\venv\Lib\site-packages\optuna\distributions.py:524: UserWarning: Choices for a categorical distribution should be a tuple of None, bool, int, float and str for persistent storage but contains (64,) which is of type tuple.
  warnings.warn(message)
F:\PycharmProjects\venv\Lib\site-packages\optuna\distributions.py:524: UserWarning: Choices for a categorical distribution should be a tuple of None, bool, int, float and str for persistent storage but contains (128,) which is of type tuple.
  warnings.warn(message)
F:\PycharmProjects\venv\Lib\site-packages\optuna\distributions.py:524: UserWarning: Choices for a categorical distribution should be a tuple of None, bool, int, float and str for persistent storage but contains (256,) which is of type tuple.
  warnings.warn(message)
F:\PycharmProjects\venv\Lib\site-packages\optuna\distributions.py:524: UserWarning: Choices for a categorical distribution should be a tuple of None, bool, int, float and str for persistent storage but contains (512,) which is of type tuple.
  warnings.warn(message)
[I 2024-06-27 16:33:54,398] Trial 26 finished with value: 0.98 and parameters: {'classifier': 'NeuralNetwork', 'nn_alpha': 0.0025580621680906654, 'hidden_layer_sizes': (128,), 'activation': 'tanh', 'solver': 'adam'}. Best is trial 25 with value: 0.9866666666666667.
F:\PycharmProjects\venv\Lib\site-packages\optuna\distributions.py:524: UserWarning: Choices for a categorical distribution should be a tuple of None, bool, int, float and str for persistent storage but contains (64,) which is of type tuple.
  warnings.warn(message)
F:\PycharmProjects\venv\Lib\site-packages\optuna\distributions.py:524: UserWarning: Choices for a categorical distribution should be a tuple of None, bool, int, float and str for persistent storage but contains (128,) which is of type tuple.
  warnings.warn(message)
F:\PycharmProjects\venv\Lib\site-packages\optuna\distributions.py:524: UserWarning: Choices for a categorical distribution should be a tuple of None, bool, int, float and str for persistent storage but contains (256,) which is of type tuple.
  warnings.warn(message)
F:\PycharmProjects\venv\Lib\site-packages\optuna\distributions.py:524: UserWarning: Choices for a categorical distribution should be a tuple of None, bool, int, float and str for persistent storage but contains (512,) which is of type tuple.
  warnings.warn(message)
[I 2024-06-27 16:33:55,080] Trial 27 finished with value: 0.9733333333333333 and parameters: {'classifier': 'NeuralNetwork', 'nn_alpha': 0.0004994970270064972, 'hidden_layer_sizes': (128,), 'activation': 'logistic', 'solver': 'adam'}. Best is trial 25 with value: 0.9866666666666667.
[I 2024-06-27 16:33:55,745] Trial 28 finished with value: 0.9533333333333333 and parameters: {'classifier': 'XGBoost', 'xgb_eta': 0.28126144130666825, 'xgb_max_depth': 3}. Best is trial 25 with value: 0.9866666666666667.
[I 2024-06-27 16:33:55,765] Trial 29 finished with value: 0.32 and parameters: {'classifier': 'SVC', 'svc_c': 7.26800344578409e-10, 'gamma': 'auto', 'kernel': 'rbf'}. Best is trial 25 with value: 0.9866666666666667.
F:\PycharmProjects\venv\Lib\site-packages\optuna\distributions.py:524: UserWarning: Choices for a categorical distribution should be a tuple of None, bool, int, float and str for persistent storage but contains (64,) which is of type tuple.
  warnings.warn(message)
F:\PycharmProjects\venv\Lib\site-packages\optuna\distributions.py:524: UserWarning: Choices for a categorical distribution should be a tuple of None, bool, int, float and str for persistent storage but contains (128,) which is of type tuple.
  warnings.warn(message)
F:\PycharmProjects\venv\Lib\site-packages\optuna\distributions.py:524: UserWarning: Choices for a categorical distribution should be a tuple of None, bool, int, float and str for persistent storage but contains (256,) which is of type tuple.
  warnings.warn(message)
F:\PycharmProjects\venv\Lib\site-packages\optuna\distributions.py:524: UserWarning: Choices for a categorical distribution should be a tuple of None, bool, int, float and str for persistent storage but contains (512,) which is of type tuple.
  warnings.warn(message)
[I 2024-06-27 16:33:56,980] Trial 30 finished with value: 0.9866666666666667 and parameters: {'classifier': 'NeuralNetwork', 'nn_alpha': 0.007394473799987024, 'hidden_layer_sizes': (512,), 'activation': 'tanh', 'solver': 'sgd'}. Best is trial 25 with value: 0.9866666666666667.
F:\PycharmProjects\venv\Lib\site-packages\optuna\distributions.py:524: UserWarning: Choices for a categorical distribution should be a tuple of None, bool, int, float and str for persistent storage but contains (64,) which is of type tuple.
  warnings.warn(message)
F:\PycharmProjects\venv\Lib\site-packages\optuna\distributions.py:524: UserWarning: Choices for a categorical distribution should be a tuple of None, bool, int, float and str for persistent storage but contains (128,) which is of type tuple.
  warnings.warn(message)
F:\PycharmProjects\venv\Lib\site-packages\optuna\distributions.py:524: UserWarning: Choices for a categorical distribution should be a tuple of None, bool, int, float and str for persistent storage but contains (256,) which is of type tuple.
  warnings.warn(message)
F:\PycharmProjects\venv\Lib\site-packages\optuna\distributions.py:524: UserWarning: Choices for a categorical distribution should be a tuple of None, bool, int, float and str for persistent storage but contains (512,) which is of type tuple.
  warnings.warn(message)
[I 2024-06-27 16:33:58,277] Trial 31 finished with value: 0.9866666666666667 and parameters: {'classifier': 'NeuralNetwork', 'nn_alpha': 0.006083521523637442, 'hidden_layer_sizes': (512,), 'activation': 'tanh', 'solver': 'sgd'}. Best is trial 25 with value: 0.9866666666666667.
F:\PycharmProjects\venv\Lib\site-packages\optuna\distributions.py:524: UserWarning: Choices for a categorical distribution should be a tuple of None, bool, int, float and str for persistent storage but contains (64,) which is of type tuple.
  warnings.warn(message)
F:\PycharmProjects\venv\Lib\site-packages\optuna\distributions.py:524: UserWarning: Choices for a categorical distribution should be a tuple of None, bool, int, float and str for persistent storage but contains (128,) which is of type tuple.
  warnings.warn(message)
F:\PycharmProjects\venv\Lib\site-packages\optuna\distributions.py:524: UserWarning: Choices for a categorical distribution should be a tuple of None, bool, int, float and str for persistent storage but contains (256,) which is of type tuple.
  warnings.warn(message)
F:\PycharmProjects\venv\Lib\site-packages\optuna\distributions.py:524: UserWarning: Choices for a categorical distribution should be a tuple of None, bool, int, float and str for persistent storage but contains (512,) which is of type tuple.
  warnings.warn(message)
[I 2024-06-27 16:33:59,613] Trial 32 finished with value: 0.9866666666666667 and parameters: {'classifier': 'NeuralNetwork', 'nn_alpha': 0.0061112643475594456, 'hidden_layer_sizes': (512,), 'activation': 'tanh', 'solver': 'sgd'}. Best is trial 25 with value: 0.9866666666666667.
F:\PycharmProjects\venv\Lib\site-packages\optuna\distributions.py:524: UserWarning: Choices for a categorical distribution should be a tuple of None, bool, int, float and str for persistent storage but contains (64,) which is of type tuple.
  warnings.warn(message)
F:\PycharmProjects\venv\Lib\site-packages\optuna\distributions.py:524: UserWarning: Choices for a categorical distribution should be a tuple of None, bool, int, float and str for persistent storage but contains (128,) which is of type tuple.
  warnings.warn(message)
F:\PycharmProjects\venv\Lib\site-packages\optuna\distributions.py:524: UserWarning: Choices for a categorical distribution should be a tuple of None, bool, int, float and str for persistent storage but contains (256,) which is of type tuple.
  warnings.warn(message)
F:\PycharmProjects\venv\Lib\site-packages\optuna\distributions.py:524: UserWarning: Choices for a categorical distribution should be a tuple of None, bool, int, float and str for persistent storage but contains (512,) which is of type tuple.
  warnings.warn(message)
[I 2024-06-27 16:34:00,900] Trial 33 finished with value: 0.9866666666666667 and parameters: {'classifier': 'NeuralNetwork', 'nn_alpha': 0.006956768725676988, 'hidden_layer_sizes': (512,), 'activation': 'tanh', 'solver': 'sgd'}. Best is trial 25 with value: 0.9866666666666667.
F:\PycharmProjects\venv\Lib\site-packages\optuna\distributions.py:524: UserWarning: Choices for a categorical distribution should be a tuple of None, bool, int, float and str for persistent storage but contains (64,) which is of type tuple.
  warnings.warn(message)
F:\PycharmProjects\venv\Lib\site-packages\optuna\distributions.py:524: UserWarning: Choices for a categorical distribution should be a tuple of None, bool, int, float and str for persistent storage but contains (128,) which is of type tuple.
  warnings.warn(message)
F:\PycharmProjects\venv\Lib\site-packages\optuna\distributions.py:524: UserWarning: Choices for a categorical distribution should be a tuple of None, bool, int, float and str for persistent storage but contains (256,) which is of type tuple.
  warnings.warn(message)
F:\PycharmProjects\venv\Lib\site-packages\optuna\distributions.py:524: UserWarning: Choices for a categorical distribution should be a tuple of None, bool, int, float and str for persistent storage but contains (512,) which is of type tuple.
  warnings.warn(message)
[I 2024-06-27 16:34:02,252] Trial 34 finished with value: 0.9866666666666667 and parameters: {'classifier': 'NeuralNetwork', 'nn_alpha': 0.006481132061328623, 'hidden_layer_sizes': (512,), 'activation': 'tanh', 'solver': 'sgd'}. Best is trial 25 with value: 0.9866666666666667.
[I 2024-06-27 16:34:02,370] Trial 35 finished with value: 0.96 and parameters: {'classifier': 'RandomForest', 'rf_max_depth': 27, 'rf_min_samples_split': 20, 'rf_min_samples_leaf': 1, 'rf_max_features': 'sqrt'}. Best is trial 25 with value: 0.9866666666666667.
F:\PycharmProjects\venv\Lib\site-packages\optuna\distributions.py:524: UserWarning: Choices for a categorical distribution should be a tuple of None, bool, int, float and str for persistent storage but contains (64,) which is of type tuple.
  warnings.warn(message)
F:\PycharmProjects\venv\Lib\site-packages\optuna\distributions.py:524: UserWarning: Choices for a categorical distribution should be a tuple of None, bool, int, float and str for persistent storage but contains (128,) which is of type tuple.
  warnings.warn(message)
F:\PycharmProjects\venv\Lib\site-packages\optuna\distributions.py:524: UserWarning: Choices for a categorical distribution should be a tuple of None, bool, int, float and str for persistent storage but contains (256,) which is of type tuple.
  warnings.warn(message)
F:\PycharmProjects\venv\Lib\site-packages\optuna\distributions.py:524: UserWarning: Choices for a categorical distribution should be a tuple of None, bool, int, float and str for persistent storage but contains (512,) which is of type tuple.
  warnings.warn(message)
[I 2024-06-27 16:34:03,620] Trial 36 finished with value: 0.9866666666666667 and parameters: {'classifier': 'NeuralNetwork', 'nn_alpha': 0.017398933263462438, 'hidden_layer_sizes': (512,), 'activation': 'tanh', 'solver': 'sgd'}. Best is trial 25 with value: 0.9866666666666667.
[I 2024-06-27 16:34:03,661] Trial 37 finished with value: 0.9466666666666667 and parameters: {'classifier': 'XGBoost', 'xgb_eta': 0.010275910287407613, 'xgb_max_depth': 3}. Best is trial 25 with value: 0.9866666666666667.
[I 2024-06-27 16:34:03,830] Trial 38 finished with value: 0.9466666666666667 and parameters: {'classifier': 'RandomForest', 'rf_max_depth': 6, 'rf_min_samples_split': 2, 'rf_min_samples_leaf': 10, 'rf_max_features': 'sqrt'}. Best is trial 25 with value: 0.9866666666666667.
F:\PycharmProjects\venv\Lib\site-packages\optuna\distributions.py:524: UserWarning: Choices for a categorical distribution should be a tuple of None, bool, int, float and str for persistent storage but contains (64,) which is of type tuple.
  warnings.warn(message)
F:\PycharmProjects\venv\Lib\site-packages\optuna\distributions.py:524: UserWarning: Choices for a categorical distribution should be a tuple of None, bool, int, float and str for persistent storage but contains (128,) which is of type tuple.
  warnings.warn(message)
F:\PycharmProjects\venv\Lib\site-packages\optuna\distributions.py:524: UserWarning: Choices for a categorical distribution should be a tuple of None, bool, int, float and str for persistent storage but contains (256,) which is of type tuple.
  warnings.warn(message)
F:\PycharmProjects\venv\Lib\site-packages\optuna\distributions.py:524: UserWarning: Choices for a categorical distribution should be a tuple of None, bool, int, float and str for persistent storage but contains (512,) which is of type tuple.
  warnings.warn(message)
[I 2024-06-27 16:34:05,092] Trial 39 finished with value: 0.9866666666666667 and parameters: {'classifier': 'NeuralNetwork', 'nn_alpha': 0.0008043308815922561, 'hidden_layer_sizes': (512,), 'activation': 'tanh', 'solver': 'sgd'}. Best is trial 25 with value: 0.9866666666666667.
[I 2024-06-27 16:34:05,685] Trial 40 finished with value: 0.96 and parameters: {'classifier': 'XGBoost', 'xgb_eta': 0.03497282207849203, 'xgb_max_depth': 9}. Best is trial 25 with value: 0.9866666666666667.
F:\PycharmProjects\venv\Lib\site-packages\optuna\distributions.py:524: UserWarning: Choices for a categorical distribution should be a tuple of None, bool, int, float and str for persistent storage but contains (64,) which is of type tuple.
  warnings.warn(message)
F:\PycharmProjects\venv\Lib\site-packages\optuna\distributions.py:524: UserWarning: Choices for a categorical distribution should be a tuple of None, bool, int, float and str for persistent storage but contains (128,) which is of type tuple.
  warnings.warn(message)
F:\PycharmProjects\venv\Lib\site-packages\optuna\distributions.py:524: UserWarning: Choices for a categorical distribution should be a tuple of None, bool, int, float and str for persistent storage but contains (256,) which is of type tuple.
  warnings.warn(message)
F:\PycharmProjects\venv\Lib\site-packages\optuna\distributions.py:524: UserWarning: Choices for a categorical distribution should be a tuple of None, bool, int, float and str for persistent storage but contains (512,) which is of type tuple.
  warnings.warn(message)
[I 2024-06-27 16:34:06,969] Trial 41 finished with value: 0.9866666666666667 and parameters: {'classifier': 'NeuralNetwork', 'nn_alpha': 0.004950031870418388, 'hidden_layer_sizes': (512,), 'activation': 'tanh', 'solver': 'sgd'}. Best is trial 25 with value: 0.9866666666666667.
F:\PycharmProjects\venv\Lib\site-packages\optuna\distributions.py:524: UserWarning: Choices for a categorical distribution should be a tuple of None, bool, int, float and str for persistent storage but contains (64,) which is of type tuple.
  warnings.warn(message)
F:\PycharmProjects\venv\Lib\site-packages\optuna\distributions.py:524: UserWarning: Choices for a categorical distribution should be a tuple of None, bool, int, float and str for persistent storage but contains (128,) which is of type tuple.
  warnings.warn(message)
F:\PycharmProjects\venv\Lib\site-packages\optuna\distributions.py:524: UserWarning: Choices for a categorical distribution should be a tuple of None, bool, int, float and str for persistent storage but contains (256,) which is of type tuple.
  warnings.warn(message)
F:\PycharmProjects\venv\Lib\site-packages\optuna\distributions.py:524: UserWarning: Choices for a categorical distribution should be a tuple of None, bool, int, float and str for persistent storage but contains (512,) which is of type tuple.
  warnings.warn(message)
[I 2024-06-27 16:34:08,332] Trial 42 finished with value: 0.9866666666666667 and parameters: {'classifier': 'NeuralNetwork', 'nn_alpha': 0.0071996374151307215, 'hidden_layer_sizes': (512,), 'activation': 'tanh', 'solver': 'sgd'}. Best is trial 25 with value: 0.9866666666666667.
F:\PycharmProjects\venv\Lib\site-packages\optuna\distributions.py:524: UserWarning: Choices for a categorical distribution should be a tuple of None, bool, int, float and str for persistent storage but contains (64,) which is of type tuple.
  warnings.warn(message)
F:\PycharmProjects\venv\Lib\site-packages\optuna\distributions.py:524: UserWarning: Choices for a categorical distribution should be a tuple of None, bool, int, float and str for persistent storage but contains (128,) which is of type tuple.
  warnings.warn(message)
F:\PycharmProjects\venv\Lib\site-packages\optuna\distributions.py:524: UserWarning: Choices for a categorical distribution should be a tuple of None, bool, int, float and str for persistent storage but contains (256,) which is of type tuple.
  warnings.warn(message)
F:\PycharmProjects\venv\Lib\site-packages\optuna\distributions.py:524: UserWarning: Choices for a categorical distribution should be a tuple of None, bool, int, float and str for persistent storage but contains (512,) which is of type tuple.
  warnings.warn(message)
[I 2024-06-27 16:34:09,698] Trial 43 finished with value: 0.9866666666666667 and parameters: {'classifier': 'NeuralNetwork', 'nn_alpha': 0.02336920522372882, 'hidden_layer_sizes': (512,), 'activation': 'tanh', 'solver': 'sgd'}. Best is trial 25 with value: 0.9866666666666667.
F:\PycharmProjects\venv\Lib\site-packages\optuna\distributions.py:524: UserWarning: Choices for a categorical distribution should be a tuple of None, bool, int, float and str for persistent storage but contains (64,) which is of type tuple.
  warnings.warn(message)
F:\PycharmProjects\venv\Lib\site-packages\optuna\distributions.py:524: UserWarning: Choices for a categorical distribution should be a tuple of None, bool, int, float and str for persistent storage but contains (128,) which is of type tuple.
  warnings.warn(message)
F:\PycharmProjects\venv\Lib\site-packages\optuna\distributions.py:524: UserWarning: Choices for a categorical distribution should be a tuple of None, bool, int, float and str for persistent storage but contains (256,) which is of type tuple.
  warnings.warn(message)
F:\PycharmProjects\venv\Lib\site-packages\optuna\distributions.py:524: UserWarning: Choices for a categorical distribution should be a tuple of None, bool, int, float and str for persistent storage but contains (512,) which is of type tuple.
  warnings.warn(message)
[I 2024-06-27 16:34:11,040] Trial 44 finished with value: 0.9866666666666667 and parameters: {'classifier': 'NeuralNetwork', 'nn_alpha': 0.0038332959742571346, 'hidden_layer_sizes': (512,), 'activation': 'tanh', 'solver': 'sgd'}. Best is trial 25 with value: 0.9866666666666667.
F:\PycharmProjects\venv\Lib\site-packages\optuna\distributions.py:524: UserWarning: Choices for a categorical distribution should be a tuple of None, bool, int, float and str for persistent storage but contains (64,) which is of type tuple.
  warnings.warn(message)
F:\PycharmProjects\venv\Lib\site-packages\optuna\distributions.py:524: UserWarning: Choices for a categorical distribution should be a tuple of None, bool, int, float and str for persistent storage but contains (128,) which is of type tuple.
  warnings.warn(message)
F:\PycharmProjects\venv\Lib\site-packages\optuna\distributions.py:524: UserWarning: Choices for a categorical distribution should be a tuple of None, bool, int, float and str for persistent storage but contains (256,) which is of type tuple.
  warnings.warn(message)
F:\PycharmProjects\venv\Lib\site-packages\optuna\distributions.py:524: UserWarning: Choices for a categorical distribution should be a tuple of None, bool, int, float and str for persistent storage but contains (512,) which is of type tuple.
  warnings.warn(message)
[I 2024-06-27 16:34:11,889] Trial 45 finished with value: 0.9733333333333333 and parameters: {'classifier': 'NeuralNetwork', 'nn_alpha': 0.0012394972414406847, 'hidden_layer_sizes': (512,), 'activation': 'relu', 'solver': 'sgd'}. Best is trial 25 with value: 0.9866666666666667.
