[I 2024-06-30 14:11:01,936] A new study created in memory with name: no-name-27a7dd1c-866e-4a76-9e72-69a8c4abbb75
[I 2024-06-30 14:11:02,749] Trial 0 finished with value: 0.9533333333333333 and parameters: {'classifier': 'XGBoost', 'xgb_eta': 0.24851821082542472, 'xgb_max_depth': 3, 'xgb_min_child_weight': 7.114439945403514e-05, 'xgb_subsample': 0.7804484776762088, 'xgb_colsample_bytree': 0.5519955355658899}. Best is trial 0 with value: 0.9533333333333333.
[I 2024-06-30 14:11:02,771] Trial 1 finished with value: 0.47333333333333333 and parameters: {'classifier': 'SVC', 'svc_c': 0.0012066732078062172, 'gamma': 'scale', 'kernel': 'linear'}. Best is trial 0 with value: 0.9533333333333333.
[I 2024-06-30 14:11:02,795] Trial 2 finished with value: 0.32 and parameters: {'classifier': 'SVC', 'svc_c': 5.058976136993165e-06, 'gamma': 'auto', 'kernel': 'rbf'}. Best is trial 0 with value: 0.9533333333333333.
[I 2024-06-30 14:11:02,952] Trial 3 finished with value: 0.9533333333333333 and parameters: {'classifier': 'SVC', 'svc_c': 637711.5531857725, 'gamma': 'scale', 'kernel': 'poly'}. Best is trial 0 with value: 0.9533333333333333.
[I 2024-06-30 14:11:03,345] Trial 4 finished with value: 0.96 and parameters: {'classifier': 'XGBoost', 'xgb_eta': 0.07101020088535395, 'xgb_max_depth': 3, 'xgb_min_child_weight': 0.007968667484301998, 'xgb_subsample': 0.5754163617898349, 'xgb_colsample_bytree': 0.9735432796995662}. Best is trial 4 with value: 0.96.
[I 2024-06-30 14:11:04,075] Trial 5 finished with value: 0.9666666666666667 and parameters: {'classifier': 'RandomForest', 'rf_max_depth': 9, 'rf_min_samples_split': 6, 'rf_min_samples_leaf': 1, 'rf_max_features': 'log2'}. Best is trial 5 with value: 0.9666666666666667.
[I 2024-06-30 14:11:04,294] Trial 6 finished with value: 0.32 and parameters: {'classifier': 'XGBoost', 'xgb_eta': 0.12390674661745794, 'xgb_max_depth': 4, 'xgb_min_child_weight': 41.77311322325748, 'xgb_subsample': 0.9175808313180193, 'xgb_colsample_bytree': 0.8187023062287467}. Best is trial 5 with value: 0.9666666666666667.
[I 2024-06-30 14:11:04,984] Trial 7 finished with value: 0.9466666666666667 and parameters: {'classifier': 'RandomForest', 'rf_max_depth': 19, 'rf_min_samples_split': 2, 'rf_min_samples_leaf': 3, 'rf_max_features': 'sqrt'}. Best is trial 5 with value: 0.9666666666666667.
[I 2024-06-30 14:11:05,627] Trial 8 finished with value: 0.9466666666666667 and parameters: {'classifier': 'RandomForest', 'rf_max_depth': 10, 'rf_min_samples_split': 12, 'rf_min_samples_leaf': 4, 'rf_max_features': 'sqrt'}. Best is trial 5 with value: 0.9666666666666667.
FrozenTrial(number=9, state=1, values=[0.9733333333333333], datetime_start=datetime.datetime(2024, 6, 30, 14, 11, 5, 627213), datetime_complete=datetime.datetime(2024, 6, 30, 14, 11, 6, 999523), params={'classifier': 'NeuralNetwork', 'nn_alpha': 0.00011100293483624912, 'hidden_layer_sizes': 128, 'activation': 'relu', 'solver': 'adam'}, user_attrs={}, system_attrs={}, intermediate_values={}, distributions={'classifier': CategoricalDistribution(choices=('SVC', 'RandomForest', 'NeuralNetwork', 'XGBoost')), 'nn_alpha': FloatDistribution(high=0.1, log=True, low=1e-05, step=None), 'hidden_layer_sizes': CategoricalDistribution(choices=(64, 128, 256, 512)), 'activation': CategoricalDistribution(choices=('relu', 'tanh', 'logistic')), 'solver': CategoricalDistribution(choices=('adam', 'lbfgs', 'sgd', 'adagrad', 'adadelta'))}, trial_id=9, value=None)
[I 2024-06-30 14:11:07,000] Trial 9 finished with value: 0.9733333333333333 and parameters: {'classifier': 'NeuralNetwork', 'nn_alpha': 0.00011100293483624912, 'hidden_layer_sizes': 128, 'activation': 'relu', 'solver': 'adam'}. Best is trial 9 with value: 0.9733333333333333.
Traceback (most recent call last):
  File "F:\PycharmProjects\pythonProject\机器学习\好用的工具\optuna\分类比拼.py", line 73, in <module>
    wandb.plot.bar({"accuracy": study.best_trial})
TypeError: bar() missing 2 required positional arguments: 'label' and 'value'