[I 2024-06-30 14:17:49,817] A new study created in memory with name: no-name-3bb1dfa4-9ad5-4364-9118-9c74baabce23
[I 2024-06-30 14:17:50,550] Trial 0 finished with value: 0.96 and parameters: {'classifier': 'XGBoost', 'xgb_eta': 0.044614942190964735, 'xgb_max_depth': 7, 'xgb_min_child_weight': 0.6427007072198719, 'xgb_subsample': 0.852966190088244, 'xgb_colsample_bytree': 0.7140072944108968}. Best is trial 0 with value: 0.96.
[I 2024-06-30 14:17:51,203] Trial 1 finished with value: 0.9533333333333333 and parameters: {'classifier': 'RandomForest', 'rf_max_depth': 6, 'rf_min_samples_split': 14, 'rf_min_samples_leaf': 7, 'rf_max_features': 'sqrt'}. Best is trial 0 with value: 0.96.
[I 2024-06-30 14:17:51,518] Trial 2 finished with value: 0.32666666666666666 and parameters: {'classifier': 'XGBoost', 'xgb_eta': 0.14052097718655618, 'xgb_max_depth': 4, 'xgb_min_child_weight': 34.181600966029215, 'xgb_subsample': 0.7650938938879963, 'xgb_colsample_bytree': 0.7391975806891455}. Best is trial 0 with value: 0.96.
[I 2024-06-30 14:17:51,995] Trial 3 finished with value: 0.96 and parameters: {'classifier': 'SVC', 'svc_c': 9138766.86416998, 'gamma': 'auto', 'kernel': 'linear'}. Best is trial 0 with value: 0.96.
[I 2024-06-30 14:18:00,403] Trial 4 finished with value: 0.9866666666666667 and parameters: {'classifier': 'NeuralNetwork', 'nn_alpha': 0.0005631147891447542, 'hidden_layer_sizes': 512, 'activation': 'tanh', 'solver': 'sgd'}. Best is trial 4 with value: 0.9866666666666667.
[I 2024-06-30 14:18:00,676] Trial 5 finished with value: 0.32 and parameters: {'classifier': 'XGBoost', 'xgb_eta': 0.017750308953382303, 'xgb_max_depth': 4, 'xgb_min_child_weight': 43.23151176595827, 'xgb_subsample': 0.9096702510995395, 'xgb_colsample_bytree': 0.9710533503201859}. Best is trial 4 with value: 0.9866666666666667.
[I 2024-06-30 14:18:01,357] Trial 6 finished with value: 0.96 and parameters: {'classifier': 'RandomForest', 'rf_max_depth': 4, 'rf_min_samples_split': 18, 'rf_min_samples_leaf': 1, 'rf_max_features': 'log2'}. Best is trial 4 with value: 0.9866666666666667.
[I 2024-06-30 14:18:01,380] Trial 7 finished with value: 0.96 and parameters: {'classifier': 'SVC', 'svc_c': 8268385506.104245, 'gamma': 'auto', 'kernel': 'rbf'}. Best is trial 4 with value: 0.9866666666666667.
[I 2024-06-30 14:18:06,339] Trial 8 finished with value: 0.9866666666666667 and parameters: {'classifier': 'NeuralNetwork', 'nn_alpha': 0.006241636311455937, 'hidden_layer_sizes': 256, 'activation': 'tanh', 'solver': 'sgd'}. Best is trial 4 with value: 0.9866666666666667.
[I 2024-06-30 14:18:06,357] Trial 9 finished with value: 0.96 and parameters: {'classifier': 'SVC', 'svc_c': 2854883.7230406143, 'gamma': 'auto', 'kernel': 'rbf'}. Best is trial 4 with value: 0.9866666666666667.
FrozenTrial(number=4, state=1, values=[0.9866666666666667], datetime_start=datetime.datetime(2024, 6, 30, 14, 17, 51, 995047), datetime_complete=datetime.datetime(2024, 6, 30, 14, 18, 0, 402479), params={'classifier': 'NeuralNetwork', 'nn_alpha': 0.0005631147891447542, 'hidden_layer_sizes': 512, 'activation': 'tanh', 'solver': 'sgd'}, user_attrs={}, system_attrs={}, intermediate_values={}, distributions={'classifier': CategoricalDistribution(choices=('SVC', 'RandomForest', 'NeuralNetwork', 'XGBoost')), 'nn_alpha': FloatDistribution(high=0.1, log=True, low=1e-05, step=None), 'hidden_layer_sizes': CategoricalDistribution(choices=(64, 128, 256, 512)), 'activation': CategoricalDistribution(choices=('relu', 'tanh', 'logistic')), 'solver': CategoricalDistribution(choices=('sgd', 'adam', 'lbfgs'))}, trial_id=4, value=None)