[I 2024-06-27 17:02:51,899] A new study created in memory with name: no-name-a68e00c1-23de-4d2c-b518-a5ecaba6f48e
[I 2024-06-27 17:02:52,148] Trial 0 finished with value: 0.9666666666666667 and parameters: {'classifier': 'RandomForest', 'rf_max_depth': 5, 'rf_min_samples_split': 8, 'rf_min_samples_leaf': 1, 'rf_max_features': 'log2'}. Best is trial 0 with value: 0.9666666666666667.
[I 2024-06-27 17:02:52,417] Trial 1 finished with value: 0.9733333333333333 and parameters: {'classifier': 'NeuralNetwork', 'nn_alpha': 0.00013285190019836173, 'hidden_layer_sizes': 64, 'activation': 'tanh', 'solver': 'lbfgs'}. Best is trial 1 with value: 0.9733333333333333.
[I 2024-06-27 17:02:52,660] Trial 2 finished with value: 0.9533333333333333 and parameters: {'classifier': 'RandomForest', 'rf_max_depth': 3, 'rf_min_samples_split': 18, 'rf_min_samples_leaf': 3, 'rf_max_features': 'log2'}. Best is trial 1 with value: 0.9733333333333333.
[I 2024-06-27 17:02:55,862] Trial 3 finished with value: 0.9866666666666667 and parameters: {'classifier': 'NeuralNetwork', 'nn_alpha': 0.0005400626886622456, 'hidden_layer_sizes': 512, 'activation': 'tanh', 'solver': 'sgd'}. Best is trial 3 with value: 0.9866666666666667.
[I 2024-06-27 17:02:55,868] Trial 4 finished with value: 0.9666666666666667 and parameters: {'classifier': 'SVC', 'svc_c': 21.476629311128118, 'gamma': 'scale', 'kernel': 'linear'}. Best is trial 3 with value: 0.9866666666666667.
[I 2024-06-27 17:02:56,204] Trial 5 finished with value: 0.96 and parameters: {'classifier': 'XGBoost', 'xgb_eta': 0.049895781057760824, 'xgb_max_depth': 3, 'xgb_min_child_weight': 0.01843278546155346, 'xgb_subsample': 0.8303481833306474, 'xgb_colsample_bytree': 0.663813739607716}. Best is trial 3 with value: 0.9866666666666667.
[I 2024-06-27 17:03:00,410] Trial 6 finished with value: 0.98 and parameters: {'classifier': 'NeuralNetwork', 'nn_alpha': 0.039724274644344214, 'hidden_layer_sizes': 512, 'activation': 'logistic', 'solver': 'adam'}. Best is trial 3 with value: 0.9866666666666667.
[I 2024-06-27 17:03:00,931] Trial 7 finished with value: 0.9733333333333333 and parameters: {'classifier': 'NeuralNetwork', 'nn_alpha': 0.0002097789711826483, 'hidden_layer_sizes': 256, 'activation': 'relu', 'solver': 'adam'}. Best is trial 3 with value: 0.9866666666666667.
[I 2024-06-27 17:03:00,939] Trial 8 finished with value: 0.96 and parameters: {'classifier': 'SVC', 'svc_c': 199562.1891325969, 'gamma': 'auto', 'kernel': 'rbf'}. Best is trial 3 with value: 0.9866666666666667.
[I 2024-06-27 17:03:01,051] Trial 9 finished with value: 0.9533333333333333 and parameters: {'classifier': 'XGBoost', 'xgb_eta': 0.2626390340142989, 'xgb_max_depth': 7, 'xgb_min_child_weight': 1.4170530664542547, 'xgb_subsample': 0.6600267926216308, 'xgb_colsample_bytree': 0.8054807318294916}. Best is trial 3 with value: 0.9866666666666667.
Traceback (most recent call last):
  File "F:\PycharmProjects\pythonProject\机器学习\好用的工具\optuna\分类比拼.py", line 137, in <module>
    wandb.plot.bar({"accuracy": study.best_trial})
TypeError: bar() missing 2 required positional arguments: 'label' and 'value'
FrozenTrial(number=3, state=1, values=[0.9866666666666667], datetime_start=datetime.datetime(2024, 6, 27, 17, 2, 52, 660246), datetime_complete=datetime.datetime(2024, 6, 27, 17, 2, 55, 861121), params={'classifier': 'NeuralNetwork', 'nn_alpha': 0.0005400626886622456, 'hidden_layer_sizes': 512, 'activation': 'tanh', 'solver': 'sgd'}, user_attrs={}, system_attrs={}, intermediate_values={}, distributions={'classifier': CategoricalDistribution(choices=('SVC', 'RandomForest', 'NeuralNetwork', 'XGBoost')), 'nn_alpha': FloatDistribution(high=0.1, log=True, low=1e-05, step=None), 'hidden_layer_sizes': CategoricalDistribution(choices=(64, 128, 256, 512)), 'activation': CategoricalDistribution(choices=('relu', 'tanh', 'logistic')), 'solver': CategoricalDistribution(choices=('adam', 'lbfgs', 'sgd'))}, trial_id=3, value=None)