[I 2024-06-30 14:16:06,708] A new study created in memory with name: no-name-fd697508-838a-4ae3-a3b5-6d84c8457717
[I 2024-06-30 14:16:07,503] Trial 0 finished with value: 0.96 and parameters: {'classifier': 'XGBoost', 'xgb_eta': 0.03712142517453601, 'xgb_max_depth': 3, 'xgb_min_child_weight': 0.32051264870794965, 'xgb_subsample': 0.7747930184361369, 'xgb_colsample_bytree': 0.5731052910933073}. Best is trial 0 with value: 0.96.
[I 2024-06-30 14:16:08,080] Trial 1 finished with value: 0.96 and parameters: {'classifier': 'XGBoost', 'xgb_eta': 0.232674722886265, 'xgb_max_depth': 7, 'xgb_min_child_weight': 0.01887074593617756, 'xgb_subsample': 0.8351500424194488, 'xgb_colsample_bytree': 0.9766124080754015}. Best is trial 0 with value: 0.96.
[I 2024-06-30 14:16:08,505] Trial 2 finished with value: 0.96 and parameters: {'classifier': 'XGBoost', 'xgb_eta': 0.03577108852380846, 'xgb_max_depth': 4, 'xgb_min_child_weight': 0.00023237534488824068, 'xgb_subsample': 0.9795418887310343, 'xgb_colsample_bytree': 0.8365483704077}. Best is trial 0 with value: 0.96.
[I 2024-06-30 14:16:11,804] Trial 3 finished with value: 0.9666666666666667 and parameters: {'classifier': 'NeuralNetwork', 'nn_alpha': 0.025333166098183212, 'hidden_layer_sizes': 64, 'activation': 'tanh', 'solver': 'lbfgs'}. Best is trial 3 with value: 0.9666666666666667.
[I 2024-06-30 14:16:12,455] Trial 4 finished with value: 0.9666666666666667 and parameters: {'classifier': 'RandomForest', 'rf_max_depth': 5, 'rf_min_samples_split': 9, 'rf_min_samples_leaf': 5, 'rf_max_features': 'log2'}. Best is trial 3 with value: 0.9666666666666667.
[I 2024-06-30 14:16:12,472] Trial 5 finished with value: 0.32 and parameters: {'classifier': 'SVC', 'svc_c': 1.3455212745836478e-06, 'gamma': 'auto', 'kernel': 'linear'}. Best is trial 3 with value: 0.9666666666666667.
[I 2024-06-30 14:16:13,117] Trial 6 finished with value: 0.9466666666666667 and parameters: {'classifier': 'RandomForest', 'rf_max_depth': 3, 'rf_min_samples_split': 19, 'rf_min_samples_leaf': 5, 'rf_max_features': 'sqrt'}. Best is trial 3 with value: 0.9666666666666667.
[I 2024-06-30 14:16:13,136] Trial 7 finished with value: 0.32 and parameters: {'classifier': 'SVC', 'svc_c': 2.489837158965991e-10, 'gamma': 'auto', 'kernel': 'rbf'}. Best is trial 3 with value: 0.9666666666666667.
[I 2024-06-30 14:16:13,284] Trial 8 finished with value: 0.9466666666666667 and parameters: {'classifier': 'SVC', 'svc_c': 3537171264.508671, 'gamma': 'auto', 'kernel': 'poly'}. Best is trial 3 with value: 0.9666666666666667.
[I 2024-06-30 14:16:14,642] Trial 9 finished with value: 0.9733333333333333 and parameters: {'classifier': 'NeuralNetwork', 'nn_alpha': 0.00287597492083189, 'hidden_layer_sizes': 128, 'activation': 'relu', 'solver': 'adam'}. Best is trial 9 with value: 0.9733333333333333.
Traceback (most recent call last):
  File "F:\PycharmProjects\pythonProject\机器学习\好用的工具\optuna\分类比拼.py", line 73, in <module>
    wandb.plot.bar({"accuracy": best_accuracy}, {"accuracy": best_accuracy})
                                ^^^^^^^^^^^^^
NameError: name 'best_accuracy' is not defined
FrozenTrial(number=9, state=1, values=[0.9733333333333333], datetime_start=datetime.datetime(2024, 6, 30, 14, 16, 13, 284069), datetime_complete=datetime.datetime(2024, 6, 30, 14, 16, 14, 640931), params={'classifier': 'NeuralNetwork', 'nn_alpha': 0.00287597492083189, 'hidden_layer_sizes': 128, 'activation': 'relu', 'solver': 'adam'}, user_attrs={}, system_attrs={}, intermediate_values={}, distributions={'classifier': CategoricalDistribution(choices=('SVC', 'RandomForest', 'NeuralNetwork', 'XGBoost')), 'nn_alpha': FloatDistribution(high=0.1, log=True, low=1e-05, step=None), 'hidden_layer_sizes': CategoricalDistribution(choices=(64, 128, 256, 512)), 'activation': CategoricalDistribution(choices=('relu', 'tanh', 'logistic')), 'solver': CategoricalDistribution(choices=('sgd', 'adam', 'lbfgs'))}, trial_id=9, value=None)