[I 2024-09-02 22:32:44,692] Trial 483 finished with value: 0.9866666666666667 and parameters: {'classifier': 'NeuralNetwork', 'nn_alpha': 0.05882065564383321, 'hidden_layer_sizes': 256, 'activation': 'tanh', 'solver': 'sgd'}. Best is trial 18 with value: 0.9866666666666667.
[I 2024-09-02 22:32:47,685] Trial 484 finished with value: 0.9666666666666667 and parameters: {'classifier': 'NeuralNetwork', 'nn_alpha': 0.04359193851703245, 'hidden_layer_sizes': 256, 'activation': 'tanh', 'solver': 'lbfgs'}. Best is trial 18 with value: 0.9866666666666667.
[I 2024-09-02 22:32:47,838] Trial 485 finished with value: 0.9666666666666667 and parameters: {'classifier': 'XGBoost', 'xgb_eta': 0.10714434800500558, 'xgb_max_depth': 6, 'xgb_min_child_weight': 0.47137790889732833, 'xgb_subsample': 0.5616449896776583, 'xgb_colsample_bytree': 0.5849084244727812}. Best is trial 18 with value: 0.9866666666666667.
[I 2024-09-02 22:32:49,719] Trial 486 finished with value: 0.9866666666666667 and parameters: {'classifier': 'NeuralNetwork', 'nn_alpha': 0.0025129947203070915, 'hidden_layer_sizes': 256, 'activation': 'tanh', 'solver': 'sgd'}. Best is trial 18 with value: 0.9866666666666667.
[I 2024-09-02 22:32:51,511] Trial 487 finished with value: 0.9866666666666667 and parameters: {'classifier': 'NeuralNetwork', 'nn_alpha': 0.053718713126634905, 'hidden_layer_sizes': 256, 'activation': 'tanh', 'solver': 'sgd'}. Best is trial 18 with value: 0.9866666666666667.
[I 2024-09-02 22:32:52,517] Trial 488 finished with value: 0.98 and parameters: {'classifier': 'NeuralNetwork', 'nn_alpha': 2.6255118325522634e-05, 'hidden_layer_sizes': 128, 'activation': 'relu', 'solver': 'sgd'}. Best is trial 18 with value: 0.9866666666666667.
[I 2024-09-02 22:32:54,343] Trial 489 finished with value: 0.98 and parameters: {'classifier': 'NeuralNetwork', 'nn_alpha': 0.06618713426585886, 'hidden_layer_sizes': 256, 'activation': 'tanh', 'solver': 'sgd'}. Best is trial 18 with value: 0.9866666666666667.
[I 2024-09-02 22:32:55,120] Trial 490 finished with value: 0.98 and parameters: {'classifier': 'NeuralNetwork', 'nn_alpha': 0.023977128219959978, 'hidden_layer_sizes': 256, 'activation': 'tanh', 'solver': 'adam'}. Best is trial 18 with value: 0.9866666666666667.
[I 2024-09-02 22:32:55,135] Trial 491 finished with value: 0.96 and parameters: {'classifier': 'SVC', 'svc_c': 1061356407.3049965, 'gamma': 'auto', 'kernel': 'rbf'}. Best is trial 18 with value: 0.9866666666666667.
[I 2024-09-02 22:32:56,161] Trial 492 finished with value: 0.98 and parameters: {'classifier': 'NeuralNetwork', 'nn_alpha': 0.034972299668340465, 'hidden_layer_sizes': 64, 'activation': 'tanh', 'solver': 'sgd'}. Best is trial 18 with value: 0.9866666666666667.
[I 2024-09-02 22:32:57,957] Trial 493 finished with value: 0.9866666666666667 and parameters: {'classifier': 'NeuralNetwork', 'nn_alpha': 0.08615663183127872, 'hidden_layer_sizes': 256, 'activation': 'tanh', 'solver': 'sgd'}. Best is trial 18 with value: 0.9866666666666667.
[I 2024-09-02 22:32:59,767] Trial 494 finished with value: 0.98 and parameters: {'classifier': 'NeuralNetwork', 'nn_alpha': 0.049466427202090914, 'hidden_layer_sizes': 256, 'activation': 'tanh', 'solver': 'sgd'}. Best is trial 18 with value: 0.9866666666666667.
[I 2024-09-02 22:33:01,621] Trial 495 finished with value: 0.98 and parameters: {'classifier': 'NeuralNetwork', 'nn_alpha': 0.04119028011229958, 'hidden_layer_sizes': 256, 'activation': 'tanh', 'solver': 'sgd'}. Best is trial 18 with value: 0.9866666666666667.
[I 2024-09-02 22:33:10,090] Trial 496 finished with value: 0.96 and parameters: {'classifier': 'NeuralNetwork', 'nn_alpha': 0.07439992665633043, 'hidden_layer_sizes': 256, 'activation': 'logistic', 'solver': 'sgd'}. Best is trial 18 with value: 0.9866666666666667.
[I 2024-09-02 22:33:10,336] Trial 497 finished with value: 0.9533333333333333 and parameters: {'classifier': 'RandomForest', 'rf_max_depth': 5, 'rf_min_samples_split': 12, 'rf_min_samples_leaf': 2, 'rf_max_features': 'log2'}. Best is trial 18 with value: 0.9866666666666667.
[I 2024-09-02 22:33:12,157] Trial 498 finished with value: 0.98 and parameters: {'classifier': 'NeuralNetwork', 'nn_alpha': 0.017203800111790773, 'hidden_layer_sizes': 256, 'activation': 'tanh', 'solver': 'sgd'}. Best is trial 18 with value: 0.9866666666666667.
[I 2024-09-02 22:33:14,012] Trial 499 finished with value: 0.98 and parameters: {'classifier': 'NeuralNetwork', 'nn_alpha': 0.029072349421140075, 'hidden_layer_sizes': 256, 'activation': 'tanh', 'solver': 'sgd'}. Best is trial 18 with value: 0.9866666666666667.
[I 2024-09-02 22:33:15,887] Trial 500 finished with value: 0.9866666666666667 and parameters: {'classifier': 'NeuralNetwork', 'nn_alpha': 0.05560913418386787, 'hidden_layer_sizes': 256, 'activation': 'tanh', 'solver': 'sgd'}. Best is trial 18 with value: 0.9866666666666667.
[I 2024-09-02 22:33:17,705] Trial 501 finished with value: 0.9866666666666667 and parameters: {'classifier': 'NeuralNetwork', 'nn_alpha': 0.0011470381764715674, 'hidden_layer_sizes': 256, 'activation': 'tanh', 'solver': 'sgd'}. Best is trial 18 with value: 0.9866666666666667.
[I 2024-09-02 22:33:19,537] Trial 502 finished with value: 0.98 and parameters: {'classifier': 'NeuralNetwork', 'nn_alpha': 0.00018700411241048335, 'hidden_layer_sizes': 256, 'activation': 'tanh', 'solver': 'sgd'}. Best is trial 18 with value: 0.9866666666666667.
[I 2024-09-02 22:33:21,366] Trial 503 finished with value: 0.9866666666666667 and parameters: {'classifier': 'NeuralNetwork', 'nn_alpha': 0.0996049640742731, 'hidden_layer_sizes': 256, 'activation': 'tanh', 'solver': 'sgd'}. Best is trial 18 with value: 0.9866666666666667.
[I 2024-09-02 22:33:22,616] Trial 504 finished with value: 0.9866666666666667 and parameters: {'classifier': 'NeuralNetwork', 'nn_alpha': 0.03795148775024326, 'hidden_layer_sizes': 128, 'activation': 'tanh', 'solver': 'sgd'}. Best is trial 18 with value: 0.9866666666666667.
[I 2024-09-02 22:33:22,637] Trial 505 finished with value: 0.9333333333333332 and parameters: {'classifier': 'DecisionTree', 'dt_max_depth': 13, 'dt_min_samples_split': 9, 'dt_min_samples_leaf': 7, 'dt_max_features': 'log2'}. Best is trial 18 with value: 0.9866666666666667.
[I 2024-09-02 22:33:23,661] Trial 506 finished with value: 0.98 and parameters: {'classifier': 'NeuralNetwork', 'nn_alpha': 0.06367921530960755, 'hidden_layer_sizes': 512, 'activation': 'tanh', 'solver': 'adam'}. Best is trial 18 with value: 0.9866666666666667.
[I 2024-09-02 22:33:25,552] Trial 507 finished with value: 0.98 and parameters: {'classifier': 'NeuralNetwork', 'nn_alpha': 0.04667858133868348, 'hidden_layer_sizes': 256, 'activation': 'tanh', 'solver': 'sgd'}. Best is trial 18 with value: 0.9866666666666667.
[I 2024-09-02 22:33:26,620] Trial 508 finished with value: 0.9733333333333333 and parameters: {'classifier': 'NeuralNetwork', 'nn_alpha': 0.07927459091940048, 'hidden_layer_sizes': 64, 'activation': 'tanh', 'solver': 'sgd'}. Best is trial 18 with value: 0.9866666666666667.
[I 2024-09-02 22:33:28,531] Trial 509 finished with value: 0.9866666666666667 and parameters: {'classifier': 'NeuralNetwork', 'nn_alpha': 0.030132334948701402, 'hidden_layer_sizes': 256, 'activation': 'tanh', 'solver': 'sgd'}. Best is trial 18 with value: 0.9866666666666667.
[I 2024-09-02 22:33:30,085] Trial 510 finished with value: 0.9733333333333333 and parameters: {'classifier': 'NeuralNetwork', 'nn_alpha': 0.022923245914466643, 'hidden_layer_sizes': 256, 'activation': 'logistic', 'solver': 'lbfgs'}. Best is trial 18 with value: 0.9866666666666667.
[I 2024-09-02 22:33:30,296] Trial 511 finished with value: 0.9533333333333333 and parameters: {'classifier': 'XGBoost', 'xgb_eta': 0.08791608765817345, 'xgb_max_depth': 8, 'xgb_min_child_weight': 0.0015595679809755777, 'xgb_subsample': 0.7865670822026686, 'xgb_colsample_bytree': 0.9521530165907692}. Best is trial 18 with value: 0.9866666666666667.
[I 2024-09-02 22:33:31,773] Trial 512 finished with value: 0.98 and parameters: {'classifier': 'NeuralNetwork', 'nn_alpha': 0.06360430354953354, 'hidden_layer_sizes': 256, 'activation': 'relu', 'solver': 'sgd'}. Best is trial 18 with value: 0.9866666666666667.
[I 2024-09-02 22:33:33,690] Trial 513 finished with value: 0.9866666666666667 and parameters: {'classifier': 'NeuralNetwork', 'nn_alpha': 0.014514716229050055, 'hidden_layer_sizes': 256, 'activation': 'tanh', 'solver': 'sgd'}. Best is trial 18 with value: 0.9866666666666667.
[I 2024-09-02 22:33:35,524] Trial 514 finished with value: 0.98 and parameters: {'classifier': 'NeuralNetwork', 'nn_alpha': 0.04244226737687051, 'hidden_layer_sizes': 256, 'activation': 'tanh', 'solver': 'sgd'}. Best is trial 18 with value: 0.9866666666666667.
[I 2024-09-02 22:33:37,389] Trial 515 finished with value: 0.9866666666666667 and parameters: {'classifier': 'NeuralNetwork', 'nn_alpha': 0.03456479242114699, 'hidden_layer_sizes': 256, 'activation': 'tanh', 'solver': 'sgd'}. Best is trial 18 with value: 0.9866666666666667.
[I 2024-09-02 22:33:39,194] Trial 516 finished with value: 0.9866666666666667 and parameters: {'classifier': 'NeuralNetwork', 'nn_alpha': 0.05318335669534249, 'hidden_layer_sizes': 256, 'activation': 'tanh', 'solver': 'sgd'}. Best is trial 18 with value: 0.9866666666666667.
[I 2024-09-02 22:33:41,046] Trial 517 finished with value: 0.98 and parameters: {'classifier': 'NeuralNetwork', 'nn_alpha': 0.007612344851557289, 'hidden_layer_sizes': 256, 'activation': 'tanh', 'solver': 'sgd'}. Best is trial 18 with value: 0.9866666666666667.
[I 2024-09-02 22:33:41,062] Trial 518 finished with value: 0.5133333333333333 and parameters: {'classifier': 'SVC', 'svc_c': 0.00043211189035014826, 'gamma': 'scale', 'kernel': 'poly'}. Best is trial 18 with value: 0.9866666666666667.
[I 2024-09-02 22:33:42,954] Trial 519 finished with value: 0.98 and parameters: {'classifier': 'NeuralNetwork', 'nn_alpha': 0.08254997162466451, 'hidden_layer_sizes': 256, 'activation': 'tanh', 'solver': 'sgd'}. Best is trial 18 with value: 0.9866666666666667.
[I 2024-09-02 22:33:43,515] Trial 520 finished with value: 0.98 and parameters: {'classifier': 'NeuralNetwork', 'nn_alpha': 0.047650340191930075, 'hidden_layer_sizes': 128, 'activation': 'tanh', 'solver': 'adam'}. Best is trial 18 with value: 0.9866666666666667.
[I 2024-09-02 22:33:45,344] Trial 521 finished with value: 0.98 and parameters: {'classifier': 'NeuralNetwork', 'nn_alpha': 0.07078158760031766, 'hidden_layer_sizes': 256, 'activation': 'tanh', 'solver': 'sgd'}. Best is trial 18 with value: 0.9866666666666667.
[I 2024-09-02 22:33:47,183] Trial 522 finished with value: 0.9866666666666667 and parameters: {'classifier': 'NeuralNetwork', 'nn_alpha': 0.019336748365585067, 'hidden_layer_sizes': 256, 'activation': 'tanh', 'solver': 'sgd'}. Best is trial 18 with value: 0.9866666666666667.
[I 2024-09-02 22:33:47,433] Trial 523 finished with value: 0.9533333333333333 and parameters: {'classifier': 'RandomForest', 'rf_max_depth': 12, 'rf_min_samples_split': 15, 'rf_min_samples_leaf': 4, 'rf_max_features': 'log2'}. Best is trial 18 with value: 0.9866666666666667.
[I 2024-09-02 22:33:48,401] Trial 524 finished with value: 0.9733333333333333 and parameters: {'classifier': 'NeuralNetwork', 'nn_alpha': 0.025976336709848464, 'hidden_layer_sizes': 64, 'activation': 'tanh', 'solver': 'sgd'}. Best is trial 18 with value: 0.9866666666666667.
[I 2024-09-02 22:33:50,229] Trial 525 finished with value: 0.98 and parameters: {'classifier': 'NeuralNetwork', 'nn_alpha': 0.0386953066135595, 'hidden_layer_sizes': 256, 'activation': 'tanh', 'solver': 'sgd'}. Best is trial 18 with value: 0.9866666666666667.
[I 2024-09-02 22:33:58,688] Trial 526 finished with value: 0.96 and parameters: {'classifier': 'NeuralNetwork', 'nn_alpha': 0.0015290373437319411, 'hidden_layer_sizes': 256, 'activation': 'logistic', 'solver': 'sgd'}. Best is trial 18 with value: 0.9866666666666667.
[I 2024-09-02 22:34:00,491] Trial 527 finished with value: 0.9866666666666667 and parameters: {'classifier': 'NeuralNetwork', 'nn_alpha': 0.05484010087028603, 'hidden_layer_sizes': 256, 'activation': 'tanh', 'solver': 'sgd'}. Best is trial 18 with value: 0.9866666666666667.
[I 2024-09-02 22:34:02,367] Trial 528 finished with value: 0.9866666666666667 and parameters: {'classifier': 'NeuralNetwork', 'nn_alpha': 0.03363646673577481, 'hidden_layer_sizes': 256, 'activation': 'tanh', 'solver': 'sgd'}. Best is trial 18 with value: 0.9866666666666667.
[I 2024-09-02 22:34:04,228] Trial 529 finished with value: 0.9866666666666667 and parameters: {'classifier': 'NeuralNetwork', 'nn_alpha': 0.09962625243377392, 'hidden_layer_sizes': 256, 'activation': 'tanh', 'solver': 'sgd'}. Best is trial 18 with value: 0.9866666666666667.
[I 2024-09-02 22:34:06,126] Trial 530 finished with value: 0.9866666666666667 and parameters: {'classifier': 'NeuralNetwork', 'nn_alpha': 0.06568630863086952, 'hidden_layer_sizes': 256, 'activation': 'tanh', 'solver': 'sgd'}. Best is trial 18 with value: 0.9866666666666667.
[I 2024-09-02 22:34:08,061] Trial 531 finished with value: 0.9866666666666667 and parameters: {'classifier': 'NeuralNetwork', 'nn_alpha': 0.0008038577452698928, 'hidden_layer_sizes': 256, 'activation': 'tanh', 'solver': 'sgd'}. Best is trial 18 with value: 0.9866666666666667.
[I 2024-09-02 22:34:08,083] Trial 532 finished with value: 0.8733333333333334 and parameters: {'classifier': 'DecisionTree', 'dt_max_depth': 2, 'dt_min_samples_split': 20, 'dt_min_samples_leaf': 2, 'dt_max_features': 'sqrt'}. Best is trial 18 with value: 0.9866666666666667.
[I 2024-09-02 22:34:10,124] Trial 533 finished with value: 0.9866666666666667 and parameters: {'classifier': 'NeuralNetwork', 'nn_alpha': 0.045534919063680054, 'hidden_layer_sizes': 256, 'activation': 'tanh', 'solver': 'sgd'}. Best is trial 18 with value: 0.9866666666666667.
[I 2024-09-02 22:34:11,186] Trial 534 finished with value: 0.98 and parameters: {'classifier': 'NeuralNetwork', 'nn_alpha': 0.08109944886810512, 'hidden_layer_sizes': 512, 'activation': 'tanh', 'solver': 'adam'}. Best is trial 18 with value: 0.9866666666666667.
[I 2024-09-02 22:34:13,219] Trial 535 finished with value: 0.9866666666666667 and parameters: {'classifier': 'NeuralNetwork', 'nn_alpha': 0.02965342655380459, 'hidden_layer_sizes': 256, 'activation': 'tanh', 'solver': 'sgd'}. Best is trial 18 with value: 0.9866666666666667.
[I 2024-09-02 22:34:14,490] Trial 536 finished with value: 0.9866666666666667 and parameters: {'classifier': 'NeuralNetwork', 'nn_alpha': 0.06065348283772323, 'hidden_layer_sizes': 128, 'activation': 'tanh', 'solver': 'sgd'}. Best is trial 18 with value: 0.9866666666666667.
F:\PycharmProjects\venv\Lib\site-packages\sklearn\neural_network\_multilayer_perceptron.py:545: ConvergenceWarning: lbfgs failed to converge (status=1):
STOP: TOTAL NO. of ITERATIONS REACHED LIMIT.
Increase the number of iterations (max_iter) or scale the data as shown in:
    https://scikit-learn.org/stable/modules/preprocessing.html
  self.n_iter_ = _check_optimize_result("lbfgs", opt_res, self.max_iter)
[I 2024-09-02 22:34:19,004] Trial 537 finished with value: 0.9733333333333333 and parameters: {'classifier': 'NeuralNetwork', 'nn_alpha': 0.049320155424361335, 'hidden_layer_sizes': 256, 'activation': 'tanh', 'solver': 'lbfgs'}. Best is trial 18 with value: 0.9866666666666667.
[I 2024-09-02 22:34:19,185] Trial 538 finished with value: 0.96 and parameters: {'classifier': 'XGBoost', 'xgb_eta': 0.013512788491467108, 'xgb_max_depth': 4, 'xgb_min_child_weight': 3.080774884648935e-05, 'xgb_subsample': 0.9921977513777711, 'xgb_colsample_bytree': 0.546255363303497}. Best is trial 18 with value: 0.9866666666666667.
[I 2024-09-02 22:34:20,594] Trial 539 finished with value: 0.98 and parameters: {'classifier': 'NeuralNetwork', 'nn_alpha': 0.040294004185976555, 'hidden_layer_sizes': 256, 'activation': 'relu', 'solver': 'sgd'}. Best is trial 18 with value: 0.9866666666666667.
[I 2024-09-02 22:34:21,643] Trial 540 finished with value: 0.9866666666666667 and parameters: {'classifier': 'NeuralNetwork', 'nn_alpha': 0.07159476265434121, 'hidden_layer_sizes': 64, 'activation': 'tanh', 'solver': 'sgd'}. Best is trial 18 with value: 0.9866666666666667.
[I 2024-09-02 22:34:30,193] Trial 541 finished with value: 0.96 and parameters: {'classifier': 'NeuralNetwork', 'nn_alpha': 0.02465329858133086, 'hidden_layer_sizes': 256, 'activation': 'logistic', 'solver': 'sgd'}. Best is trial 18 with value: 0.9866666666666667.
[I 2024-09-02 22:34:30,215] Trial 542 finished with value: 0.9666666666666667 and parameters: {'classifier': 'SVC', 'svc_c': 0.12668391031928808, 'gamma': 'auto', 'kernel': 'linear'}. Best is trial 18 with value: 0.9866666666666667.
[I 2024-09-02 22:34:32,045] Trial 543 finished with value: 0.9866666666666667 and parameters: {'classifier': 'NeuralNetwork', 'nn_alpha': 0.05737161242622797, 'hidden_layer_sizes': 256, 'activation': 'tanh', 'solver': 'sgd'}. Best is trial 18 with value: 0.9866666666666667.
[I 2024-09-02 22:34:33,886] Trial 544 finished with value: 0.9866666666666667 and parameters: {'classifier': 'NeuralNetwork', 'nn_alpha': 0.035322193722126534, 'hidden_layer_sizes': 256, 'activation': 'tanh', 'solver': 'sgd'}. Best is trial 18 with value: 0.9866666666666667.
[I 2024-09-02 22:34:35,733] Trial 545 finished with value: 0.9866666666666667 and parameters: {'classifier': 'NeuralNetwork', 'nn_alpha': 0.07785004578293268, 'hidden_layer_sizes': 256, 'activation': 'tanh', 'solver': 'sgd'}. Best is trial 18 with value: 0.9866666666666667.
[I 2024-09-02 22:34:37,600] Trial 546 finished with value: 0.9866666666666667 and parameters: {'classifier': 'NeuralNetwork', 'nn_alpha': 5.469358235064018e-05, 'hidden_layer_sizes': 256, 'activation': 'tanh', 'solver': 'sgd'}. Best is trial 18 with value: 0.9866666666666667.
[I 2024-09-02 22:34:39,455] Trial 547 finished with value: 0.9866666666666667 and parameters: {'classifier': 'NeuralNetwork', 'nn_alpha': 0.04375114700716442, 'hidden_layer_sizes': 256, 'activation': 'tanh', 'solver': 'sgd'}. Best is trial 18 with value: 0.9866666666666667.
[I 2024-09-02 22:34:41,251] Trial 548 finished with value: 0.9866666666666667 and parameters: {'classifier': 'NeuralNetwork', 'nn_alpha': 0.00027775333002411263, 'hidden_layer_sizes': 256, 'activation': 'tanh', 'solver': 'sgd'}. Best is trial 18 with value: 0.9866666666666667.
[I 2024-09-02 22:34:41,503] Trial 549 finished with value: 0.9466666666666667 and parameters: {'classifier': 'RandomForest', 'rf_max_depth': 2, 'rf_min_samples_split': 9, 'rf_min_samples_leaf': 7, 'rf_max_features': 'sqrt'}. Best is trial 18 with value: 0.9866666666666667.
[I 2024-09-02 22:34:42,183] Trial 550 finished with value: 0.98 and parameters: {'classifier': 'NeuralNetwork', 'nn_alpha': 0.08819017791328664, 'hidden_layer_sizes': 256, 'activation': 'tanh', 'solver': 'adam'}. Best is trial 18 with value: 0.9866666666666667.
[I 2024-09-02 22:34:43,442] Trial 551 finished with value: 0.9866666666666667 and parameters: {'classifier': 'NeuralNetwork', 'nn_alpha': 0.018129068177145442, 'hidden_layer_sizes': 128, 'activation': 'tanh', 'solver': 'sgd'}. Best is trial 18 with value: 0.9866666666666667.
[I 2024-09-02 22:34:45,300] Trial 552 finished with value: 0.9866666666666667 and parameters: {'classifier': 'NeuralNetwork', 'nn_alpha': 0.0033536903039470285, 'hidden_layer_sizes': 256, 'activation': 'tanh', 'solver': 'sgd'}. Best is trial 18 with value: 0.9866666666666667.
[I 2024-09-02 22:34:47,133] Trial 553 finished with value: 0.9866666666666667 and parameters: {'classifier': 'NeuralNetwork', 'nn_alpha': 0.02983700774245124, 'hidden_layer_sizes': 256, 'activation': 'tanh', 'solver': 'sgd'}. Best is trial 18 with value: 0.9866666666666667.
[I 2024-09-02 22:34:48,987] Trial 554 finished with value: 0.9866666666666667 and parameters: {'classifier': 'NeuralNetwork', 'nn_alpha': 0.050543697395035794, 'hidden_layer_sizes': 256, 'activation': 'tanh', 'solver': 'sgd'}. Best is trial 18 with value: 0.9866666666666667.
[I 2024-09-02 22:34:52,230] Trial 555 finished with value: 0.98 and parameters: {'classifier': 'NeuralNetwork', 'nn_alpha': 0.004178377815184353, 'hidden_layer_sizes': 64, 'activation': 'logistic', 'solver': 'sgd'}. Best is trial 18 with value: 0.9866666666666667.
[I 2024-09-02 22:34:54,091] Trial 556 finished with value: 0.9866666666666667 and parameters: {'classifier': 'NeuralNetwork', 'nn_alpha': 1.0718673969028328e-05, 'hidden_layer_sizes': 256, 'activation': 'tanh', 'solver': 'sgd'}. Best is trial 18 with value: 0.9866666666666667.
[I 2024-09-02 22:34:54,114] Trial 557 finished with value: 0.8933333333333334 and parameters: {'classifier': 'DecisionTree', 'dt_max_depth': 4, 'dt_min_samples_split': 17, 'dt_min_samples_leaf': 9, 'dt_max_features': 'sqrt'}. Best is trial 18 with value: 0.9866666666666667.
[I 2024-09-02 22:34:55,926] Trial 558 finished with value: 0.9866666666666667 and parameters: {'classifier': 'NeuralNetwork', 'nn_alpha': 0.06358169801627579, 'hidden_layer_sizes': 256, 'activation': 'tanh', 'solver': 'sgd'}. Best is trial 18 with value: 0.9866666666666667.
[I 2024-09-02 22:34:57,758] Trial 559 finished with value: 0.9866666666666667 and parameters: {'classifier': 'NeuralNetwork', 'nn_alpha': 0.040681209993445135, 'hidden_layer_sizes': 256, 'activation': 'tanh', 'solver': 'sgd'}. Best is trial 18 with value: 0.9866666666666667.
[I 2024-09-02 22:34:59,599] Trial 560 finished with value: 0.9866666666666667 and parameters: {'classifier': 'NeuralNetwork', 'nn_alpha': 0.0336380888145506, 'hidden_layer_sizes': 256, 'activation': 'tanh', 'solver': 'sgd'}. Best is trial 18 with value: 0.9866666666666667.
[I 2024-09-02 22:35:01,444] Trial 561 finished with value: 0.98 and parameters: {'classifier': 'NeuralNetwork', 'nn_alpha': 0.021597466330565467, 'hidden_layer_sizes': 256, 'activation': 'tanh', 'solver': 'sgd'}. Best is trial 18 with value: 0.9866666666666667.
