[I 2024-09-02 22:25:08,707] Trial 242 finished with value: 0.9866666666666667 and parameters: {'classifier': 'NeuralNetwork', 'nn_alpha': 0.01828508933418629, 'hidden_layer_sizes': 256, 'activation': 'tanh', 'solver': 'sgd'}. Best is trial 18 with value: 0.9866666666666667.
[I 2024-09-02 22:25:10,497] Trial 243 finished with value: 0.9866666666666667 and parameters: {'classifier': 'NeuralNetwork', 'nn_alpha': 0.02896884891524938, 'hidden_layer_sizes': 256, 'activation': 'tanh', 'solver': 'sgd'}. Best is trial 18 with value: 0.9866666666666667.
[I 2024-09-02 22:25:12,281] Trial 244 finished with value: 0.9866666666666667 and parameters: {'classifier': 'NeuralNetwork', 'nn_alpha': 0.06081558762152616, 'hidden_layer_sizes': 256, 'activation': 'tanh', 'solver': 'sgd'}. Best is trial 18 with value: 0.9866666666666667.
[I 2024-09-02 22:25:20,563] Trial 245 finished with value: 0.96 and parameters: {'classifier': 'NeuralNetwork', 'nn_alpha': 0.034748806589733665, 'hidden_layer_sizes': 256, 'activation': 'logistic', 'solver': 'sgd'}. Best is trial 18 with value: 0.9866666666666667.
[I 2024-09-02 22:25:22,313] Trial 246 finished with value: 0.9866666666666667 and parameters: {'classifier': 'NeuralNetwork', 'nn_alpha': 0.08789822763555258, 'hidden_layer_sizes': 256, 'activation': 'tanh', 'solver': 'sgd'}. Best is trial 18 with value: 0.9866666666666667.
[I 2024-09-02 22:25:27,260] Trial 247 finished with value: 0.9733333333333333 and parameters: {'classifier': 'NeuralNetwork', 'nn_alpha': 0.019723006212708758, 'hidden_layer_sizes': 512, 'activation': 'tanh', 'solver': 'lbfgs'}. Best is trial 18 with value: 0.9866666666666667.
[I 2024-09-02 22:25:29,117] Trial 248 finished with value: 0.9866666666666667 and parameters: {'classifier': 'NeuralNetwork', 'nn_alpha': 0.04721373764599342, 'hidden_layer_sizes': 256, 'activation': 'tanh', 'solver': 'sgd'}. Best is trial 18 with value: 0.9866666666666667.
[I 2024-09-02 22:25:29,266] Trial 249 finished with value: 0.9666666666666667 and parameters: {'classifier': 'XGBoost', 'xgb_eta': 0.018493620039818956, 'xgb_max_depth': 3, 'xgb_min_child_weight': 0.08524279475060893, 'xgb_subsample': 0.6200416222071619, 'xgb_colsample_bytree': 0.7257516134939476}. Best is trial 18 with value: 0.9866666666666667.
[I 2024-09-02 22:25:30,542] Trial 250 finished with value: 0.98 and parameters: {'classifier': 'NeuralNetwork', 'nn_alpha': 0.0743678032872449, 'hidden_layer_sizes': 256, 'activation': 'relu', 'solver': 'sgd'}. Best is trial 18 with value: 0.9866666666666667.
[I 2024-09-02 22:25:32,432] Trial 251 finished with value: 0.9866666666666667 and parameters: {'classifier': 'NeuralNetwork', 'nn_alpha': 0.000297099452649189, 'hidden_layer_sizes': 256, 'activation': 'tanh', 'solver': 'sgd'}. Best is trial 18 with value: 0.9866666666666667.
[I 2024-09-02 22:25:33,711] Trial 252 finished with value: 0.9866666666666667 and parameters: {'classifier': 'NeuralNetwork', 'nn_alpha': 0.054229856485018525, 'hidden_layer_sizes': 128, 'activation': 'tanh', 'solver': 'sgd'}. Best is trial 18 with value: 0.9866666666666667.
[I 2024-09-02 22:25:34,386] Trial 253 finished with value: 0.98 and parameters: {'classifier': 'NeuralNetwork', 'nn_alpha': 0.03703887584561492, 'hidden_layer_sizes': 256, 'activation': 'tanh', 'solver': 'adam'}. Best is trial 18 with value: 0.9866666666666667.
[I 2024-09-02 22:25:35,377] Trial 254 finished with value: 0.9866666666666667 and parameters: {'classifier': 'NeuralNetwork', 'nn_alpha': 0.06727713017413753, 'hidden_layer_sizes': 64, 'activation': 'tanh', 'solver': 'sgd'}. Best is trial 18 with value: 0.9866666666666667.
[I 2024-09-02 22:25:35,574] Trial 255 finished with value: 0.96 and parameters: {'classifier': 'SVC', 'svc_c': 8342822.619446016, 'gamma': 'scale', 'kernel': 'linear'}. Best is trial 18 with value: 0.9866666666666667.
[I 2024-09-02 22:25:37,387] Trial 256 finished with value: 0.9866666666666667 and parameters: {'classifier': 'NeuralNetwork', 'nn_alpha': 0.015994082118846904, 'hidden_layer_sizes': 256, 'activation': 'tanh', 'solver': 'sgd'}. Best is trial 18 with value: 0.9866666666666667.
[I 2024-09-02 22:25:39,284] Trial 257 finished with value: 0.9866666666666667 and parameters: {'classifier': 'NeuralNetwork', 'nn_alpha': 0.04363832646235075, 'hidden_layer_sizes': 256, 'activation': 'tanh', 'solver': 'sgd'}. Best is trial 18 with value: 0.9866666666666667.
[I 2024-09-02 22:25:41,109] Trial 258 finished with value: 0.9866666666666667 and parameters: {'classifier': 'NeuralNetwork', 'nn_alpha': 0.09590044432556612, 'hidden_layer_sizes': 256, 'activation': 'tanh', 'solver': 'sgd'}. Best is trial 18 with value: 0.9866666666666667.
[I 2024-09-02 22:25:49,688] Trial 259 finished with value: 0.96 and parameters: {'classifier': 'NeuralNetwork', 'nn_alpha': 0.0010218996580911685, 'hidden_layer_sizes': 256, 'activation': 'logistic', 'solver': 'sgd'}. Best is trial 18 with value: 0.9866666666666667.
[I 2024-09-02 22:25:51,484] Trial 260 finished with value: 0.98 and parameters: {'classifier': 'NeuralNetwork', 'nn_alpha': 0.055495141436768, 'hidden_layer_sizes': 256, 'activation': 'tanh', 'solver': 'sgd'}. Best is trial 18 with value: 0.9866666666666667.
[I 2024-09-02 22:25:51,734] Trial 261 finished with value: 0.9533333333333333 and parameters: {'classifier': 'RandomForest', 'rf_max_depth': 17, 'rf_min_samples_split': 5, 'rf_min_samples_leaf': 6, 'rf_max_features': 'sqrt'}. Best is trial 18 with value: 0.9866666666666667.
[I 2024-09-02 22:25:53,551] Trial 262 finished with value: 0.9866666666666667 and parameters: {'classifier': 'NeuralNetwork', 'nn_alpha': 0.03234983924614159, 'hidden_layer_sizes': 256, 'activation': 'tanh', 'solver': 'sgd'}. Best is trial 18 with value: 0.9866666666666667.
[I 2024-09-02 22:25:55,348] Trial 263 finished with value: 0.9866666666666667 and parameters: {'classifier': 'NeuralNetwork', 'nn_alpha': 0.06254453592160443, 'hidden_layer_sizes': 256, 'activation': 'tanh', 'solver': 'sgd'}. Best is trial 18 with value: 0.9866666666666667.
[I 2024-09-02 22:25:57,156] Trial 264 finished with value: 0.9866666666666667 and parameters: {'classifier': 'NeuralNetwork', 'nn_alpha': 0.027472907453943287, 'hidden_layer_sizes': 256, 'activation': 'tanh', 'solver': 'sgd'}. Best is trial 18 with value: 0.9866666666666667.
[I 2024-09-02 22:25:58,444] Trial 265 finished with value: 0.9866666666666667 and parameters: {'classifier': 'NeuralNetwork', 'nn_alpha': 0.00466353774977525, 'hidden_layer_sizes': 128, 'activation': 'tanh', 'solver': 'sgd'}. Best is trial 18 with value: 0.9866666666666667.
[I 2024-09-02 22:26:00,317] Trial 266 finished with value: 0.9866666666666667 and parameters: {'classifier': 'NeuralNetwork', 'nn_alpha': 4.195399263524037e-05, 'hidden_layer_sizes': 256, 'activation': 'tanh', 'solver': 'sgd'}. Best is trial 18 with value: 0.9866666666666667.
[I 2024-09-02 22:26:01,004] Trial 267 finished with value: 0.98 and parameters: {'classifier': 'NeuralNetwork', 'nn_alpha': 0.07849118220096182, 'hidden_layer_sizes': 256, 'activation': 'tanh', 'solver': 'adam'}. Best is trial 18 with value: 0.9866666666666667.
[I 2024-09-02 22:26:02,035] Trial 268 finished with value: 0.98 and parameters: {'classifier': 'NeuralNetwork', 'nn_alpha': 0.04186178362162183, 'hidden_layer_sizes': 64, 'activation': 'tanh', 'solver': 'sgd'}. Best is trial 18 with value: 0.9866666666666667.
[I 2024-09-02 22:26:02,053] Trial 269 finished with value: 0.7333333333333334 and parameters: {'classifier': 'DecisionTree', 'dt_max_depth': 2, 'dt_min_samples_split': 12, 'dt_min_samples_leaf': 6, 'dt_max_features': 'log2'}. Best is trial 18 with value: 0.9866666666666667.
[I 2024-09-02 22:26:03,897] Trial 270 finished with value: 0.9866666666666667 and parameters: {'classifier': 'NeuralNetwork', 'nn_alpha': 0.04959270979853482, 'hidden_layer_sizes': 256, 'activation': 'tanh', 'solver': 'sgd'}. Best is trial 18 with value: 0.9866666666666667.
[I 2024-09-02 22:26:05,660] Trial 271 finished with value: 0.9866666666666667 and parameters: {'classifier': 'NeuralNetwork', 'nn_alpha': 0.020949542541504232, 'hidden_layer_sizes': 256, 'activation': 'tanh', 'solver': 'sgd'}. Best is trial 18 with value: 0.9866666666666667.
[I 2024-09-02 22:26:07,465] Trial 272 finished with value: 0.98 and parameters: {'classifier': 'NeuralNetwork', 'nn_alpha': 0.08333704602328353, 'hidden_layer_sizes': 256, 'activation': 'tanh', 'solver': 'sgd'}. Best is trial 18 with value: 0.9866666666666667.
[I 2024-09-02 22:26:15,916] Trial 273 finished with value: 0.96 and parameters: {'classifier': 'NeuralNetwork', 'nn_alpha': 0.03597465857849756, 'hidden_layer_sizes': 256, 'activation': 'logistic', 'solver': 'sgd'}. Best is trial 18 with value: 0.9866666666666667.
[I 2024-09-02 22:26:17,724] Trial 274 finished with value: 0.9866666666666667 and parameters: {'classifier': 'NeuralNetwork', 'nn_alpha': 0.06352249487906672, 'hidden_layer_sizes': 256, 'activation': 'tanh', 'solver': 'sgd'}. Best is trial 18 with value: 0.9866666666666667.
[I 2024-09-02 22:26:18,544] Trial 275 finished with value: 0.9733333333333333 and parameters: {'classifier': 'NeuralNetwork', 'nn_alpha': 0.04851635783646056, 'hidden_layer_sizes': 256, 'activation': 'relu', 'solver': 'lbfgs'}. Best is trial 18 with value: 0.9866666666666667.
[I 2024-09-02 22:26:18,683] Trial 276 finished with value: 0.9533333333333333 and parameters: {'classifier': 'XGBoost', 'xgb_eta': 0.04542374063502852, 'xgb_max_depth': 9, 'xgb_min_child_weight': 1.4910250967544627, 'xgb_subsample': 0.8731207854776568, 'xgb_colsample_bytree': 0.5889555857024714}. Best is trial 18 with value: 0.9866666666666667.
[I 2024-09-02 22:26:21,897] Trial 277 finished with value: 0.9866666666666667 and parameters: {'classifier': 'NeuralNetwork', 'nn_alpha': 0.02579979938005404, 'hidden_layer_sizes': 512, 'activation': 'tanh', 'solver': 'sgd'}. Best is trial 18 with value: 0.9866666666666667.
[I 2024-09-02 22:26:23,740] Trial 278 finished with value: 0.98 and parameters: {'classifier': 'NeuralNetwork', 'nn_alpha': 0.00018761479932506475, 'hidden_layer_sizes': 256, 'activation': 'tanh', 'solver': 'sgd'}. Best is trial 18 with value: 0.9866666666666667.
[I 2024-09-02 22:26:25,588] Trial 279 finished with value: 0.9866666666666667 and parameters: {'classifier': 'NeuralNetwork', 'nn_alpha': 0.03167737592296491, 'hidden_layer_sizes': 256, 'activation': 'tanh', 'solver': 'sgd'}. Best is trial 18 with value: 0.9866666666666667.
[I 2024-09-02 22:26:25,603] Trial 280 finished with value: 0.32 and parameters: {'classifier': 'SVC', 'svc_c': 0.0027419109921086177, 'gamma': 'auto', 'kernel': 'rbf'}. Best is trial 18 with value: 0.9866666666666667.
[I 2024-09-02 22:26:27,436] Trial 281 finished with value: 0.9866666666666667 and parameters: {'classifier': 'NeuralNetwork', 'nn_alpha': 0.09597716166360347, 'hidden_layer_sizes': 256, 'activation': 'tanh', 'solver': 'sgd'}. Best is trial 18 with value: 0.9866666666666667.
[I 2024-09-02 22:26:28,703] Trial 282 finished with value: 0.9866666666666667 and parameters: {'classifier': 'NeuralNetwork', 'nn_alpha': 0.07158189985629286, 'hidden_layer_sizes': 128, 'activation': 'tanh', 'solver': 'sgd'}. Best is trial 18 with value: 0.9866666666666667.
[I 2024-09-02 22:26:29,493] Trial 283 finished with value: 0.98 and parameters: {'classifier': 'NeuralNetwork', 'nn_alpha': 0.0021692073192837156, 'hidden_layer_sizes': 256, 'activation': 'tanh', 'solver': 'adam'}. Best is trial 18 with value: 0.9866666666666667.
[I 2024-09-02 22:26:31,333] Trial 284 finished with value: 0.9866666666666667 and parameters: {'classifier': 'NeuralNetwork', 'nn_alpha': 0.041822500420418726, 'hidden_layer_sizes': 256, 'activation': 'tanh', 'solver': 'sgd'}. Best is trial 18 with value: 0.9866666666666667.
[I 2024-09-02 22:26:32,388] Trial 285 finished with value: 0.98 and parameters: {'classifier': 'NeuralNetwork', 'nn_alpha': 0.054705016463889485, 'hidden_layer_sizes': 64, 'activation': 'tanh', 'solver': 'sgd'}. Best is trial 18 with value: 0.9866666666666667.
[I 2024-09-02 22:26:34,301] Trial 286 finished with value: 0.9866666666666667 and parameters: {'classifier': 'NeuralNetwork', 'nn_alpha': 0.037909044989882186, 'hidden_layer_sizes': 256, 'activation': 'tanh', 'solver': 'sgd'}. Best is trial 18 with value: 0.9866666666666667.
[I 2024-09-02 22:26:36,160] Trial 287 finished with value: 0.9866666666666667 and parameters: {'classifier': 'NeuralNetwork', 'nn_alpha': 0.012870872485559357, 'hidden_layer_sizes': 256, 'activation': 'tanh', 'solver': 'sgd'}. Best is trial 18 with value: 0.9866666666666667.
[I 2024-09-02 22:26:36,422] Trial 288 finished with value: 0.9466666666666667 and parameters: {'classifier': 'RandomForest', 'rf_max_depth': 3, 'rf_min_samples_split': 13, 'rf_min_samples_leaf': 9, 'rf_max_features': 'log2'}. Best is trial 18 with value: 0.9866666666666667.
[I 2024-09-02 22:26:44,558] Trial 289 finished with value: 0.96 and parameters: {'classifier': 'NeuralNetwork', 'nn_alpha': 0.07921005057732287, 'hidden_layer_sizes': 256, 'activation': 'logistic', 'solver': 'sgd'}. Best is trial 18 with value: 0.9866666666666667.
[I 2024-09-02 22:26:46,374] Trial 290 finished with value: 0.9866666666666667 and parameters: {'classifier': 'NeuralNetwork', 'nn_alpha': 0.05976595378521799, 'hidden_layer_sizes': 256, 'activation': 'tanh', 'solver': 'sgd'}. Best is trial 18 with value: 0.9866666666666667.
[I 2024-09-02 22:26:48,246] Trial 291 finished with value: 0.9866666666666667 and parameters: {'classifier': 'NeuralNetwork', 'nn_alpha': 0.04829209766366383, 'hidden_layer_sizes': 256, 'activation': 'tanh', 'solver': 'sgd'}. Best is trial 18 with value: 0.9866666666666667.
[I 2024-09-02 22:26:50,118] Trial 292 finished with value: 0.9866666666666667 and parameters: {'classifier': 'NeuralNetwork', 'nn_alpha': 0.016837060881559115, 'hidden_layer_sizes': 256, 'activation': 'tanh', 'solver': 'sgd'}. Best is trial 18 with value: 0.9866666666666667.
[I 2024-09-02 22:26:52,068] Trial 293 finished with value: 0.9866666666666667 and parameters: {'classifier': 'NeuralNetwork', 'nn_alpha': 0.023339694297978202, 'hidden_layer_sizes': 256, 'activation': 'tanh', 'solver': 'sgd'}. Best is trial 18 with value: 0.9866666666666667.
[I 2024-09-02 22:26:53,909] Trial 294 finished with value: 0.9866666666666667 and parameters: {'classifier': 'NeuralNetwork', 'nn_alpha': 0.0321577037642057, 'hidden_layer_sizes': 256, 'activation': 'tanh', 'solver': 'sgd'}. Best is trial 18 with value: 0.9866666666666667.
[I 2024-09-02 22:26:53,927] Trial 295 finished with value: 0.64 and parameters: {'classifier': 'DecisionTree', 'dt_max_depth': 1, 'dt_min_samples_split': 18, 'dt_min_samples_leaf': 3, 'dt_max_features': 'sqrt'}. Best is trial 18 with value: 0.9866666666666667.
[I 2024-09-02 22:26:55,777] Trial 296 finished with value: 0.9866666666666667 and parameters: {'classifier': 'NeuralNetwork', 'nn_alpha': 0.09927568654881853, 'hidden_layer_sizes': 256, 'activation': 'tanh', 'solver': 'sgd'}. Best is trial 18 with value: 0.9866666666666667.
[I 2024-09-02 22:26:56,412] Trial 297 finished with value: 0.98 and parameters: {'classifier': 'NeuralNetwork', 'nn_alpha': 0.0005235212204017218, 'hidden_layer_sizes': 128, 'activation': 'tanh', 'solver': 'adam'}. Best is trial 18 with value: 0.9866666666666667.
[I 2024-09-02 22:26:58,227] Trial 298 finished with value: 0.9866666666666667 and parameters: {'classifier': 'NeuralNetwork', 'nn_alpha': 0.06629316903448747, 'hidden_layer_sizes': 256, 'activation': 'tanh', 'solver': 'sgd'}. Best is trial 18 with value: 0.9866666666666667.
[I 2024-09-02 22:27:00,050] Trial 299 finished with value: 0.9866666666666667 and parameters: {'classifier': 'NeuralNetwork', 'nn_alpha': 0.042461845468535105, 'hidden_layer_sizes': 256, 'activation': 'tanh', 'solver': 'sgd'}. Best is trial 18 with value: 0.9866666666666667.
[I 2024-09-02 22:27:01,141] Trial 300 finished with value: 0.9866666666666667 and parameters: {'classifier': 'NeuralNetwork', 'nn_alpha': 0.0573216822996321, 'hidden_layer_sizes': 64, 'activation': 'tanh', 'solver': 'sgd'}. Best is trial 18 with value: 0.9866666666666667.
[I 2024-09-02 22:27:01,533] Trial 301 finished with value: 0.9733333333333333 and parameters: {'classifier': 'NeuralNetwork', 'nn_alpha': 0.027516237794703243, 'hidden_layer_sizes': 256, 'activation': 'relu', 'solver': 'lbfgs'}. Best is trial 18 with value: 0.9866666666666667.
[I 2024-09-02 22:27:03,462] Trial 302 finished with value: 0.9866666666666667 and parameters: {'classifier': 'NeuralNetwork', 'nn_alpha': 1.5421123827715795e-05, 'hidden_layer_sizes': 256, 'activation': 'tanh', 'solver': 'sgd'}. Best is trial 18 with value: 0.9866666666666667.
[I 2024-09-02 22:27:03,574] Trial 303 finished with value: 0.3333333333333333 and parameters: {'classifier': 'XGBoost', 'xgb_eta': 0.019898822781674482, 'xgb_max_depth': 7, 'xgb_min_child_weight': 93.049833049589, 'xgb_subsample': 0.8051153530882154, 'xgb_colsample_bytree': 0.6993962474757301}. Best is trial 18 with value: 0.9866666666666667.
[I 2024-09-02 22:27:11,730] Trial 304 finished with value: 0.96 and parameters: {'classifier': 'NeuralNetwork', 'nn_alpha': 0.08183263100074133, 'hidden_layer_sizes': 256, 'activation': 'logistic', 'solver': 'sgd'}. Best is trial 18 with value: 0.9866666666666667.
[I 2024-09-02 22:27:14,886] Trial 305 finished with value: 0.98 and parameters: {'classifier': 'NeuralNetwork', 'nn_alpha': 0.036589907412886646, 'hidden_layer_sizes': 512, 'activation': 'tanh', 'solver': 'sgd'}. Best is trial 18 with value: 0.9866666666666667.
[I 2024-09-02 22:27:16,702] Trial 306 finished with value: 0.98 and parameters: {'classifier': 'NeuralNetwork', 'nn_alpha': 0.049727818477374675, 'hidden_layer_sizes': 256, 'activation': 'tanh', 'solver': 'sgd'}. Best is trial 18 with value: 0.9866666666666667.
[I 2024-09-02 22:27:16,716] Trial 307 finished with value: 0.32 and parameters: {'classifier': 'SVC', 'svc_c': 6.538524092013005e-08, 'gamma': 'scale', 'kernel': 'linear'}. Best is trial 18 with value: 0.9866666666666667.
[I 2024-09-02 22:27:18,498] Trial 308 finished with value: 0.9866666666666667 and parameters: {'classifier': 'NeuralNetwork', 'nn_alpha': 0.06922714051486017, 'hidden_layer_sizes': 256, 'activation': 'tanh', 'solver': 'sgd'}. Best is trial 18 with value: 0.9866666666666667.
[I 2024-09-02 22:27:20,311] Trial 309 finished with value: 0.9866666666666667 and parameters: {'classifier': 'NeuralNetwork', 'nn_alpha': 0.02145428755154066, 'hidden_layer_sizes': 256, 'activation': 'tanh', 'solver': 'sgd'}. Best is trial 18 with value: 0.9866666666666667.
[I 2024-09-02 22:27:22,132] Trial 310 finished with value: 0.9866666666666667 and parameters: {'classifier': 'NeuralNetwork', 'nn_alpha': 0.04143251256117247, 'hidden_layer_sizes': 256, 'activation': 'tanh', 'solver': 'sgd'}. Best is trial 18 with value: 0.9866666666666667.
[I 2024-09-02 22:27:23,992] Trial 311 finished with value: 0.98 and parameters: {'classifier': 'NeuralNetwork', 'nn_alpha': 0.05467038418046271, 'hidden_layer_sizes': 256, 'activation': 'tanh', 'solver': 'sgd'}. Best is trial 18 with value: 0.9866666666666667.
[I 2024-09-02 22:27:24,682] Trial 312 finished with value: 0.98 and parameters: {'classifier': 'NeuralNetwork', 'nn_alpha': 0.08049587238107121, 'hidden_layer_sizes': 256, 'activation': 'tanh', 'solver': 'adam'}. Best is trial 18 with value: 0.9866666666666667.
[I 2024-09-02 22:27:26,574] Trial 313 finished with value: 0.9866666666666667 and parameters: {'classifier': 'NeuralNetwork', 'nn_alpha': 0.031211907021220366, 'hidden_layer_sizes': 256, 'activation': 'tanh', 'solver': 'sgd'}. Best is trial 18 with value: 0.9866666666666667.
[I 2024-09-02 22:27:26,823] Trial 314 finished with value: 0.9533333333333333 and parameters: {'classifier': 'RandomForest', 'rf_max_depth': 9, 'rf_min_samples_split': 7, 'rf_min_samples_leaf': 4, 'rf_max_features': 'sqrt'}. Best is trial 18 with value: 0.9866666666666667.
[I 2024-09-02 22:27:28,137] Trial 315 finished with value: 0.9866666666666667 and parameters: {'classifier': 'NeuralNetwork', 'nn_alpha': 0.046321557962668694, 'hidden_layer_sizes': 128, 'activation': 'tanh', 'solver': 'sgd'}. Best is trial 18 with value: 0.9866666666666667.
[I 2024-09-02 22:27:29,936] Trial 316 finished with value: 0.9866666666666667 and parameters: {'classifier': 'NeuralNetwork', 'nn_alpha': 0.061666034772066905, 'hidden_layer_sizes': 256, 'activation': 'tanh', 'solver': 'sgd'}. Best is trial 18 with value: 0.9866666666666667.
[I 2024-09-02 22:27:30,961] Trial 317 finished with value: 0.98 and parameters: {'classifier': 'NeuralNetwork', 'nn_alpha': 0.007186374593103889, 'hidden_layer_sizes': 64, 'activation': 'tanh', 'solver': 'sgd'}. Best is trial 18 with value: 0.9866666666666667.
[I 2024-09-02 22:27:36,528] Trial 318 finished with value: 0.7466666666666667 and parameters: {'classifier': 'NeuralNetwork', 'nn_alpha': 0.09884917427200843, 'hidden_layer_sizes': 256, 'activation': 'logistic', 'solver': 'sgd'}. Best is trial 18 with value: 0.9866666666666667.
[I 2024-09-02 22:27:38,379] Trial 319 finished with value: 0.98 and parameters: {'classifier': 'NeuralNetwork', 'nn_alpha': 0.02662311130999303, 'hidden_layer_sizes': 256, 'activation': 'tanh', 'solver': 'sgd'}. Best is trial 18 with value: 0.9866666666666667.
[I 2024-09-02 22:27:40,181] Trial 320 finished with value: 0.9866666666666667 and parameters: {'classifier': 'NeuralNetwork', 'nn_alpha': 0.035270100293744916, 'hidden_layer_sizes': 256, 'activation': 'tanh', 'solver': 'sgd'}. Best is trial 18 with value: 0.9866666666666667.
[I 2024-09-02 22:27:41,928] Trial 321 finished with value: 0.9866666666666667 and parameters: {'classifier': 'NeuralNetwork', 'nn_alpha': 0.07313021797057055, 'hidden_layer_sizes': 256, 'activation': 'tanh', 'solver': 'sgd'}. Best is trial 18 with value: 0.9866666666666667.
