[I 2024-09-02 22:47:55,631] Trial 965 finished with value: 0.94 and parameters: {'classifier': 'RandomForest', 'rf_max_depth': 13, 'rf_min_samples_split': 14, 'rf_min_samples_leaf': 7, 'rf_max_features': 'log2'}. Best is trial 18 with value: 0.9866666666666667.
[I 2024-09-02 22:47:57,470] Trial 966 finished with value: 0.9866666666666667 and parameters: {'classifier': 'NeuralNetwork', 'nn_alpha': 0.041703747353865485, 'hidden_layer_sizes': 256, 'activation': 'tanh', 'solver': 'sgd'}. Best is trial 18 with value: 0.9866666666666667.
[I 2024-09-02 22:47:59,278] Trial 967 finished with value: 0.9866666666666667 and parameters: {'classifier': 'NeuralNetwork', 'nn_alpha': 0.06690509898900278, 'hidden_layer_sizes': 256, 'activation': 'tanh', 'solver': 'sgd'}. Best is trial 18 with value: 0.9866666666666667.
[I 2024-09-02 22:48:00,363] Trial 968 finished with value: 0.9733333333333333 and parameters: {'classifier': 'NeuralNetwork', 'nn_alpha': 0.024200152903473847, 'hidden_layer_sizes': 64, 'activation': 'tanh', 'solver': 'sgd'}. Best is trial 18 with value: 0.9866666666666667.
[I 2024-09-02 22:48:08,684] Trial 969 finished with value: 0.96 and parameters: {'classifier': 'NeuralNetwork', 'nn_alpha': 0.08380050609301726, 'hidden_layer_sizes': 256, 'activation': 'logistic', 'solver': 'sgd'}. Best is trial 18 with value: 0.9866666666666667.
[I 2024-09-02 22:48:10,574] Trial 970 finished with value: 0.9866666666666667 and parameters: {'classifier': 'NeuralNetwork', 'nn_alpha': 0.0009849472647465833, 'hidden_layer_sizes': 256, 'activation': 'tanh', 'solver': 'sgd'}. Best is trial 18 with value: 0.9866666666666667.
[I 2024-09-02 22:48:12,370] Trial 971 finished with value: 0.9866666666666667 and parameters: {'classifier': 'NeuralNetwork', 'nn_alpha': 0.018894296418424182, 'hidden_layer_sizes': 256, 'activation': 'tanh', 'solver': 'sgd'}. Best is trial 18 with value: 0.9866666666666667.
[I 2024-09-02 22:48:14,206] Trial 972 finished with value: 0.98 and parameters: {'classifier': 'NeuralNetwork', 'nn_alpha': 0.0572728059847632, 'hidden_layer_sizes': 256, 'activation': 'tanh', 'solver': 'sgd'}. Best is trial 18 with value: 0.9866666666666667.
[I 2024-09-02 22:48:16,077] Trial 973 finished with value: 0.9866666666666667 and parameters: {'classifier': 'NeuralNetwork', 'nn_alpha': 0.0448817563502401, 'hidden_layer_sizes': 256, 'activation': 'tanh', 'solver': 'sgd'}. Best is trial 18 with value: 0.9866666666666667.
[I 2024-09-02 22:48:17,979] Trial 974 finished with value: 0.9866666666666667 and parameters: {'classifier': 'NeuralNetwork', 'nn_alpha': 0.03473379889013016, 'hidden_layer_sizes': 256, 'activation': 'tanh', 'solver': 'sgd'}. Best is trial 18 with value: 0.9866666666666667.
[I 2024-09-02 22:48:18,015] Trial 975 finished with value: 0.9466666666666667 and parameters: {'classifier': 'DecisionTree', 'dt_max_depth': 30, 'dt_min_samples_split': 20, 'dt_min_samples_leaf': 6, 'dt_max_features': 'log2'}. Best is trial 18 with value: 0.9866666666666667.
[I 2024-09-02 22:48:19,915] Trial 976 finished with value: 0.98 and parameters: {'classifier': 'NeuralNetwork', 'nn_alpha': 0.07242269458281271, 'hidden_layer_sizes': 256, 'activation': 'tanh', 'solver': 'sgd'}. Best is trial 18 with value: 0.9866666666666667.
[I 2024-09-02 22:48:20,709] Trial 977 finished with value: 0.98 and parameters: {'classifier': 'NeuralNetwork', 'nn_alpha': 0.028760930919690775, 'hidden_layer_sizes': 256, 'activation': 'tanh', 'solver': 'adam'}. Best is trial 18 with value: 0.9866666666666667.
[I 2024-09-02 22:48:21,997] Trial 978 finished with value: 0.9866666666666667 and parameters: {'classifier': 'NeuralNetwork', 'nn_alpha': 0.052804667700463, 'hidden_layer_sizes': 128, 'activation': 'tanh', 'solver': 'sgd'}. Best is trial 18 with value: 0.9866666666666667.
[I 2024-09-02 22:48:22,153] Trial 979 finished with value: 0.96 and parameters: {'classifier': 'XGBoost', 'xgb_eta': 0.16195347333403584, 'xgb_max_depth': 4, 'xgb_min_child_weight': 0.23971188698310994, 'xgb_subsample': 0.5470506994327232, 'xgb_colsample_bytree': 0.810568862748898}. Best is trial 18 with value: 0.9866666666666667.
[I 2024-09-02 22:48:22,663] Trial 980 finished with value: 0.9733333333333333 and parameters: {'classifier': 'NeuralNetwork', 'nn_alpha': 0.03610829854617717, 'hidden_layer_sizes': 256, 'activation': 'relu', 'solver': 'lbfgs'}. Best is trial 18 with value: 0.9866666666666667.
[I 2024-09-02 22:48:24,511] Trial 981 finished with value: 0.9866666666666667 and parameters: {'classifier': 'NeuralNetwork', 'nn_alpha': 0.06239136966161038, 'hidden_layer_sizes': 256, 'activation': 'tanh', 'solver': 'sgd'}. Best is trial 18 with value: 0.9866666666666667.
[I 2024-09-02 22:48:25,643] Trial 982 finished with value: 0.9866666666666667 and parameters: {'classifier': 'NeuralNetwork', 'nn_alpha': 0.015016500792884076, 'hidden_layer_sizes': 64, 'activation': 'tanh', 'solver': 'sgd'}. Best is trial 18 with value: 0.9866666666666667.
[I 2024-09-02 22:48:27,530] Trial 983 finished with value: 0.98 and parameters: {'classifier': 'NeuralNetwork', 'nn_alpha': 0.08144558531463794, 'hidden_layer_sizes': 256, 'activation': 'tanh', 'solver': 'sgd'}. Best is trial 18 with value: 0.9866666666666667.
[I 2024-09-02 22:48:27,551] Trial 984 finished with value: 0.32 and parameters: {'classifier': 'SVC', 'svc_c': 8.031396866475945e-06, 'gamma': 'scale', 'kernel': 'rbf'}. Best is trial 18 with value: 0.9866666666666667.
[I 2024-09-02 22:48:35,901] Trial 985 finished with value: 0.96 and parameters: {'classifier': 'NeuralNetwork', 'nn_alpha': 0.04435313710844196, 'hidden_layer_sizes': 256, 'activation': 'logistic', 'solver': 'sgd'}. Best is trial 18 with value: 0.9866666666666667.
[I 2024-09-02 22:48:37,729] Trial 986 finished with value: 0.98 and parameters: {'classifier': 'NeuralNetwork', 'nn_alpha': 0.02281978592648929, 'hidden_layer_sizes': 256, 'activation': 'tanh', 'solver': 'sgd'}. Best is trial 18 with value: 0.9866666666666667.
[I 2024-09-02 22:48:39,552] Trial 987 finished with value: 0.9866666666666667 and parameters: {'classifier': 'NeuralNetwork', 'nn_alpha': 0.0392054458340213, 'hidden_layer_sizes': 256, 'activation': 'tanh', 'solver': 'sgd'}. Best is trial 18 with value: 0.9866666666666667.
[I 2024-09-02 22:48:41,399] Trial 988 finished with value: 0.9866666666666667 and parameters: {'classifier': 'NeuralNetwork', 'nn_alpha': 0.00021737846226242005, 'hidden_layer_sizes': 256, 'activation': 'tanh', 'solver': 'sgd'}. Best is trial 18 with value: 0.9866666666666667.
[I 2024-09-02 22:48:43,207] Trial 989 finished with value: 0.9866666666666667 and parameters: {'classifier': 'NeuralNetwork', 'nn_alpha': 0.09986011113809232, 'hidden_layer_sizes': 256, 'activation': 'tanh', 'solver': 'sgd'}. Best is trial 18 with value: 0.9866666666666667.
[I 2024-09-02 22:48:45,052] Trial 990 finished with value: 0.9866666666666667 and parameters: {'classifier': 'NeuralNetwork', 'nn_alpha': 0.050126503106823914, 'hidden_layer_sizes': 256, 'activation': 'tanh', 'solver': 'sgd'}. Best is trial 18 with value: 0.9866666666666667.
[I 2024-09-02 22:48:48,090] Trial 991 finished with value: 0.9866666666666667 and parameters: {'classifier': 'NeuralNetwork', 'nn_alpha': 0.06799801213477889, 'hidden_layer_sizes': 512, 'activation': 'tanh', 'solver': 'sgd'}. Best is trial 18 with value: 0.9866666666666667.
[I 2024-09-02 22:48:48,341] Trial 992 finished with value: 0.9533333333333333 and parameters: {'classifier': 'RandomForest', 'rf_max_depth': 3, 'rf_min_samples_split': 4, 'rf_min_samples_leaf': 2, 'rf_max_features': 'sqrt'}. Best is trial 18 with value: 0.9866666666666667.
[I 2024-09-02 22:48:49,151] Trial 993 finished with value: 0.98 and parameters: {'classifier': 'NeuralNetwork', 'nn_alpha': 0.02924922630044201, 'hidden_layer_sizes': 256, 'activation': 'tanh', 'solver': 'adam'}. Best is trial 18 with value: 0.9866666666666667.
[I 2024-09-02 22:48:50,930] Trial 994 finished with value: 0.9866666666666667 and parameters: {'classifier': 'NeuralNetwork', 'nn_alpha': 0.05726119521948463, 'hidden_layer_sizes': 256, 'activation': 'tanh', 'solver': 'sgd'}. Best is trial 18 with value: 0.9866666666666667.
[I 2024-09-02 22:48:52,223] Trial 995 finished with value: 0.98 and parameters: {'classifier': 'NeuralNetwork', 'nn_alpha': 0.0831823337965662, 'hidden_layer_sizes': 128, 'activation': 'tanh', 'solver': 'sgd'}. Best is trial 18 with value: 0.9866666666666667.
[I 2024-09-02 22:48:54,089] Trial 996 finished with value: 0.9866666666666667 and parameters: {'classifier': 'NeuralNetwork', 'nn_alpha': 0.03842590659917104, 'hidden_layer_sizes': 256, 'activation': 'tanh', 'solver': 'sgd'}. Best is trial 18 with value: 0.9866666666666667.
[I 2024-09-02 22:48:55,965] Trial 997 finished with value: 0.9866666666666667 and parameters: {'classifier': 'NeuralNetwork', 'nn_alpha': 0.025530495195538957, 'hidden_layer_sizes': 256, 'activation': 'tanh', 'solver': 'sgd'}. Best is trial 18 with value: 0.9866666666666667.
[I 2024-09-02 22:48:59,120] Trial 998 finished with value: 0.9733333333333333 and parameters: {'classifier': 'NeuralNetwork', 'nn_alpha': 0.04922997892386627, 'hidden_layer_sizes': 64, 'activation': 'logistic', 'solver': 'sgd'}. Best is trial 18 with value: 0.9866666666666667.
[I 2024-09-02 22:48:59,148] Trial 999 finished with value: 0.9466666666666667 and parameters: {'classifier': 'DecisionTree', 'dt_max_depth': 19, 'dt_min_samples_split': 11, 'dt_min_samples_leaf': 5, 'dt_max_features': 'sqrt'}. Best is trial 18 with value: 0.9866666666666667.
FrozenTrial(number=18, state=1, values=[0.9866666666666667], datetime_start=datetime.datetime(2024, 9, 2, 22, 18, 32, 843733), datetime_complete=datetime.datetime(2024, 9, 2, 22, 18, 35, 21887), params={'classifier': 'NeuralNetwork', 'nn_alpha': 0.09430997871171372, 'hidden_layer_sizes': 256, 'activation': 'logistic', 'solver': 'adam'}, user_attrs={}, system_attrs={}, intermediate_values={}, distributions={'classifier': CategoricalDistribution(choices=('SVC', 'RandomForest', 'NeuralNetwork', 'XGBoost', 'DecisionTree')), 'nn_alpha': FloatDistribution(high=0.1, log=True, low=1e-05, step=None), 'hidden_layer_sizes': CategoricalDistribution(choices=(64, 128, 256, 512)), 'activation': CategoricalDistribution(choices=('relu', 'tanh', 'logistic')), 'solver': CategoricalDistribution(choices=('sgd', 'adam', 'lbfgs'))}, trial_id=18, value=None)