[I 2024-09-02 22:40:10,907] Trial 723 finished with value: 0.9866666666666667 and parameters: {'classifier': 'NeuralNetwork', 'nn_alpha': 0.011196047287964748, 'hidden_layer_sizes': 256, 'activation': 'tanh', 'solver': 'sgd'}. Best is trial 18 with value: 0.9866666666666667.
[I 2024-09-02 22:40:10,926] Trial 724 finished with value: 0.9666666666666667 and parameters: {'classifier': 'SVC', 'svc_c': 446.6232204888464, 'gamma': 'scale', 'kernel': 'poly'}. Best is trial 18 with value: 0.9866666666666667.
[I 2024-09-02 22:40:12,823] Trial 725 finished with value: 0.98 and parameters: {'classifier': 'NeuralNetwork', 'nn_alpha': 0.03708462911678917, 'hidden_layer_sizes': 256, 'activation': 'tanh', 'solver': 'sgd'}. Best is trial 18 with value: 0.9866666666666667.
[I 2024-09-02 22:40:14,156] Trial 726 finished with value: 0.9866666666666667 and parameters: {'classifier': 'NeuralNetwork', 'nn_alpha': 0.0586338248086438, 'hidden_layer_sizes': 128, 'activation': 'tanh', 'solver': 'sgd'}. Best is trial 18 with value: 0.9866666666666667.
[I 2024-09-02 22:40:14,912] Trial 727 finished with value: 0.98 and parameters: {'classifier': 'NeuralNetwork', 'nn_alpha': 0.09032725544849977, 'hidden_layer_sizes': 256, 'activation': 'tanh', 'solver': 'adam'}. Best is trial 18 with value: 0.9866666666666667.
[I 2024-09-02 22:40:16,810] Trial 728 finished with value: 0.9866666666666667 and parameters: {'classifier': 'NeuralNetwork', 'nn_alpha': 0.00034014042914539365, 'hidden_layer_sizes': 256, 'activation': 'tanh', 'solver': 'sgd'}. Best is trial 18 with value: 0.9866666666666667.
[I 2024-09-02 22:40:18,725] Trial 729 finished with value: 0.98 and parameters: {'classifier': 'NeuralNetwork', 'nn_alpha': 0.09980303981356979, 'hidden_layer_sizes': 256, 'activation': 'tanh', 'solver': 'sgd'}. Best is trial 18 with value: 0.9866666666666667.
[I 2024-09-02 22:40:19,805] Trial 730 finished with value: 0.9866666666666667 and parameters: {'classifier': 'NeuralNetwork', 'nn_alpha': 0.01953277415666514, 'hidden_layer_sizes': 64, 'activation': 'tanh', 'solver': 'sgd'}. Best is trial 18 with value: 0.9866666666666667.
[I 2024-09-02 22:40:21,734] Trial 731 finished with value: 0.9866666666666667 and parameters: {'classifier': 'NeuralNetwork', 'nn_alpha': 4.808835912564342e-05, 'hidden_layer_sizes': 256, 'activation': 'tanh', 'solver': 'sgd'}. Best is trial 18 with value: 0.9866666666666667.
[I 2024-09-02 22:40:21,998] Trial 732 finished with value: 0.96 and parameters: {'classifier': 'RandomForest', 'rf_max_depth': 22, 'rf_min_samples_split': 4, 'rf_min_samples_leaf': 6, 'rf_max_features': 'log2'}. Best is trial 18 with value: 0.9866666666666667.
[I 2024-09-02 22:40:28,073] Trial 733 finished with value: 0.7533333333333333 and parameters: {'classifier': 'NeuralNetwork', 'nn_alpha': 0.02510198358274347, 'hidden_layer_sizes': 256, 'activation': 'logistic', 'solver': 'sgd'}. Best is trial 18 with value: 0.9866666666666667.
[I 2024-09-02 22:40:29,945] Trial 734 finished with value: 0.9866666666666667 and parameters: {'classifier': 'NeuralNetwork', 'nn_alpha': 0.0013079211384963633, 'hidden_layer_sizes': 256, 'activation': 'tanh', 'solver': 'sgd'}. Best is trial 18 with value: 0.9866666666666667.
[I 2024-09-02 22:40:31,793] Trial 735 finished with value: 0.9866666666666667 and parameters: {'classifier': 'NeuralNetwork', 'nn_alpha': 0.05040863447988531, 'hidden_layer_sizes': 256, 'activation': 'tanh', 'solver': 'sgd'}. Best is trial 18 with value: 0.9866666666666667.
[I 2024-09-02 22:40:35,072] Trial 736 finished with value: 0.9866666666666667 and parameters: {'classifier': 'NeuralNetwork', 'nn_alpha': 0.03252192805673277, 'hidden_layer_sizes': 512, 'activation': 'tanh', 'solver': 'sgd'}. Best is trial 18 with value: 0.9866666666666667.
[I 2024-09-02 22:40:36,949] Trial 737 finished with value: 0.9866666666666667 and parameters: {'classifier': 'NeuralNetwork', 'nn_alpha': 1.650444355448138e-05, 'hidden_layer_sizes': 256, 'activation': 'tanh', 'solver': 'sgd'}. Best is trial 18 with value: 0.9866666666666667.
[I 2024-09-02 22:40:38,756] Trial 738 finished with value: 0.9866666666666667 and parameters: {'classifier': 'NeuralNetwork', 'nn_alpha': 0.040741522277163406, 'hidden_layer_sizes': 256, 'activation': 'tanh', 'solver': 'sgd'}. Best is trial 18 with value: 0.9866666666666667.
[I 2024-09-02 22:40:38,780] Trial 739 finished with value: 0.9333333333333332 and parameters: {'classifier': 'DecisionTree', 'dt_max_depth': 28, 'dt_min_samples_split': 3, 'dt_min_samples_leaf': 7, 'dt_max_features': 'log2'}. Best is trial 18 with value: 0.9866666666666667.
[I 2024-09-02 22:40:40,603] Trial 740 finished with value: 0.9866666666666667 and parameters: {'classifier': 'NeuralNetwork', 'nn_alpha': 0.07421510986903415, 'hidden_layer_sizes': 256, 'activation': 'tanh', 'solver': 'sgd'}. Best is trial 18 with value: 0.9866666666666667.
[I 2024-09-02 22:40:41,244] Trial 741 finished with value: 0.98 and parameters: {'classifier': 'NeuralNetwork', 'nn_alpha': 0.000592548222074624, 'hidden_layer_sizes': 128, 'activation': 'tanh', 'solver': 'adam'}. Best is trial 18 with value: 0.9866666666666667.
[I 2024-09-02 22:40:43,091] Trial 742 finished with value: 0.9866666666666667 and parameters: {'classifier': 'NeuralNetwork', 'nn_alpha': 0.06014553403777654, 'hidden_layer_sizes': 256, 'activation': 'tanh', 'solver': 'sgd'}. Best is trial 18 with value: 0.9866666666666667.
[I 2024-09-02 22:40:44,935] Trial 743 finished with value: 0.9866666666666667 and parameters: {'classifier': 'NeuralNetwork', 'nn_alpha': 0.08156727174271611, 'hidden_layer_sizes': 256, 'activation': 'tanh', 'solver': 'sgd'}. Best is trial 18 with value: 0.9866666666666667.
[I 2024-09-02 22:40:46,778] Trial 744 finished with value: 0.9866666666666667 and parameters: {'classifier': 'NeuralNetwork', 'nn_alpha': 0.04862638420007176, 'hidden_layer_sizes': 256, 'activation': 'tanh', 'solver': 'sgd'}. Best is trial 18 with value: 0.9866666666666667.
[I 2024-09-02 22:40:47,002] Trial 745 finished with value: 0.9666666666666667 and parameters: {'classifier': 'XGBoost', 'xgb_eta': 0.01216256886661271, 'xgb_max_depth': 6, 'xgb_min_child_weight': 4.851719153275346e-05, 'xgb_subsample': 0.5864657101306141, 'xgb_colsample_bytree': 0.7438350890814424}. Best is trial 18 with value: 0.9866666666666667.
[I 2024-09-02 22:40:47,296] Trial 746 finished with value: 0.9733333333333333 and parameters: {'classifier': 'NeuralNetwork', 'nn_alpha': 0.029710220241097138, 'hidden_layer_sizes': 64, 'activation': 'relu', 'solver': 'lbfgs'}. Best is trial 18 with value: 0.9866666666666667.
[I 2024-09-02 22:40:49,167] Trial 747 finished with value: 0.98 and parameters: {'classifier': 'NeuralNetwork', 'nn_alpha': 0.06527063763437155, 'hidden_layer_sizes': 256, 'activation': 'tanh', 'solver': 'sgd'}. Best is trial 18 with value: 0.9866666666666667.
[I 2024-09-02 22:40:57,842] Trial 748 finished with value: 0.96 and parameters: {'classifier': 'NeuralNetwork', 'nn_alpha': 0.039204809506894915, 'hidden_layer_sizes': 256, 'activation': 'logistic', 'solver': 'sgd'}. Best is trial 18 with value: 0.9866666666666667.
[I 2024-09-02 22:40:59,633] Trial 749 finished with value: 0.98 and parameters: {'classifier': 'NeuralNetwork', 'nn_alpha': 0.00024176537749530806, 'hidden_layer_sizes': 256, 'activation': 'tanh', 'solver': 'sgd'}. Best is trial 18 with value: 0.9866666666666667.
[I 2024-09-02 22:41:01,464] Trial 750 finished with value: 0.9866666666666667 and parameters: {'classifier': 'NeuralNetwork', 'nn_alpha': 0.016904643246312846, 'hidden_layer_sizes': 256, 'activation': 'tanh', 'solver': 'sgd'}. Best is trial 18 with value: 0.9866666666666667.
[I 2024-09-02 22:41:01,484] Trial 751 finished with value: 0.32 and parameters: {'classifier': 'SVC', 'svc_c': 5.588192799034678e-07, 'gamma': 'auto', 'kernel': 'rbf'}. Best is trial 18 with value: 0.9866666666666667.
[I 2024-09-02 22:41:03,391] Trial 752 finished with value: 0.98 and parameters: {'classifier': 'NeuralNetwork', 'nn_alpha': 0.05283151446725807, 'hidden_layer_sizes': 256, 'activation': 'tanh', 'solver': 'sgd'}. Best is trial 18 with value: 0.9866666666666667.
[I 2024-09-02 22:41:05,242] Trial 753 finished with value: 0.9866666666666667 and parameters: {'classifier': 'NeuralNetwork', 'nn_alpha': 0.034509410877887496, 'hidden_layer_sizes': 256, 'activation': 'tanh', 'solver': 'sgd'}. Best is trial 18 with value: 0.9866666666666667.
[I 2024-09-02 22:41:07,024] Trial 754 finished with value: 0.9866666666666667 and parameters: {'classifier': 'NeuralNetwork', 'nn_alpha': 0.07310327721893742, 'hidden_layer_sizes': 256, 'activation': 'tanh', 'solver': 'sgd'}. Best is trial 18 with value: 0.9866666666666667.
[I 2024-09-02 22:41:08,864] Trial 755 finished with value: 0.9866666666666667 and parameters: {'classifier': 'NeuralNetwork', 'nn_alpha': 0.022683666162419146, 'hidden_layer_sizes': 256, 'activation': 'tanh', 'solver': 'sgd'}. Best is trial 18 with value: 0.9866666666666667.
[I 2024-09-02 22:41:09,464] Trial 756 finished with value: 0.9733333333333333 and parameters: {'classifier': 'NeuralNetwork', 'nn_alpha': 0.0440252797643329, 'hidden_layer_sizes': 128, 'activation': 'tanh', 'solver': 'adam'}. Best is trial 18 with value: 0.9866666666666667.
[I 2024-09-02 22:41:09,724] Trial 757 finished with value: 0.9533333333333333 and parameters: {'classifier': 'RandomForest', 'rf_max_depth': 3, 'rf_min_samples_split': 7, 'rf_min_samples_leaf': 1, 'rf_max_features': 'sqrt'}. Best is trial 18 with value: 0.9866666666666667.
[I 2024-09-02 22:41:11,573] Trial 758 finished with value: 0.98 and parameters: {'classifier': 'NeuralNetwork', 'nn_alpha': 0.06157998646708489, 'hidden_layer_sizes': 256, 'activation': 'tanh', 'solver': 'sgd'}. Best is trial 18 with value: 0.9866666666666667.
[I 2024-09-02 22:41:13,493] Trial 759 finished with value: 0.98 and parameters: {'classifier': 'NeuralNetwork', 'nn_alpha': 0.08431957637631188, 'hidden_layer_sizes': 256, 'activation': 'tanh', 'solver': 'sgd'}. Best is trial 18 with value: 0.9866666666666667.
[I 2024-09-02 22:41:15,370] Trial 760 finished with value: 0.9866666666666667 and parameters: {'classifier': 'NeuralNetwork', 'nn_alpha': 0.02712567551271547, 'hidden_layer_sizes': 256, 'activation': 'tanh', 'solver': 'sgd'}. Best is trial 18 with value: 0.9866666666666667.
[I 2024-09-02 22:41:16,437] Trial 761 finished with value: 0.98 and parameters: {'classifier': 'NeuralNetwork', 'nn_alpha': 0.05253350328531464, 'hidden_layer_sizes': 64, 'activation': 'tanh', 'solver': 'sgd'}. Best is trial 18 with value: 0.9866666666666667.
[I 2024-09-02 22:41:24,835] Trial 762 finished with value: 0.96 and parameters: {'classifier': 'NeuralNetwork', 'nn_alpha': 0.03978875658472773, 'hidden_layer_sizes': 256, 'activation': 'logistic', 'solver': 'sgd'}. Best is trial 18 with value: 0.9866666666666667.
[I 2024-09-02 22:41:26,680] Trial 763 finished with value: 0.9866666666666667 and parameters: {'classifier': 'NeuralNetwork', 'nn_alpha': 0.00041074757057684336, 'hidden_layer_sizes': 256, 'activation': 'tanh', 'solver': 'sgd'}. Best is trial 18 with value: 0.9866666666666667.
[I 2024-09-02 22:41:28,507] Trial 764 finished with value: 0.9866666666666667 and parameters: {'classifier': 'NeuralNetwork', 'nn_alpha': 0.09877988810673484, 'hidden_layer_sizes': 256, 'activation': 'tanh', 'solver': 'sgd'}. Best is trial 18 with value: 0.9866666666666667.
[I 2024-09-02 22:41:28,535] Trial 765 finished with value: 0.9333333333333332 and parameters: {'classifier': 'DecisionTree', 'dt_max_depth': 3, 'dt_min_samples_split': 19, 'dt_min_samples_leaf': 8, 'dt_max_features': 'sqrt'}. Best is trial 18 with value: 0.9866666666666667.
[I 2024-09-02 22:41:30,445] Trial 766 finished with value: 0.9866666666666667 and parameters: {'classifier': 'NeuralNetwork', 'nn_alpha': 0.03258917949321912, 'hidden_layer_sizes': 256, 'activation': 'tanh', 'solver': 'sgd'}. Best is trial 18 with value: 0.9866666666666667.
[I 2024-09-02 22:41:33,742] Trial 767 finished with value: 0.9866666666666667 and parameters: {'classifier': 'NeuralNetwork', 'nn_alpha': 0.06843418841566934, 'hidden_layer_sizes': 512, 'activation': 'tanh', 'solver': 'sgd'}. Best is trial 18 with value: 0.9866666666666667.
[I 2024-09-02 22:41:35,683] Trial 768 finished with value: 0.9866666666666667 and parameters: {'classifier': 'NeuralNetwork', 'nn_alpha': 0.04775794721462976, 'hidden_layer_sizes': 256, 'activation': 'tanh', 'solver': 'sgd'}. Best is trial 18 with value: 0.9866666666666667.
[I 2024-09-02 22:41:37,587] Trial 769 finished with value: 0.9866666666666667 and parameters: {'classifier': 'NeuralNetwork', 'nn_alpha': 0.0597294760141337, 'hidden_layer_sizes': 256, 'activation': 'tanh', 'solver': 'sgd'}. Best is trial 18 with value: 0.9866666666666667.
[I 2024-09-02 22:41:39,460] Trial 770 finished with value: 0.9866666666666667 and parameters: {'classifier': 'NeuralNetwork', 'nn_alpha': 0.014124649272808659, 'hidden_layer_sizes': 256, 'activation': 'tanh', 'solver': 'sgd'}. Best is trial 18 with value: 0.9866666666666667.
[I 2024-09-02 22:41:39,624] Trial 771 finished with value: 0.96 and parameters: {'classifier': 'XGBoost', 'xgb_eta': 0.08394905380493457, 'xgb_max_depth': 9, 'xgb_min_child_weight': 0.7758502962938005, 'xgb_subsample': 0.5022029598792769, 'xgb_colsample_bytree': 0.8223443703394219}. Best is trial 18 with value: 0.9866666666666667.
[I 2024-09-02 22:41:40,388] Trial 772 finished with value: 0.98 and parameters: {'classifier': 'NeuralNetwork', 'nn_alpha': 0.0863572249295013, 'hidden_layer_sizes': 256, 'activation': 'relu', 'solver': 'lbfgs'}. Best is trial 18 with value: 0.9866666666666667.
[I 2024-09-02 22:41:41,708] Trial 773 finished with value: 0.9866666666666667 and parameters: {'classifier': 'NeuralNetwork', 'nn_alpha': 0.020640404606832703, 'hidden_layer_sizes': 128, 'activation': 'tanh', 'solver': 'sgd'}. Best is trial 18 with value: 0.9866666666666667.
[I 2024-09-02 22:41:42,434] Trial 774 finished with value: 0.98 and parameters: {'classifier': 'NeuralNetwork', 'nn_alpha': 0.04203833217163941, 'hidden_layer_sizes': 256, 'activation': 'tanh', 'solver': 'adam'}. Best is trial 18 with value: 0.9866666666666667.
[I 2024-09-02 22:41:44,341] Trial 775 finished with value: 0.9866666666666667 and parameters: {'classifier': 'NeuralNetwork', 'nn_alpha': 0.026705572378807236, 'hidden_layer_sizes': 256, 'activation': 'tanh', 'solver': 'sgd'}. Best is trial 18 with value: 0.9866666666666667.
[I 2024-09-02 22:41:44,569] Trial 776 finished with value: 0.96 and parameters: {'classifier': 'SVC', 'svc_c': 1335028.2636225352, 'gamma': 'scale', 'kernel': 'linear'}. Best is trial 18 with value: 0.9866666666666667.
[I 2024-09-02 22:41:46,465] Trial 777 finished with value: 0.98 and parameters: {'classifier': 'NeuralNetwork', 'nn_alpha': 0.03519956417447055, 'hidden_layer_sizes': 256, 'activation': 'tanh', 'solver': 'sgd'}. Best is trial 18 with value: 0.9866666666666667.
[I 2024-09-02 22:41:49,662] Trial 778 finished with value: 0.9733333333333333 and parameters: {'classifier': 'NeuralNetwork', 'nn_alpha': 0.05541189298600277, 'hidden_layer_sizes': 64, 'activation': 'logistic', 'solver': 'sgd'}. Best is trial 18 with value: 0.9866666666666667.
[I 2024-09-02 22:41:51,585] Trial 779 finished with value: 0.9866666666666667 and parameters: {'classifier': 'NeuralNetwork', 'nn_alpha': 0.07064958574746551, 'hidden_layer_sizes': 256, 'activation': 'tanh', 'solver': 'sgd'}. Best is trial 18 with value: 0.9866666666666667.
[I 2024-09-02 22:41:53,497] Trial 780 finished with value: 0.9866666666666667 and parameters: {'classifier': 'NeuralNetwork', 'nn_alpha': 0.04610279605047926, 'hidden_layer_sizes': 256, 'activation': 'tanh', 'solver': 'sgd'}. Best is trial 18 with value: 0.9866666666666667.
[I 2024-09-02 22:41:55,470] Trial 781 finished with value: 0.9866666666666667 and parameters: {'classifier': 'NeuralNetwork', 'nn_alpha': 2.9714138510819422e-05, 'hidden_layer_sizes': 256, 'activation': 'tanh', 'solver': 'sgd'}. Best is trial 18 with value: 0.9866666666666667.
[I 2024-09-02 22:41:57,349] Trial 782 finished with value: 0.98 and parameters: {'classifier': 'NeuralNetwork', 'nn_alpha': 0.07685025904035876, 'hidden_layer_sizes': 256, 'activation': 'tanh', 'solver': 'sgd'}. Best is trial 18 with value: 0.9866666666666667.
[I 2024-09-02 22:41:57,605] Trial 783 finished with value: 0.9533333333333333 and parameters: {'classifier': 'RandomForest', 'rf_max_depth': 15, 'rf_min_samples_split': 10, 'rf_min_samples_leaf': 4, 'rf_max_features': 'sqrt'}. Best is trial 18 with value: 0.9866666666666667.
[I 2024-09-02 22:41:59,458] Trial 784 finished with value: 0.9866666666666667 and parameters: {'classifier': 'NeuralNetwork', 'nn_alpha': 0.030468400847799962, 'hidden_layer_sizes': 256, 'activation': 'tanh', 'solver': 'sgd'}. Best is trial 18 with value: 0.9866666666666667.
[I 2024-09-02 22:42:01,381] Trial 785 finished with value: 0.9866666666666667 and parameters: {'classifier': 'NeuralNetwork', 'nn_alpha': 0.05860938458018294, 'hidden_layer_sizes': 256, 'activation': 'tanh', 'solver': 'sgd'}. Best is trial 18 with value: 0.9866666666666667.
[I 2024-09-02 22:42:02,109] Trial 786 finished with value: 0.98 and parameters: {'classifier': 'NeuralNetwork', 'nn_alpha': 0.0380293221560034, 'hidden_layer_sizes': 256, 'activation': 'tanh', 'solver': 'adam'}. Best is trial 18 with value: 0.9866666666666667.
[I 2024-09-02 22:42:03,993] Trial 787 finished with value: 0.9866666666666667 and parameters: {'classifier': 'NeuralNetwork', 'nn_alpha': 0.0018443212910314603, 'hidden_layer_sizes': 256, 'activation': 'tanh', 'solver': 'sgd'}. Best is trial 18 with value: 0.9866666666666667.
[I 2024-09-02 22:42:05,296] Trial 788 finished with value: 0.9866666666666667 and parameters: {'classifier': 'NeuralNetwork', 'nn_alpha': 0.049103490014958465, 'hidden_layer_sizes': 128, 'activation': 'tanh', 'solver': 'sgd'}. Best is trial 18 with value: 0.9866666666666667.
[I 2024-09-02 22:42:07,218] Trial 789 finished with value: 0.98 and parameters: {'classifier': 'NeuralNetwork', 'nn_alpha': 0.07819537427078724, 'hidden_layer_sizes': 256, 'activation': 'tanh', 'solver': 'sgd'}. Best is trial 18 with value: 0.9866666666666667.
[I 2024-09-02 22:42:09,130] Trial 790 finished with value: 0.9866666666666667 and parameters: {'classifier': 'NeuralNetwork', 'nn_alpha': 0.02464536238468643, 'hidden_layer_sizes': 256, 'activation': 'tanh', 'solver': 'sgd'}. Best is trial 18 with value: 0.9866666666666667.
[I 2024-09-02 22:42:09,154] Trial 791 finished with value: 0.94 and parameters: {'classifier': 'DecisionTree', 'dt_max_depth': 10, 'dt_min_samples_split': 8, 'dt_min_samples_leaf': 5, 'dt_max_features': 'log2'}. Best is trial 18 with value: 0.9866666666666667.
[I 2024-09-02 22:42:25,022] Trial 792 finished with value: 0.96 and parameters: {'classifier': 'NeuralNetwork', 'nn_alpha': 0.003062700820551106, 'hidden_layer_sizes': 512, 'activation': 'logistic', 'solver': 'sgd'}. Best is trial 18 with value: 0.9866666666666667.
[I 2024-09-02 22:42:26,081] Trial 793 finished with value: 0.9733333333333333 and parameters: {'classifier': 'NeuralNetwork', 'nn_alpha': 0.08562337498259738, 'hidden_layer_sizes': 64, 'activation': 'tanh', 'solver': 'sgd'}. Best is trial 18 with value: 0.9866666666666667.
[I 2024-09-02 22:42:27,928] Trial 794 finished with value: 0.9866666666666667 and parameters: {'classifier': 'NeuralNetwork', 'nn_alpha': 0.06449504056946957, 'hidden_layer_sizes': 256, 'activation': 'tanh', 'solver': 'sgd'}. Best is trial 18 with value: 0.9866666666666667.
[I 2024-09-02 22:42:29,767] Trial 795 finished with value: 0.9866666666666667 and parameters: {'classifier': 'NeuralNetwork', 'nn_alpha': 0.04182343061297678, 'hidden_layer_sizes': 256, 'activation': 'tanh', 'solver': 'sgd'}. Best is trial 18 with value: 0.9866666666666667.
[I 2024-09-02 22:42:32,209] Trial 796 finished with value: 0.9666666666666667 and parameters: {'classifier': 'NeuralNetwork', 'nn_alpha': 0.03167931153708924, 'hidden_layer_sizes': 256, 'activation': 'tanh', 'solver': 'lbfgs'}. Best is trial 18 with value: 0.9866666666666667.
[I 2024-09-02 22:42:33,528] Trial 797 finished with value: 0.98 and parameters: {'classifier': 'NeuralNetwork', 'nn_alpha': 0.008226070753272407, 'hidden_layer_sizes': 256, 'activation': 'relu', 'solver': 'sgd'}. Best is trial 18 with value: 0.9866666666666667.
[I 2024-09-02 22:42:33,716] Trial 798 finished with value: 0.96 and parameters: {'classifier': 'XGBoost', 'xgb_eta': 0.060184217094704145, 'xgb_max_depth': 5, 'xgb_min_child_weight': 0.14373888405601934, 'xgb_subsample': 0.7910048565312271, 'xgb_colsample_bytree': 0.500075720922603}. Best is trial 18 with value: 0.9866666666666667.
[I 2024-09-02 22:42:35,527] Trial 799 finished with value: 0.9866666666666667 and parameters: {'classifier': 'NeuralNetwork', 'nn_alpha': 0.017125317803359803, 'hidden_layer_sizes': 256, 'activation': 'tanh', 'solver': 'sgd'}. Best is trial 18 with value: 0.9866666666666667.
[I 2024-09-02 22:42:37,365] Trial 800 finished with value: 0.98 and parameters: {'classifier': 'NeuralNetwork', 'nn_alpha': 0.0546766378749858, 'hidden_layer_sizes': 256, 'activation': 'tanh', 'solver': 'sgd'}. Best is trial 18 with value: 0.9866666666666667.
[I 2024-09-02 22:42:39,192] Trial 801 finished with value: 0.98 and parameters: {'classifier': 'NeuralNetwork', 'nn_alpha': 0.036807416715541, 'hidden_layer_sizes': 256, 'activation': 'tanh', 'solver': 'sgd'}. Best is trial 18 with value: 0.9866666666666667.
[I 2024-09-02 22:42:39,978] Trial 802 finished with value: 0.98 and parameters: {'classifier': 'NeuralNetwork', 'nn_alpha': 0.0025279823422850855, 'hidden_layer_sizes': 256, 'activation': 'tanh', 'solver': 'adam'}. Best is trial 18 with value: 0.9866666666666667.
