[I 2024-09-02 22:18:16,174] A new study created in memory with name: no-name-b6fec63d-f84e-4115-8542-8e1b12eccfac
[I 2024-09-02 22:18:16,419] Trial 0 finished with value: 0.96 and parameters: {'classifier': 'SVC', 'svc_c': 321056267.4733013, 'gamma': 'auto', 'kernel': 'linear'}. Best is trial 0 with value: 0.96.
[I 2024-09-02 22:18:16,430] Trial 1 finished with value: 0.9533333333333333 and parameters: {'classifier': 'DecisionTree', 'dt_max_depth': 13, 'dt_min_samples_split': 11, 'dt_min_samples_leaf': 2, 'dt_max_features': 'log2'}. Best is trial 0 with value: 0.96.
[I 2024-09-02 22:18:16,444] Trial 2 finished with value: 0.9533333333333333 and parameters: {'classifier': 'SVC', 'svc_c': 1769.446917591619, 'gamma': 'scale', 'kernel': 'poly'}. Best is trial 0 with value: 0.96.
[I 2024-09-02 22:18:16,450] Trial 3 finished with value: 0.9199999999999999 and parameters: {'classifier': 'DecisionTree', 'dt_max_depth': 2, 'dt_min_samples_split': 2, 'dt_min_samples_leaf': 8, 'dt_max_features': 'sqrt'}. Best is trial 0 with value: 0.96.
[I 2024-09-02 22:18:16,694] Trial 4 finished with value: 0.9533333333333333 and parameters: {'classifier': 'RandomForest', 'rf_max_depth': 32, 'rf_min_samples_split': 20, 'rf_min_samples_leaf': 7, 'rf_max_features': 'log2'}. Best is trial 0 with value: 0.96.
[I 2024-09-02 22:18:16,786] Trial 5 finished with value: 0.96 and parameters: {'classifier': 'SVC', 'svc_c': 537972.4531094676, 'gamma': 'auto', 'kernel': 'linear'}. Best is trial 0 with value: 0.96.
[I 2024-09-02 22:18:17,138] Trial 6 finished with value: 0.9533333333333333 and parameters: {'classifier': 'XGBoost', 'xgb_eta': 0.28438119304156106, 'xgb_max_depth': 3, 'xgb_min_child_weight': 0.00015631446945919494, 'xgb_subsample': 0.916325095003931, 'xgb_colsample_bytree': 0.6418295708310102}. Best is trial 0 with value: 0.96.
[I 2024-09-02 22:18:17,221] Trial 7 finished with value: 0.3333333333333333 and parameters: {'classifier': 'XGBoost', 'xgb_eta': 0.027150849684714377, 'xgb_max_depth': 6, 'xgb_min_child_weight': 14.535386297373655, 'xgb_subsample': 0.5140083383164704, 'xgb_colsample_bytree': 0.7484471745556764}. Best is trial 0 with value: 0.96.
[I 2024-09-02 22:18:19,502] Trial 8 finished with value: 0.98 and parameters: {'classifier': 'NeuralNetwork', 'nn_alpha': 0.007711774850786508, 'hidden_layer_sizes': 256, 'activation': 'logistic', 'solver': 'adam'}. Best is trial 8 with value: 0.98.
[I 2024-09-02 22:18:19,640] Trial 9 finished with value: 0.9666666666666667 and parameters: {'classifier': 'XGBoost', 'xgb_eta': 0.010263630236351186, 'xgb_max_depth': 3, 'xgb_min_child_weight': 0.004109174389011349, 'xgb_subsample': 0.7658120594702651, 'xgb_colsample_bytree': 0.7965052955436067}. Best is trial 8 with value: 0.98.
[I 2024-09-02 22:18:22,186] Trial 10 finished with value: 0.9733333333333333 and parameters: {'classifier': 'NeuralNetwork', 'nn_alpha': 0.011061567078398869, 'hidden_layer_sizes': 256, 'activation': 'logistic', 'solver': 'adam'}. Best is trial 8 with value: 0.98.
[I 2024-09-02 22:18:24,480] Trial 11 finished with value: 0.9733333333333333 and parameters: {'classifier': 'NeuralNetwork', 'nn_alpha': 0.011147747065452641, 'hidden_layer_sizes': 256, 'activation': 'logistic', 'solver': 'adam'}. Best is trial 8 with value: 0.98.
[I 2024-09-02 22:18:26,608] Trial 12 finished with value: 0.98 and parameters: {'classifier': 'NeuralNetwork', 'nn_alpha': 0.010931846722377727, 'hidden_layer_sizes': 256, 'activation': 'logistic', 'solver': 'adam'}. Best is trial 8 with value: 0.98.
[I 2024-09-02 22:18:29,069] Trial 13 finished with value: 0.9666666666666667 and parameters: {'classifier': 'NeuralNetwork', 'nn_alpha': 0.00036284954436479136, 'hidden_layer_sizes': 256, 'activation': 'logistic', 'solver': 'lbfgs'}. Best is trial 8 with value: 0.98.
[I 2024-09-02 22:18:30,108] Trial 14 finished with value: 0.98 and parameters: {'classifier': 'NeuralNetwork', 'nn_alpha': 0.08898886806179726, 'hidden_layer_sizes': 512, 'activation': 'tanh', 'solver': 'adam'}. Best is trial 8 with value: 0.98.
[I 2024-09-02 22:18:30,947] Trial 15 finished with value: 0.9733333333333333 and parameters: {'classifier': 'NeuralNetwork', 'nn_alpha': 0.003563455477977843, 'hidden_layer_sizes': 64, 'activation': 'relu', 'solver': 'sgd'}. Best is trial 8 with value: 0.98.
[I 2024-09-02 22:18:31,197] Trial 16 finished with value: 0.9533333333333333 and parameters: {'classifier': 'RandomForest', 'rf_max_depth': 3, 'rf_min_samples_split': 3, 'rf_min_samples_leaf': 1, 'rf_max_features': 'sqrt'}. Best is trial 8 with value: 0.98.
[I 2024-09-02 22:18:32,843] Trial 17 finished with value: 0.98 and parameters: {'classifier': 'NeuralNetwork', 'nn_alpha': 3.174715409456025e-05, 'hidden_layer_sizes': 128, 'activation': 'logistic', 'solver': 'adam'}. Best is trial 8 with value: 0.98.
[I 2024-09-02 22:18:35,021] Trial 18 finished with value: 0.9866666666666667 and parameters: {'classifier': 'NeuralNetwork', 'nn_alpha': 0.09430997871171372, 'hidden_layer_sizes': 256, 'activation': 'logistic', 'solver': 'adam'}. Best is trial 18 with value: 0.9866666666666667.
[I 2024-09-02 22:18:36,493] Trial 19 finished with value: 0.9733333333333333 and parameters: {'classifier': 'NeuralNetwork', 'nn_alpha': 0.09355818130393749, 'hidden_layer_sizes': 256, 'activation': 'tanh', 'solver': 'lbfgs'}. Best is trial 18 with value: 0.9866666666666667.
[I 2024-09-02 22:18:36,507] Trial 20 finished with value: 0.9533333333333333 and parameters: {'classifier': 'DecisionTree', 'dt_max_depth': 32, 'dt_min_samples_split': 20, 'dt_min_samples_leaf': 10, 'dt_max_features': 'sqrt'}. Best is trial 18 with value: 0.9866666666666667.
[I 2024-09-02 22:18:38,784] Trial 21 finished with value: 0.98 and parameters: {'classifier': 'NeuralNetwork', 'nn_alpha': 0.013263357984167608, 'hidden_layer_sizes': 256, 'activation': 'logistic', 'solver': 'adam'}. Best is trial 18 with value: 0.9866666666666667.
[I 2024-09-02 22:18:41,232] Trial 22 finished with value: 0.9733333333333333 and parameters: {'classifier': 'NeuralNetwork', 'nn_alpha': 0.0012615569649188684, 'hidden_layer_sizes': 256, 'activation': 'logistic', 'solver': 'adam'}. Best is trial 18 with value: 0.9866666666666667.
[I 2024-09-02 22:18:43,599] Trial 23 finished with value: 0.98 and parameters: {'classifier': 'NeuralNetwork', 'nn_alpha': 0.029981484159925083, 'hidden_layer_sizes': 256, 'activation': 'logistic', 'solver': 'adam'}. Best is trial 18 with value: 0.9866666666666667.
[I 2024-09-02 22:18:43,842] Trial 24 finished with value: 0.9533333333333333 and parameters: {'classifier': 'RandomForest', 'rf_max_depth': 16, 'rf_min_samples_split': 14, 'rf_min_samples_leaf': 10, 'rf_max_features': 'sqrt'}. Best is trial 18 with value: 0.9866666666666667.
[I 2024-09-02 22:18:44,664] Trial 25 finished with value: 0.98 and parameters: {'classifier': 'NeuralNetwork', 'nn_alpha': 0.0019973406837903687, 'hidden_layer_sizes': 64, 'activation': 'relu', 'solver': 'sgd'}. Best is trial 18 with value: 0.9866666666666667.
[I 2024-09-02 22:18:48,445] Trial 26 finished with value: 0.98 and parameters: {'classifier': 'NeuralNetwork', 'nn_alpha': 0.0004289486641781066, 'hidden_layer_sizes': 512, 'activation': 'logistic', 'solver': 'adam'}. Best is trial 18 with value: 0.9866666666666667.
[I 2024-09-02 22:18:50,027] Trial 27 finished with value: 0.98 and parameters: {'classifier': 'NeuralNetwork', 'nn_alpha': 0.028116366808629528, 'hidden_layer_sizes': 128, 'activation': 'logistic', 'solver': 'adam'}. Best is trial 18 with value: 0.9866666666666667.
[I 2024-09-02 22:18:52,324] Trial 28 finished with value: 0.98 and parameters: {'classifier': 'NeuralNetwork', 'nn_alpha': 0.004015370221833145, 'hidden_layer_sizes': 256, 'activation': 'logistic', 'solver': 'adam'}. Best is trial 18 with value: 0.9866666666666667.
[I 2024-09-02 22:18:52,335] Trial 29 finished with value: 0.32 and parameters: {'classifier': 'SVC', 'svc_c': 1.0390164331321386e-09, 'gamma': 'scale', 'kernel': 'rbf'}. Best is trial 18 with value: 0.9866666666666667.
[I 2024-09-02 22:18:52,575] Trial 30 finished with value: 0.94 and parameters: {'classifier': 'RandomForest', 'rf_max_depth': 2, 'rf_min_samples_split': 3, 'rf_min_samples_leaf': 1, 'rf_max_features': 'log2'}. Best is trial 18 with value: 0.9866666666666667.
[I 2024-09-02 22:18:53,538] Trial 31 finished with value: 0.98 and parameters: {'classifier': 'NeuralNetwork', 'nn_alpha': 0.05566658692563119, 'hidden_layer_sizes': 512, 'activation': 'tanh', 'solver': 'adam'}. Best is trial 18 with value: 0.9866666666666667.
[I 2024-09-02 22:18:54,562] Trial 32 finished with value: 0.98 and parameters: {'classifier': 'NeuralNetwork', 'nn_alpha': 0.07688489486654228, 'hidden_layer_sizes': 512, 'activation': 'tanh', 'solver': 'adam'}. Best is trial 18 with value: 0.9866666666666667.
[I 2024-09-02 22:18:54,578] Trial 33 finished with value: 0.66 and parameters: {'classifier': 'DecisionTree', 'dt_max_depth': 1, 'dt_min_samples_split': 2, 'dt_min_samples_leaf': 1, 'dt_max_features': 'log2'}. Best is trial 18 with value: 0.9866666666666667.
[I 2024-09-02 22:18:54,590] Trial 34 finished with value: 0.32 and parameters: {'classifier': 'SVC', 'svc_c': 2.3703272858114527e-05, 'gamma': 'scale', 'kernel': 'rbf'}. Best is trial 18 with value: 0.9866666666666667.
[I 2024-09-02 22:18:55,731] Trial 35 finished with value: 0.98 and parameters: {'classifier': 'NeuralNetwork', 'nn_alpha': 0.03022730888245666, 'hidden_layer_sizes': 512, 'activation': 'tanh', 'solver': 'adam'}. Best is trial 18 with value: 0.9866666666666667.
[I 2024-09-02 22:18:55,746] Trial 36 finished with value: 0.9466666666666667 and parameters: {'classifier': 'DecisionTree', 'dt_max_depth': 6, 'dt_min_samples_split': 19, 'dt_min_samples_leaf': 5, 'dt_max_features': 'sqrt'}. Best is trial 18 with value: 0.9866666666666667.
[I 2024-09-02 22:18:57,644] Trial 37 finished with value: 0.9866666666666667 and parameters: {'classifier': 'NeuralNetwork', 'nn_alpha': 0.09957020452991809, 'hidden_layer_sizes': 256, 'activation': 'tanh', 'solver': 'sgd'}. Best is trial 18 with value: 0.9866666666666667.
[I 2024-09-02 22:18:57,804] Trial 38 finished with value: 0.3333333333333333 and parameters: {'classifier': 'XGBoost', 'xgb_eta': 0.2696034329693687, 'xgb_max_depth': 9, 'xgb_min_child_weight': 64.74231111015747, 'xgb_subsample': 0.5289373821160407, 'xgb_colsample_bytree': 0.9659897980379861}. Best is trial 18 with value: 0.9866666666666667.
[I 2024-09-02 22:18:57,818] Trial 39 finished with value: 0.96 and parameters: {'classifier': 'SVC', 'svc_c': 0.04372683816400726, 'gamma': 'auto', 'kernel': 'poly'}. Best is trial 18 with value: 0.9866666666666667.
[I 2024-09-02 22:18:59,256] Trial 40 finished with value: 0.9733333333333333 and parameters: {'classifier': 'NeuralNetwork', 'nn_alpha': 0.006009965308557257, 'hidden_layer_sizes': 256, 'activation': 'relu', 'solver': 'sgd'}. Best is trial 18 with value: 0.9866666666666667.
[I 2024-09-02 22:19:01,193] Trial 41 finished with value: 0.98 and parameters: {'classifier': 'NeuralNetwork', 'nn_alpha': 0.09981889185787361, 'hidden_layer_sizes': 256, 'activation': 'tanh', 'solver': 'sgd'}. Best is trial 18 with value: 0.9866666666666667.
[I 2024-09-02 22:19:03,151] Trial 42 finished with value: 0.9866666666666667 and parameters: {'classifier': 'NeuralNetwork', 'nn_alpha': 0.029984330181739374, 'hidden_layer_sizes': 256, 'activation': 'tanh', 'solver': 'sgd'}. Best is trial 18 with value: 0.9866666666666667.
[I 2024-09-02 22:19:05,152] Trial 43 finished with value: 0.98 and parameters: {'classifier': 'NeuralNetwork', 'nn_alpha': 0.026364752433629134, 'hidden_layer_sizes': 256, 'activation': 'tanh', 'solver': 'sgd'}. Best is trial 18 with value: 0.9866666666666667.
[I 2024-09-02 22:19:05,377] Trial 44 finished with value: 0.96 and parameters: {'classifier': 'XGBoost', 'xgb_eta': 0.06994946436585685, 'xgb_max_depth': 5, 'xgb_min_child_weight': 1.1125539869578246e-05, 'xgb_subsample': 0.9898406509679796, 'xgb_colsample_bytree': 0.5260253787787398}. Best is trial 18 with value: 0.9866666666666667.
[I 2024-09-02 22:19:07,411] Trial 45 finished with value: 0.9866666666666667 and parameters: {'classifier': 'NeuralNetwork', 'nn_alpha': 0.03828460008366439, 'hidden_layer_sizes': 256, 'activation': 'tanh', 'solver': 'sgd'}. Best is trial 18 with value: 0.9866666666666667.
[I 2024-09-02 22:19:09,569] Trial 46 finished with value: 0.98 and parameters: {'classifier': 'NeuralNetwork', 'nn_alpha': 0.038763650341119005, 'hidden_layer_sizes': 256, 'activation': 'tanh', 'solver': 'sgd'}. Best is trial 18 with value: 0.9866666666666667.
[I 2024-09-02 22:19:11,456] Trial 47 finished with value: 0.98 and parameters: {'classifier': 'NeuralNetwork', 'nn_alpha': 0.020658885674917693, 'hidden_layer_sizes': 256, 'activation': 'tanh', 'solver': 'sgd'}. Best is trial 18 with value: 0.9866666666666667.
[I 2024-09-02 22:19:11,938] Trial 48 finished with value: 0.9533333333333333 and parameters: {'classifier': 'RandomForest', 'rf_max_depth': 7, 'rf_min_samples_split': 10, 'rf_min_samples_leaf': 5, 'rf_max_features': 'sqrt'}. Best is trial 18 with value: 0.9866666666666667.
[I 2024-09-02 22:19:12,203] Trial 49 finished with value: 0.96 and parameters: {'classifier': 'XGBoost', 'xgb_eta': 0.07117648219534117, 'xgb_max_depth': 8, 'xgb_min_child_weight': 0.2997334648891877, 'xgb_subsample': 0.7089355549350662, 'xgb_colsample_bytree': 0.9874209886245907}. Best is trial 18 with value: 0.9866666666666667.
[I 2024-09-02 22:19:14,136] Trial 50 finished with value: 0.9866666666666667 and parameters: {'classifier': 'NeuralNetwork', 'nn_alpha': 0.05426125595591959, 'hidden_layer_sizes': 256, 'activation': 'tanh', 'solver': 'sgd'}. Best is trial 18 with value: 0.9866666666666667.
[I 2024-09-02 22:19:16,174] Trial 51 finished with value: 0.9866666666666667 and parameters: {'classifier': 'NeuralNetwork', 'nn_alpha': 0.050076054125482126, 'hidden_layer_sizes': 256, 'activation': 'tanh', 'solver': 'sgd'}. Best is trial 18 with value: 0.9866666666666667.
[I 2024-09-02 22:19:18,230] Trial 52 finished with value: 0.9866666666666667 and parameters: {'classifier': 'NeuralNetwork', 'nn_alpha': 0.04792687664065512, 'hidden_layer_sizes': 256, 'activation': 'tanh', 'solver': 'sgd'}. Best is trial 18 with value: 0.9866666666666667.
[I 2024-09-02 22:19:20,231] Trial 53 finished with value: 0.9866666666666667 and parameters: {'classifier': 'NeuralNetwork', 'nn_alpha': 0.05115679042258668, 'hidden_layer_sizes': 256, 'activation': 'tanh', 'solver': 'sgd'}. Best is trial 18 with value: 0.9866666666666667.
[I 2024-09-02 22:19:22,112] Trial 54 finished with value: 0.9866666666666667 and parameters: {'classifier': 'NeuralNetwork', 'nn_alpha': 0.04707018655048045, 'hidden_layer_sizes': 256, 'activation': 'tanh', 'solver': 'sgd'}. Best is trial 18 with value: 0.9866666666666667.
[I 2024-09-02 22:19:24,013] Trial 55 finished with value: 0.9866666666666667 and parameters: {'classifier': 'NeuralNetwork', 'nn_alpha': 0.01900403287155359, 'hidden_layer_sizes': 256, 'activation': 'tanh', 'solver': 'sgd'}. Best is trial 18 with value: 0.9866666666666667.
[I 2024-09-02 22:19:24,028] Trial 56 finished with value: 0.6533333333333333 and parameters: {'classifier': 'DecisionTree', 'dt_max_depth': 1, 'dt_min_samples_split': 11, 'dt_min_samples_leaf': 5, 'dt_max_features': 'log2'}. Best is trial 18 with value: 0.9866666666666667.
[I 2024-09-02 22:19:25,026] Trial 57 finished with value: 0.9866666666666667 and parameters: {'classifier': 'NeuralNetwork', 'nn_alpha': 0.060797723264788814, 'hidden_layer_sizes': 64, 'activation': 'tanh', 'solver': 'sgd'}. Best is trial 18 with value: 0.9866666666666667.
[I 2024-09-02 22:19:26,950] Trial 58 finished with value: 0.9866666666666667 and parameters: {'classifier': 'NeuralNetwork', 'nn_alpha': 0.014825617328491069, 'hidden_layer_sizes': 256, 'activation': 'tanh', 'solver': 'sgd'}. Best is trial 18 with value: 0.9866666666666667.
[I 2024-09-02 22:19:28,258] Trial 59 finished with value: 0.9866666666666667 and parameters: {'classifier': 'NeuralNetwork', 'nn_alpha': 0.09838745734448333, 'hidden_layer_sizes': 128, 'activation': 'tanh', 'solver': 'sgd'}. Best is trial 18 with value: 0.9866666666666667.
[I 2024-09-02 22:19:28,269] Trial 60 finished with value: 0.32 and parameters: {'classifier': 'SVC', 'svc_c': 1.8039603525588086e-10, 'gamma': 'scale', 'kernel': 'linear'}. Best is trial 18 with value: 0.9866666666666667.
[I 2024-09-02 22:19:30,139] Trial 61 finished with value: 0.9866666666666667 and parameters: {'classifier': 'NeuralNetwork', 'nn_alpha': 0.046216102047502025, 'hidden_layer_sizes': 256, 'activation': 'tanh', 'solver': 'sgd'}. Best is trial 18 with value: 0.9866666666666667.
[I 2024-09-02 22:19:32,017] Trial 62 finished with value: 0.9866666666666667 and parameters: {'classifier': 'NeuralNetwork', 'nn_alpha': 0.04858560753825619, 'hidden_layer_sizes': 256, 'activation': 'tanh', 'solver': 'sgd'}. Best is trial 18 with value: 0.9866666666666667.
[I 2024-09-02 22:19:33,884] Trial 63 finished with value: 0.9866666666666667 and parameters: {'classifier': 'NeuralNetwork', 'nn_alpha': 0.0335777875227453, 'hidden_layer_sizes': 256, 'activation': 'tanh', 'solver': 'sgd'}. Best is trial 18 with value: 0.9866666666666667.
[I 2024-09-02 22:19:35,384] Trial 64 finished with value: 0.9733333333333333 and parameters: {'classifier': 'NeuralNetwork', 'nn_alpha': 0.06350516787334039, 'hidden_layer_sizes': 256, 'activation': 'tanh', 'solver': 'lbfgs'}. Best is trial 18 with value: 0.9866666666666667.
[I 2024-09-02 22:19:37,289] Trial 65 finished with value: 0.98 and parameters: {'classifier': 'NeuralNetwork', 'nn_alpha': 0.008442275687555569, 'hidden_layer_sizes': 256, 'activation': 'tanh', 'solver': 'sgd'}. Best is trial 18 with value: 0.9866666666666667.
[I 2024-09-02 22:19:37,545] Trial 66 finished with value: 0.9466666666666667 and parameters: {'classifier': 'RandomForest', 'rf_max_depth': 6, 'rf_min_samples_split': 10, 'rf_min_samples_leaf': 5, 'rf_max_features': 'log2'}. Best is trial 18 with value: 0.9866666666666667.
[I 2024-09-02 22:19:39,459] Trial 67 finished with value: 0.98 and parameters: {'classifier': 'NeuralNetwork', 'nn_alpha': 0.019974233962837214, 'hidden_layer_sizes': 256, 'activation': 'tanh', 'solver': 'sgd'}. Best is trial 18 with value: 0.9866666666666667.
[I 2024-09-02 22:19:39,908] Trial 68 finished with value: 0.9666666666666667 and parameters: {'classifier': 'NeuralNetwork', 'nn_alpha': 0.06687067591998333, 'hidden_layer_sizes': 256, 'activation': 'relu', 'solver': 'lbfgs'}. Best is trial 18 with value: 0.9866666666666667.
[I 2024-09-02 22:19:41,788] Trial 69 finished with value: 0.9866666666666667 and parameters: {'classifier': 'NeuralNetwork', 'nn_alpha': 0.037126461511742995, 'hidden_layer_sizes': 256, 'activation': 'tanh', 'solver': 'sgd'}. Best is trial 18 with value: 0.9866666666666667.
[I 2024-09-02 22:19:41,804] Trial 70 finished with value: 0.94 and parameters: {'classifier': 'DecisionTree', 'dt_max_depth': 4, 'dt_min_samples_split': 7, 'dt_min_samples_leaf': 8, 'dt_max_features': 'log2'}. Best is trial 18 with value: 0.9866666666666667.
[I 2024-09-02 22:19:43,688] Trial 71 finished with value: 0.9866666666666667 and parameters: {'classifier': 'NeuralNetwork', 'nn_alpha': 1.681767038414861e-05, 'hidden_layer_sizes': 256, 'activation': 'tanh', 'solver': 'sgd'}. Best is trial 18 with value: 0.9866666666666667.
[I 2024-09-02 22:19:45,528] Trial 72 finished with value: 0.9866666666666667 and parameters: {'classifier': 'NeuralNetwork', 'nn_alpha': 0.06278270264414816, 'hidden_layer_sizes': 256, 'activation': 'tanh', 'solver': 'sgd'}. Best is trial 18 with value: 0.9866666666666667.
[I 2024-09-02 22:19:47,398] Trial 73 finished with value: 0.9866666666666667 and parameters: {'classifier': 'NeuralNetwork', 'nn_alpha': 0.09942999226922548, 'hidden_layer_sizes': 256, 'activation': 'tanh', 'solver': 'sgd'}. Best is trial 18 with value: 0.9866666666666667.
[I 2024-09-02 22:19:49,260] Trial 74 finished with value: 0.9866666666666667 and parameters: {'classifier': 'NeuralNetwork', 'nn_alpha': 0.04368871133056854, 'hidden_layer_sizes': 256, 'activation': 'tanh', 'solver': 'sgd'}. Best is trial 18 with value: 0.9866666666666667.
[I 2024-09-02 22:19:50,268] Trial 75 finished with value: 0.9733333333333333 and parameters: {'classifier': 'NeuralNetwork', 'nn_alpha': 0.016568865068556593, 'hidden_layer_sizes': 64, 'activation': 'tanh', 'solver': 'sgd'}. Best is trial 18 with value: 0.9866666666666667.
[I 2024-09-02 22:19:55,335] Trial 76 finished with value: 0.9733333333333333 and parameters: {'classifier': 'NeuralNetwork', 'nn_alpha': 0.00013086567461219749, 'hidden_layer_sizes': 128, 'activation': 'logistic', 'solver': 'sgd'}. Best is trial 18 with value: 0.9866666666666667.
[I 2024-09-02 22:19:58,696] Trial 77 finished with value: 0.96 and parameters: {'classifier': 'NeuralNetwork', 'nn_alpha': 0.02678911167791424, 'hidden_layer_sizes': 256, 'activation': 'tanh', 'solver': 'lbfgs'}. Best is trial 18 with value: 0.9866666666666667.
[I 2024-09-02 22:19:58,767] Trial 78 finished with value: 0.9466666666666667 and parameters: {'classifier': 'SVC', 'svc_c': 9702303635.983797, 'gamma': 'auto', 'kernel': 'poly'}. Best is trial 18 with value: 0.9866666666666667.
[I 2024-09-02 22:19:58,952] Trial 79 finished with value: 0.96 and parameters: {'classifier': 'XGBoost', 'xgb_eta': 0.010876312844115266, 'xgb_max_depth': 4, 'xgb_min_child_weight': 0.16249245407827093, 'xgb_subsample': 0.7139206906968711, 'xgb_colsample_bytree': 0.8399945479079308}. Best is trial 18 with value: 0.9866666666666667.
[I 2024-09-02 22:20:08,054] Trial 80 finished with value: 0.96 and parameters: {'classifier': 'NeuralNetwork', 'nn_alpha': 0.0108857182681109, 'hidden_layer_sizes': 256, 'activation': 'logistic', 'solver': 'sgd'}. Best is trial 18 with value: 0.9866666666666667.
