[I 2024-08-15 20:11:36,816] A new study created in memory with name: no-name-62810974-b8db-46fa-9aee-c18b9bd4723e
[I 2024-08-15 20:11:36,976] Trial 0 finished with value: 0.9733333333333333 and parameters: {'classifier': 'NeuralNetwork', 'nn_alpha': 0.0003611505956287705, 'hidden_layer_sizes': 64, 'activation': 'relu', 'solver': 'lbfgs'}. Best is trial 0 with value: 0.9733333333333333.
[I 2024-08-15 20:11:36,988] Trial 1 finished with value: 0.86 and parameters: {'classifier': 'SVC', 'svc_c': 6.037584802241745e-05, 'gamma': 'auto', 'kernel': 'poly'}. Best is trial 0 with value: 0.9733333333333333.
[I 2024-08-15 20:11:36,999] Trial 2 finished with value: 0.96 and parameters: {'classifier': 'SVC', 'svc_c': 1.320562117089699, 'gamma': 'auto', 'kernel': 'poly'}. Best is trial 0 with value: 0.9733333333333333.
[I 2024-08-15 20:11:38,438] Trial 3 finished with value: 0.9866666666666667 and parameters: {'classifier': 'NeuralNetwork', 'nn_alpha': 0.000816038588685837, 'hidden_layer_sizes': 64, 'activation': 'logistic', 'solver': 'adam'}. Best is trial 3 with value: 0.9866666666666667.
[I 2024-08-15 20:11:38,733] Trial 4 finished with value: 0.96 and parameters: {'classifier': 'RandomForest', 'rf_max_depth': 2, 'rf_min_samples_split': 19, 'rf_min_samples_leaf': 3, 'rf_max_features': 'sqrt'}. Best is trial 3 with value: 0.9866666666666667.
[I 2024-08-15 20:11:38,885] Trial 5 finished with value: 0.9666666666666667 and parameters: {'classifier': 'NeuralNetwork', 'nn_alpha': 0.07071756505762365, 'hidden_layer_sizes': 64, 'activation': 'relu', 'solver': 'lbfgs'}. Best is trial 3 with value: 0.9866666666666667.
[I 2024-08-15 20:11:42,622] Trial 6 finished with value: 0.98 and parameters: {'classifier': 'NeuralNetwork', 'nn_alpha': 0.0078028391691421775, 'hidden_layer_sizes': 64, 'activation': 'logistic', 'solver': 'sgd'}. Best is trial 3 with value: 0.9866666666666667.
[I 2024-08-15 20:11:43,929] Trial 7 finished with value: 0.9733333333333333 and parameters: {'classifier': 'NeuralNetwork', 'nn_alpha': 0.08103577225032832, 'hidden_layer_sizes': 64, 'activation': 'tanh', 'solver': 'sgd'}. Best is trial 3 with value: 0.9866666666666667.
[I 2024-08-15 20:11:44,217] Trial 8 finished with value: 0.9666666666666667 and parameters: {'classifier': 'NeuralNetwork', 'nn_alpha': 0.00018635544502737023, 'hidden_layer_sizes': 256, 'activation': 'relu', 'solver': 'lbfgs'}. Best is trial 3 with value: 0.9866666666666667.
[I 2024-08-15 20:11:45,675] Trial 9 finished with value: 0.9866666666666667 and parameters: {'classifier': 'NeuralNetwork', 'nn_alpha': 0.0002566815450337123, 'hidden_layer_sizes': 64, 'activation': 'logistic', 'solver': 'adam'}. Best is trial 3 with value: 0.9866666666666667.
FrozenTrial(number=3, state=1, values=[0.9866666666666667], datetime_start=datetime.datetime(2024, 8, 15, 20, 11, 36, 999124), datetime_complete=datetime.datetime(2024, 8, 15, 20, 11, 38, 436011), params={'classifier': 'NeuralNetwork', 'nn_alpha': 0.000816038588685837, 'hidden_layer_sizes': 64, 'activation': 'logistic', 'solver': 'adam'}, user_attrs={}, system_attrs={}, intermediate_values={}, distributions={'classifier': CategoricalDistribution(choices=('SVC', 'RandomForest', 'NeuralNetwork', 'XGBoost')), 'nn_alpha': FloatDistribution(high=0.1, log=True, low=1e-05, step=None), 'hidden_layer_sizes': CategoricalDistribution(choices=(64, 128, 256, 512)), 'activation': CategoricalDistribution(choices=('relu', 'tanh', 'logistic')), 'solver': CategoricalDistribution(choices=('sgd', 'adam', 'lbfgs'))}, trial_id=3, value=None)